W08-2201,A New Life for Semantic Annotations?,2008,0,0,1,1,16745,harry bunt,Semantics in Text Processing. {STEP} 2008 Conference Proceedings,0,"Semantic annotation has so far been approached in essentially the same way as annotation at other levels of linguistic information, namely as the business of labeling text with certain tags which add certain information to the text, in this case, semantic information. Semantic role labeling is a case in point. This may be very useful, for instance for determining the variety of ways in which certain types of semantic information tend to be expressed, but it seems to me that semantic annotations can and should have a deeper significance and a more important role to play.n n Since semantic annotations are intended to capture some of the meaning of the annotated text, it ought to be possible to use such annotations in reasoning, and hence to apply that information in language processing tasks. However, reasoning with semantic annotations presupposes that the annotation language has a formal semantics. (In fact, one may wonder how much sense it makes to use a semantic annotation language without a semantics, since there is a priori little reason to assume that semantically undefined annotations would capture the meanings of natural language expressions any better than the expressions themselves.)n n Still, existing work in this area, for instance on semantic role annotation (as in the FrameNet and PropBank initiatives) or on the annotation of temporal information (as in the TimeML effort) makes use of uninterpreted annotation languages.n n In this talk, I will discuss some of the possibilities, perspectives, and problems in defining semantic annotation languages with a well-defined semantics. I will do this by starting from an attempt to integrate intermediate results from the design of a standard for temporal annotation in the International Organisation for Standards (ISO), and from the definition of annotation schemas for coreference annotation and semantic role labeling in the European project LIRICS. I will indicate the requirements for integrated and multilayered semantic annotation approaches, and certain general principles for semantic annotation. Moreover, I hope to address issues concerning the relations between using semantic annotations with a formal semantics on the one hand, and using underspecified semantic representations on the other. Finally, I will consider some of the potential applications of the use of interpreted semantic annotations in areas such as information extraction, paraphrase generation, and textual entailment."
geertzen-etal-2008-evaluating,Evaluating Dialogue Act Tagging with Naive and Expert Annotators,2008,11,9,3,1,39317,jeroen geertzen,Proceedings of the Sixth International Conference on Language Resources and Evaluation ({LREC}'08),0,"In this paper the dialogue act annotation of naive and expert annotators, both annotating the same data, are compared in order to characterise the insights annotations made by different kind of annotators may provide for evaluating dialogue act tagsets. It is argued that the agreement among naive annotators provides insight in the clarity of the tagset, whereas agreement among expert annotators provides an indication of how reliably the tagset can be applied when errors are ruled out that are due to deficiencies in understanding the concepts of the tagset, to a lack of experience in using the annotation tool, or to little experience in annotation more generally. An indication of the differences between the two groups in terms of inter-annotator agreement and tagging accuracy on task-oriented dialogue in different domains, annotated with the DIT++ dialogue act tagset is presented, and the annotations of both groups are assessed against a gold standard. Additionally, the effect of the reduction of the tagsets granularity on the performances of both groups is looked into. In general, it is concluded that the annotations of both groups provide complementary insights in reliability, clarity, and more fundamental conceptual issues."
bunt-overbeeke-2008-towards,Towards Formal Interpretation of Semantic Annotation,2008,8,4,1,1,16745,harry bunt,Proceedings of the Sixth International Conference on Language Resources and Evaluation ({LREC}'08),0,"In this paper we present a novel approach to the incremental incorporation of semantic information in natural language processing which does not fall victim to the notorious problems of ambiguity and lack of robustness, namely through the formal interpretation of semantic annotation. We present a formal semantics for a language for the integrated annotation of several types of semantic information, such as (co-)reference relations, temporal information, and semantic roles. This semantics has the form of a compositional translation into second-order logic. We show that a truly semantic approach to the annotation of different types of semantic information raises interesting issues relating to the borders between these areas of semantics, and to the consistency of semantic annotations in multiple areas or in multiple annotation layers. The approach is compositional, in the sense that every well-formed subexpression of the annotation language can be translated to formal logic (and hence interpreted) independent of the rest of the annotation structure. The approach is also incremental in the sense that it is designed to be extendable to the semantic annotation of many other types of semantic information, such as spatial information, noun-noun relations, or quantification and modification structures."
petukhova-bunt-2008-lirics,{LIRICS} Semantic Role Annotation: Design and Evaluation of a Set of Data Categories,2008,6,18,2,1,16746,volha petukhova,Proceedings of the Sixth International Conference on Language Resources and Evaluation ({LREC}'08),0,"Semantic roles have often proved to be useful labels for stating linguistic generalisations of various sorts. There is, however, a lack of agreement on their defining criteria, which causes serious problems for semantic roles to be a useful classificatory device for predicate-argument relations. These criteria should (a) support the design of a semantic role set which is complete but does not contain redundant relations; (b) be based on semantic rather than morphological, lexical or syntactic properties; and (c) enable formal interpretation. In this paper we report on the analyses of alternative approaches to annotation and representation of semantic role information (such as FrameNet, PropBank and VerbNet) with respect to their models of description, granularity of semantic role sets, definitions of semantic roles concepts, consistency and reliability of annotations. We present methodological principles for characterising well-defined concepts which were developed within the LIRICS (Linguistic InfRastructure for Interoperable ResourCes and Systems; see http://lirics.loria.fr) project, as well as the designed set of semantic roles and their definitions in ISO 12620 format. We discuss evaluation results of the defined concepts for semantic role annotation concerning the redundancy and completeness of the tagset and the reliability of annotations in terms of inter-annotator agreement."
Y07-1002,The Semantics of Semantic Annotation,2007,7,6,1,1,16745,harry bunt,"Proceedings of the 21st Pacific Asia Conference on Language, Information and Computation",0,"This is a speculative paper, describing a recently started effort to give a formal semantics to semantic annotation schemes. Semantic annotations are intended to capture certain semantic information in a text, which means that it only makes sense to use semantic annotations if these have a well-defined semantics. In practice, however, semantic annotation schemes are used that lack any formal semantics. In this paper we outline how existing approaches to the annotation of temporal information, semantic roles, and reference relations can be integrated in a single XML-based format and can be given a formal semantics by translating them into second-order logic. This is argued to offer an incremental aproach to the incorporation of semantic information in natural language processing that does not suffer from the problems of ambiguity and lack of robustness that are common to traditional approaches to computational semantics."
2007.sigdial-1.26,A Multidimensional Approach to Utterance Segmentation and Dialogue Act Classification,2007,9,22,3,1,39317,jeroen geertzen,Proceedings of the 8th SIGdial Workshop on Discourse and Dialogue,0,"In this paper we present a multidimensional approach to utterance segmentation and automatic dialogue act classification. We show that the use of multiple dimensions in distinguishing and annotating units not only supports a more accurate analysis of human communication, but can also help to solve some notorious problems concerning the segmentation of dialogue into functional units. We introduce the use of per-dimension segmentation for dialogue act taxonomies that feature multi-functionality and show that better classification results are obtained when using a separate segmentation for each dimension than when using one segmentation that fits all dimensions. Three machine learning techniques are applied and compared on the task of automatic classification of multiple communicative functions of utterances. The results are encouraging and indicate that communicative functions in important dimensions are easy machinelearnable."
2007.sigdial-1.28,Evaluating Combinations of Dialogue Acts for Generation,2007,-1,-1,2,1,16749,simon keizer,Proceedings of the 8th SIGdial Workshop on Discourse and Dialogue,0,None
2007.sigdial-1.49,An Empirically Based Computational Model of Grounding in Dialogue,2007,-1,-1,1,1,16745,harry bunt,Proceedings of the 8th SIGdial Workshop on Discourse and Dialogue,0,None
W06-1306,Multidimensional Dialogue Management,2006,22,18,2,1,16749,simon keizer,Proceedings of the 7th {SIG}dial Workshop on Discourse and Dialogue,0,"In this paper we present an approach to dialogue management that supports the generation of multifunctional utterances. It is based on the multidimensional dialogue act taxonomy and associated context model as developed in Dynamic Interpretation Theory (DIT). The multidimensional organisation of the taxonomy reflects that there are various aspects that dialogue participants have to deal with simultaneously during a dialogue. Besides performing some underlying task, a participant also has to pay attention to various aspects of the communication process itself, including social conventions.n n Therefore, a multi-agent approach is proposed, in which for each of the dimensions in the taxonomy a specialised dialogue act agent is designed, dedicated to the generation of dialogue acts from that particular dimension. These dialogue act agents operate in parallel on the information state of the system. For a simplified version of the taxonomy, a dialogue manager has been implemented and integrated into an interactive QA system."
W06-1318,Measuring annotator agreement in a complex hierarchical dialogue act annotation scheme,2006,-1,-1,2,1,39317,jeroen geertzen,Proceedings of the 7th {SIG}dial Workshop on Discourse and Dialogue,0,None
bunt-2006-dimensions,Dimensions in Dialogue Act Annotation,2006,9,35,1,1,16745,harry bunt,Proceedings of the Fifth International Conference on Language Resources and Evaluation ({LREC}{'}06),0,"This paper is concerned with the fundamentals of multidimensional dialogue act annotation, i.e. with what it means to annotate dialogues with information about the communicative acts that are performed with the utterances, taking various 'dimensions' into account. Two ideas seem to be prevalent in the literature concerning the notion of dimension: (1) dimensions correspond to different types of information; and (2) a dimension is formed by a set of mutually exclusive tags. In DAMSL, for instance, the terms dimension and layer are used sometimes in the sense of (1) and sometimes in that of (2). We argue that being mutually exclusive is not a good criterion for a set of dialogue act types to constitute a dimension, even though the description of an object in a multidimensional space should never assign more than one value per dimension. We define a dimension of dialogue act annotation as an aspect of participating in a dialogue that can be addressed independently by means of dialogue acts. We show that DAMSL dimensions such as Info-request, Statement, and Answer do not qualify as proper dimensions, and that the communicative functions in these categories do not fall in any specific dimension, but should be considered as general-purpose in the sense that they can be used in any dimension. We argue that using the notion of dimension that we propose, a multidimensional taxonomy of dialogue acts emerges that optimally supports multidimensional dialogue act annotation."
bunt-schiffrin-2006-methodological,Methodological Aspects of Semantic Annotation,2006,23,4,1,1,16745,harry bunt,Proceedings of the Fifth International Conference on Language Resources and Evaluation ({LREC}{'}06),0,"This paper constitutes a preliminary report on the work carried out on semantic content annotation in the LIRICS project, in close collaboration with the activities of ISO TC 37/SC 4/TDG 31. This consists primarily of: (1) identifying commonalities in alternative approaches to the annotation and representation of various types of semantic information; and (2) developing methodological principles and concepts for identifying and characterising representational concepts for semantic content. The LIRICS project does not aim to develop a standard format for the annotation and representation of semantic content, but at providing well-defined descriptive concepts. In particular, the aim is to build an on-line registry of definitions of such concepts, called data categories, in accordance with ISO standard 12620. These semantic data categories are abstract concepts, whose use is not restricted to any particular format or representation language. We advocate the use of the metamodel as a tool to extract the most important of these abstract overarching concepts, with examples from dialogue act, temporal, reference and semantic role annotation."
lee-etal-2004-towards,Towards an International Standard on Feature Structure Representation,2004,22,18,7,0.517352,18931,kiyong lee,Proceedings of the Fourth International Conference on Language Resources and Evaluation ({LREC}{'}04),0,This paper describes the preliminary results of a joint initiative of the TEI (Text Encoding Initiative) Consortium and the ISO Committee TC 37SC 4 (language Resource management) to provide a standard for the representation and interchange of feature structures.
bunt-romary-2004-standardization,Standardization in Multimodal Content Representation: Some Methodological Issues,2004,10,13,1,1,16745,harry bunt,Proceedings of the Fourth International Conference on Language Resources and Evaluation ({LREC}{'}04),0,"In this paper we discuss some basic methodological considerations of the activities undertaken in the ACL-SIGSEM Working Group on the Representation of Multimodal Semantic Information. This independent expert group was founded on the instigation of the Interna- tional Organization for Standardisation ISO for investigating the possibilities to develop well-founded guidelines for the representation and annotation of semantic information in interactive multimodal contexts, with the aim to support the interoperability and reuse of multimodal and language resources."
1993.iwpt-1.1,Proceedings of the Third International Workshop on Parsing Technologies ({IWPT} {'}93),1993,-1,-1,1,1,16745,harry bunt,Proceedings of the Third International Workshop on Parsing Technologies,0,
1993.iwpt-1.4,Parsing as Dynamic Interpretation,1993,-1,-1,1,1,16745,harry bunt,Proceedings of the Third International Workshop on Parsing Technologies,0,"In this paper we consider the merging of the language of feature structures with a formal logical language, and how the semantic definition of the resulting language can be used in parsing. For the logical language we use the language EL, defined and implemented earlier for computational semantic purposes. To this language we add the basic constructions and operations of feature structures. The extended language we refer to as {`}Generalized EL{'}, or {`}GEL{'}. The semantics of EL, and that of its extension GEL, is defined model-theoretically: for each construction of the language, a recursive rule describes how its value can be computed from the values of its constituents. Since GEL talks not only about semantic objects and their relations but also about syntactic concepts, GEL models are nonstandard in containing both kinds of entities. Whereas phrase-structure rules are traditionally viewed procedurally, as recipes for building phrases, and a rule in the parsing-as-deduction is viewed declaratively, as a proposition which is true when the conditions for building the phrase are satisfied, a rule in GEL is best viewed as a proposition in Dynamic Semantics: it can be evaluated recursively, and evaluates not to true or false, but to the minimal change in the model, needed to make the proposition true. The viability of this idea has been demonstrated by a proof-of-concept implementation for DPSG chart parsing and an emulation of HPSG parsing in the STUF environment."
E87-1034,"Discontinuous Constituents in Trees, Rules, and Parsing",1987,10,6,1,1,16745,harry bunt,Third Conference of the {E}uropean Chapter of the Association for Computational Linguistics,0,"This paper discusses the consequences of allowing discontinuous constituents in syntactic representions and phrase-structure rules, and the resulting complications for a standard parser of phrase-structure grammar.It is argued, first, that discontinuous constituents seem inevitable in a phrase-structure grammar which is acceptable from a semantic point of view. It is shown that tree-like constituent structures with discontinuities can be given a precise definition which makes them just as acceptable for syntactic representation as ordinary trees. However, the formulation of phrase-structure rules that generate such structures entails quite intricate problems. The notions of linear precedence and adjacency are reexamined, and the concept of n-place adjacency sequence is introduced. Finally, the resulting form of phrase-structure grammar, called Discontinuous Phrase-Structure Grammar, is shown to be parsable by an algorithm for context-free parsing with relatively minor adaptations. The paper describes the adaptations in the chart parser which was implemented as part of the TENDUMdialogue system."
P84-1028,The Resolution of Quantificational Ambiguity in the {TENDUM} System,1984,6,2,1,1,16745,harry bunt,10th International Conference on Computational Linguistics and 22nd Annual Meeting of the Association for Computational Linguistics,1,"A method is described for handling the ambiguity and vagueness that is often found in quantifications - the semantically complex relations between nominal and verbal constituents. In natural language certain aspects of quantification are often left open; it is argued that the analysis of quantification in a model-theoretic framework should use semantic representation in which this may also be done. This paper shows a form for such a representation and how ambiguous representations are used in an elegant and efficient procedure for semantic analysis, incorporated in the TENDUM dialogue system."
