2020.lrec-1.69,"The {ISO} Standard for Dialogue Act Annotation, Second Edition",2020,-1,-1,1,1,16745,harry bunt,Proceedings of the 12th Language Resources and Evaluation Conference,0,"ISO standard 24617-2 for dialogue act annotation, established in 2012, has in the past few years been used both in corpus annotation and in the design of components for spoken and multimodal dialogue systems. This has brought some inaccuracies and undesirbale limitations of the standard to light, which are addressed in a proposed second edition. This second edition allows a more accurate annotation of dependence relations and rhetorical relations in dialogue. Following the ISO 24617-4 principles of semantic annotation, and borrowing ideas from EmotionML, a triple-layered plug-in mechanism is introduced which allows dialogue act descriptions to be enriched with information about their semantic content, about accompanying emotions, and other information, and allows the annotation scheme to be customised by adding application-specific dialogue act types."
2020.isa-1.1,Annotation of Quantification: The Current State of {ISO} 24617-12,2020,-1,-1,1,1,16745,harry bunt,16th Joint ACL - ISO Workshop on Interoperable Semantic Annotation PROCEEDINGS,0,"This paper discusses the current state of developing an ISO standard annotation scheme for quantification phenomena in natural language, as part of the ISO Semantic Annotation Framework (ISO 24617). A proposed approach that combines ideas from the theory of generalised quantifiers and from neo-Davidsonian event semantics was adopted by the ISO organisation in 2019 as a starting point for developing such an annotation scheme. * This scheme consists of (1) a conceptual {`}metamodel{'} that visualises the types of entities, functions and relations that go into annotations of quantification; (2) an abstract syntax which defines {`}annotation structures{'} as triples and other set-theoretic constructs; (3) an XML-based representation of annotation structures ({`}concrete syntax{'}); and (4) a compositional semantics of annotation structures. The latter three components together define the interpreted markup language QuantML. The focus in this paper is on the structuring of the semantic information needed to characterise quantification in natural language and the representation of these structures in QuantML."
2020.isa-1.9,Adapting the {ISO} 24617-2 Dialogue Act Annotation Scheme for Modelling Medical Consultations,2020,-1,-1,2,0,16746,volha petukhova,16th Joint ACL - ISO Workshop on Interoperable Semantic Annotation PROCEEDINGS,0,"Effective, professional and socially competent dialogue of health care providers with their patients is essential to best practice in medicine. To identify, categorize and quantify salient features of patient-provider communication, to model interactive processes in medical encounters and to design digital interactive medical services, two important instruments have been developed: (1) medical interaction analysis systems with the Roter Interaction Analysis System (RIAS) as the most widely used by medical practitioners and (2) dialogue act annotation schemes with ISO 24617-2 as a multidimensional taxonomy of interoperable semantic concepts widely used for corpus annotation and dialogue systems design. Neither instrument fits all purposes. In this paper, we perform a systematic comparative analysis of the categories defined in the RIAS and ISO taxonomies. Overcoming the deficiencies and gaps that were found, we propose a number of extensions to the ISO annotation scheme, making it a powerful analytical and modelling instrument for the analysis, modelling and assessment of medical communication."
W19-0403,A Semantic Annotation Scheme for Quantification,2019,0,0,1,1,16745,harry bunt,Proceedings of the 13th International Conference on Computational Semantics - Long Papers,0,"This paper describes in brief the proposal called {`}QuantML{'} which was accepted by the International Organisation for Standards (ISO) last February as a starting point for developing a standard for the interoperable annotation of quantification phenomena in natural language, as part of the ISO 24617 Semantic Annotation Framework. The proposal, firmly rooted in the theory of generalised quantifiers, neo-Davidsonian semantics, and DRT, covers a wide range of quantification phenomena. The QuantML scheme consists of (1) an abstract syntax which defines {`}annotation structures{'} as triples and other set-theoretic constructs; (b) a compositional semantics of annotation structures; (3) an XML representation of annotation structures."
W18-4703,Downward Compatible Revision of Dialogue Annotation,2018,0,1,1,1,16745,harry bunt,Proceedings 14th Joint {ACL} - {ISO} Workshop on Interoperable Semantic Annotation,0,"This paper discusses some aspects of revising the ISO standard for dialogue act annotation (ISO 24617-2). The revision is aimed at making annotations using the ISO scheme more accurate and at providing more powerful tools for building natural language based dialogue systems, without invalidating the annotated resources that have been built, with the current version of the standard. In support of the revision of the standard, an analysis is provided of the downward compatibility of a revised annotation scheme with the original scheme at the levels of abstract syntax, concrete syntax, and semantics of annotations."
W18-4704,"The Revision of {ISO}-Space,Focused on the Movement Link",2018,-1,-1,3,0,18931,kiyong lee,Proceedings 14th Joint {ACL} - {ISO} Workshop on Interoperable Semantic Annotation,0,None
L18-1121,Towards Continuous Dialogue Corpus Creation: writing to corpus and generating from it,2018,0,0,3,1,29635,andrei malchanau,Proceedings of the Eleventh International Conference on Language Resources and Evaluation ({LREC} 2018),0,None
L18-1282,Towards an {ISO} Standard for the Annotation of Quantification,2018,0,1,1,1,16745,harry bunt,Proceedings of the Eleventh International Conference on Language Resources and Evaluation ({LREC} 2018),0,None
W17-7404,Revisiting the {ISO} standard for dialogue act annotation,2017,0,3,1,1,16745,harry bunt,Proceedings of the 13th Joint {ISO}-{ACL} Workshop on Interoperable Semantic Annotation ({ISA}-13),0,None
W17-7409,Towards interoperable annotation of quantification,2017,0,0,1,1,16745,harry bunt,Proceedings of the 13th Joint {ISO}-{ACL} Workshop on Interoperable Semantic Annotation ({ISA}-13),0,None
L16-1503,The {D}ialog{B}ank,2016,-1,-1,1,1,16745,harry bunt,Proceedings of the Tenth International Conference on Language Resources and Evaluation ({LREC}'16),0,"This paper presents the DialogBank, a new language resource consisting of dialogues with gold standard annotations according to the ISO 24617-2 standard. Some of these dialogues have been taken from existing corpora and have been re-annotated according to the ISO standard; others have been annotated directly according to the standard. The ISO 24617-2 annotations have been designed according to the ISO principles for semantic annotation, as formulated in ISO 24617-6. The DialogBank makes use of three alternative representation formats, which are shown to be interoperable."
W15-0201,On the Principles of Semantic Annotation,2015,0,2,1,1,16745,harry bunt,Proceedings of the 11th Joint {ACL}-{ISO} Workshop on Interoperable Semantic Annotation ({ISA}-11),0,None
W15-0210,Semantic Relations in Discourse: The Current State of {ISO} 24617-8,2015,35,10,2,0,4772,rashmi prasad,Proceedings of the 11th Joint {ACL}-{ISO} Workshop on Interoperable Semantic Annotation ({ISA}-11),0,None
petukhova-etal-2014-interoperability,Interoperability of Dialogue Corpora through {ISO} 24617-2-based Querying,2014,8,1,3,1,16746,volha petukhova,Proceedings of the Ninth International Conference on Language Resources and Evaluation ({LREC}'14),0,"This paper explores a way of achieving interoperability: developing a query format for accessing existing annotated corpora whose expressions make use of the annotation language defined by the standard. The interpretation of expressions in the query implements a mapping from ISO 24617-2 concepts to those of the annotation scheme used in the corpus. We discuss two possible ways to query existing annotated corpora using DiAML. One way is to transform corpora into DiAML compliant format, and subsequently query these data using XQuery or XPath. The second approach is to define a DiAML query that can be directly used to retrieve requested information from the annotated data. Both approaches are valid. The first one presents a standard way of querying XML data. The second approach is a DiAML-oriented querying of dialogue act annotated data, for which we designed an interface. The proposed approach is tested on two important types of existing dialogue corpora: spoken two-person dialogue corpora collected and annotated within the HCRC Map Task paradigm, and multiparty face-to-face dialogues of the AMI corpus. We present the results and evaluate them with respect to accuracy and completeness through statistical comparisons between retrieved and manually constructed reference annotations."
W13-0507,Issues in the addition of {ISO} standard annotations to the Switchboard corpus,2013,13,4,1,1,16745,harry bunt,Proceedings of the 9th Joint {ISO} - {ACL} {SIGSEM} Workshop on Interoperable Semantic Annotation,0,"This paper analyzes the issues that arise when trying to add annotations to the dialogues in the Switchboard corpus according to ISO standard 24617-2, exploiting the existing SWBD-DAMSL annotations. These issues relate to differences between the two tag sets; to the highly multidimensional view that underlies the ISO standard; to differences in segmenting the dialogues into functional units; to the use of in-line markups for certain phenomena in Switchboard, and to the use of intra-dialogue dependence relations as defined in the ISO standard. The analysis is supplemented by a discussion of how the existing annotations may be helpful to semi-automatically create a fullyfledged ISO standard annotation alongside the existing SWBD-DAMSL annotation."
W13-0202,The semantic annotation of quantification,2013,9,0,1,1,16745,harry bunt,Proceedings of the 10th International Conference on Computational Semantics ({IWCS} 2013) {--} Short Papers,0,"This paper presents an approach to the annotation of quantification, developed in the context of an ISO project aiming to define standards for semantic annotation. The approach is illustrated for a range of quantification phenomena, including cumulative, collective, and group quantification."
W12-0509,Collaborative Annotation of Dialogue Acts: Application of a New {ISO} Standard to the Switchboard Corpus,2012,1,2,2,0,16748,alex fang,Proceedings of the Workshop on Innovative Hybrid Approaches to the Processing of Textual Data,0,None
petukhova-bunt-2012-coding,The coding and annotation of multimodal dialogue acts,2012,25,5,2,1,16746,volha petukhova,Proceedings of the Eighth International Conference on Language Resources and Evaluation ({LREC}'12),0,"Recent years have witnessed a growing interest in annotating linguistic data at the semantic level, including the annotation of dialogue corpus data. The annotation scheme developed as international standard for dialogue act annotation ISO 24617-2 is based on the DIT++ scheme (Bunt, 2006; 2009) which combines the multidimensional DIT scheme (Bunt, 1994) with concepts from DAMSL (Allen and Core , 1997) and various other schemes. This scheme is designed in a such way that it can be applied not only to spoken dialogue, as is the case for most of the previously defined dialogue annotation schemes, but also to multimodal dialogue. This paper describes how the ISO 24617-2 annotation scheme can be used, together with the DIT++ method of multidimensional segmentation', to annotate nonverbal and multimodal dialogue behaviour. We analyse the fundamental distinction between (a) the coding of surface features; (b) form-related semantic classification; and (c) semantic annotation in terms of dialogue acts, supported by experimental studies of (a) and (b). We discuss examples of specification languages for representing the results of each of these activities, show how dialogue act annotations can be attached to XML representations of functional segments of multimodal data."
bunt-etal-2012-iso,{ISO} 24617-2: A semantically-based standard for dialogue annotation,2012,14,51,1,1,16745,harry bunt,Proceedings of the Eighth International Conference on Language Resources and Evaluation ({LREC}'12),0,"This paper summarizes the latest, final version of ISO standard 24617-2 ``Semantic annotation framework, Part 2: Dialogue acts''''''''. Compared to the preliminary version ISO DIS 24617-2:2010, described in Bunt et al. (2010), the final version additionally includes concepts for annotating rhetorical relations between dialogue units, defines a full-blown compositional semantics for the Dialogue Act Markup Language DiAML (resulting, as a side-effect, in a different treatment of functional dependence relations among dialogue acts and feedback dependence relations); and specifies an optimally transparent XML-based reference format for the representation of DiAML annotations, based on the systematic application of the notion of `ideal concrete syntax'. We describe these differences and briefly discuss the design and implementation of an incremental method for dialogue act recognition, which proves the usability of the ISO standard for automatic dialogue annotation."
bunt-etal-2012-using,Using {D}i{AML} and {ANVIL} for multimodal dialogue annotations,2012,22,5,1,1,16745,harry bunt,Proceedings of the Eighth International Conference on Language Resources and Evaluation ({LREC}'12),0,"This paper shows how interoperable dialogue act annotations, using the multidimensional annotation scheme and the markup language DiAML of ISO standard 24617-2, can conveniently be obtained using the newly implemented facility in the ANVIL annotation tool to produce XML-based output directly in the DiAML format. ANVIL offers the use of multiple user-defined `tiers' for annotating various kinds of information. This is shown to be convenient not only for multimodal information but also for dialogue act annotation according to ISO standard 24617-2 because of the latter's multidimensionality: functional dialogue segments are viewed as expressing one or more dialogue acts, and every dialogue act belongs to one of a number of dimensions of communication, defined in the standard, for each of which a different ANVIL tier can conveniently be used. Annotations made in the multi-tier interface can be exported in the ISO 24617-2 format, thus supporting the creation of interoperable annotated corpora of multimodal dialogue."
W11-0101,The Semantics of Dialogue Acts,2011,13,17,1,1,16745,harry bunt,Proceedings of the Ninth International Conference on Computational Semantics ({IWCS} 2011),0,"This paper presents an update semantic for dialogue acts, defined in terms of combinations of very simple 'elementary update functions'. This approach allows fine-grained distinctions to be made between related types of dialogue acts, and relations like entailment and exclusion between dialogue acts to be established. The approach is applied to dialogue act representations as defined in the Dialogue Act Markup Language (DiAML), part of the recently proposed ISO standard 24617-2 for dialogue act annotation."
W11-0125,Incremental dialogue act understanding,2011,24,15,2,1,16746,volha petukhova,Proceedings of the Ninth International Conference on Computational Semantics ({IWCS} 2011),0,"This paper presents a machine learning-based approach to the incremental understanding of dialogue utterances, with a focus on the recognition of their communicative functions. A token-based approach combining the use of local classifiers, which exploit local utterance features, and global classifiers which use the outputs of local classifiers applied to previous and subsequent tokens, is shown to result in excellent dialogue act recognition scores for unsegmented spoken dialogue. This can be seen as a significant step forward towards the development of fully incremental, on-line methods for computing the meaning of utterances in spoken dialogue."
W10-1840,Anatomy of Annotation Schemes: Mapping to {G}r{AF},2010,9,15,2,0,16303,nancy ide,Proceedings of the Fourth Linguistic Annotation Workshop,0,"In this paper, we apply the annotation scheme design methodology defined in (Bunt, 2010) and demonstrate its use for generating a mapping from an existing annotation scheme to a representation in GrAF format. The most important features of this methodology are (1) the distinction of the abstract and concrete syntax of an annotation language; (2) the specification of a formal semantics for the abstract syntax; and (3) the formalization of the relation between abstract and concrete syntax, which guarantees that any concrete syntax inherits the semantics of the abstract syntax, and thus guarantees meaning-preserving mappings between representation formats. By way of illustration, we apply this mapping strategy to annotations from ISO-TimeML, PropBank, and FrameNet."
pustejovsky-etal-2010-iso,{ISO}-{T}ime{ML}: An International Standard for Semantic Annotation,2010,8,113,3,0,993,james pustejovsky,Proceedings of the Seventh International Conference on Language Resources and Evaluation ({LREC}'10),0,"In this paper, we present ISO-TimeML, a revised and interoperable version of the temporal markup language, TimeML. We describe the changes and enrichments made, while framing the effort in a more general methodology of semantic annotation. In particular, we assume a principled distinction between the annotation of an expression and the representation which that annotation denotes. This involves not only the specification of an annotation language for a particular phenomenon, but also the development of a meta-model that allows one to interpret the syntactic expressions of the specification semantically."
petukhova-bunt-2010-towards,Towards an Integrated Scheme for Semantic Annotation of Multimodal Dialogue Data,2010,25,4,2,1,16746,volha petukhova,Proceedings of the Seventh International Conference on Language Resources and Evaluation ({LREC}'10),0,"Recent years witness a growing interest in the use of multimodal data for modelling of communicative behaviour in dialogue. Dybkjaer and Bernsen (2002), point out that coding schemes for multimodal data are used solely by their creators. Standardisation has been achieved to some extent for coding behavioural features for certain nonverbal expressions, e.g. for facial expression, however, for the semantic annotation of such expressions combined with other modalities such as speech there is still a long way to go. The majority of existing dialogue act annotation schemes that are designed to code semantic and pragmatic dialogue information are limited to analysis of spoken modality. This paper investigates the applicability of existing dialogue act annotation schemes to the semantic annotation of multimodal data, and the way a dialogue act annotation scheme can be extended to cover dialogue phenomena from multiple modalities. The general conclusion of our explorative study is that a multidimensional dialogue act taxonomy is usable for this purpose when some adjustments are made. We proposed a solution for adding these aspects to a dialogue act annotation scheme without changing its set of communicative functions, in the form of qualifiers that can be attached to communicative function tags."
bunt-etal-2010-towards,Towards an {ISO} Standard for Dialogue Act Annotation,2010,22,96,1,1,16745,harry bunt,Proceedings of the Seventh International Conference on Language Resources and Evaluation ({LREC}'10),0,"This paper describes an ISO project which aims at developing a standard for annotating spoken and multimodal dialogue with semantic information concerning the communicative functions of utterances, the kind of semantic content they address, and their relations with what was said and done earlier in the dialogue. The project, ISO 24617-2 ''``Semantic annotation framework, Part 2: Dialogue acts'''', is currently at DIS stage. The proposed annotation schema distinguishes 9 orthogonal dimensions, allowing each functional segment in dialogue to have a function in each of these dimensions, thus accounting for the multifunctionality that utterances in dialogue often have. A number of core communicative functions is defined in the form of ISO data categories, available at http://semantic-annotation.uvt.nl/dialogue-acts/iso-datcats.pdf; they are divided into ''``dimension-specific'''' functions, which can be used only in a particular dimension, such as Turn Accept in the Turn Management dimension, and ''``general-purpose'''' functions, which can be used in any dimension, such as Inform and Request. An XML-based annotation language, ''``DiAML'''' is defined, with an abstract syntax, a semantics, and a concrete syntax."
W09-3706,Semantic annotations as complimentary to underspecified semantic representations,2009,15,1,1,1,16745,harry bunt,Proceedings of the Eight International Conference on Computational Semantics,0,"This paper presents a new perspective on the use of semantic annotations. We argue that semantic annotations should (1) capture semantic information that is complimentary to the information that is expressed in the source text; (2) have a formal interpretation. If these conditions are fullfilled, then the information in semantic annotations can be effectively combined with the information in the source text by interpreting a semantic annotation language through the translation of annotations into the same formalism as underspecified semantic representations obtained through compositional semantic analysis."
W09-3715,Towards a Multidimensional Semantics of Discourse Markers in Spoken Dialogue,2009,13,17,2,1,16746,volha petukhova,Proceedings of the Eight International Conference on Computational Semantics,0,"The literature contains a wealth of theoretical and empirical analyses of discourse marker functions in human communication. Some of these studies address the phenomenon that discourse markers are often multifunctional in a given context, but do not study this in systematic and formal ways. In this paper we show that the use of multiple dimensions in distinguishing and annotating semantic units supports a more accurate analysis of the meaning of discourse markers. We present an empirically-based analysis of the semantic functions of discourse markers in dialogue. We demonstrate that the multiple functions, which a discourse marker may have, are automatically recognizable from utterance surface-features using machine-learning techniques."
W09-3725,A methodological note on the definition of semantic annotation languages (short paper),2009,0,0,1,1,16745,harry bunt,Proceedings of the Eight International Conference on Computational Semantics,0,None
N09-2050,The independence of dimensions in multidimensional dialogue act annotation,2009,5,14,2,1,16746,volha petukhova,"Proceedings of Human Language Technologies: The 2009 Annual Conference of the North {A}merican Chapter of the Association for Computational Linguistics, Companion Volume: Short Papers",0,"This paper presents empirical evidence for the orthogonality of the DIT multidimensional dialogue act annotation scheme, showing that the ten dimensions of communication which underlie this scheme are addressed independently in natural dialogue."
