W19-0413,Language-Agnostic Model for Aspect-Based Sentiment Analysis,2019,0,0,4,0.31746,7352,md akhtar,Proceedings of the 13th International Conference on Computational Semantics - Long Papers,0,"In this paper, we propose a language-agnostic deep neural network architecture for aspect-based sentiment analysis. The proposed approach is based on Bidirectional Long Short-Term Memory (Bi-LSTM) network, which is further assisted with extra hand-crafted features. We define three different architectures for the successful combination of word embeddings and hand-crafted features. We evaluate the proposed approach for six languages (i.e. English, Spanish, French, Dutch, German and Hindi) and two problems (i.e. aspect term extraction and aspect sentiment classification). Experiments show that the proposed model attains state-of-the-art performance in most of the settings."
S19-2018,{HHMM} at {S}em{E}val-2019 Task 2: Unsupervised Frame Induction using Contextualized Word Embeddings,2019,5,1,5,1,11070,saba anwar,Proceedings of the 13th International Workshop on Semantic Evaluation,0,"We present our system for semantic frame induction that showed the best performance in Subtask B.1 and finished as the runner-up in Subtask A of the SemEval 2019 Task 2 on unsupervised semantic frame induction (Qasem-iZadeh et al., 2019). Our approach separates this task into two independent steps: verb clustering using word and their context embeddings and role labeling by combining these embeddings with syntactical features. A simple combination of these steps shows very competitive results and can be extended to process other datasets and languages."
S19-2137,{UHH}-{LT} at {S}em{E}val-2019 Task 6: Supervised vs. Unsupervised Transfer Learning for Offensive Language Detection,2019,0,1,3,1,10216,gregor wiedemann,Proceedings of the 13th International Workshop on Semantic Evaluation,0,"We present a neural network based approach of transfer learning for offensive language detection. For our system, we compare two types of knowledge transfer: supervised and unsupervised pre-training. Supervised pre-training of our bidirectional GRU-3-CNN architecture is performed as multi-task learning of parallel training of five different tasks. The selected tasks are supervised classification problems from public NLP resources with some overlap to offensive language such as sentiment detection, emoji classification, and aggressive language classification. Unsupervised transfer learning is performed with a thematic clustering of 40M unlabeled tweets via LDA. Based on this dataset, pre-training is performed by predicting the main topic of a tweet. Results indicate that unsupervised transfer from large datasets performs slightly better than supervised training on small {`}near target category{'} datasets. In the SemEval Task, our system ranks 14 out of 103 participants."
S19-1014,Learning Graph Embeddings from {W}ord{N}et-based Similarity Measures,2019,0,0,4,0.449179,2619,andrey kutuzov,Proceedings of the Eighth Joint Conference on Lexical and Computational Semantics (*{SEM} 2019),0,"We present path2vec, a new approach for learning graph embeddings that relies on structural measures of pairwise node similarities. The model learns representations for nodes in a dense space that approximate a given user-defined graph distance measure, such as e.g. the shortest path distance or distance measures that take information beyond the graph structure into account. Evaluation of the proposed model on semantic similarity and word sense disambiguation tasks, using various WordNet-based similarity measures, show that our approach yields competitive results, outperforming strong graph embedding baselines. The model is computationally efficient, being orders of magnitude faster than the direct computation of graph-based distances."
P19-3031,{TARGER}: Neural Argument Mining at Your Fingertips,2019,0,1,6,0,5979,artem chernodub,Proceedings of the 57th Annual Meeting of the Association for Computational Linguistics: System Demonstrations,0,"We present TARGER, an open source neural argument mining framework for tagging arguments in free input texts and for keyword-based retrieval of arguments from an argument-tagged web-scale corpus. The currently available models are pre-trained on three recent argument mining datasets and enable the use of neural argument mining without any reproducibility effort on the user{'}s side. The open source code ensures portability to other domains and use cases."
P19-2044,Improving Neural Entity Disambiguation with Graph Embeddings,2019,0,0,3,0,25522,ozge sevgili,Proceedings of the 57th Annual Meeting of the Association for Computational Linguistics: Student Research Workshop,0,"Entity Disambiguation (ED) is the task of linking an ambiguous entity mention to a corresponding entry in a knowledge base. Current methods have mostly focused on unstructured text data to learn representations of entities, however, there is structured information in the knowledge base itself that should be useful to disambiguate entities. In this work, we propose a method that uses graph embeddings for integrating structured information from the knowledge base with unstructured information from text-based representations. Our experiments confirm that graph embeddings trained on a graph of hyperlinks between Wikipedia articles improve the performances of simple feed-forward neural ED model and a state-of-the-art neural ED system."
P19-2045,Hierarchical Multi-label Classification of Text with Capsule Networks,2019,0,6,3,0,635,rami aly,Proceedings of the 57th Annual Meeting of the Association for Computational Linguistics: Student Research Workshop,0,"Capsule networks have been shown to demonstrate good performance on structured data in the area of visual inference. In this paper we apply and compare simple shallow capsule networks for hierarchical multi-label text classification and show that they can perform superior to other neural networks, such as CNNs and LSTMs, and non-neural network architectures such as SVMs. For our experiments, we use the established Web of Science (WOS) dataset and introduce a new real-world scenario dataset, the BlurbGenreCollection (BGC). Our results confirm the hypothesis that capsule networks are especially advantageous for rare events and structurally diverse categories, which we attribute to their ability to combine latent encoded information."
P19-1316,On the Compositionality Prediction of Noun Phrases using Poincar{\\'e} Embeddings,2019,43,0,5,1,2564,abhik jana,Proceedings of the 57th Annual Meeting of the Association for Computational Linguistics,1,"The compositionality degree of multiword expressions indicates to what extent the meaning of a phrase can be derived from the meaning of its constituents and their grammatical relations. Prediction of (non)-compositionality is a task that has been frequently addressed with distributional semantic models. We introduce a novel technique to blend hierarchical information with distributional information for predicting compositionality. In particular, we use hypernymy information of the multiword and its constituents encoded in the form of the recently introduced Poincar{\'e} embeddings in addition to the distributional information to detect compositionality for noun phrases. Using a weighted average of the distributional similarity and a Poincar{\'e} similarity function, we obtain consistent and substantial, statistically significant improvement across three gold standard datasets over state-of-the-art models based on distributional information only. Unlike traditional approaches that solely use an unsupervised setting, we have also framed the problem as a supervised task, obtaining comparable improvements. Further, we publicly release our Poincar{\'e} embeddings, which are trained on the output of handcrafted lexical-syntactic patterns on a large corpus."
P19-1325,Making Fast Graph-based Algorithms with Graph Metric Embeddings,2019,32,0,4,0.449179,2619,andrey kutuzov,Proceedings of the 57th Annual Meeting of the Association for Computational Linguistics,1,"Graph measures, such as node distances, are inefficient to compute. We explore dense vector representations as an effective way to approximate the same information. We introduce a simple yet efficient and effective approach for learning graph embeddings. Instead of directly operating on the graph structure, our method takes structural measures of pairwise node similarities into account and learns dense node representations reflecting user-defined graph distance measures, such as e.g. the shortest path distance or distance measures that take information beyond the graph structure into account. We demonstrate a speed-up of several orders of magnitude when predicting word similarity by vector operations on our embeddings as opposed to directly computing the respective path-based measures, while outperforming various other graph embeddings on semantic similarity and word sense disambiguation tasks."
P19-1474,Every Child Should Have Parents: A Taxonomy Refinement Algorithm Based on Hyperbolic Term Embeddings,2019,29,0,5,0,635,rami aly,Proceedings of the 57th Annual Meeting of the Association for Computational Linguistics,1,"We introduce the use of Poincar{\'e} embeddings to improve existing state-of-the-art approaches to domain-specific taxonomy induction from text as a signal for both relocating wrong hyponym terms within a (pre-induced) taxonomy as well as for attaching disconnected terms in a taxonomy. This method substantially improves previous state-of-the-art results on the SemEval-2016 Task 13 on taxonomy extraction. We demonstrate the superiority of Poincar{\'e} embeddings over distributional semantic representations, supporting the hypothesis that they can better capture hierarchical lexical-semantic relationships than embeddings in the Euclidean space."
P19-1584,Adversarial Learning of Privacy-Preserving Text Representations for De-Identification of Medical Records,2019,0,0,4,0,25891,max friedrich,Proceedings of the 57th Annual Meeting of the Association for Computational Linguistics,1,"De-identification is the task of detecting protected health information (PHI) in medical text. It is a critical step in sanitizing electronic health records (EHR) to be shared for research. Automatic de-identification classifiers can significantly speed up the sanitization process. However, obtaining a large and diverse dataset to train such a classifier that works well across many types of medical text poses a challenge as privacy laws prohibit the sharing of raw medical records. We introduce a method to create privacy-preserving shareable representations of medical text (i.e. they contain no PHI) that does not require expensive manual pseudonymization. These representations can be shared between organizations to create unified datasets for training de-identification models. Our representation allows training a simple LSTM-CRF de-identification model to an F1 score of 97.4{\%}, which is comparable to a strong baseline that exposes private information in its representation. A robust, widely available de-identification classifier based on our representation could potentially enable studies for which de-identification would otherwise be too costly."
N19-4017,{LT} Expertfinder: An Evaluation Framework for Expert Finding Methods,2019,0,1,3,0,25969,tim fischer,Proceedings of the 2019 Conference of the North {A}merican Chapter of the Association for Computational Linguistics (Demonstrations),0,"Expert finding is the task of ranking persons for a predefined topic or search query. Finding experts for a specified area is an important task and has attracted much attention in the information retrieval community. Most approaches for this task are evaluated in a supervised fashion, which depend on predefined topics of interest as well as gold standard expert rankings. Famous representatives of such datasets are enriched versions of DBLP provided by the ArnetMiner projet or the W3C Corpus of TREC. However, manually ranking experts can be considered highly subjective and detailed rankings are hardly distinguishable. Evaluating these datasets does not necessarily guarantee a good or bad performance of the system. Particularly for dynamic systems, where topics are not predefined but formulated as a search query, we believe a more informative approach is to perform user studies for directly comparing different methods in the same view. In order to accomplish this in a user-friendly way, we present the LT Expert Finder web-application, which is equipped with various query-based expert finding methods that can be easily extended, a detailed expert profile view, detailed evidence in form of relevant documents and statistics, and an evaluation component that allows the qualitative comparison between different rankings."
J19-3002,Watset: Local-Global Graph Clustering with Applications in Sense and Frame Induction,2019,145,2,3,1,756,dmitry ustalov,Computational Linguistics,0,"We present a detailed theoretical and computational analysis of the Watset meta-algorithm for fuzzy graph clustering, which has been found to be widely applicable in a variety of domains. This algorithm creates an intermediate representation of the input graph, which reflects the {``}ambiguity{''} of its nodes. Then, it uses hard clustering to discover clusters in this {``}disambiguated{''} intermediate graph. After outlining the approach and analyzing its computational complexity, we demonstrate that Watset shows competitive results in three applications: unsupervised synset induction from a synonymy graph, unsupervised semantic frame induction from dependency triples, and unsupervised semantic class induction from a distributional thesaurus. Our algorithm is generic and can also be applied to other networks of linguistic data."
W18-0507,A Report on the Complex Word Identification Shared Task 2018,2018,16,0,2,1,282,seid yimam,Proceedings of the Thirteenth Workshop on Innovative Use of {NLP} for Building Educational Applications,0,"We report the findings of the second Complex Word Identification (CWI) shared task organized as part of the BEA workshop co-located with NAACL-HLT{'}2018. The second CWI shared task featured multilingual and multi-genre datasets divided into four tracks: English monolingual, German monolingual, Spanish monolingual, and a multilingual track with a French test set, and two tasks: binary classification and probabilistic classification. A total of 12 teams submitted their results in different task/track combinations and 11 of them wrote system description papers that are referred to in this report and appear in the BEA workshop proceedings."
S18-1163,"{B}om{J}i at {S}em{E}val-2018 Task 10: Combining Vector-, Pattern- and Graph-based Information to Identify Discriminative Attributes",2018,0,0,2,0,181,enrico santus,Proceedings of The 12th International Workshop on Semantic Evaluation,0,"This paper describes BomJi, a supervised system for capturing discriminative attributes in word pairs (e.g. yellow as discriminative for banana over watermelon). The system relies on an XGB classifier trained on carefully engineered graph-, pattern- and word embedding-based features. It participated in the SemEval-2018 Task 10 on Capturing Discriminative Attributes, achieving an F1 score of 0.73 and ranking 2nd out of 26 participant systems."
P18-2010,Unsupervised Semantic Frame Induction using Triclustering,2018,20,3,4,1,756,dmitry ustalov,Proceedings of the 56th Annual Meeting of the Association for Computational Linguistics (Volume 2: Short Papers),0,"We use dependency triples automatically extracted from a Web-scale corpus to perform unsupervised semantic frame induction. We cast the frame induction problem as a triclustering problem that is a generalization of clustering for triadic data. Our replicable benchmarks demonstrate that the proposed graph-based approach, Triframes, shows state-of-the art results on this task on a FrameNet-derived dataset and performing on par with competitive methods on a verb class clustering task."
N18-3027,Document-based Recommender System for Job Postings using Dense Representations,2018,0,2,3,0,29338,ahmed elsafty,"Proceedings of the 2018 Conference of the North {A}merican Chapter of the Association for Computational Linguistics: Human Language Technologies, Volume 3 (Industry Papers)",0,"Job boards and professional social networks heavily use recommender systems in order to better support users in exploring job advertisements. Detecting the similarity between job advertisements is important for job recommendation systems as it allows, for example, the application of item-to-item based recommendations. In this work, we research the usage of dense vector representations to enhance a large-scale job recommendation system and to rank German job advertisements regarding their similarity. We follow a two-folded evaluation scheme: (1) we exploit historic user interactions to automatically create a dataset of similar jobs that enables an offline evaluation. (2) In addition, we conduct an online A/B test and evaluate the best performing method on our platform reaching more than 1 million users. We achieve the best results by combining job titles with full-text job descriptions. In particular, this method builds dense document representation using words of the titles to weigh the importance of words of the full-text description. In the online evaluation, this approach allows us to increase the click-through rate on job recommendations for active users by 8.0{\%}."
L18-1093,Enriching Frame Representations with Distributionally Induced Senses,2018,17,0,3,1,17226,stefano faralli,Proceedings of the Eleventh International Conference on Language Resources and Evaluation ({LREC} 2018),0,"We introduce a new lexical resource that enriches the Framester knowledge graph, which links Framnet, WordNet, VerbNet and other resources, with semantic features from text corpora. These features are extracted from distributionally induced sense inventories and subsequently linked to the manually-constructed frame representations to boost the performance of frame disambiguation in context. Since Framester is a frame-based knowledge graph, which enables full-fledged OWL querying and reasoning, our resource paves the way for the development of novel, deeper semantic-aware applications that could benefit from the combination of knowledge from text and complex symbolic representations of events and participants. Together with the resource we also provide the software we developed for the evaluation in the task of Word Frame Disambiguation (WFD)."
L18-1164,An Unsupervised Word Sense Disambiguation System for Under-Resourced Languages,2018,13,1,5,1,756,dmitry ustalov,Proceedings of the Eleventh International Conference on Language Resources and Evaluation ({LREC} 2018),0,"In this paper, we present Watasense, an unsupervised system for word sense disambiguation. Given a sentence, the system chooses the most relevant sense of each input word with respect to the semantic similarity between the given sentence and the synset constituting the sense of the target word. Watasense has two modes of operation. The sparse mode uses the traditional vector space model to estimate the most similar word sense corresponding to its context. The dense mode, instead, uses synset embeddings to cope with the sparsity problem. We describe the architecture of the present system and also conduct its evaluation on three different lexical semantic resources for Russian. We found that the dense mode substantially outperforms the sparse one on all datasets according to the adjusted Rand index."
L18-1167,Retrofitting Word Representations for Unsupervised Sense Aware Word Similarities,2018,0,3,2,1,18079,steffen remus,Proceedings of the Eleventh International Conference on Language Resources and Evaluation ({LREC} 2018),0,None
L18-1244,Improving Hypernymy Extraction with Distributional Semantic Classes,2018,0,1,5,1,1663,alexander panchenko,Proceedings of the Eleventh International Conference on Language Resources and Evaluation ({LREC} 2018),0,"In this paper, we show for the first time how distributionally-induced semantic classes can be helpful for extraction of hypernyms. We present a method for (1) inducing sense-aware semantic classes using distributional semantics and (2) using these induced semantic classes for filtering noisy hypernymy relations. Denoising of hypernyms is performed by labeling each semantic class with its hypernyms. On one hand, this allows us to filter out wrong extractions using the global structure of the distributionally similar senses. On the other hand, we infer missing hypernyms via label propagation to cluster terms. We conduct a large-scale crowdsourcing study showing that processing of automatically extracted hypernyms using our approach improves the quality of the hypernymy extraction both in terms of precision and recall. Furthermore, we show the utility of our method in the domain taxonomy induction task, achieving the state-of-the-art results on a benchmarking dataset."
L18-1286,Building a Web-Scale Dependency-Parsed Corpus from {C}ommon{C}rawl,2018,-1,-1,5,1,1663,alexander panchenko,Proceedings of the Eleventh International Conference on Language Resources and Evaluation ({LREC} 2018),0,None
J18-3005,Using Semantics for Granularities of Tokenization,2018,36,1,2,1,24663,martin riedl,Computational Linguistics,0,"Depending on downstream applications, it is advisable to extend the notion of tokenization from low-level character-based token boundary detection to identification of meaningful and useful language units. This entails both identifying units composed of several single words that form a several single words that form a, as well as splitting single-word compounds into their meaningful parts. In this article, we introduce unsupervised and knowledge-free methods for these two tasks. The main novelty of our research is based on the fact that methods are primarily based on distributional similarity, of which we use two flavors: a sparse count-based and a dense neural-based distributional semantic model. First, we introduce DRUID, which is a method for detecting MWEs. The evaluation on MWE-annotated data sets in two languages and newly extracted evaluation data sets for 32 languages shows that DRUID compares favorably over previous methods not utilizing distributional information. Second, we present SECOS, an algorithm for decompounding close compounds. In an evaluation of four dedicated decompounding data sets across four languages and on data sets extracted from Wiktionary for 14 languages, we demonstrate the superiority of our approach over unsupervised baselines, sometimes even matching the performance of previous language-specific and supervised methods. In a final experiment, we show how both decompounding and MWE information can be used in information retrieval. Here, we obtain the best results when combining word information with MWEs and the compound parts in a bag-of-words retrieval set-up. Overall, our methodology paves the way to automatic detection of lexical units beyond standard tokenization techniques without language-specific preprocessing steps such as POS tagging."
D18-2009,Demonstrating {P}ar4{S}em - A Semantic Writing Aid with Adaptive Paraphrasing,2018,0,0,2,1,282,seid yimam,Proceedings of the 2018 Conference on Empirical Methods in Natural Language Processing: System Demonstrations,0,"In this paper, we present Par4Sem, a semantic writing aid tool based on adaptive paraphrasing. Unlike many annotation tools that are primarily used to collect training examples, Par4Sem is integrated into a real word application, in this case a writing aid tool, in order to collect training examples from usage data. Par4Sem is a tool, which supports an adaptive, iterative, and interactive process where the underlying machine learning models are updated for each iteration using new training examples from usage data. After motivating the use of ever-learning tools in NLP applications, we evaluate Par4Sem by adopting it to a text simplification task through mere usage."
D18-2014,A Multilingual Information Extraction Pipeline for Investigative Journalism,2018,10,0,3,1,10216,gregor wiedemann,Proceedings of the 2018 Conference on Empirical Methods in Natural Language Processing: System Demonstrations,0,"We introduce an advanced information extraction pipeline to automatically process very large collections of unstructured textual data for the purpose of investigative journalism. The pipeline serves as a new input processor for the upcoming major release of our New/s/leak 2.0 software, which we develop in cooperation with a large German news organization. The use case is that journalists receive a large collection of files up to several Gigabytes containing unknown contents. Collections may originate either from official disclosures of documents, e.g. Freedom of Information Act requests, or unofficial data leaks."
