N18-1139,Generating Descriptions from Structured Data Using a Bifocal Attention Mechanism and Gated Orthogonalization,2018,35,2,6,1,20297,preksha nema,"Proceedings of the 2018 Conference of the North {A}merican Chapter of the Association for Computational Linguistics: Human Language Technologies, Volume 1 (Long Papers)",0,"In this work, we focus on the task of generating natural language descriptions from a structured table of facts containing fields (such as nationality, occupation, etc) and values (such as Indian, actor, director, etc). One simple choice is to treat the table as a sequence of fields and values and then use a standard seq2seq model for this task. However, such a model is too generic and does not exploit task specific characteristics. For example, while generating descriptions from a table, a human would attend to information at two levels: (i) the fields (macro level) and (ii) the values within the field (micro level). Further, a human would continue attending to a field for a few timesteps till all the information from that field has been rendered and then never return back to this field (because there is nothing left to say about it). To capture this behavior we use (i) a fused bifocal attention mechanism which exploits and combines this micro and macro level information and (ii) a gated orthogonalization mechanism which tries to ensure that a field is remembered for a few time steps and then forgotten. We experiment with a recently released dataset which contains fact tables about people and their corresponding one line biographical descriptions in English. In addition, we also introduce two similar datasets for French and German. Our experiments show that the proposed model gives 21{\%} relative improvement over a recently proposed state of the art method and 10{\%} relative improvement over basic seq2seq models. The code and the datasets developed as a part of this work are publicly available on \url{https://github.com/PrekshaNema25/StructuredData_To_Descriptions}"
D18-1255,Towards Exploiting Background Knowledge for Building Conversation Systems,2018,0,26,4,1,8806,nikita moghe,Proceedings of the 2018 Conference on Empirical Methods in Natural Language Processing,0,"Existing dialog datasets contain a sequence of utterances and responses without any explicit background knowledge associated with them. This has resulted in the development of models which treat conversation as a sequence-to-sequence generation task (i.e., given a sequence of utterances generate the response sequence). This is not only an overly simplistic view of conversation but it is also emphatically different from the way humans converse by heavily relying on their background knowledge about the topic (as opposed to simply relying on the previous sequence of utterances). For example, it is common for humans to (involuntarily) produce utterances which are copied or suitably modified from background articles they have read about the topic. To facilitate the development of such natural conversation models which mimic the human process of conversing, we create a new dataset containing movie chats wherein each response is explicitly generated by copying and/or modifying sentences from unstructured background knowledge such as plots, comments and reviews about the movie. We establish baseline results on this dataset (90K utterances from 9K conversations) using three different models: (i) pure generation based models which ignore the background knowledge (ii) generation based models which learn to copy information from the background knowledge when required and (iii) span prediction based models which predict the appropriate response span in the background knowledge."
D18-1429,Towards a Better Metric for Evaluating Question Generation Systems,2018,31,3,2,1,20297,preksha nema,Proceedings of the 2018 Conference on Empirical Methods in Natural Language Processing,0,"There has always been criticism for using $n$-gram based similarity metrics, such as BLEU, NIST, \textit{etc}, for evaluating the performance of NLG systems. However, these metrics continue to remain popular and are recently being used for evaluating the performance of systems which automatically generate questions from documents, knowledge graphs, images, \textit{etc}. Given the rising interest in such automatic question generation (AQG) systems, it is important to objectively examine whether these metrics are suitable for this task. In particular, it is important to verify whether such metrics used for evaluating AQG systems focus on \textit{answerability} of the generated question by preferring questions which contain all relevant information such as question type (Wh-types), entities, relations, \textit{etc}. In this work, we show that current automatic evaluation metrics based on $n$-gram similarity do not always correlate well with human judgments about \textit{answerability} of a question. To alleviate this problem and as a first step towards better evaluation metrics for AQG, we introduce a scoring function to capture \textit{answerability} and show that when this scoring function is integrated with existing metrics, they correlate significantly better with human judgments. The scripts and data developed as a part of this work are made publicly available."
C18-1319,A Dataset for Building Code-Mixed Goal Oriented Conversation Systems,2018,45,1,4,1,25420,suman banerjee,Proceedings of the 27th International Conference on Computational Linguistics,0,"There is an increasing demand for goal-oriented conversation systems which can assist users in various day-to-day activities such as booking tickets, restaurant reservations, shopping, etc. Most of the existing datasets for building such conversation systems focus on monolingual conversations and there is hardly any work on multilingual and/or code-mixed conversations. Such datasets and systems thus do not cater to the multilingual regions of the world, such as India, where it is very common for people to speak more than one language and seamlessly switch between them resulting in code-mixed conversations. For example, a Hindi speaking user looking to book a restaurant would typically ask, {``}Kya tum is restaurant mein ek table book karne mein meri help karoge?{''} ({``}Can you help me in booking a table at this restaurant?{''}). To facilitate the development of such code-mixed conversation models, we build a goal-oriented dialog dataset containing code-mixed conversations. Specifically, we take the text from the DSTC2 restaurant reservation dataset and create code-mixed versions of it in Hindi-English, Bengali-English, Gujarati-English and Tamil-English. We also establish initial baselines on this dataset using existing state of the art models. This dataset along with our baseline implementations will be made publicly available for research purposes."
P17-1098,Diversity driven attention model for query-based abstractive summarization,2017,20,15,2,1,20297,preksha nema,Proceedings of the 55th Annual Meeting of the Association for Computational Linguistics (Volume 1: Long Papers),1,"Abstractive summarization aims to generate a shorter version of the document covering all the salient points in a compact and coherent fashion. On the other hand, query-based summarization highlights those points that are relevant in the context of a given query. The encode-attend-decode paradigm has achieved notable success in machine translation, extractive summarization, dialog systems, etc. But it suffers from the drawback of generation of repeated phrases. In this work we propose a model for the query-based summarization task based on the encode-attend-decode paradigm with two key additions (i) a query attention model (in addition to document attention model) which learns to focus on different portions of the query at different time steps (instead of using a static representation for the query) and (ii) a new diversity based attention model which aims to alleviate the problem of repeating phrases in the summary. In order to enable the testing of this model we introduce a new query-based summarization dataset building on debatepedia. Our experiments show that with these two additions the proposed model clearly outperforms vanilla encode-attend-decode models with a gain of 28{\%} (absolute) in ROUGE-L scores."
E17-1036,Generating Natural Language Question-Answer Pairs from a Knowledge Graph Using a {RNN} Based Question Generation Model,2017,21,25,3,0,33028,sathish reddy,"Proceedings of the 15th Conference of the {E}uropean Chapter of the Association for Computational Linguistics: Volume 1, Long Papers",0,"In recent years, knowledge graphs such as Freebase that capture facts about entities and relationships between them have been used actively for answering factoid questions. In this paper, we explore the problem of automatically generating question answer pairs from a given knowledge graph. The generated question answer (QA) pairs can be used in several downstream applications. For example, they could be used for training better QA systems. To generate such QA pairs, we first extract a set of keywords from entities and relationships expressed in a triple stored in the knowledge graph. From each such set, we use a subset of keywords to generate a natural language question that has a unique answer. We treat this subset of keywords as a sequence and propose a sequence to sequence model using RNN to generate a natural language question from it. Our RNN based model generates QA pairs with an accuracy of 33.61 percent and performs 110.47 percent (relative) better than a state-of-the-art template based method for generating natural language question from keywords. We also do an extrinsic evaluation by using the generated QA pairs to train a QA system and observe that the F1-score of the QA system improves by 5.5 percent (relative) when using automatically generated QA pairs in addition to manually generated QA pairs available for training."
N16-4002,Multilingual Multimodal Language Processing Using Neural Networks,2016,0,0,1,1,3162,mitesh khapra,Proceedings of the 2016 Conference of the North {A}merican Chapter of the Association for Computational Linguistics: Tutorial Abstracts,0,None
N16-4006,Statistical Machine Translation between Related Languages,2016,5,4,2,0,382,pushpak bhattacharyya,Proceedings of the 2016 Conference of the North {A}merican Chapter of the Association for Computational Linguistics: Tutorial Abstracts,0,None
N16-1021,Bridge Correlational Neural Networks for Multilingual Multimodal Representation Learning,2016,22,15,2,0,2959,janarthanan rajendran,Proceedings of the 2016 Conference of the North {A}merican Chapter of the Association for Computational Linguistics: Human Language Technologies,0,None
K16-1027,Substring-based unsupervised transliteration with phonetic and contextual knowledge,2016,0,0,3,0.212563,290,anoop kunchukuttan,Proceedings of The 20th {SIGNLL} Conference on Computational Natural Language Learning,0,None
C16-1011,A Correlational Encoder Decoder Architecture for Pivot Based Sequence Generation,2016,31,7,2,1,25404,amrita saha,"Proceedings of {COLING} 2016, the 26th International Conference on Computational Linguistics: Technical Papers",0,"Interlingua based Machine Translation (MT) aims to encode multiple languages into a common linguistic representation and then decode sentences in multiple target languages from this representation. In this work we explore this idea in the context of neural encoder decoder architectures, albeit on a smaller scale and without MT as the end goal. Specifically, we consider the case of three languages or modalities X, Z and Y wherein we are interested in generating sequences in Y starting from information available in X. However, there is no parallel training data available between X and Y but, training data is available between X {\&} Z and Z {\&} Y (as is often the case in many real world applications). Z thus acts as a pivot/bridge. An obvious solution, which is perhaps less elegant but works very well in practice is to train a two stage model which first converts from X to Z and then from Z to Y. Instead we explore an interlingua inspired solution which jointly learns to do the following (i) encode X and Z to a common representation and (ii) decode Y from this common representation. We evaluate our model on two tasks: (i) bridge transliteration and (ii) bridge captioning. We report promising results in both these applications and believe that this is a right step towards truly interlingua inspired encoder decoder architectures."
D15-1050,Show Me Your Evidence - an Automatic Method for Context Dependent Evidence Detection,2015,34,63,4,0,23066,ruty rinott,Proceedings of the 2015 Conference on Empirical Methods in Natural Language Processing,0,"Engaging in a debate with oneself or others to take decisions is an integral part of our day-today life. A debate on a topic (say, use of performance enhancing drugs) typically proceeds by one party making an assertion/claim (say, PEDs are bad for health) and then providing an evidence to support the claim (say, a 2006 study shows that PEDs have psychiatric side effects). In this work, we propose the task of automatically detecting such evidences from unstructured text that support a given claim. This task has many practical applications in decision support and persuasion enhancement in a wide range of domains. We first introduce an extensive benchmark data set tailored for this task, which allows training statistical models and assessing their performance. Then, we suggest a system architecture based on supervised learning to address the evidence detection task. Finally, promising experimental results are reported."
khapra-etal-2014-transliteration,"When Transliteration Met Crowdsourcing : An Empirical Study of Transliteration via Crowdsourcing using Efficient, Non-redundant and Fair Quality Control",2014,20,4,1,1,3162,mitesh khapra,Proceedings of the Ninth International Conference on Language Resources and Evaluation ({LREC}'14),0,"Sufficient parallel transliteration pairs are needed for training state of the art transliteration engines. Given the cost involved, it is often infeasible to collect such data using experts. Crowdsourcing could be a cheaper alternative, provided that a good quality control (QC) mechanism can be devised for this task. Most QC mechanisms employed in crowdsourcing are aggressive (unfair to workers) and expensive (unfair to requesters). In contrast, we propose a low-cost QC mechanism which is fair to both workers and requesters. At the heart of our approach, lies a rule based Transliteration Equivalence approach which takes as input a list of vowels in the two languages and a mapping of the consonants in the two languages. We empirically show that our approach outperforms other popular QC mechanisms ({\textbackslash}textit{viz.}, consensus and sampling) on two vital parameters : (i) fairness to requesters (lower cost per correct transliteration) and (ii) fairness to workers (lower rate of rejecting correct answers). Further, as an extrinsic evaluation we use the standard NEWS 2010 test set and show that such quality controlled crowdsourced data compares well to expert data when used for training a transliteration engine."
C14-2002,Claims on demand {--} an initial demonstration of a system for automatic detection and polarity identification of context dependent claims in massive corpora,2014,7,4,10,0,10089,noam slonim,"Proceedings of {COLING} 2014, the 25th International Conference on Computational Linguistics: System Demonstrations",0,"While discussing a concrete controversial topic, most humans will find it challenging to swiftly raise a diverse set of convincing and relevant claims that should set the basis of their arguments. Here, we demonstrate the initial capabilities of a system that, given a controversial topic, can automatically pinpoint relevant claims in Wikipedia, determine their polarity with respect to the given topic, and articulate them per the user's request."
P13-1125,Cut the noise: Mutually reinforcing reordering and alignments for improved machine translation,2013,31,3,2,0,39171,karthik visweswariah,Proceedings of the 51st Annual Meeting of the Association for Computational Linguistics (Volume 1: Long Papers),1,"Preordering of a source language sentence to match target word order has proved to be useful for improving machine translation systems. Previous work has shown that a reordering model can be learned from high quality manual word alignments to improve machine translation performance. In this paper, we focus on further improving the performance of the reordering model (and thereby machine translation) by using a larger corpus of sentence aligned data for which manual word alignments are not available but automatic machine generated alignments are available. The main challenge we tackle is to generate quality data for training the reordering model in spite of the machine alignments being noisy. To mitigate the effect of noisy machine alignments, we propose a novel approach that improves reorderings produced given noisy alignments and also improves word alignments using information from the reordering model. This approach generates alignments that are 2.6 f-Measure points better than a baseline supervised aligner. The data generated allows us to train a reordering model that gives an improvement of 1.8 BLEU points on the NIST MT-08 Urdu-English evaluation set over a reordering model that only uses manual word alignments, and a gain of 5.2 BLEU points over a standard phrase-based baseline."
N13-1032,Improving reordering performance using higher order and structural features,2013,27,5,1,1,3162,mitesh khapra,Proceedings of the 2013 Conference of the North {A}merican Chapter of the Association for Computational Linguistics: Human Language Technologies,0,"Recent work has shown that word aligned data can be used to learn a model for reordering source sentences to match the target order. This model learns the cost of putting a word immediately before another word and finds the best reordering by solving an instance of the Traveling Salesman Problem (TSP). However, for efficiently solving the TSP, the model is restricted to pairwise features which examine only a pair of words and their neighborhood. In this work, we go beyond these pairwise features and learn a model to rerank the n-best reorderings produced by the TSP model using higher order and structural features which help in capturing longer range dependencies. In addition to using a more informative set of source side features, we also capture target side features indirectly by using the translation score assigned to a reordering. Our experiments, involving Urdu-English, show that the proposed approach outperforms a state-of-theart PBSMT system which uses the TSP model for reordering by 1.3 BLEU points, and a publicly available state-of-the-art MT system, Hiero, by 3 BLEU points."
W12-5901,Whitepaper for Shared Task on Learning Reordering from Word Alignments at {RSMT} 2012,2012,7,0,1,1,3162,mitesh khapra,Proceedings of the Workshop on Reordering for Statistical Machine Translation,0,"Several studies have shown that the task of reordering source sentences to match the target order is crucial to improve the performance of Statistical Machine Translation, especially when the source and target languages have significantly divergent grammatical structures. In fact, it is now become a standard practice to include reordering as a pre-processing step or as an integrated module (within the decoder). However, despite the importance of this sub-task, there is no forum dedicated for its evaluation. The objective of the proposed Shared Task is to provide a common benchmarking platform to evaluate state of the art approaches for reordering."
W12-5902,Report of the Shared Task on Learning Reordering from Word Alignments at {RSMT} 2012,2012,5,0,1,1,3162,mitesh khapra,Proceedings of the Workshop on Reordering for Statistical Machine Translation,0,"Several studies have shown that the task of reordering source sentences to match the target order is crucial to improve the performance of Statistical Machine Translation, especially when the source and target languages have significantly divergent grammatical structures. In fact, it is now become a standard practice to include reordering as a pre-processing step or as an integrated module (within the decoder). However, despite the importance of this sub-task, there is no forum dedicated for its evaluation. The objective of this Shared Task was to provide a common benchmarking platform to evaluate state of the art approaches for reordering."
kunchukuttan-etal-2012-experiences,Experiences in Resource Generation for Machine Translation through Crowdsourcing,2012,21,9,6,0.212563,290,anoop kunchukuttan,Proceedings of the Eighth International Conference on Language Resources and Evaluation ({LREC}'12),0,"The logistics of collecting resources for Machine Translation (MT) has always been a cause of concern for some of the resource deprived languages of the world. The recent advent of crowdsourcing platforms provides an opportunity to explore the large scale generation of resources for MT. However, before venturing into this mode of resource collection, it is important to understand the various factors such as, task design, crowd motivation, quality control, etc. which can influence the success of such a crowd sourcing venture. In this paper, we present our experiences based on a series of experiments performed. This is an attempt to provide a holistic view of the different facets of translation crowd sourcing and identifying key challenges which need to be addressed for building a practical crowdsourcing solution for MT."
C12-3031,{I} Can Sense It: a Comprehensive Online System for {WSD},2012,5,2,2,0,41612,salil joshi,Proceedings of {COLING} 2012: Demonstration Papers,0,"We have developed an online interface for running all the current state-of-the-art algorithms for WSD. This is motivated by the fact that exhaustive comparison of a new Word Sense Disambiguation (WSD) algorithm with existing state-of-the-art algorithms is a tedious task. This impediment is due to one of the following reasons: (1) the source code of the earlier approach is not available and there is a considerable overhead in implementing it or (2) the source code/binary is available but there is some overhead in using it due to system requirements, portability issues, customization issues and software dependencies. A simple tool which has no overhead for the user and has minimal system requirements would greatly benefit the researchers. Our system currently supports 3 languages, viz., English, Hindi and Marathi, and requires only a web-browser to run. To demonstrate the usability of our system, we compare the performance of current state-of-the-art algorithms on 3 publicly available datasets."
P11-1057,Together We Can: Bilingual Bootstrapping for {WSD},2011,12,9,1,1,3162,mitesh khapra,Proceedings of the 49th Annual Meeting of the Association for Computational Linguistics: Human Language Technologies,1,"Recent work on bilingual Word Sense Disambiguation (WSD) has shown that a resource deprived language (L1) can benefit from the annotation work done in a resource rich language (L2) via parameter projection. However, this method assumes the presence of sufficient annotated data in one resource rich language which may not always be possible. Instead, we focus on the situation where there are two resource deprived languages, both having a very small amount of seed annotated data and a large amount of untagged data. We then use bilingual bootstrapping, wherein, a model trained using the seed annotated data of L1 is used to annotate the untagged data of L2 and vice versa using parameter projection. The untagged instances of L1 and L2 which get annotated with high confidence are then added to the seed data of the respective languages and the above process is repeated. Our experiments show that such a bilingual bootstrapping algorithm when evaluated on two different domains with small seed sizes using Hindi (L1) and Marathi (L2) as the language pair performs better than monolingual bootstrapping and significantly reduces annotation cost."
I11-1078,It Takes Two to Tango: A Bilingual Unsupervised Approach for Estimating Sense Distributions using Expectation Maximization,2011,23,4,1,1,3162,mitesh khapra,Proceedings of 5th International Joint Conference on Natural Language Processing,0,"Several bilingual WSD algorithms which exploit translation correspondences between parallel corpora have been proposed. However, the availability of such parallel corpora itself is a tall task for some of the resource constrained languages of the world. We propose an unsupervised bilingual EM based algorithm which relies on the counts of translations to estimate sense distributions. No parallel or sense annotated corpora are needed. The algorithm relies on a synset-aligned bilingual dictionary and in-domain corpora from the two languages. A symmetric generalized Expectation Maximization formulation is used wherein the sense distributions of words in one language are estimated based on the raw counts of the words in the aligned synset in the target language. The overall performance of our algorithm when tested on 4 language-domain pairs is better than current state-of-the-art knowledge based and bilingual unsupervised ap"
