2021.wnut-1.28,A Novel Framework for Detecting Important Subevents from Crisis Events via Dynamic Semantic Graphs,2021,-1,-1,3,0,189,evangelia spiliopoulou,Proceedings of the Seventh Workshop on Noisy User-generated Text (W-NUT 2021),0,"Social media is an essential tool to share information about crisis events, such as natural disasters. Event Detection aims at extracting information in the form of an event, but considers each event in isolation, without combining information across sentences or events. Many posts in Crisis NLP contain repetitive or complementary information which needs to be aggregated (e.g., the number of trapped people and their location) for disaster response. Although previous approaches in Crisis NLP aggregate information across posts, they only use shallow representations of the content (e.g., keywords), which cannot adequately represent the semantics of a crisis event and its sub-events. In this work, we propose a novel framework to extract critical sub-events from a large-scale crisis event by combining important information across relevant tweets. Our framework first converts all the tweets from a crisis event into a temporally-ordered set of graphs. Then it extracts sub-graphs that represent semantic relationships connecting verbs and nouns in 3 to 6 node sub-graphs. It does this by learning edge weights via Dynamic Graph Convolutional Networks (DGCNs) and extracting smaller, relevant sub-graphs. Our experiments show that our extracted structures (1) are semantically meaningful sub-events and (2) contain information important for the large crisis-event. Furthermore, we show that our approach significantly outperforms event detection baselines, highlighting the importance of aggregating information across tweets for our task."
2021.textgraphs-1.13,{GTN}-{ED}: Event Detection Using Graph Transformer Networks,2021,-1,-1,5,0,744,sanghamitra dutta,Proceedings of the Fifteenth Workshop on Graph-Based Methods for Natural Language Processing (TextGraphs-15),0,"Recent works show that the graph structure of sentences, generated from dependency parsers, has potential for improving event detection. However, they often only leverage the edges (dependencies) between words, and discard the dependency labels (e.g., nominal-subject), treating the underlying graph edges as homogeneous. In this work, we propose a novel framework for incorporating both dependencies and their labels using a recently proposed technique called Graph Transformer Network (GTN). We integrate GTN to leverage dependency relations on two existing homogeneous-graph-based models and demonstrate an improvement in the F1 score on the ACE dataset."
2021.naacl-main.256,"Ol{\\'a}, Bonjour, Salve! {XFORMAL}: A Benchmark for Multilingual Formality Style Transfer",2021,-1,-1,4,0,4011,eleftheria briakou,Proceedings of the 2021 Conference of the North American Chapter of the Association for Computational Linguistics: Human Language Technologies,0,"We take the first step towards multilingual style transfer by creating and releasing XFORMAL, a benchmark of multiple formal reformulations of informal text in Brazilian Portuguese, French, and Italian. Results on XFORMAL suggest that state-of-the-art style transfer approaches perform close to simple baselines, indicating that style transfer is even more challenging when moving multilingual."
2021.gem-1.6,A Review of Human Evaluation for Style Transfer,2021,-1,-1,4,0,4011,eleftheria briakou,"Proceedings of the 1st Workshop on Natural Language Generation, Evaluation, and Metrics (GEM 2021)",0,"This paper reviews and summarizes human evaluation practices described in 97 style transfer papers with respect to three main evaluation aspects: style transfer, meaning preservation, and fluency. In principle, evaluations by human raters should be the most reliable. However, in style transfer papers, we find that protocols for human evaluations are often underspecified and not standardized, which hampers the reproducibility of research in this field and progress toward better human and automatic evaluation methods."
2021.emnlp-main.100,Evaluating the Evaluation Metrics for Style Transfer: A Case Study in Multilingual Formality Transfer,2021,-1,-1,3,0,4011,eleftheria briakou,Proceedings of the 2021 Conference on Empirical Methods in Natural Language Processing,0,"While the field of style transfer (ST) has been growing rapidly, it has been hampered by a lack of standardized practices for automatic evaluation. In this paper, we evaluate leading automatic metrics on the oft-researched task of formality style transfer. Unlike previous evaluations, which focus solely on English, we expand our focus to Brazilian-Portuguese, French, and Italian, making this work the first multilingual evaluation of metrics in ST. We outline best practices for automatic evaluation in (formality) style transfer and identify several models that correlate well with human judgments and are robust across languages. We hope that this work will help accelerate development in ST, where human evaluation is often challenging to collect."
2021.emnlp-main.419,Journalistic Guidelines Aware News Image Captioning,2021,-1,-1,3,0,9574,xuewen yang,Proceedings of the 2021 Conference on Empirical Methods in Natural Language Processing,0,"The task of news article image captioning aims to generate descriptive and informative captions for news article images. Unlike conventional image captions that simply describe the content of the image in general terms, news image captions follow journalistic guidelines and rely heavily on named entities to describe the image content, often drawing context from the whole article they are associated with. In this work, we propose a new approach to this task, motivated by caption guidelines that journalists follow. Our approach, Journalistic Guidelines Aware News Image Captioning (JoGANIC), leverages the structure of captions to improve the generation quality and guide our representation design. Experimental results, including detailed ablation studies, on two large-scale publicly available datasets show that JoGANIC substantially outperforms state-of-the-art methods both on caption generation and named entity related metrics."
2020.coling-main.180,"The {A}ppos{C}orpus: a new multilingual, multi-domain dataset for factual appositive generation",2020,-1,-1,3,0,8496,yova kementchedjhieva,Proceedings of the 28th International Conference on Computational Linguistics,0,"News articles, image captions, product reviews and many other texts mention people and organizations whose name recognition could vary for different audiences. In such cases, background information about the named entities could be provided in the form of an appositive noun phrase, either written by a human or generated automatically. We expand on the previous work in appositive generation with a new, more realistic, end-to-end definition of the task, instantiated by a dataset that spans four languages (English, Spanish, German and Polish), two entity types (person and organization) and two domains (Wikipedia and News). We carry out an extensive analysis of the data and the task, pointing to the various modeling challenges it poses. The results we obtain with standard language generation methods show that the task is indeed non-trivial, and leaves plenty of room for improvement."
2020.coling-main.402,"Rhetoric, Logic, and Dialectic: Advancing Theory-based Argument Quality Assessment in Natural Language Processing",2020,-1,-1,4,0,7441,anne lauscher,Proceedings of the 28th International Conference on Computational Linguistics,0,"Though preceding work in computational argument quality (AQ) mostly focuses on assessing overall AQ, researchers agree that writers would benefit from feedback targeting individual dimensions of argumentation theory. However, a large-scale theory-based corpus and corresponding computational models are missing. We fill this gap by conducting an extensive analysis covering three diverse domains of online argumentative writing and presenting GAQCorpus: the first large-scale English multi-domain (community Q{\&}A forums, debate forums, review forums) corpus annotated with theory-based AQ scores. We then propose the first computational approaches to theory-based assessment, which can serve as strong baselines for future work. We demonstrate the feasibility of large-scale AQ annotation, show that exploiting relations between dimensions yields performance improvements, and explore the synergies between theory-based prediction and practical AQ assessment."
2020.argmining-1.13,Creating a Domain-diverse Corpus for Theory-based Argument Quality Assessment,2020,-1,-1,3,0,21491,lily ng,Proceedings of the 7th Workshop on Argument Mining,0,"Computational models of argument quality (AQ) have focused primarily on assessing the overall quality or just one specific characteristic of an argument, such as its convincingness or its clarity. However, previous work has claimed that assessment based on theoretical dimensions of argumentation could benefit writers, but developing such models has been limited by the lack of annotated data. In this work, we describe GAQCorpus, the first large, domain-diverse annotated corpus of theory-based AQ. We discuss how we designed the annotation task to reliably collect a large number of judgments with crowdsourcing, formulating theory-based guidelines that helped make subjective judgments of AQ more objective. We demonstrate how to identify arguments and adapt the annotation task for three diverse domains. Our work will inform research on theory-based argumentation annotation and enable the creation of more diverse corpora to support computational AQ assessment."
W19-4449,The Unbearable Weight of Generating Artificial Errors for Grammatical Error Correction,2019,22,0,2,0,12837,phu htut,Proceedings of the Fourteenth Workshop on Innovative Use of NLP for Building Educational Applications,0,"In this paper, we investigate the impact of using 4 recent neural models for generating artificial errors to help train the neural grammatical error correction models. We conduct a battery of experiments on the effect of data size, models, and comparison with a rule-based approach."
Q19-1032,"Enabling Robust Grammatical Error Correction in New Domains: Data Sets, Metrics, and Analyses",2019,23,1,3,0.975459,21492,courtney napoles,Transactions of the Association for Computational Linguistics,0,"Until now, grammatical error correction (GEC) has been primarily evaluated on text written by non-native English speakers, with a focus on student essays. This paper enables GEC development on text written by native speakers by providing a new data set and metric. We present a multiple-reference test corpus for GEC that includes 4,000 sentences in two new domains (formal and informal writing by native English speakers) and 2,000 sentences from a diverse set of non-native student writing. We also collect human judgments of several GEC systems on this new test set and perform a meta-evaluation, assessing how reliable automatic metrics are across these domains. We find that commonly used GEC metrics have inconsistent performance across domains, and therefore we propose a new ensemble metric that is robust on all three domains of text."
P19-1043,This Email Could Save Your Life: Introducing the Task of Email Subject Line Generation,2019,55,0,2,0,3325,rui zhang,Proceedings of the 57th Annual Meeting of the Association for Computational Linguistics,1,"Given the overwhelming number of emails, an effective subject line becomes essential to better inform the recipient of the email{'}s content. In this paper, we propose and study the task of \textit{email subject line generation}: automatically generating an email subject line from the email body. We create the first dataset for this task and find that email subject line generation favor extremely abstractive summary which differentiates it from news headline generation or news single document summarization. We then develop a novel deep learning method and compare it to several baselines as well as recent state-of-the-art text summarization systems. We also investigate the efficacy of several automatic metrics based on correlations with human judgments and propose a new automatic evaluation metric. Our system outperforms competitive baselines given both automatic and human evaluations. To our knowledge, this is the first work to tackle the problem of effective email subject line generation."
N19-1373,{D}ialogue {A}ct {C}lassification with {C}ontext-{A}ware {S}elf-{A}ttention,2019,29,6,2,0,12214,vipul raheja,"Proceedings of the 2019 Conference of the North {A}merican Chapter of the Association for Computational Linguistics: Human Language Technologies, Volume 1 (Long and Short Papers)",0,Recent work in Dialogue Act classification has treated the task as a sequence labeling problem using hierarchical deep neural networks. We build on this prior work by leveraging the effectiveness of a context-aware self-attention mechanism coupled with a hierarchical recurrent neural network. We conduct extensive evaluations on standard Dialogue Act classification datasets and show significant improvement over state-of-the-art results on the Switchboard Dialogue Act (SwDA) Corpus. We also investigate the impact of different utterance-level representation learning methods and show that our method is effective at capturing utterance-level semantic text representations while maintaining high accuracy.
D19-5504,Personalizing Grammatical Error Correction: Adaptation to Proficiency Level and {L}1,2019,0,1,2,0,26553,maria nadejde,Proceedings of the 5th Workshop on Noisy User-generated Text (W-NUT 2019),0,"Grammar error correction (GEC) systems have become ubiquitous in a variety of software applications, and have started to approach human-level performance for some datasets. However, very little is known about how to efficiently personalize these systems to the user{'}s characteristics, such as their proficiency level and first language, or to emerging domains of text. We present the first results on adapting a general purpose neural GEC system to both the proficiency level and the first language of a writer, using only a few thousand annotated sentences. Our study is the broadest of its kind, covering five proficiency levels and twelve different languages, and comparing three different adaptation scenarios: adapting to the proficiency level only, to the first language only, or to both aspects simultaneously. We show that tailoring to both scenarios achieves the largest performance improvement (3.6 F0.5) relative to a strong baseline."
W18-6105,How do you correct run-on sentences it{'}s not as easy as it seems,2018,0,0,3,0,27809,junchao zheng,Proceedings of the 2018 {EMNLP} Workshop W-{NUT}: The 4th Workshop on Noisy User-generated Text,0,"Run-on sentences are common grammatical mistakes but little research has tackled this problem to date. This work introduces two machine learning models to correct run-on sentences that outperform leading methods for related tasks, punctuation restoration and whole-sentence grammatical error correction. Due to the limited annotated data for this error, we experiment with artificially generating training data from clean newswire text. Our findings suggest artificial training data is viable for this task. We discuss implications for correcting run-ons and other types of mistakes that have low coverage in error-annotated corpora."
W18-5023,"Discourse Coherence in the Wild: A Dataset, Evaluation and Methods",2018,16,0,2,0,28061,alice lai,Proceedings of the 19th Annual {SIG}dial Meeting on Discourse and Dialogue,0,"To date there has been very little work on assessing discourse coherence methods on real-world data. To address this, we present a new corpus of real-world texts (GCDC) as well as the first large-scale evaluation of leading discourse coherence algorithms. We show that neural models, including two that we introduce here (SentAvg and ParSeq), tend to perform best. We analyze these performance differences and discuss patterns we observed in low coherence texts in four domains."
N18-1012,"Dear Sir or Madam, May {I} Introduce the {GYAFC} Dataset: Corpus, Benchmarks and Metrics for Formality Style Transfer",2018,30,28,2,0,4267,sudha rao,"Proceedings of the 2018 Conference of the North {A}merican Chapter of the Association for Computational Linguistics: Human Language Technologies, Volume 1 (Long Papers)",0,"Style transfer is the task of automatically transforming a piece of text in one particular style into another. A major barrier to progress in this field has been a lack of training and evaluation datasets, as well as benchmarks and automatic metrics. In this work, we create the largest corpus for a particular stylistic transfer (formality) and show that techniques from the machine translation community can serve as strong baselines for future work. We also discuss challenges of using automatic metrics."
W17-5007,A Report on the 2017 Native Language Identification Shared Task,2017,-1,-1,4,0.0929269,3599,shervin malmasi,Proceedings of the 12th Workshop on Innovative Use of {NLP} for Building Educational Applications,0,"Native Language Identification (NLI) is the task of automatically identifying the native language (L1) of an individual based on their language production in a learned language. It is typically framed as a classification task where the set of L1s is known a priori. Two previous shared tasks on NLI have been organized where the aim was to identify the L1 of learners of English based on essays (2013) and spoken responses (2016) they provided during a standardized assessment of academic English proficiency. The 2017 shared task combines the inputs from the two prior tasks for the first time. There are three tracks: NLI on the essay only, NLI on the spoken response only (based on a transcription of the response and i-vector acoustic features), and NLI using both responses. We believe this makes for a more interesting shared task while building on the methods and results from the previous two shared tasks. In this paper, we report the results of the shared task. A total of 19 teams competed across the three different sub-tasks. The fusion track showed that combining the written and spoken responses provides a large boost in prediction accuracy. Multiple classifier systems (e.g. ensembles and meta-classifiers) were the most effective in all tasks, with most based on traditional classifiers (e.g. SVMs) with lexical/syntactic features."
W17-5019,{GEC} into the future: Where are we going and how do we get there?,2017,0,2,3,0.857143,6885,keisuke sakaguchi,Proceedings of the 12th Workshop on Innovative Use of {NLP} for Building Educational Applications,0,"The field of grammatical error correction (GEC) has made tremendous bounds in the last ten years, but new questions and obstacles are revealing themselves. In this position paper, we discuss the issues that need to be addressed and provide recommendations for the field to continue to make progress, and propose a new shared task. We invite suggestions and critiques from the audience to make the new shared task a community-driven venture."
W17-0802,Finding Good Conversations Online: The {Y}ahoo {N}ews Annotated Comments Corpus,2017,26,23,2,1,21492,courtney napoles,Proceedings of the 11th Linguistic Annotation Workshop,0,"This work presents a dataset and annotation scheme for the new task of identifying {``}good{''} conversations that occur online, which we call ERICs: Engaging, Respectful, and/or Informative Conversations. We develop a taxonomy to reflect features of entire threads and individual comments which we believe contribute to identifying ERICs; code a novel dataset of Yahoo News comment threads (2.4k threads and 10k comments) and 1k threads from the Internet Argument Corpus; and analyze the features characteristic of ERICs. This is one of the largest annotated corpora of online human dialogues, with the most detailed set of annotations. It will be valuable for identifying ERICs and other aspects of argumentation, dialogue, and discourse."
E17-2037,{JFLEG}: A Fluency Corpus and Benchmark for Grammatical Error Correction,2017,0,19,3,1,21492,courtney napoles,"Proceedings of the 15th Conference of the {E}uropean Chapter of the Association for Computational Linguistics: Volume 2, Short Papers",0,"We present a new parallel corpus, JHU FLuency-Extended GUG corpus (JFLEG) for developing and evaluating grammatical error correction (GEC). Unlike other corpora, it represents a broad range of language proficiency levels and uses holistic fluency edits to not only correct grammatical errors but also make the original text more native sounding. We describe the types of corrections made and benchmark four leading GEC systems on this corpus, identifying specific areas in which they do well and how they can improve. JFLEG fulfills the need for a new gold standard to properly assess the current state of GEC."
W16-3638,Do Characters Abuse More Than Words?,2016,15,42,2,0,3127,yashar mehdad,Proceedings of the 17th Annual Meeting of the Special Interest Group on Discourse and Dialogue,0,None
Q16-1005,An Empirical Analysis of Formality in Online Communication,2016,35,37,2,0,7335,ellie pavlick,Transactions of the Association for Computational Linguistics,0,"This paper presents an empirical study of linguistic formality. We perform an analysis of humans{'} perceptions of formality in four different genres. These findings are used to develop a statistical model for predicting formality, which is evaluated under different feature settings and genres. We apply our model to an investigation of formality in online discussion forums, and present findings consistent with theories of formality and linguistic coordination."
Q16-1013,Reassessing the Goals of Grammatical Error Correction: Fluency Instead of Grammaticality,2016,28,21,4,0.869565,6885,keisuke sakaguchi,Transactions of the Association for Computational Linguistics,0,"The field of grammatical error correction (GEC) has grown substantially in recent years, with research directed at both evaluation metrics and improved system performance against those metrics. One unvisited assumption, however, is the reliance of GEC evaluation on error-coded corpora, which contain specific labeled corrections. We examine current practices and show that GEC{'}s reliance on such corpora unnaturally constrains annotation and automatic evaluation, resulting in (a) sentences that do not sound acceptable to native speakers and (b) system rankings that do not correlate with human judgments. In light of this, we propose an alternate approach that jettisons costly error coding in favor of unannotated, whole-sentence rewrites. We compare the performance of existing metrics over different gold-standard annotations, and show that automatic evaluation with our new annotation scheme has very strong correlation with expert rankings (ρ = 0.82). As a result, we advocate for a fundamental and necessary shift in the goal of GEC, from correcting small, labeled error types, to producing text that has native fluency."
L16-1076,Humor in Collective Discourse: Unsupervised Funniness Detection in the New Yorker Cartoon Caption Contest,2016,-1,-1,3,0,2447,dragomir radev,Proceedings of the Tenth International Conference on Language Resources and Evaluation ({LREC}'16),0,"The New Yorker publishes a weekly captionless cartoon. More than 5,000 readers submit captions for it. The editors select three of them and ask the readers to pick the funniest one. We describe an experiment that compares a dozen automatic methods for selecting the funniest caption. We show that negative sentiment, human-centeredness, and lexical centrality most strongly match the funniest captions, followed by positive sentiment. These results are useful for understanding humor and also in the design of more engaging conversational agents in text and multimodal (vision+text) systems. As part of this work, a large set of cartoons and captions is being made available to the community."
D16-1228,There{'}s No Comparison: Reference-less Evaluation Metrics in Grammatical Error Correction,2016,18,5,3,0.819699,21492,courtney napoles,Proceedings of the 2016 Conference on Empirical Methods in Natural Language Processing,0,None
W15-0620,Oracle and Human Baselines for Native Language Identification,2015,18,11,2,0.0929269,3599,shervin malmasi,Proceedings of the Tenth Workshop on Innovative Use of {NLP} for Building Educational Applications,0,"We examine different ensemble methods, including an oracle, to estimate the upper-limit of classification accuracy for Native Language Identification (NLI). The oracle outperforms state-of-the-art systems by over 10% and results indicate that for many misclassified texts the correct class label receives a significant portion of the ensemble votes, often being the runner-up. We also present a pilot study of human performance for NLI, the first such experiment. While some participants achieve modest results on our simplified setup with 5 L1s, they did not outperform our NLI system, and this performance gap is likely to widen on the standard NLI setup."
P15-2097,Ground Truth for Grammatical Error Correction Metrics,2015,11,50,4,0.797997,21492,courtney napoles,Proceedings of the 53rd Annual Meeting of the Association for Computational Linguistics and the 7th International Joint Conference on Natural Language Processing (Volume 2: Short Papers),0,None
