2021.findings-acl.332,Using surprisal and f{MRI} to map the neural bases of broad and local contextual prediction during natural language comprehension,2021,-1,-1,2,0,8278,shohini bhattasali,Findings of the Association for Computational Linguistics: ACL-IJCNLP 2021,0,None
2021.clpsych-1.7,Community-level Research on Suicidality Prediction in a Secure Environment: Overview of the {CLP}sych 2021 Shared Task,2021,-1,-1,5,0,398,sean macavaney,Proceedings of the Seventh Workshop on Computational Linguistics and Clinical Psychology: Improving Access,0,"Progress on NLP for mental health {---} indeed, for healthcare in general {---} is hampered by obstacles to shared, community-level access to relevant data. We report on what is, to our knowledge, the first attempt to address this problem in mental health by conducting a shared task using sensitive data in a secure data enclave. Participating teams received access to Twitter posts donated for research, including data from users with and without suicide attempts, and did all work with the dataset entirely within a secure computational environment. We discuss the task, team results, and lessons learned to set the stage for future tasks on sensitive or confidential data."
2021.acl-long.126,Syntopical Graphs for Computational Argumentation Tasks,2021,-1,-1,8,1,12878,joe barrow,Proceedings of the 59th Annual Meeting of the Association for Computational Linguistics and the 11th International Joint Conference on Natural Language Processing (Volume 1: Long Papers),1,"Approaches to computational argumentation tasks such as stance detection and aspect detection have largely focused on the text of independent claims, losing out on potentially valuable context provided by the rest of the collection. We introduce a general approach to these tasks motivated by syntopical reading, a reading process that emphasizes comparing and contrasting viewpoints in order to improve topic understanding. To capture collection-level context, we introduce the syntopical graph, a data structure for linking claims within a collection. A syntopical graph is a typed multi-graph where nodes represent claims and edges represent different possible pairwise relationships, such as entailment, paraphrase, or support. Experiments applying syntopical graphs to the problems of detecting stance and aspects demonstrate state-of-the-art performance in each domain, significantly outperforming approaches that do not utilize collection-level information."
2020.nlpcovid19-2.30,Developing a Curated Topic Model for {COVID}-19 Medical Research Literature,2020,-1,-1,1,1,8279,philip resnik,Proceedings of the 1st Workshop on {NLP} for {COVID}-19 (Part 2) at {EMNLP} 2020,0,"Topic models can facilitate search, navigation, and knowledge discovery in large document collections. However, automatic generation of topic models can produce results that fail to meet the needs of users. We advocate for a set of user-focused desiderata in topic modeling for the COVID-19 literature, and describe an effort in progress to develop a curated topic model for COVID-19 articles informed by subject matter expertise and the way medical researchers engage with medical literature."
2020.emnlp-main.137,{I}mproving {N}eural {T}opic {M}odels using {K}nowledge {D}istillation,2020,-1,-1,3,0,7701,alexander hoyle,Proceedings of the 2020 Conference on Empirical Methods in Natural Language Processing (EMNLP),0,"Topic models are often used to identify human-interpretable topics to help make sense of large document collections. We use knowledge distillation to combine the best attributes of probabilistic topic models and pretrained transformers. Our modular method can be straightforwardly applied with any neural topic model to improve topic quality, which we demonstrate using two models having disparate architectures, obtaining state-of-the-art topic coherence. We show that our adaptable framework not only improves performance in the aggregate over all estimated topics, as is commonly reported, but also in head-to-head comparisons of aligned topics."
2020.acl-main.29,A Joint Model for Document Segmentation and Segment Labeling,2020,-1,-1,6,1,12878,joe barrow,Proceedings of the 58th Annual Meeting of the Association for Computational Linguistics,1,"Text segmentation aims to uncover latent structure by dividing text from a document into coherent sections. Where previous work on text segmentation considers the tasks of document segmentation and segment labeling separately, we show that the tasks contain complementary information and are best addressed jointly. We introduce Segment Pooling LSTM (S-LSTM), which is capable of jointly segmenting a document and labeling segments. In support of joint training, we develop a method for teaching the model to recover from errors by aligning the predicted and ground truth segments. We show that S-LSTM reduces segmentation error by 30{\%} on average, while also improving segment labeling."
2020.acl-main.723,A Prioritization Model for Suicidality Risk Assessment,2020,-1,-1,2,0,23096,hanchin shing,Proceedings of the 58th Annual Meeting of the Association for Computational Linguistics,1,"We reframe suicide risk assessment from social media as a ranking problem whose goal is maximizing detection of severely at-risk individuals given the time available. Building on measures developed for resource-bounded document retrieval, we introduce a well founded evaluation paradigm, and demonstrate using an expert-annotated test collection that meaningful improvements over plausible cascade model baselines can be achieved using an approach that jointly ranks individuals and their social media posts."
W19-3003,{CLP}sych 2019 Shared Task: Predicting the Degree of Suicide Risk in {R}eddit Posts,2019,-1,-1,2,0.952381,16583,ayah zirikly,Proceedings of the Sixth Workshop on Computational Linguistics and Clinical Psychology,0,"The shared task for the 2019 Workshop on Computational Linguistics and Clinical Psychology (CLPsych{'}19) introduced an assessment of suicide risk based on social media postings, using data from Reddit to identify users at no, low, moderate, or severe risk. Two variations of the task focused on users whose posts to the r/SuicideWatch subreddit indicated they might be at risk; a third task looked at screening users based only on their more everyday (non-SuicideWatch) posts. We received submissions from 15 different teams, and the results provide progress and insight into the value of language signal in helping to predict risk level."
D19-1120,A Multilingual Topic Model for Learning Weighted Topic Links Across Corpora with Low Comparability,2019,0,0,3,1,26832,weiwei yang,Proceedings of the 2019 Conference on Empirical Methods in Natural Language Processing and the 9th International Joint Conference on Natural Language Processing (EMNLP-IJCNLP),0,"Multilingual topic models (MTMs) learn topics on documents in multiple languages. Past models align topics across languages by implicitly assuming the documents in different languages are highly comparable, often a false assumption. We introduce a new model that does not rely on this assumption, particularly useful in important low-resource language scenarios. Our MTM learns weighted topic links and connects cross-lingual topics only when the dominant words defining them are similar, outperforming LDA and previous MTMs in classification tasks using documents{'} topic posteriors as features. It also learns coherent topics on documents with low comparability."
W18-0603,"Expert, Crowdsourced, and Machine Assessment of Suicide Risk via Online Postings",2018,-1,-1,6,0,23096,hanchin shing,Proceedings of the Fifth Workshop on Computational Linguistics and Clinical Psychology: From Keyboard to Clinic,0,"We report on the creation of a dataset for studying assessment of suicide risk via online postings in Reddit. Evaluation of risk-level annotations by experts yields what is, to our knowledge, the first demonstration of reliability in risk assessment by clinicians based on social media postings. We also introduce and demonstrate the value of a new, detailed rubric for assessing suicide risk, compare crowdsourced with expert performance, and present baseline predictive modeling experiments using the new dataset, which will be made available to researchers through the American Association of Suicidology."
W18-0604,{CLP}sych 2018 Shared Task: Predicting Current and Future Psychological Health from Childhood Essays,2018,-1,-1,5,0,22950,veronica lynn,Proceedings of the Fifth Workshop on Computational Linguistics and Clinical Psychology: From Keyboard to Clinic,0,"We describe the shared task for the CLPsych 2018 workshop, which focused on predicting current and future psychological health from an essay authored in childhood. Language-based predictions of a person{'}s current health have the potential to supplement traditional psychological assessment such as questionnaires, improving intake risk measurement and monitoring. Predictions of future psychological health can aid with both early detection and the development of preventative care. Research into the mental health trajectory of people, beginning from their childhood, has thus far been an area of little work within the NLP community. This shared task represents one of the first attempts to evaluate the use of early language to predict future health; this has the potential to support a wide variety of clinical health care tasks, from early assessment of lifetime risk for mental health problems, to optimal timing for targeted interventions aimed at both prevention and treatment."
C18-1152,Assessing Composition in Sentence Vector Representations,2018,35,2,4,1,8001,allyson ettinger,Proceedings of the 27th International Conference on Computational Linguistics,0,"An important component of achieving language understanding is mastering the composition of sentence meaning, but an immediate challenge to solving this problem is the opacity of sentence vector representations produced by current neural sentence composition models. We present a method to address this challenge, developing tasks that directly target compositional meaning information in sentence vector representations with a high degree of precision and control. To enable the creation of these controlled tasks, we introduce a specialized sentence generation system that produces large, annotated sentence sets meeting specified syntactic, semantic and lexical constraints. We describe the details of the method and generation system, and then present results of experiments applying our method to probe for compositional information in embeddings from a number of existing sentence composition models. We find that the method is able to extract useful information about the differing capacities of these models, and we discuss the implications of our results with respect to these systems{'} capturing of sentence information. We make available for public use the datasets used for these experiments, as well as the generation system."
D17-1203,Adapting Topic Models using Lexical Associations with Tree Priors,2017,17,1,3,1,26832,weiwei yang,Proceedings of the 2017 Conference on Empirical Methods in Natural Language Processing,0,"Models work best when they are optimized taking into account the evaluation criteria that people care about. For topic models, people often care about interpretability, which can be approximated using measures of lexical association. We integrate lexical association into topic optimization using tree priors, which provide a flexible framework that can take advantage of both first order word associations and the higher-order associations captured by word embeddings. Tree priors improve topic interpretability without hurting extrinsic performance."
W16-2524,Probing for semantic evidence of composition by means of simple classification tasks,2016,21,21,3,1,8001,allyson ettinger,Proceedings of the 1st Workshop on Evaluating Vector-Space Representations for {NLP},0,"We propose a diagnostic method for probing specific information captured in vector representations of sentence meaning, via simple classification tasks with strategically constructed sentence sets. We identify some key types of semantic information that we might expect to be captured in sentence composition, and illustrate example classification tasks for targeting this information."
W16-0319,The {UMD} {CLP}sych 2016 Shared Task System: Text Representation for Predicting Triage of Forum Posts about Mental Health,2016,6,0,4,0,28601,meir friedenberg,Proceedings of the Third Workshop on Computational Linguistics and Clinical Psychology,0,None
W16-0321,The {GW}/{UMD} {CLP}sych 2016 Shared Task System,2016,5,2,3,0.804598,16583,ayah zirikly,Proceedings of the Third Workshop on Computational Linguistics and Clinical Psychology,0,None
S16-1184,{CLIP}@{UMD} at {S}em{E}val-2016 Task 8: Parser for {A}bstract {M}eaning {R}epresentation using Learning to Search,2016,13,3,4,0.740741,4267,sudha rao,Proceedings of the 10th International Workshop on Semantic Evaluation ({S}em{E}val-2016),0,"In this paper we describe our approach to the Abstract Meaning Representation (AMR) parsing shared task as part of SemEval 2016. We develop a novel technique to parse English sentences into AMR using Learning to Search. We decompose the AMR parsing task into three subtasks that of predicting the concepts, the relations, and the root. Each of these subtasks are treated as a sequence of predictions. Using Learning to Search, we add past predictions as features for future predictions, and define a combined loss over the entire AMR structure."
P16-1065,A Discriminative Topic Model using Document Network Structure,2016,39,9,3,1,26832,weiwei yang,Proceedings of the 54th Annual Meeting of the Association for Computational Linguistics (Volume 1: Long Papers),1,"Document collections often have links between documentsxe2x80x94citations, hyperlinks, or revisionsxe2x80x94and which links are added is often based on topical similarity. To model these intuitions, we introduce a new topic model for documents situated within a network structure, integrating latent blocks of documents with a max-margin learning criterion for link prediction using topicand word-level features. Experiments on a scientific paper dataset and collection of webpages show that, by more robustly exploiting the rich link structure within a document network, our model improves link prediction, topic quality, and block distributions."
P16-1177,Learning Text Pair Similarity with Context-sensitive Autoencoders,2016,27,24,2,0,12582,hadi amiri,Proceedings of the 54th Annual Meeting of the Association for Computational Linguistics (Volume 1: Long Papers),1,None
N16-1163,Retrofitting Sense-Specific Word Vectors Using Parallel Text,2016,16,4,2,1,8001,allyson ettinger,Proceedings of the 2016 Conference of the North {A}merican Chapter of the Association for Computational Linguistics: Human Language Technologies,0,None
W15-3003,Data Selection With Fewer Words,2015,19,3,2,0,18812,amittai axelrod,Proceedings of the Tenth Workshop on Statistical Machine Translation,0,"We present a method that improves data selection by combining a hybrid word/part-of-speech representation for corpora, with the idea of distinguishing between rare and frequent events. We validate our approach using data selection for machine translation, and show that it maintains or improves BLEU and TER translation scores while substantially improving vocabulary coverage and reducing data selection model size. Paradoxically, the coverage improvement is achieved by abstracting away over 97% of the total training corpus vocabulary using simple part-of-speech tags during the data selection process."
W15-1207,The {U}niversity of {M}aryland {CLP}sych 2015 Shared Task System,2015,10,16,1,1,8279,philip resnik,Proceedings of the 2nd Workshop on Computational Linguistics and Clinical Psychology: From Linguistic Signal to Clinical Reality,0,"The 2015 ACL Workshop on Computational Linguistics and Clinical Psychology included a shared task focusing on classification of a sample of Twitter users according to three mental health categories: users who have self-reported a diagnosis of depression, users who have self-reported a diagnosis of post-traumatic stress disorder (PTSD), and control users who have done neither (Coppersmith et al., 2015; Coppersmith et al., 2014). Like other shared tasks, the goal here was to assess the state of the art with regard to a challenging problem, to advance that state of the art, and to bring together and hopefully expand the community of researchers interested in solving it."
W15-1212,Beyond {LDA}: Exploring Supervised Topic Modeling for Depression-Related Language in {T}witter,2015,23,41,1,1,8279,philip resnik,Proceedings of the 2nd Workshop on Computational Linguistics and Clinical Psychology: From Linguistic Signal to Clinical Reality,0,"Topic models can yield insight into how depressed and non-depressed individuals use language differently. In this paper, we explore the use of supervised topic models in the analysis of linguistic signal for detecting depression, providing promising results using several models."
P15-2072,The Media Frames Corpus: Annotations of Frames Across Issues,2015,30,43,4,0,4218,dallas card,Proceedings of the 53rd Annual Meeting of the Association for Computational Linguistics and the 7th International Joint Conference on Natural Language Processing (Volume 2: Short Papers),0,"We describe the first version of the Media Frames Corpus: several thousand news articles on three policy issues, annotated in terms of media framing. We motivate framing as a phenomenon of study for computational linguistics and describe our annotation process."
P15-1139,Tea Party in the House: A Hierarchical Ideal Point Topic Model and Its Application to Republican Legislators in the 112th Congress,2015,33,26,3,1,37071,vietan nguyen,Proceedings of the 53rd Annual Meeting of the Association for Computational Linguistics and the 7th International Joint Conference on Natural Language Processing (Volume 1: Long Papers),1,"We introduce the Hierarchical Ideal Point Topic Model, which provides a rich picture of policy issues, framing, and voting behavior using a joint model of votes, bill text, and the language that legislators use when debating bills. We use this model to look at the relationship between Tea Party Republicans and xe2x80x9cestablishmentxe2x80x9d Republicans in the U.S. House of Representatives during the 112th Congress. 1 Capturing Political Polarization Ideal-point models are one of the most widely used tools in contemporary political science research (Poole and Rosenthal, 2007). These models estimate political preferences for legislators, known as their ideal points, from binary data such as legislative votes. Popular formulations analyze legislatorsxe2x80x99 votes and place them on a one-dimensional scale, most often interpreted as an ideological spectrum from liberal to conservative. Moving beyond a single dimension is attractive, however, since people may lean differently based on policy issues; for example, the conservative movement in the U.S. includes fiscal conservatives who are relatively liberal on social issues, and vice versa. In multi-dimensional ideal point models, therefore, the ideal point of each legislator is no longer characterized by a single number, but by a multi-dimensional vector. With that move comes a new challenge, though: the additional dimensions are often difficult to interpret. To mitigate this problem, recent research has introduced methods that estimate multi-dimensional ideal points using both voting data and the texts of the bills being voted on, e.g., using topic models and associating each dimension of the ideal point space with a topic. The words most strongly associated with the topic can sometimes provide a readable description of its corresponding dimension. In this paper, we develop this idea further by introducing HIPTM, the Hierarchical Ideal Point Topic Model, to estimate multi-dimensional ideal points for legislators in the U.S. Congress. HIPTM differs from previous models in three ways. First, HIPTM uses not only votes and associated bill text, but also the language of the legislators themselves; this allows predictions of ideal points from politiciansxe2x80x99 writing alone. Second, HIPTM improves the interpretability of ideal-point dimensions by incorporating data from the Congressional Bills Project (Adler and Wilkerson, 2015), in which bills are labeled with major topics from the Policy Agendas Project Topic Codebook.1 And third, HIPTM discovers a hierarchy of topics, allowing us to analyze both agenda issues and issue-specific frames that legislators use on the congressional floor, following Nguyen et al. (2013) in modeling framing as second-level agenda setting (McCombs, 2005). Using this new model, we focus on Republican legislators during the 112th U.S. Congress, from January 2011 until January 2013. This is a particularly interesting session of Congress for political scientists, because of the rise of the Tea Party, a decentralized political movement with populist, libertarian, and conservative elements. Although united with xe2x80x9cestablishmentxe2x80x9d Republicans against Democrats in the 2010 midterm elections, leading to massive Democratic defeats, the Tea Party wasxe2x80x94and still isxe2x80x94wrestling with establishment Republicans for control of the Republican party. The Tea Party is a new and complex phenomenon for political scientists; as Carmines and Dxe2x80x99Amico (2015) observe: xe2x80x9cConventional views of ideology as a single-dimensional, left-right spectrum experience great difficulty in understanding or explaining the Tea Party.xe2x80x9d Our model identifies legislators who have low (or high) levels of xe2x80x9cTea Partinessxe2x80x9d but are (or are not) members of the Tea Party Caucus, and providing insights into the nahttp://www.policyagendas.org/"
N15-1052,Dialogue focus tracking for zero pronoun resolution,2015,18,6,4,0.740741,4267,sudha rao,Proceedings of the 2015 Conference of the North {A}merican Chapter of the Association for Computational Linguistics: Human Language Technologies,0,"We take a novel approach to zero pronoun resolution in Chinese: our model explicitly tracks the flow of focus in a discourse. Our approach, which generalizes to deictic references, is not reliant on the presence of overt noun phrase antecedents to resolve to, and allows us to address the large percentage of xe2x80x9cnon-anaphoricxe2x80x9d pronouns filtered out in other approaches. We furthermore train our model using readily available parallel Chinese/English corpora, allowing for training without hand-annotated data. Our results demonstrate improvements on two test sets, as well as the usefulness of linguistically motivated features."
D15-1030,Birds of a Feather Linked Together: A Discriminative Topic Model using Link-based Priors,2015,20,3,3,1,26832,weiwei yang,Proceedings of the 2015 Conference on Empirical Methods in Natural Language Processing,0,"A wide range of applications, from social media to scientific literature analysis, involve graphs in which documents are connected by links. We introduce a topic model for link prediction based on the intuition that linked documents will tend to have similar topic distributions, integrating a max-margin learning criterion and lexical term weights in the loss function. We validate our approach on the tweets from 2,000 Sina Weibo users and evaluate our modelxe2x80x99s reconstruction of the social network."
W14-2520,"{``}{I} Want to Talk About, Again, My Record On Energy ...{''}: Modeling Agendas and Framing in Political Debates and Other Conversations",2014,-1,-1,1,1,8279,philip resnik,Proceedings of the {ACL} 2014 Workshop on Language Technologies and Computational Social Science,0,None
P14-1105,Political Ideology Detection Using Recursive Neural Networks,2014,31,105,4,0,4054,mohit iyyer,Proceedings of the 52nd Annual Meeting of the Association for Computational Linguistics (Volume 1: Long Papers),1,"An individualxe2x80x99s words often reveal their political ideology. Existing automated techniques to identify ideology from text focus on bags of words or wordlists, ignoring syntax. Taking inspiration from recent work in sentiment analysis that successfully models the compositional aspect of language, we apply a recursive neural network (RNN) framework to the task of identifying the political position evinced by a sentence. To show the importance of modeling subsentential elements, we crowdsource political annotations at a phrase and sentence level. Our model outperforms existing models on our newly annotated dataset and an existing dataset."
P14-1106,A Unified Model for Soft Linguistic Reordering Constraints in Statistical Machine Translation,2014,45,6,3,1,9182,junhui li,Proceedings of the 52nd Annual Meeting of the Association for Computational Linguistics (Volume 1: Long Papers),1,"This paper explores a simple and effective unified framework for incorporating soft linguistic reordering constraints into a hierarchical phrase-based translation system: 1) a syntactic reordering model that explores reorderings for context free grammar rules; and 2) a semantic reordering model that focuses on the reordering of predicate-argument structures. We develop novel features based on both models and use them as soft constraints to guide the translation process. Experiments on Chinese-English translation show that the reordering approach can significantly improve a state-of-the-art hierarchical phrase-based translation system. However, the gain achieved by the semantic reordering model is limited in the presence of the syntactic reordering model, and we therefore provide a detailed analysis of the behavior differences between the two."
