W10-4011,"More Languages, More {MAP}?: A Study of Multiple Assisting Languages in Multilingual {PRF}",2010,16,0,3,0,45213,vishal vachhani,Proceedings of the 4th Workshop on Cross Lingual Information Access,0,"Multilingual Pseudo-Relevance Feedback (MultiPRF) is a framework to improve the PRF of a source language by taking the help of another language called assisting language. In this paper, we extend the MultiPRF framework to include multiple assisting languages. We consider three different configurations to incorporate multiple assisting languages - a) Parallel - all assisting languages combined simultaneously b) Serial - assisting languages combined in sequence one after another and c) Selective - dynamically selecting the best feedback model for each query. We study their effect on MultiPRF performance. Results using multiple assisting languages are mixed and it helps in boosting MultiPRF accuracy only in some cases. We also observe that MultiPRF becomes more robust with increase in number of assisting languages."
W10-2403,Report of {NEWS} 2010 Transliteration Mining Shared Task,2010,11,25,2,0,33855,kumaran,Proceedings of the 2010 Named Entities Workshop,0,"This report documents the details of the Transliteration Mining Shared Task that was run as a part of the Named Entities Workshop (NEWS 2010), an ACL 2010 workshop. The shared task featured mining of name transliterations from the paired Wikipedia titles in 5 different language pairs, specifically, between English and one of Arabic, Chinese, Hindi Russian and Tamil. Totally 5 groups took part in this shared task, participating in multiple mining tasks in different languages pairs. The methodology and the data sets used in this shared task are published in the Shared Task White Paper [Kumaran et al, 2010]. We measure and report 3 metrics on the submitted results to calibrate the performance of individual systems on a commonly available Wikipedia dataset. We believe that the significant contribution of this shared task is in (i) assembling a diverse set of participants working in the area of transliteration mining, (ii) creating a baseline performance of transliteration mining systems in a set of diverse languages using commonly available Wikipedia data, and (iii) providing a basis for meaningful comparison and analysis of trade-offs between various algorithmic approaches used in mining. We believe that this shared task would complement the NEWS 2010 transliteration generation shared task, in enabling development of practical systems with a small amount of seed data in a given pair of languages."
W10-2404,Whitepaper of {NEWS} 2010 Shared Task on Transliteration Mining,2010,0,11,2,0,33855,kumaran,Proceedings of the 2010 Named Entities Workshop,0,"Transliteration is generally defined as phonetic translation of names across languages. Machine Transliteration is a critical technology in many domains, such as machine translation, cross-language information retrieval/extraction, etc. Recent research has shown that high quality machine transliteration systems may be developed in a language-neutral manner, using a reasonably sized good quality corpus (~15--25K parallel names) between a given pair of languages. In this shared task, we focus on acquisition of such good quality names corpora in many languages, thus complementing the machine transliteration shared task that is concurrently conducted in the same NEWS 2010 workshop. Specifically, this task focuses on mining the Wikipedia paired entities data (aka, inter-wiki-links) to produce high-quality transliteration data that may be used for transliteration tasks."
S10-1028,{OWNS}: Cross-lingual Word Sense Disambiguation Using Weighted Overlap Counts and {W}ordnet Based Similarity Measures,2010,10,7,3,0,45598,lipta mahapatra,Proceedings of the 5th International Workshop on Semantic Evaluation,0,"We report here our work on English French Cross-lingual Word Sense Disambiguation where the task is to find the best French translation for a target English word depending on the context in which it is used. Our approach relies on identifying the nearest neighbors of the test sentence from the training data using a pairwise similarity measure. The proposed measure finds the affinity between two sentences by calculating a weighted sum of the word overlap and the semantic overlap between them. The semantic overlap is calculated using standard Wordnet Similarity measures. Once the nearest neighbors have been identified, the best translation is found by taking a majority vote over the French translations of the nearest neighbors."
S10-1094,{CFILT}: Resource Conscious Approaches for All-Words Domain Specific {WSD},2010,8,4,2,0,45628,anup kulkarni,Proceedings of the 5th International Workshop on Semantic Evaluation,0,"We describe two approaches for All-words Word Sense Disambiguation on a Specific Domain. The first approach is a knowledge based approach which extracts domain-specific largest connected components from the Wordnet graph by exploiting the semantic relations between all candidate synsets appearing in a domain-specific untagged corpus. Given a test word, disambiguation is performed by considering only those candidate synsets that belong to the top-k largest connected components.n n The second approach is a weakly supervised approach which relies on the One Sense Per Domain heuristic and uses a few hand labeled examples for the most frequently appearing words in the target domain. Once the most frequent words have been disambiguated they can provide strong clues for disambiguating other words in the sentence using an iterative disambiguation algorithm. Our weakly supervised system gave the best performance across all systems that participated in the task even when it used as few as 100 hand labeled examples from the target domain."
P10-1155,All Words Domain Adapted {WSD}: Finding a Middle Ground between Supervision and Unsupervision,2010,19,19,1,1,3162,mitesh khapra,Proceedings of the 48th Annual Meeting of the Association for Computational Linguistics,1,"In spite of decades of research on word sense disambiguation (WSD), all-words general purpose WSD has remained a distant goal. Many supervised WSD systems have been built, but the effort of creating the training corpus - annotated sense marked corpora - has always been a matter of concern. Therefore, attempts have been made to develop unsupervised and knowledge based techniques for WSD which do not need sense marked corpora. However such approaches have not proved effective, since they typically do not better Wordnet first sense baseline accuracy. Our research reported here proposes to stick to the supervised approach, but with far less demand on annotation. We show that if we have ANY sense marked corpora, be it from mixed domain or a specific domain, a small amount of annotation in ANY other domain can deliver the goods almost as if exhaustive sense marking were available in that domain. We have tested our approach across Tourism and Health domain corpora, using also the well known mixed domain SemCor corpus. Accuracy figures close to self domain training lend credence to the viability of our approach. Our contribution thus lies in finding a convenient middle ground between pure supervised and pure unsupervised WSD. Finally, our approach is not restricted to any specific set of target words, a departure from a commonly observed practice in domain specific WSD."
N10-1065,Everybody loves a rich cousin: An empirical study of transliteration through bridge languages,2010,16,17,1,1,3162,mitesh khapra,Human Language Technologies: The 2010 Annual Conference of the North {A}merican Chapter of the Association for Computational Linguistics,0,"Most state of the art approaches for machine transliteration are data driven and require significant parallel names corpora between languages. As a result, developing transliteration functionality among n languages could be a resource intensive task requiring parallel names corpora in the order of nC2. In this paper, we explore ways of reducing this high resource requirement by leveraging the available parallel data between subsets of the n languages, transitively. We propose, and show empirically, that reasonable quality transliteration engines may be developed between two languages, X and Y, even when no direct parallel names data exists between them, but only transitively through language Z. Such systems alleviate the need for O(nC2) corpora, significantly. In addition we show that the performance of such transitive transliteration systems is in par with direct transliteration systems, in practical applications, such as CLIR systems."
N10-1073,Improving the Multilingual User Experience of {W}ikipedia Using Cross-Language Name Search,2010,22,24,2,0,42939,raghavendra udupa,Human Language Technologies: The 2010 Annual Conference of the North {A}merican Chapter of the Association for Computational Linguistics,0,"Although Wikipedia has emerged as a powerful collaborative Encyclopedia on the Web, it is only partially multilingual as most of the content is in English and a small number of other languages. In real-life scenarios, non-English users in general and ESL/EFL users in particular, have a need to search for relevant English Wikipedia articles as no relevant articles are available in their language. The multilingual experience of such users can be significantly improved if they could express their information need in their native language while searching for English Wikipedia articles. In this paper, we propose a novel cross-language name search algorithm and employ it for searching English Wikipedia articles in a diverse set of languages including Hebrew, Hindi, Russian, Kannada, Bangla and Tamil. Our empirical study shows that the multilingual experience of users is significantly improved by our approach."
C10-2040,Verbs are where all the action lies: Experiences of Shallow Parsing of a Morphologically Rich Language,2010,11,13,3,0,45228,harshada gune,Coling 2010: Posters,0,Verb suffixes and verb complexes of morphologically rich languages carry a lot of information. We show that this information if harnessed for the task of shallow parsing can lead to dramatic improvements in accuracy for a morphologically rich language- Marathi. The crux of the approach is to use a powerful morphological analyzer backed by a high coverage lexicon to generate rich features for a CRF based sequence classifier. Accuracy figures of 94% for Part of Speech Tagging and 97% for Chunking using a modestly sized corpus (20K words) vindicate our claim that for morphologically rich languages linguistic insight can obviate the need for large amount of annotated corpora.
C10-1063,"Value for Money: Balancing Annotation Effort, Lexicon Building and Accuracy for Multilingual {WSD}",2010,10,7,1,1,3162,mitesh khapra,Proceedings of the 23rd International Conference on Computational Linguistics (Coling 2010),0,"Sense annotation and lexicon building are costly affairs demanding prudent investment of resources. Recent work on multilingual WSD has shown that it is possible to leverage the annotation work done for WSD of one language (SL) for another (TL), by projecting Wordnet and sense marked corpus parameters of SL to TL. However, this work does not take into account the cost of manually cross-linking the words within aligned synsets. Further, it does not answer the question of Can better accuracy be achieved if a user is willing to pay additional money? We propose a measure for cost-benefit analysis which measures the value for money earned in terms of accuracy by investing in annotation effort and lexicon building. Two key ideas explored in this paper are (i) the use of probabilistic cross-linking model to reduce manual cross-linking effort and (ii) the use of selective sampling to inject a few training examples for hard-to-disambiguate words from the target language to boost the accuracy."
W09-3518,Improving Transliteration Accuracy Using Word-Origin Detection and Lexicon Lookup,2009,13,8,1,1,3162,mitesh khapra,Proceedings of the 2009 Named Entities Workshop: Shared Task on Transliteration ({NEWS} 2009),0,We propose a framework for transliteration which uses (i) a word-origin detection engine (pre-processing) (ii) a CRF based transliteration engine and (iii) a re-ranking model based on lexicon-lookup (post-processing). The results obtained for English-Hindi and English-Kannada transliteration show that the preprocessing and post-processing modules improve the top-1 accuracy by 7.1%.
D09-1048,Projecting Parameters for Multilingual Word Sense Disambiguation,2009,16,14,1,1,3162,mitesh khapra,Proceedings of the 2009 Conference on Empirical Methods in Natural Language Processing,0,"We report in this paper a way of doing Word Sense Disambiguation (WSD) that has its origin in multilingual MT and that is cognizant of the fact that parallel corpora, wordnets and sense annotated corpora are scarce resources. With respect to these resources, languages show different levels of readiness; however a more resource fortunate language can help a less resource fortunate language. Our WSD method can be applied to a language even when no sense tagged corpora for that language is available. This is achieved by projecting wordnet and corpus parameters from another language to the language in question. The approach is centered around a novel synset based multilingual dictionary and the empirical observation that within a domain the distribution of senses remains more or less invariant across languages. The effectiveness of our approach is verified by doing parameter projection and then running two different WSD algorithms. The accuracy values of approximately 75% (F1-score) for three languages in two different domains establish the fact that within a domain it is possible to circumvent the problem of scarcity of resources by projecting parameters like sense distributions, corpus-co-occurrences, conceptual distance, etc. from one language to another."
