dahab-belz-2010-game,A Game-based Approach to Transcribing Images of Text,2010,4,2,2,0,46126,khalil dahab,Proceedings of the Seventh International Conference on Language Resources and Evaluation ({LREC}'10),0,"Creating language resources is expensive and time-consuming, and this forms a bottleneck in the development of language technology, for less-studied non-European languages in particular. The recent internet phenomenon of crowd-sourcing offers a cost-effective and potentially fast way of overcoming such language resource acquisition bottlenecks. We present a methodology that takes as its input scanned documents of typed or hand-written text, and produces transcriptions of the text as its output. Instead of using Optical Character Recognition (OCR) technology, the methodology is game-based and produces such transcriptions as a by-product. The approach is intended particularly for languages for which language technology and resources are scarce and reliable OCR technology may not exist. It can be used in place of OCR for transcribing individual documents, or to create corpora of paired images and transcriptions required to train OCR tools. We present Minefield, a prototype implementation of the approach which is currently collecting Arabic transcriptions."
W09-2816,The {GREC} Main Subject Reference Generation Challenge 2009: Overview and Evaluation Results,2009,9,9,1,1,26421,anja belz,Proceedings of the 2009 Workshop on Language Generation and Summarisation ({UCNLG}+{S}um 2009),0,"The GREC-MSR Task at Generation Challenges 2009 required participating systems to select coreference chains to the main subject of short encyclopaedic texts collected from Wikipedia. Three teams submitted one system each, and we additionally created four baseline systems. Systems were tested automatically using existing intrinsic metrics. We also evaluated systems extrinsically by applying coreference resolution tools to the outputs and measuring the success of the tools. In addition, systems were tested in an intrinsic evaluation involving human judges. This report describes the GREC-MSR Task and the evaluation methods applied, gives brief descriptions of the participating systems, and presents the evaluation results."
W09-2817,The {GREC} Named Entity Generation Challenge 2009: Overview and Evaluation Results,2009,5,5,1,1,26421,anja belz,Proceedings of the 2009 Workshop on Language Generation and Summarisation ({UCNLG}+{S}um 2009),0,"The GREC-NEG Task at Generation Challenges 2009 required participating systems to select coreference chains for all people entities mentioned in short encyclopaedic texts about people collected from Wikipedia. Three teams submitted six systems in total, and we additionally created four baseline systems. Systems were tested automatically using a range of existing intrinsic metrics. We also evaluated systems extrinsically by applying coreference resolution tools to the outputs and measuring the success of the tools. In addition, systems were tested in an intrinsic evaluation involving human judges. This report describes the GREC-NEG Task and the evaluation methods applied, gives brief descriptions of the participating systems, and presents the evaluation results."
W09-0603,System Building Cost vs. Output Quality in Data-to-Text Generation,2009,16,22,1,1,26421,anja belz,Proceedings of the 12th {E}uropean Workshop on Natural Language Generation ({ENLG} 2009),0,"Data-to-text generation systems tend to be knowledge-based and manually built, which limits their reusability and makes them time and cost-intensive to create and maintain. Methods for automating (part of) the system building process exist, but do such methods risk a loss in output quality? In this paper, we investigate the cost/quality trade-off in generation system building. We compare four new data-to-text systems which were created by predominantly automatic techniques against six existing systems for the same domain which were created by predominantly manual techniques. We evaluate the ten systems using intrinsic automatic metrics and human quality ratings. We find that increasing the degree to which system building is automated does not necessarily result in a reduction in output quality. We find furthermore that standard automatic evaluation metrics underestimate the quality of handcrafted systems and over-estimate the quality of automatically created systems."
W09-0627,Generation {C}hallenges 2009: Preface,2009,0,0,1,1,26421,anja belz,Proceedings of the 12th {E}uropean Workshop on Natural Language Generation ({ENLG} 2009),0,"Generation Challenges 2009 was the third round of shared-task evaluation competitions (STECs) that involve the generation of natural language, and followed the Pilot Attribute Selection for Generating Referring Expressions Challenge in 2007 (ASGRE'07) and Referring Expression Generation Challenges in 2008 (REG'08). More information about all these NLG STEC activities can be found via the links on the Generation Challenges homepage: http://www.nltg.brighton.ac.uk/research/genchal09"
W09-0629,The {TUNA}-{REG} {C}hallenge 2009: Overview and Evaluation Results,2009,17,87,2,0.666667,6764,albert gatt,Proceedings of the 12th {E}uropean Workshop on Natural Language Generation ({ENLG} 2009),0,"The GREC Task at REG '08 required participating systems to select coreference chains to the main subject of short encyclopaedic texts collected from Wikipedia. Three teams submitted a total of 6 systems, and we additionally created four baseline systems. Systems were tested automatically using a range of existing intrinsic metrics. We also evaluated systems extrinsically by applying coreference resolution tools to the outputs and measuring the success of the tools. In addition, systems were tested in a reading/comprehension experiment involving human subjects. This report describes the GREC Task and the evaluation methods, gives brief descriptions of the participating systems, and presents the evaluation results."
J09-4008,An Investigation into the Validity of Some Metrics for Automatically Evaluating Natural Language Generation Systems,2009,57,76,2,0,5931,ehud reiter,Computational Linguistics,0,"There is growing interest in using automatically computed corpus-based evaluation metrics to evaluate Natural Language Generation (NLG) systems, because these are often considerably cheaper than the human-based evaluations which have traditionally been used in NLG. We review previous work on NLG evaluation and on validation of automatic metrics in NLP, and then present the results of two studies of how well some metrics which are popular in other areas of NLP (notably BLEU and ROUGE) correlate with human judgments in the domain of computer-generated weather forecasts. Our results suggest that, at least in this domain, metrics may provide a useful measure of language quality, although the evidence for this is not as strong as we would ideally like to see; however, they do not provide a useful measure of content quality. We also discuss a number of caveats which must be kept in mind when interpreting this and other validation studies."
J09-1008,Last Words: That{'}s Nice ... What Can You Do With It?,2009,27,24,1,1,26421,anja belz,Computational Linguistics,0,"A regular fixture on the mid 1990s international research seminar circuit was the billion-neuron artificial brain talk. The idea behind this project was simple: in order to create artificial intelligence, what was needed first of all was a very large artificial brain; if a big enough set of interconnected modules of neurons could be implemented, then it would be possible to evolve mammalian-level behavior with current computational- neuron technology. The talk included progress reports on the current size of the artificial brain, its structure, update rate, and power consumption, and explained how intelli- gent behavior was going to develop by mechanisms simulating biological evolution. What the talk didnt mention was what kind of functionality the team had so far managed to evolve, and so the first comment at the end of the talk was inevitably nice work, but have you actually done anything with the brain yet?1 In human language technology (HLT) research, we currently report a range of evaluation scores that measure and assess various aspects of systems, in particular the similarity of their outputs to samples of human language or to human-produced gold- standard annotations, but are we leaving ourselves open to the same question as the billion-neuron artificial brain researchers?"
W08-1108,Attribute Selection for Referring Expression Generation: New Algorithms and Evaluation Methods,2008,27,22,2,0.666667,6764,albert gatt,Proceedings of the Fifth International Natural Language Generation Conference,0,"Referring expression generation has recently been the subject of the first Shared Task Challenge in NLG. In this paper, we analyse the systems that participated in the Challenge in terms of their algorithmic properties, comparing new techniques to classic ones, based on results from a new human task-performance experiment and from the intrinsic measures that were used in the Challenge. We also consider the relationship between different evaluation methods, showing that extrinsic task-performance experiments and intrinsic evaluation methods yield results that are not significantly correlated. We argue that this highlights the importance of including extrinsic evaluation methods in comparative NLG evaluations."
W08-1126,{REG} Challenge Preface,2008,0,0,1,1,26421,anja belz,Proceedings of the Fifth International Natural Language Generation Conference,0,None
W08-1127,The {GREC} Challenge 2008: Overview and Evaluation Results,2008,-1,-1,1,1,26421,anja belz,Proceedings of the Fifth International Natural Language Generation Conference,0,None
W08-1131,The {TUNA} Challenge 2008: Overview and Evaluation Results,2008,-1,-1,2,0.666667,6764,albert gatt,Proceedings of the Fifth International Natural Language Generation Conference,0,None
P08-2050,Intrinsic vs. Extrinsic Evaluation Measures for Referring Expression Generation,2008,11,39,1,1,26421,anja belz,"Proceedings of ACL-08: HLT, Short Papers",0,"In this paper we present research in which we apply (i) the kind of intrinsic evaluation metrics that are characteristic of current comparative HLT evaluation, and (ii) extrinsic, human task-performance evaluations more in keeping with NLG traditions, to 15 systems implementing a language generation task. We analyse the evaluation results and find that there are no significant correlations between intrinsic and extrinsic evaluation measures for this task."
W07-2302,Generation of repeated references to discourse entities,2007,17,16,1,1,26421,anja belz,Proceedings of the Eleventh {E}uropean Workshop on Natural Language Generation ({ENLG} 07),0,"Generation of Referring Expressions is a thriving subfield of Natural Language Generation which has traditionally focused on the task of selecting a set of attributes that unambiguously identify a given referent. In this paper, we address the complementary problem of generating repeated, potentially different referential expressions that refer to the same entity in the context of a piece of discourse longer than a sentence. We describe a corpus of short encyclopaedic texts we have compiled and annotated for reference to the main subject of the text, and report results for our experiments in which we set human subjects and automatic methods the task of selecting a referential expression from a wide range of choices in a full-text context. We find that our human subjects agree on choice of expression to a considerable degree, with three identical expressions selected in 50% of cases. We tested automatic selection strategies based on most frequent choice heuristics, involving different combinations of information about syntactic MSR type and domain type. We find that more information generally produces better results, achieving a best overall test set accuracy of 53.9% when both syntactic MSR type and domain type are known."
W07-2304,Modelling control in generation,2007,10,3,5,0,32465,roger evans,Proceedings of the Eleventh {E}uropean Workshop on Natural Language Generation ({ENLG} 07),0,"In this paper we present a view of natural language generation in which the control structure of the generator is clearly separated from the content decisions made during generation, allowing us to explore and compare different control strategies in a systematic way. Our approach factors control into two components, a 'generation tree' which maps out the relationships between different decisions, and an algorithm for traversing such a tree which determines which choices are actually made. We illustrate the approach with examples of stylistic control and automatic text revision using both generative and empirical techniques. We argue that this approach provides a useful basis for the theoretical study of control in generation, and a framework for implementing generators with a range of control strategies. We also suggest that this approach can be developed into tool for analysing and adapting control aspects of other advanced wide-coverage generation systems."
N07-1021,Probabilistic Generation of Weather Forecast Texts,2007,15,18,1,1,26421,anja belz,Human Language Technologies 2007: The Conference of the North {A}merican Chapter of the Association for Computational Linguistics; Proceedings of the Main Conference,0,"This paper reports experiments in which pC RU xe2x80x94 a generation framework that combines probabilistic generation methodology with a comprehensive model of the generation space xe2x80x94 is used to semi-automatically create several versions of a weather forecast text generator. The generators are evaluated in terms of output quality, development time and computational efficiency against (i) human forecasters, (ii) a traditional handcrafted pipelined NLG system, and (iii) a HALOGEN-style statistical generator. The most striking result is that despite acquiring all decision-making abilities automatically, the best pC RU generators receive higher scores from human judges than forecasts written by experts."
2007.mtsummit-ucnlg.13,The attribute selection for generation of referring expressions challenge. [Introduction to Shared Task Evaluation Challenge.],2007,-1,-1,1,1,26421,anja belz,Proceedings of the Workshop on Using corpora for natural language generation,0,None
2007.mtsummit-ucnlg.14,The attribute selection for {GRE} challenge: overview and evaluation results,2007,4,40,1,1,26421,anja belz,Proceedings of the Workshop on Using corpora for natural language generation,0,") Challenge wasthe xefxacx81rst shared-task evaluation challenge inthe xefxacx81eld of Natural Language Generation.Six teams submitted a total of 22 systems.All submitted systems were tested automat-ically for minimality, uniqueness and xe2x80x98hu-manlikenessxe2x80x99. In addition, the output of 15systems was tested in a task-based exper-iment where subjects were asked to iden-tify referents, and the speed and accuracy ofidentixefxacx81cation was measured. This report de-scribes the"
W06-1418,Introduction to the {INLG}{'}06 Special Session on Sharing Data and Comparative Evaluation,2006,0,0,1,1,26421,anja belz,Proceedings of the Fourth International Natural Language Generation Conference,0,"The idea for this special session had its origins in discussions with many different members of the NLG community at the 2005 Workshop on Using Corpora for Natural Language Generation (UCNLG'05, held in conjunction with the Corpus Linguistics 2005 conference at the University of Birmingham in July 2005), and subsequently at the 10th European Natural Language Generation Workshop (ENLG'05, held at the University of Aberdeen in August 2005). At the latter event, the excitement about introducing shared tasks was infectious: the topic hijacked several of the organised discussion groups, it was the focus of conversation at many tables during lunch-breaks, and even the end of the conference didn't put a stop to it, with discussions carrying right on until the taxis to the airport arrived."
W06-1421,Shared-Task Evaluations in {HLT}: Lessons for {NLG},2006,4,15,1,1,26421,anja belz,Proceedings of the Fourth International Natural Language Generation Conference,0,"While natural language generation (NLG) has a strong evaluation tradition, in particular in userbased and task-oriented evaluation, it has never evaluated different approaches and techniques by comparing their performance on the same tasks (shared-task evaluation, STE). NLG is characterised by a lack of consolidation of results, and by isolation from the rest of NLP where STE is now standard. It is, moreover, a shrinking field (state-of-the-art MT and summarisation no longer perform generation as a subtask) which lacks the kind of funding and participation that natural language understanding (NLU) has attracted."
W06-1422,{GENEVAL}: A Proposal for Shared-task Evaluation in {NLG},2006,10,7,2,0,5931,ehud reiter,Proceedings of the Fourth International Natural Language Generation Conference,0,"We propose to organise a series of sharedtask NLG events, where participants are asked to build systems with similar input/output functionalities, and these systems are evaluated with a range of different evaluation techniques. The main purpose of these events is to allow us to compare different evaluation techniques, by correlating the results of different evaluations on the systems entered in the events."
E06-1040,Comparing Automatic and Human Evaluation of {NLG} Systems,2006,21,97,1,1,26421,anja belz,11th Conference of the {E}uropean Chapter of the Association for Computational Linguistics,0,"We consider the evaluation problem in Natural Language Generation (NLG) and present results for evaluating several NLG systems with similar functionality, including a knowledge-based generator and several statistical systems. We compare evaluation results for these systems by human domain experts, human non-experts, and several automatic evaluation metrics, including NI ST, B LEU, and ROUGE. We find that NI ST scores correlate best (>0.8) with human judgments, but that all automatic metrics we examined are biased in favour of generators that select on the basis of frequency alone. We conclude that automatic evaluation of NLG systems has considerable potential, in particular where high-quality reference texts and only a small number of human evaluators are available. However, in general it is probably best for automatic evaluations to be supported by human based evaluations, or at least by studies that demonstrate that a particular metric correlates well with human judgments in a given domain."
W05-1601,Statistical Generation: Three Methods Compared and Evaluated,2005,25,31,1,1,26421,anja belz,Proceedings of the Tenth {E}uropean Workshop on Natural Language Generation ({ENLG}-05),0,"Statistical NL G has largely meant n-gram modelling which has the considerable advantages of lending robustness to NL G systems, and of making automatic adaptation to new domains from raw corpora possible. On the downside, n-gram models are expensive to use as selection mechanisms and have a built-in bias towards shorter realisations. This paper looks at treebank-training of generators, an alternative method for building statistical models for NL G from raw corpora, and two different ways of using treebank-trained models during generation. Results show that the treebank-trained generators achieve improvements similar to a 2-gram generator over a baseline of random selection. However, the treebank-trained generators achieve this at a much lower cost than the 2-gram generator, and without its strong preference for shorter reasations."
bouayad-agha-etal-2002-pills,{PILLS}: Multilingual generation of medical information documents with overlapping content,2002,5,25,4,0,39891,nadjet bouayadagha,Proceedings of the Third International Conference on Language Resources and Evaluation ({LREC}{'}02),0,"In the pharmaceutical industry, products have to be described by a range of document types with overlapping content. Moreover, much of this documentation has to be produced in many languages. This situation is commonplace in many commercial domains, and leads to well-known problems in maintaining a set of related documents and their translations. We describe a potential solution explored in the PILLS project. All relevant knowledge about a product is entered only once, through a natural-language interface to a knowledge base. From this xe2x80x98master modelxe2x80x99, specialised models for a range of document types are derived automatically; from each specialised model, documents are generated automatically in all supported languages. As an illustration of this approach, the PILLS demonstrator generates three medical document types in English, German and French."
C02-1068,Learning Grammars for Different Parsing Tasks by Partition Search,2002,15,2,1,1,26421,anja belz,{COLING} 2002: The 19th International Conference on Computational Linguistics,0,"This paper describes a comparative application of Grammar Learning by Partition Search to four different learning tasks: deep parsing, NP identification, flat phrase chunking and NP chunking. In the experiments, base grammars were extracted from a treebank corpus. From this starting point, new grammars optimised for the different parsing tasks were learnt by Partition Search. No lexical information was used. In half of the experiments, local structural context in the form of parent phrase category information was incorporated into the grammars. Results show that grammars which contain this information outperform grammars which do not by large margins in all tests for all parsing tasks. It makes the biggest difference for deep parsing, typically corresponding to an improvement of around 5%. Overall, Partition Search with parent phrase category information is shown to be a successful method for learning grammars optimised for a given parsing task, and for minimising grammar size. The biggest margin of improvement over a base grammar was a 5.4% increase in the F-Score for deep parsing. The biggest size reductions were 93.5% fewer nonterminals (for NP identification), and 31.3% fewer rules (for XP chunking)"
W01-0712,Learning Computational Grammars,2001,30,6,2,0,38842,john nerbonne,Proceedings of the {ACL} 2001 Workshop on Computational Natural Language Learning ({C}on{LL}),0,"This paper reports on the LEARNING COMPUTATIONAL GRAMMARS (LCG) project, a postdoc network devoted to studying the application of machine learning techniques to grammars suitable for computational use. We were interested in a more systematic survey to understand the relevance of many factors to the success of learning, esp. the availability of annotated data, the kind of dependencies in the data, and the availability of knowledge bases (grammars). We focused on syntax, esp. noun phrase (NP) syntax."
W00-1805,Multi-Syllable Phonotactic Modelling,2000,0,3,1,1,26421,anja belz,Proceedings of the Fifth Workshop of the {ACL} Special Interest Group in Computational Phonology,0,None
W98-0905,An Approach to the Automatic Acquisition of Phonotactic Constraints,1998,20,3,1,1,26421,anja belz,{SIGPHON}{'}98 The Computation of Phonological Constraints,0,None
P98-2240,Discovering Phonotactic Finite-State Automata by Genetic Search,1998,5,5,1,1,26421,anja belz,"36th Annual Meeting of the Association for Computational Linguistics and 17th International Conference on Computational Linguistics, Volume 2",0,"This paper presents a genetic algorithm based approach to the automatic discovery of finite-state automata (FSAs) from positive data. FSAs are commonly used in computational phonology, but-given the limited learnability of FSAs from arbitrary language subsets-are usually constructed manually. The approach presented here offers a practical automatic method that helps reduce the cost of manual FSA construction."
C98-2235,Discovering Phonotactic Finite-State Automata by Genetic Search,1998,5,5,1,1,26421,anja belz,{COLING} 1998 Volume 2: The 17th International Conference on Computational Linguistics,0,"This paper presents a genetic algorithm based approach to the automatic discovery of finite-state automata (FSAs) from positive data. FSAs are commonly used in computational phonology, but-given the limited learnability of FSAs from arbitrary language subsets-are usually constructed manually. The approach presented here offers a practical automatic method that helps reduce the cost of manual FSA construction."
