W93-0307,Structural Ambiguity and Conceptual Relations,1993,16,32,1,1,8279,philip resnik,{V}ery {L}arge {C}orpora: Academic and Industrial Perspectives,0,"Lexical co-occurrence statistics are becoming widely used in the syntactic analysis of unconstrained text. However, analyses based solely on lexical relationships suffer from sparseness of data: it is sometimes necessary to use a less informed model in order to reliably estimate statistical parameters. For example, the lexical association strategy for resolving ambiguous prepositional phrase attachments [Hindle and Rooth. 1991] takes into account only the attachment site (a verb or its direct object) and the preposition, ignoring the object of the preposition. We investigated an extension of the lexical association strategy to make use of noun class information, thus permitting a disambiguation strategy to take more information into account. Although in preliminary experiments the extended strategy did not yield improved performance over lexical association alone. a qualitative analysis of the results suggests that the problem lies not in the noun class information, but rather in the multiplicity of classes available for each noun in the absence of sense disambiguation. This suggests several possible revisions of our proposal. 1. P r e f e r e n c e S t r a t e g i e s Prepositional phrase attachment is a paradigmatic case of the structural ambiguity problems faced by natural language parsing systems. Most models of grammar will not constrain the analysis of such attachments in examples like (1): the grammar simply specifies that a prepositional phrase such as on computer theft can be attached in several ways, and leaves the problem of selecting the correct choice to some other process. (1) a. Eventually, Mr. Stoll was invited to both the CIA and NSA to brief high-ranking officers on computer theft. b. Eventually, Mr. Stoll was invited to both the ClA and NSA [to brief [high-ranking officers on computer theft]]. c. Eventually, Mr. Stoll was invited to both the CIA and NSA [to brief [high-ranking ollicers] [on computer theft]]. As [Church and Patil, 1982] point out, the number of analyses given combinations of such all ways ambiguous constructions grows rapidly even for sentences of quite Marti A. Hearst Computer Science Division 465 Evans Hall University of California, Berkeley Berkeley, CA 94720 USA mar t i @ c s . b e r k e l e y . e d u reasonable length, so this other process has an important role to play. Discussions of sentence processing have focused primarily on structurally-based preference strategies such as right association and minimal attachment [Kimball, 1973; Frazier, 1979; Ford et al., 1982]; [Hobbs and Bear, 1990], while acknowledging the importance of semantics and pragmatics in attachment decisions, propose two syntactically-based attachment rules that are meant to be generalizations of those structural strategies. Others, however, have argued that syntactic considerations alone are insumcient for determining prepositional phrase attachments, suggesting instead that preference relationships among lexical items are the crucial factor. For example: [Wilks et aL, 1985] argue that the right attachment rules posited by [Frazier, 1979] are incorrect for phrases in general, and supply counterexarnples. They further argue that lexical preferences alone as suggested by [Ford et al., 1982] are too simplistic, and suggest instad the use of preference semantics. In the preference semantics framework, attachment relations of phrases are determined by comparing the preferences emanating from all the entities involved in the attachment, until the best mutual fit is found. Their CASSEX system represents the various meanings of the preposition in terms of (a) the preferred semantic class of the noun or verb that proceeds the preposition (e.g., move, be, strike), (b) the case of the preposition (e.g., instrument, time, loc.static), and (c) the preferred semantic class of the head noun of the prepositional phrase (e.g., physob, event). The difficult part of this method is the identification of preference relationships and particularly determining the strengths of the preferences and how they should interact. (See also discussion in [Schubert, 19841.) lDahlgren and McDowell, 1986] also suggests using preferences based on hand-built knowledge about the prepositions and their objects, specifying a simpler set of rules than those of [Wilks et al., 1985]."
H93-1054,Semantic Classes and Syntactic Ambiguity,1993,13,70,1,1,8279,philip resnik,"{H}uman {L}anguage {T}echnology: Proceedings of a Workshop Held at Plainsboro, New Jersey, March 21-24, 1993",0,"In this paper we propose to define selectional preference and semantic similarity as information-theoretic relationships involving conceptual classes, and we demonstrate the applicability of these definitions to the resolution of syntactic ambiguity. The space of classes is defined using WordNet [8], and conceptual relationships are determined by means of statistical analysis using parsed text in the Penn Treebank."
P92-1053,A Class-Based Approach to Lexical Discovery,1992,4,63,1,1,8279,philip resnik,30th Annual Meeting of the Association for Computational Linguistics,1,None
C92-2065,Probabilistic {T}ree-{A}djoining {G}rammar as a Framework for Statistical Natural Language Processing,1992,17,89,1,1,8279,philip resnik,{COLING} 1992 Volume 2: The 14th {I}nternational {C}onference on {C}omputational {L}inguistics,0,"In this paper, I argue for the use of a probabilistic form of tree-adjoining grammar (TAG) in statistical natural language processing. I first discuss two previous statistical approaches --- one that concentrates on the probabilities of structural operations, and another that emphasizes co-occurrence relationships between words. I argue that a purely structural apprach, exemplified by probabilistic context-free grammar, lacks sufficient sensitivity to lexical context, and, conversely, that lexical co-occurence analyses require a richer notion of locality that is best provided by importing some notion of structure.I then propose probabilistic TAG as a framework for statistical language modelling, arguing that it provides an advantageous combination of structure, locality, and lexical sensitivity. Issues in the acquisition of probabilistic TAG and parameter estimation are briefly considered."
C92-1032,Left-Corner Parsing and Psychological Plausibility,1992,15,57,1,1,8279,philip resnik,{COLING} 1992 Volume 1: The 14th {I}nternational {C}onference on {C}omputational {L}inguistics,0,"It is well known that even extremely limited centerembedding causes people to have difficulty in comprehension, but that left- and right-branching constructions produce no such effect. If the difficulty in comprehension is taken to be a result of processing load, as is widely assumed, then measuring the processing load induced by a parsing strategy on these constructions may help determine its plausibility as a psychological model. On this basis, it has been argued [AJ91, JL83] that by identifying processing load with space utilization, we can rule out both top-down and bottom-up parsing as viable candidates for the human sentence processing mechanism, and that left-corner parsing represents a plausible alternative.Examining their arguments in detail, we find difficulties with each presentation. In this paper we revise the argument and validate its central claim. In so doing, we discover that the key distinction between the parsing methods is not the form of prediction (top-down vs. bottom-up vs. left-corner), but rather the ability to instantiate the operation of composition."
P90-1029,Multiple Underlying Systems: Translating User Requests into Programs to Produce Answers,1990,11,15,2,0,55866,robert bobrow,28th Annual Meeting of the Association for Computational Linguistics,1,"A user may typically need to combine the strengths of more than one system in order to perform a task. In this paper, we describe a component of the Janus natural language interface that translates intensional logic expressions representing the meaning of a request into executable code for each application program, chooses which combination of application systems to use, and designs the transfer of data among them in order to provide an answer. The complete Janus natural language system has been ported to two large command and control decision support aids."
