2021.nodalida-main.7,{C}omb{A}lign: a Tool for Obtaining High-Quality Word Alignments,2021,-1,-1,3,0.666667,2629,steinthor steingrimsson,Proceedings of the 23rd Nordic Conference on Computational Linguistics (NoDaLiDa),0,"Being able to generate accurate word alignments is useful for a variety of tasks. While statistical word aligners can work well, especially when parallel training data are plentiful, multilingual embedding models have recently been shown to give good results in unsupervised scenarios. We evaluate an ensemble method for word alignment on four language pairs and demonstrate that by combining multiple tools, taking advantage of their different approaches, substantial gains can be made. This holds for settings ranging from very low-resource to high-resource. Furthermore, we introduce a new gold alignment test set for Icelandic and a new easy-to-use tool for creating manual word alignments."
2021.mtsummit-up.25,"Building {MT} systems in low resourced languages for Public Sector users in {C}roatia, {I}celand, {I}reland, and {N}orway",2021,-1,-1,9,0,4994,roisin moran,Proceedings of Machine Translation Summit XVIII: Users and Providers Track,0,"When developing Machine Translation engines, low resourced language pairs tend to be in a disadvantaged position: less available data means that developing robust MT models can be more challenging.The EU-funded PRINCIPLE project aims at overcoming this challenge for four low resourced European languages: Norwegian, Croatian, Irish and Icelandic. This presentation will give an overview of the project, with a focus on the set of Public Sector users and their use cases for which we have developed MT solutions.We will discuss the range of language resources that have been gathered through contributions from public sector collaborators, and present the extensive evaluations that have been undertaken, including significant user evaluation of MT systems across all of the public sector participants in each of the four countries involved."
2021.mtsummit-research.5,Transformers for Low-Resource Languages: Is F{\\'e}idir Linn!,2021,-1,-1,3,0,5022,seamus lankford,Proceedings of Machine Translation Summit XVIII: Research Track,0,The Transformer model is the state-of-the-art in Machine Translation. However and in general and neural translation models often under perform on language pairs with insufficient training data. As a consequence and relatively few experiments have been carried out using this architecture on low-resource language pairs. In this study and hyperparameter optimization of Transformer models in translating the low-resource English-Irish language pair is evaluated. We demonstrate that choosing appropriate parameters leads to considerable performance improvements. Most importantly and the correct choice of subword model is shown to be the biggest driver of translation performance. SentencePiece models using both unigram and BPE approaches were appraised. Variations on model architectures included modifying the number of layers and testing various regularization techniques and evaluating the optimal number of heads for attention. A generic 55k DGT corpus and an in-domain 88k public admin corpus were used for evaluation. A Transformer optimized model demonstrated a BLEU score improvement of 7.8 points when compared with a baseline RNN model. Improvements were observed across a range of metrics and including TER and indicating a substantially reduced post editing effort for Transformer optimized models with 16k BPE subword models. Bench-marked against Google Translate and our translation engines demonstrated significant improvements. The question of whether or not Transformers can be used effectively in a low-resource setting of English-Irish translation has been addressed. Is f{\'e}idir linn - yes we can.
2021.mtsummit-loresmt.15,Machine Translation in the Covid domain: an {E}nglish-{I}rish case study for {L}o{R}es{MT} 2021,2021,-1,-1,3,0,5022,seamus lankford,Proceedings of the 4th Workshop on Technologies for MT of Low Resource Languages (LoResMT2021),0,"Translation models for the specific domain of translating Covid data from English to Irish were developed for the LoResMT 2021 shared task. Domain adaptation techniques, using a Covid-adapted generic 55k corpus from the Directorate General of Translation, were applied. Fine-tuning, mixed fine-tuning and combined dataset approaches were compared with models trained on an extended in-domain dataset. As part of this study, an English-Irish dataset of Covid related data, from the Health and Education domains, was developed. The highestperforming model used a Transformer architecture trained with an extended in-domain Covid dataset. In the context of this study, we have demonstrated that extending an 8k in-domain baseline dataset by just 5k lines improved the BLEU score by 27 points."
2020.wmt-1.27,The {ADAPT} System Description for the {WMT}20 News Translation Task,2020,-1,-1,4,0,13818,venkatesh parthasarathy,Proceedings of the Fifth Conference on Machine Translation,0,"This paper describes the ADAPT Centre{'}s submissions to the WMT20 News translation shared task for English-to-Tamil and Tamil-to-English. We present our machine translation (MT) systems that were built using the state-of-the-art neural MT (NMT) model, Transformer. We applied various strategies in order to improve our baseline MT systems, e.g. onolin- gual sentence selection for creating synthetic training data, mining monolingual sentences for adapting our MT systems to the task, hyperparameters search for Transformer in lowresource scenarios. Our experiments show that adding the aforementioned techniques to the baseline yields an excellent performance in the English-to-Tamil and Tamil-to-English translation tasks."
2020.wmt-1.91,The {ADAPT}{'}s Submissions to the {WMT}20 Biomedical Translation Task,2020,-1,-1,3,0,13924,prashant nayak,Proceedings of the Fifth Conference on Machine Translation,0,"This paper describes the ADAPT Centre{'}s submissions to the WMT20 Biomedical Translation Shared Task for English-to-Basque. We present the machine translation (MT) systems that were built to translate scientific abstracts and terms from biomedical terminologies, and using the state-of-the-art neural MT (NMT) model: Transformer. In order to improve our baseline NMT system, we employ a number of methods, e.g. {``}pseudo{''} parallel data selection, monolingual data selection for synthetic corpus creation, mining monolingual sentences for adapting our NMT systems to this task, hyperparameters search for Transformer in lowresource scenarios. Our experiments show that systematic addition of the aforementioned techniques to the baseline yields an excellent performance in the English-to-Basque translation task."
2020.wat-1.12,The {ADAPT} Centre{'}s Participation in {WAT} 2020 {E}nglish-to-{O}dia Translation Task,2020,-1,-1,3,0,14098,prashanth nayak,Proceedings of the 7th Workshop on Asian Translation,0,This paper describes the ADAPT Centre sub-missions to WAT 2020 for the English-to-Odia translation task. We present the approaches that we followed to try to build competitive machine translation (MT) systems for English-to-Odia. Our approaches include monolingual data selection for creating synthetic data and identifying optimal sets of hyperparameters for the Transformer in a low-resource scenario. Our best MT system produces 4.96BLEU points on the evaluation test set in the English-to-Odia translation task.
2020.wat-1.17,The {ADAPT} Centre{'}s Neural {MT} Systems for the {WAT} 2020 Document-Level Translation Task,2020,-1,-1,3,0,14099,wandri jooste,Proceedings of the 7th Workshop on Asian Translation,0,"In this paper we describe the ADAPT Centre{'}s submissions to the WAT 2020 document-level Business Scene Dialogue (BSD) Translation task. We only consider translating from Japanese to English for this task and we use the MarianNMT toolkit to train Transformer models. In order to improve the translation quality, we made use of both in-domain and out-of-domain data for training our Machine Translation (MT) systems, as well as various data augmentation techniques for fine-tuning the model parameters. This paper outlines the experiments we ran to train our systems and report the accuracy achieved through these various experiments."
2020.wat-1.22,An Error-based Investigation of Statistical and Neural Machine Translation Performance on {H}indi-to-{T}amil and {E}nglish-to-{T}amil,2020,-1,-1,4,1,4996,akshai ramesh,Proceedings of the 7th Workshop on Asian Translation,0,"Statistical machine translation (SMT) was the state-of-the-art in machine translation (MT) research for more than two decades, but has since been superseded by neural MT (NMT). Despite producing state-of-the-art results in many translation tasks, neural models underperform in resource-poor scenarios. Despite some success, none of the present-day benchmarks that have tried to overcome this problem can be regarded as a universal solution to the problem of translation of many low-resource languages. In this work, we investigate the performance of phrase-based SMT (PB-SMT) and NMT on two rarely-tested low-resource language-pairs, English-to-Tamil and Hindi-to-Tamil, taking a specialised data domain (software localisation) into consideration. This paper demonstrates our findings including the identification of several issues of the current neural approaches to low-resource domain-specific text translation."
2020.vardial-1.10,Neural Machine Translation for translating into {C}roatian and {S}erbian,2020,-1,-1,4,0,5059,maja popovic,"Proceedings of the 7th Workshop on NLP for Similar Languages, Varieties and Dialects",0,"In this work, we systematically investigate different set-ups for training of neural machine translation (NMT) systems for translation into Croatian and Serbian, two closely related South Slavic languages. We explore English and German as source languages, different sizes and types of training corpora, as well as bilingual and multilingual systems. We also explore translation of English IMDb user movie reviews, a domain/genre where only monolingual data are available. First, our results confirm that multilingual systems with joint target languages perform better. Furthermore, translation performance from English is much better than from German, partly because German is morphologically more complex and partly because the corpus consists mostly of parallel human translations instead of original text and its human translation. The translation from German should be further investigated systematically. For translating user reviews, creating synthetic in-domain parallel data through back- and forward-translation and adding them to a small out-of-domain parallel corpus can yield performance comparable with a system trained on a full out-of-domain corpus. However, it is still not clear what is the optimal size of synthetic in-domain data, especially for forward-translated data where the target language is machine translated. More detailed research including manual evaluation and analysis is needed in this direction."
2020.sltu-1.33,Multiple Segmentations of {T}hai Sentences for Neural Machine Translation,2020,20,0,5,1,13873,alberto poncelas,Proceedings of the 1st Joint Workshop on Spoken Language Technologies for Under-resourced languages (SLTU) and Collaboration and Computing for Under-Resourced Languages (CCURL),0,"Thai is a low-resource language, so it is often the case that data is not available in sufficient quantities to train an Neural Machine Translation (NMT) model which perform to a high level of quality. In addition, the Thai script does not use white spaces to delimit the boundaries between words, which adds more complexity when building sequence to sequence models. In this work, we explore how to augment a set of English{--}Thai parallel data by replicating sentence-pairs with different word segmentation methods on Thai, as training data for NMT model training. Using different merge operations of Byte Pair Encoding, different segmentations of Thai sentences can be obtained. The experiments show that combining these datasets, performance is improved for NMT models trained with a dataset that has been split using a supervised splitting tool."
2020.nlptea-1.2,Arabisc: Context-Sensitive Neural Spelling Checker,2020,-1,-1,3,0,15987,yasmin moslem,Proceedings of the 6th Workshop on Natural Language Processing Techniques for Educational Applications,0,"Traditional statistical approaches to spelling correction usually consist of two consecutive processes {---} error detection and correction {---} and they are generally computationally intensive. Current state-of-the-art neural spelling correction models usually attempt to correct spelling errors directly over an entire sentence, which, as a consequence, lacks control of the process, e.g. they are prone to overcorrection. In recent years, recurrent neural networks (RNNs), in particular long short-term memory (LSTM) hidden units, have proven increasingly popular and powerful models for many natural language processing (NLP) problems. Accordingly, we made use of a bidirectional LSTM language model (LM) for our context-sensitive spelling detection and correction model which is shown to have much control over the correction process. While the use of LMs for spelling checking and correction is not new to this line of NLP research, our proposed approach makes better use of the rich neighbouring context, not only from before the word to be corrected, but also after it, via a dual-input deep LSTM network. Although in theory our proposed approach can be applied to any language, we carried out our experiments on Arabic, which we believe adds additional value given the fact that there are limited linguistic resources readily available in Arabic in comparison to many languages. Our experimental results demonstrate that the proposed methods are effective in both improving the quality of correction suggestions and minimising overcorrection."
2020.ngt-1.17,The {ADAPT} System Description for the {STAPLE} 2020 {E}nglish-to-{P}ortuguese Translation Task,2020,-1,-1,3,1,5016,rejwanul haque,Proceedings of the Fourth Workshop on Neural Generation and Translation,0,"This paper describes the ADAPT Centre{'}s submission to STAPLE (Simultaneous Translation and Paraphrase for Language Education) 2020, a shared task of the 4th Workshop on Neural Generation and Translation (WNGT), for the English-to-Portuguese translation task. In this shared task, the participants were asked to produce high-coverage sets of plausible translations given English prompts (input source sentences). We present our English-to-Portuguese machine translation (MT) models that were built applying various strategies, e.g. data and sentence selection, monolingual MT for generating alternative translations, and combining multiple n-best translations. Our experiments show that adding the aforementioned techniques to the baseline yields an excellent performance in the English-to-Portuguese translation task."
2020.lt4hala-1.7,A Tool for Facilitating {OCR} Postediting in Historical Documents,2020,17,0,5,1,13873,alberto poncelas,Proceedings of LT4HALA 2020 - 1st Workshop on Language Technologies for Historical and Ancient Languages,0,"Optical character recognition (OCR) for historical documents is a complex procedure subject to a unique set of material issues, including inconsistencies in typefaces and low quality scanning. Consequently, even the most sophisticated OCR engines produce errors. This paper reports on a tool built for postediting the output of Tesseract, more specifically for correcting common errors in digitized historical documents. The proposed tool suggests alternatives for word forms not found in a specified vocabulary. The assumed error is replaced by a presumably correct alternative in the post-edition based on the scores of a Language Model (LM). The tool is tested on a chapter of the book An Essay Towards Regulating the Trade and Employing the Poor of this Kingdom (Cary, 1719). As demonstrated below, the tool is successful in correcting a number of common errors. If sometimes unreliable, it is also transparent and subject to human intervention."
2020.lrec-1.407,The {E}uropean Language Technology Landscape in 2020: Language-Centric and Human-Centric {AI} for Cross-Cultural Communication in Multilingual {E}urope,2020,4,1,46,0,60,georg rehm,Proceedings of the 12th Language Resources and Evaluation Conference,0,"Multilingualism is a cultural cornerstone of Europe and firmly anchored in the European treaties including full language equality. However, language barriers impacting business, cross-lingual and cross-cultural communication are still omnipresent. Language Technologies (LTs) are a powerful means to break down these barriers. While the last decade has seen various initiatives that created a multitude of approaches and technologies tailored to Europe{'}s specific needs, there is still an immense level of fragmentation. At the same time, AI has become an increasingly important concept in the European Information and Communication Technology area. For a few years now, AI {--} including many opportunities, synergies but also misconceptions {--} has been overshadowing every other topic. We present an overview of the European LT landscape, describing funding programmes, activities, actions and challenges in the different countries with regard to LT, including the current state of play in industry and the LT market. We present a brief overview of the main LT-related activities on the EU level in the last ten years and develop strategic guidance with regard to four key dimensions."
2020.lrec-1.461,On Context Span Needed for Machine Translation Evaluation,2020,-1,-1,3,0.53301,5000,sheila castilho,Proceedings of the 12th Language Resources and Evaluation Conference,0,"Despite increasing efforts to improve evaluation of machine translation (MT) by going beyond the sentence level to the document level, the definition of what exactly constitutes a {``}document level{''} is still not clear. This work deals with the context span necessary for a more reliable MT evaluation. We report results from a series of surveys involving three domains and 18 target languages designed to identify the necessary context span as well as issues related to it. Our findings indicate that, despite the fact that some issues and spans are strongly dependent on domain and on the target language, a number of common patterns can be observed so that general guidelines for context-aware MT evaluation can be drawn."
2020.loresmt-1.14,Using Multiple Subwords to Improve {E}nglish-{E}speranto Automated Literary Translation Quality,2020,-1,-1,4,1,13873,alberto poncelas,Proceedings of the 3rd Workshop on Technologies for MT of Low Resource Languages,0,"Building Machine Translation (MT) systems for low-resource languages remains challenging. For many language pairs, parallel data are not widely available, and in such cases MT models do not achieve results comparable to those seen with high-resource languages. When data are scarce, it is of paramount importance to make optimal use of the limited material available. To that end, in this paper we propose employing the same parallel sentences multiple times, only changing the way the words are split each time. For this purpose we use several Byte Pair Encoding models, with various merge operations used in their configuration. In our experiments, we use this technique to expand the available data and improve an MT system involving a low-resource language pair, namely English-Esperanto. As an additional contribution, we made available a set of English-Esperanto parallel data in the literary domain."
2020.loresmt-1.15,Investigating Low-resource Machine Translation for {E}nglish-to-{T}amil,2020,-1,-1,4,1,4996,akshai ramesh,Proceedings of the 3rd Workshop on Technologies for MT of Low Resource Languages,0,"Statistical machine translation (SMT) which was the dominant paradigm in machine translation (MT) research for nearly three decades has recently been superseded by the end-to-end deep learning approaches to MT. Although deep neural models produce state-of-the-art results in many translation tasks, they are found to under-perform on resource-poor scenarios. Despite some success, none of the present-day benchmarks that have tried to overcome this problem can be regarded as a universal solution to the problem of translation of many low-resource languages. In this work, we investigate the performance of phrase-based SMT (PB-SMT) and neural MT (NMT) on a rarely-tested low-resource language-pair, English-to-Tamil, taking a specialised data domain (software localisation) into consideration. In particular, we produce rankings of our MT systems via a social media platform-based human evaluation scheme, and demonstrate our findings in the low-resource domain-specific text translation task."
2020.iwltp-1.6,"{ELRI}: A Decentralised Network of National Relay Stations to Collect, Prepare and Share Language Resources",2020,-1,-1,12,0,17606,thierry etchegoyhen,Proceedings of the 1st International Workshop on Language Technology Platforms,0,"We describe the European Language Resource Infrastructure (ELRI), a decentralised network to help collect, prepare and share language resources. The infrastructure was developed within a project co-funded by the Connecting Europe Facility Programme of the European Union, and has been deployed in the four Member States participating in the project, namely France, Ireland, Portugal and Spain. ELRI provides sustainable and flexible means to collect and share language resources via National Relay Stations, to which members of public institutions can freely subscribe. The infrastructure includes fully automated data processing engines to facilitate the preparation, sharing and wider reuse of useful language resources that can help optimise human and automated translation services in the European Union."
2020.icon-main.14,Identifying Complaints from Product Reviews: A Case Study on {H}indi,2020,-1,-1,4,0,19109,raghvendra singh,Proceedings of the 17th International Conference on Natural Language Processing (ICON),0,"Automatic recognition of customer complaints on products or services that they purchase can be crucial for the organisations, multinationals and online retailers since they can exploit this information to fulfil their customers{'} expectations including managing and resolving the complaints. Recently, researchers have applied supervised learning strategies to automatically identify users{'} complaints expressed in English on Twitter. The downside of these approaches is that they require labeled training data for learning, which is expensive to create. This poses a barrier for them being applied to low-resource languages and domains for which task-specific data is not available. Machine translation (MT) can be used as an alternative to the tools that require such task-specific data. In this work, we use state-of-the-art neural MT (NMT) models for translating Hindi reviews into English and investigate performance of the downstream classification task (complaints identification) on their English translations."
2020.icon-adapmt.4,Terminology-Aware Sentence Mining for {NMT} Domain Adaptation: {ADAPT}{'}s Submission to the Adap-{MT} 2020 {E}nglish-to-{H}indi {AI} Translation Shared Task,2020,-1,-1,3,1,5016,rejwanul haque,Proceedings of the 17th International Conference on Natural Language Processing (ICON): Adap-MT 2020 Shared Task,0,"This paper describes the ADAPT Centre{'}s submission to the Adap-MT 2020 AI Translation Shared Task for English-to-Hindi. The neural machine translation (NMT) systems that we built to translate AI domain texts are state-of-the-art Transformer models. In order to improve the translation quality of our NMT systems, we made use of both in-domain and out-of-domain data for training and employed different fine-tuning techniques for adapting our NMT systems to this task, e.g. mixed fine-tuning and on-the-fly self-training. For this, we mined parallel sentence pairs and monolingual sentences from large out-of-domain data, and the mining process was facilitated through automatic extraction of terminology from the in-domain data. This paper outlines the experiments we carried out for this task and reports the performance of our NMT systems on the evaluation test set."
2020.eamt-1.21,Modelling Source- and Target- Language Syntactic Information as Conditional Context in Interactive Neural Machine Translation,2020,-1,-1,5,0,391,kamal gupta,Proceedings of the 22nd Annual Conference of the European Association for Machine Translation,0,"In interactive machine translation (MT), human translators correct errors in automatic translations in collaboration with the MT systems, which is seen as an effective way to improve the productivity gain in translation. In this study, we model source-language syntactic constituency parse and target-language syntactic descriptions in the form of supertags as conditional context for interactive prediction in neural MT (NMT). We found that the supertags significantly improve productivity gain in translation in interactive-predictive NMT (INMT), while syntactic parsing somewhat found to be effective in reducing human effort in translation. Furthermore, when we model this source- and target-language syntactic information together as the conditional context, both types complement each other and our fully syntax-informed INMT model statistically significantly reduces human efforts in a French{--}to{--}English translation task, achieving 4.30 points absolute (corresponding to 9.18{\%} relative) improvement in terms of word prediction accuracy (WPA) and 4.84 points absolute (corresponding to 9.01{\%} relative) reduction in terms of word stroke ratio (WSR) over the baseline."
