W00-1426,Can text structure be incompatible with rhetorical structure?,2000,12,17,2,1,39891,nadjet bouayadagha,{INLG}{'}2000 Proceedings of the First International Conference on Natural Language Generation,0,"Scott and Souza (1990) have posed the problem of how a rhetorical structure (in which propositions are linked by rhetorical relations, but not yet arranged in a linear order) can be realized by a text structure (in which propositions are ordered and linked up by appropriate discourse connectives). Almost all work on this problem assumes, implicitly or explicitly, that this mapping is governed by a constraint on compatibility of structure. We show how this constraint can be stated precisely, and present some counterexamples which seem acceptable even though they violate compatibility. The examples are based on a phenomenon we call extraposition, in which complex embedded constituents of a rhetorical structure are extracted and realized separately."
C00-2093,Planning texts by constraint satisfaction,2000,9,24,1,1,41078,richard power,{COLING} 2000 Volume 2: The 18th International Conference on Computational Linguistics,0,"A method is described by which a rhetorical-structure tree can be realized by a text structure made up of sections, paragraphs, sentences, vertical lists, and other textual patterns, with discourse connectives added (in the correct positions) to mark rhetorical relations. We show that text-structuring can be formulated as a Constraint Satisfaction Problem, so that all solutions respecting constraints on text-structure formation and structural compatibility can be efficiently generated. Of the many solutions generated by this method, some are stylistically preferable to others; we show how further constraints can be applied in order to select the best versions. Finally, we discuss some extensions such as the generation of indented text structures."
C00-1033,Authoring Multimedia Documents using {WYSIWYM} Editing,2000,15,5,2,0.606061,5942,kees deemter,{COLING} 2000 Volume 1: The 18th International Conference on Computational Linguistics,0,"(1)This paper outlines a future 'ideal' multimedia document authoring system that allows authors to specify content and form of the document independently of each other and at a high level of abstraction;(2)It describes a working system that implements a small but significant part of the functionality of such an ideal system, based on semantic modeling of the pictures as well as the text of the document; and(3)It explains what needs to be done to bridge the gap between the implemented system and the ideal one."
E99-1002,Generating referring expressions with a unification grammar,1999,5,1,1,1,41078,richard power,Ninth Conference of the {E}uropean Chapter of the Association for Computational Linguistics,0,"A simple formalism is proposed to represent the contexts in which pronouns, definite/indefinite descriptions, and ordinal descriptions (e.g. 'the second book') can be used, and the way in which these expressions change the context. It is shown that referring expressions can be generated by a unification grammar provided that some phrase-structure rules are specially tailored to express entities in the current knowledge base."
W98-1427,Generation as a Solution to Its Own Problem,1998,12,38,2,0.272369,42447,donia scott,Natural Language Generation,0,"Natural language generation technology is now ripe for commercial exploitation, but one of the remaining bottlenecks is that of providing NLG systems with user-friendly interfaces for specifying the content of documents to be generated. We present here a new technique we have developed for providing such interfaces: WYSIWYM editing. WYSIWYM (What You See Is What You Meant) makes novel use of the systemxe2x80x99s generator to provide a natural language input device which requires no NL interpretation xe2x80x94 only NL generation."
W98-1437,{WYSIWYM}: knowledge editing with natural language feedback,1998,3,4,1,1,41078,richard power,Natural Language Generation,0,None
W98-0608,Coreference in Knowledge Editing,1998,-1,-1,2,0.606061,5942,kees deemter,The Computational Treatment of Nominals,0,None
P98-2173,Multilingual Authoring using Feedback Texts,1998,12,90,1,1,41078,richard power,"36th Annual Meeting of the Association for Computational Linguistics and 17th International Conference on Computational Linguistics, Volume 2",0,"There are obvious reasons for trying to automate the production of multilingual documentation, especially for routine subject-matter in restricted domains (e.g. technical instructions). Two approaches have been adopted: Machine Translation (MT) of a source text, and Multilingual Natural Language Generation (M-NLG) from a knowledge base. For MT, information extraction is a major difficulty, since the meaning must be derived by analysis of the source text; M-NLG avoids this difficulty but seems at first sight to require an expensive phase of knowledge engineering in order to encode the meaning. We introduce here a new technique which employs M-NLG during the phase of knowledge editing. A 'feedback text', generated from a possibly incomplete knowledge base, describes in natural language the knowledge encoded so far, and the options for extending it. This method allows anyone speaking one of the supported languages to produce texts in all of them, requiring from the author only expertise in the subject-matter, not expertise in knowledge engineering."
C98-2168,Multilingual authoring using feedback texts,1998,12,90,1,1,41078,richard power,{COLING} 1998 Volume 2: The 17th International Conference on Computational Linguistics,0,"There are obvious reasons for trying to automate the production of multilingual documentation, especially for routine subject-matter in restricted domains (e.g. technical instructions). Two approaches have been adopted: Machine Translation (MT) of a source text, and Multilingual Natural Language Generation (M-NLG) from a knowledge base. For MT, information extraction is a major difficulty, since the meaning must be derived by analysis of the source text; M-NLG avoids this difficulty but seems at first sight to require an expensive phase of knowledge engineering in order to encode the meaning. We introduce here a new technique which employs M-NLG during the phase of knowledge editing. A 'feedback text', generated from a possibly incomplete knowledge base, describes in natural language the knowledge encoded so far, and the options for extending it. This method allows anyone speaking one of the supported languages to produce texts in all of them, requiring from the author only expertise in the subject-matter, not expertise in knowledge engineering."
W96-0505,Multilingual generation of administrative forms,1996,2,16,1,1,41078,richard power,Eighth International Natural Language Generation Workshop (Posters and Demonstrations),0,None
