2009.eamt-1.14,Optimal Bilingual Data for {F}rench-{E}nglish {PB}-{SMT},2009,13,20,2,0.77381,46337,sylwia ozdowska,Proceedings of the 13th Annual conference of the European Association for Machine Translation,0,"We investigate the impact of the original source language (SL) on Frenchxe2x80x90English PB-SMT. We train four configurations of a state-of-the-art PB-SMT system based on Frenchxe2x80x90English parallel corpora which differ in terms of the original SL, and conduct experiments in both translation directions. We see that data containing original French and English translated from French is optimal when building a system translating from French into English. Conversely, using data comprising exclusively French and English translated from several other languages is suboptimal regardless of the translation direction. Accordingly, the clamour for more data needs to be tempered somewhat; unless the quality of such data is controlled, more training data can cause translation performance to decrease drastically, by up to 38% relative B LEU in our experiments."
2009.eamt-1.20,Marker-Based Filtering of Bilingual Phrase Pairs for {SMT},2009,32,8,2,0,9988,felipe sanchezmartinez,Proceedings of the 13th Annual conference of the European Association for Machine Translation,0,Spanish Ministry of Education and Science (project TIN2006-15071-C03-01). Science Foundation Ireland through grants 05/IN/1732 and 06/RF/CMS064.
2009.eamt-1.32,Using Supertags as Source Language Context in {SMT},2009,34,27,4,1,5016,rejwanul haque,Proceedings of the 13th Annual conference of the European Association for Machine Translation,0,"Recent research has shown that Phrase-Based Statistical Machine Translation (PB-SMT) systems can benefit from twon enhancements: (i) using words and POS tags as context-informed features on the source side; and (ii) incorporating lexical syntactic descriptions in the form of supertags on the target side. In this work wen present a novel PB-SMT model that combines these two aspects by using supertags as source language contextinformed features. These features enable us to exploit source similarity in addition to target similarity, as modelled by the language model. In our experiments twon kinds of supertags are employed: those from Lexicalized Tree-Adjoining Grammar and Combinatory Categorial Grammar.n We use a memory-based classification framework that enables the estimation of these features while avoidingn problems of sparseness. Despite the differences between these two approaches, the supertaggers give similar improvements. We evaluate the performance of our approach on an English-to-Chinese translation task using a state-of-the-art phrase-based SMT system, and report ann improvement of 7.88% BLEU score in translation quality when adding supertags as context-informed features."
2009.eamt-1.34,Tuning Syntactically Enhanced Word Alignment for Statistical Machine Translation,2009,23,3,3,1,11802,yanjun ma,Proceedings of the 13th Annual conference of the European Association for Machine Translation,0,"We introduce a syntactically enhanced word alignment model that is more flexible than state-of-the-art generative wordn alignment models and can be tuned according to different end tasks. First of all, this model takes the advantages ofn both unsupervised and supervised word alignment approaches by obtaining anchor alignments from unsupervised generativen models and seeding the anchor alignments into a supervised discriminative model. Second, this model offers the flexibility of tuning the alignment according to differentn optimisation criteria. Our experiments show that using our word alignment in a Phrase-Based Statistical Machine Translation system yields a 5.38% relative increasen on IWSLT 2007 task in terms of BLEU score."
W08-0409,Improving Word Alignment Using Syntactic Dependencies,2008,29,28,4,1,11802,yanjun ma,Proceedings of the {ACL}-08: {HLT} Second Workshop on Syntax and Structure in Statistical Translation ({SSST}-2),0,"We introduce a word alignment framework that facilitates the incorporation of syntax encoded in bilingual dependency tree pairs. Our model consists of two sub-models: an anchor word alignment model which aims to find a set of high-precision anchor links and a syntaxenhanced word alignment model which focuses on aligning the remaining words relying on dependency information invoked by the acquired anchor links. We show that our syntaxenhanced word alignment approach leads to a 10.32% and 5.57% relative decrease in alignment error rate compared to a generative word alignment model and a syntax-proof discriminative word alignment model respectively. Furthermore, our approach is evaluated extrinsically using a phrase-based statistical machine translation system. The results show that SMT systems based on our word alignment approach tend to generate shorter outputs. Without length penalty, using our word alignments yields statistically significant improvement in Chinese-English machine translation in comparison with the baseline word alignment."
W08-0326,{M}a{T}r{E}x: The {DCU} {MT} System for {WMT} 2008,2008,15,20,4,1,20890,john tinsley,Proceedings of the Third Workshop on Statistical Machine Translation,0,"In this paper, we give a description of the machine translation system developed at DCU that was used for our participation in the evaluation campaign of the Third Workshop on Statistical Machine Translation at ACL 2008.n n We describe the modular design of our data-driven MT system with particular focus on the components used in this participation. We also describe some of the significant modules which were unused in this task.n n We participated in the EuroParl task for the following translation directions: Spanish-English and French-English, in which we employed our hybrid EBMT-SMT architecture to translate. We also participated in the Czech-English News and News Commentary tasks which represented a previously untested language pair for our system. We report results on the provided development and test sets."
bungeroth-etal-2008-atis,The {ATIS} Sign Language Corpus,2008,5,26,6,0,48344,jan bungeroth,Proceedings of the Sixth International Conference on Language Resources and Evaluation ({LREC}'08),0,"Systems that automatically process sign language rely on appropriate data. We therefore present the ATIS sign language corpus that is based on the domain of air travel information. It is available for five languages, English, German, Irish sign language, German sign language and South African sign language. The corpus can be used for different tasks like automatic statistical translation and automatic sign language recognition and it allows the specific modeling of spatial references in signing space."
J08-1003,Wide-Coverage Deep Statistical Parsing Using Automatic Dependency Structure Annotation,2008,64,47,6,0.638298,4873,aoife cahill,Computational Linguistics,0,"A number of researchers have recently conducted experiments comparing deep hand-crafted wide-coverage with shallow treebank-and machine-learning-based parsers at the level of dependencies, using simple and automatic methods to convert tree output generated by the shallow parsers into dependencies. In this article, we revisit such experiments, this time using sophisticated automatic LFG f-structure annotation methodologies with surprising results. We compare various PCFG and history-based parsers to find a baseline parsing system that fits best into our automatic dependency structure annotation technique. This combined system of syntactic parser and dependency structure annotation is compared to two hand-crafted, deep constraint-based parsers, RASP and XLE. We evaluate using dependency-based gold standards and use the Approximate Randomization Test to test the statistical significance of the results. Our experiments show that machine-learning-based shallow grammars augmented with sophisticated automatic dependency annotation technology outperform hand-crafted, deep, wide-coverage constraint grammars. Currently our best system achieves an f-score of 82.73% against the PARC 700 Dependency Bank, a statistically significant improvement of 2.18% over the most recent results of 80.55% for the hand-crafted LFG grammar and XLE parsing system and an f-score of 80.23% against the CBS 500 Dependency Bank, a statistically significant 3.66% improvement over the 76.57% achieved by the hand-crafted RASP grammar and parsing system."
C08-1139,Automatic Generation of Parallel Treebanks,2008,18,38,2,0.632184,40415,ventsislav zhechev,Proceedings of the 22nd International Conference on Computational Linguistics (Coling 2008),0,"The need for syntactically annotated data for use in natural language processing has increased dramatically in recent years. This is true especially for parallel treebanks, of which very few exist. The ones that exist are mainly hand-crafted and too small for reliable use in data-oriented applications. In this paper we introduce a novel platform for fast and robust automatic generation of parallel treebanks. The software we have developed based on this platform has been shown to handle large data sets. We also present evaluation results demonstrating the quality of the derived treebanks and discuss some possible modifications and improvements that can lead to even better results. We expect the presented platform to help boost research in the field of data-oriented machine translation and lead to advancements in other fields where parallel treebanks can be employed."
2008.iwslt-evaluation.3,Exploiting alignment techniques in {MATREX}: the {DCU} machine translation system for {IWSLT} 2008.,2008,23,10,5,1,11802,yanjun ma,Proceedings of the 5th International Workshop on Spoken Language Translation: Evaluation Campaign,0,"In this paper, we give a description of the machine translation (MT) system developed at DCU that was used for our third participation in the evaluation campaign of the International Workshop on Spoken Language Translation (IWSLT 2008). In this participation, we focus on various techniques for word and phrase alignment to improve system quality. Specifically, we try out our word packing and syntax-enhanced word alignment techniques for the Chinese{--}English task and for the English{--}Chinese task for the first time. For all translation tasks except Arabic{--}English, we exploit linguistically motivated bilingual phrase pairs extracted from parallel treebanks. We smooth our translation tables with out-of-domain word translations for the Arabic{--}English and Chinese{--}English tasks in order to solve the problem of the high number of out of vocabulary items. We also carried out experiments combining both in-domain and out-of-domain data to improve system performance and, finally, we deploy a majority voting procedure combining a language model-based method and a translation-based method for case and punctuation restoration. We participated in all the translation tasks and translated both the single-best ASR hypotheses and the correct recognition results. The translation results confirm that our new word and phrase alignment techniques are often helpful in improving translation quality, and the data combination method we proposed can significantly improve system performance."
W07-0714,Labelled Dependencies in Machine Translation Evaluation,2007,20,52,3,1,29329,karolina owczarzak,Proceedings of the Second Workshop on Statistical Machine Translation,0,"We present a method for evaluating the quality of Machine Translation (MT) output, using labelled dependencies produced by a Lexical-Functional Grammar (LFG) parser. Our dependency-based method, in contrast to most popular string-based evaluation metrics, does not unfairly penalize perfectly valid syntactic variations in the translation, and the addition of WordNet provides a way to accommodate lexical variation. In comparison with other metrics on 16,800 sentences of Chinese-English newswire text, our method reaches high correlation with human scores."
W07-0411,Dependency-Based Automatic Evaluation for Machine Translation,2007,16,51,3,1,29329,karolina owczarzak,"Proceedings of {SSST}, {NAACL}-{HLT} 2007 / {AMTA} Workshop on Syntax and Structure in Statistical Translation",0,"We present a novel method for evaluating the output of Machine Translation (MT), based on comparing the dependency structures of the translation and reference rather than their surface string forms. Our method uses a treebank-based, widecoverage, probabilistic Lexical-Functional Grammar (LFG) parser to produce a set of structural dependencies for each translation-reference sentence pair, and then calculates the precision and recall for these dependencies. Our dependency-based evaluation, in contrast to most popular string-based evaluation metrics, will not unfairly penalize perfectly valid syntactic variations in the translation. In addition to allowing for legitimate syntactic differences, we use paraphrases in the evaluation process to account for lexical variation. In comparison with other metrics on 16,800 sentences of Chinese-English newswire text, our method reaches high correlation with human scores. An experiment with two translations of 4,000 sentences from Spanish-English Europarl shows that, in contrast to most other metrics, our method does not display a high bias towards statistical models of translation."
P07-1037,Supertagged Phrase-Based Statistical Machine Translation,2007,15,61,3,1,6587,hany hassan,Proceedings of the 45th Annual Meeting of the Association of Computational Linguistics,1,"Until quite recently, extending Phrase-based Statistical Machine Translation (PBSMT) with syntactic structure caused system performance to deteriorate. In this work we show that incorporating lexical syntactic descriptions in the form of supertags can yield significantly better PBSMT systems. We describe a novel PBSMT model that integrates supertags into the target language model and the target side of the translation model. Two kinds of supertags are employed: those from Lexicalized Tree-Adjoining Grammar and Combinatory Categorial Grammar. Despite the differences between these two approaches, the supertaggers give similar improvements. In addition to supertagging, we also explore the utility of a surface global grammaticality measure based on combinatory operators. We perform various experiments on the Arabic to English NIST 2005 test set addressing issues such as sparseness, scalability and the utility of system subcomponents. Our best result (0.4688 BLEU) improves by 6.1% relative to a state-of-theart PBSMT model, which compares very favourably with the leading systems on the NIST 2005 task."
P07-1039,Bootstrapping Word Alignment via Word Packing,2007,29,43,3,1,11802,yanjun ma,Proceedings of the 45th Annual Meeting of the Association of Computational Linguistics,1,"We introduce a simple method to pack words for statistical word alignment. Our goal is to simplify the task of automatic word alignment by packing several consecutive words together when we believe they correspond to a single word in the opposite language. This is done using the word aligner itself, i.e. by bootstrapping on its output. We evaluate the performance of our approach on a Chinese-to-English machine translation task, and report a 12.2% relative increase in BLEU score over a state-of-the art phrasebased SMT system."
2007.tmi-papers.11,Capturing translational divergences with a statistical tree-to-tree aligner,2007,25,20,4,1,48768,mary hearne,Proceedings of the 11th Conference on Theoretical and Methodological Issues in Machine Translation of Natural Languages: Papers,0,"Parallel treebanks, which comprise paired source-target parse trees aligned at sub-sentential level, could be usefuln for many applications, particularly data-driven machine translation. In this paper, we focus on how translationaln divergences are captured within a parallel treebank using a fully automatic statistical tree-to-tree aligner. Wen observe that while the algorithm performs well at the phrase level, performance on lexical-level alignmentsn is compromised by an inappropriate bias towards coverage rather than precision. This preference for high precisionn rather than broad coverage in terms of expressing translational divergences through tree-alignment stands inn direct opposition to the situation for SMT word-alignment models. We suggest that this has implications not onlyn for tree-alignment itself but also for the broader area of induction of syntaxaware models for SMT."
2007.tmi-papers.14,Alignment-guided chunking,2007,22,8,3,1,11802,yanjun ma,Proceedings of the 11th Conference on Theoretical and Methodological Issues in Machine Translation of Natural Languages: Papers,0,"We introduce an adaptable monolingual chunking approachxe2x80x93Alignment-Guided Chunking (AGC)xe2x80x93which makes use of knowledge of word alignments acquired from bilingualn corpora. Our approach is motivated by the observation that a sentence should be chunked differently dependingn the foreseen end-tasks. For example, given the differentn requirements of translation into (say) French and German, it is inappropriate to chunk up an English string in exactly the same way as preparation for translation into onen or other of these languages. We test our chunking approachn on two language pairs: Frenchxe2x80x93English and Germanxe2x80x93English, where these two bilingual corpora share the same English sentences. Two chunkers trained on Frenchxe2x80x93Englishn (FE-Chunker) and Germanxe2x80x93English(DE-Chunker ) respectively are used to perform chunking on the same English sentences. We construct two test sets, each suitable for Frenchxe2x80x93n English and Germanxe2x80x93English respectively. The performance of the two chunkers is evaluated on the appropriate test set and with one reference translation only, we report Fscoresn of 32.63% for the FE-Chunker and 40.41% for the DE-Chunker."
2007.tmi-papers.26,Hand in hand: automatic sign language to {E}nglish translation,2007,9,12,5,0.882353,32003,daniel stein,Proceedings of the 11th Conference on Theoretical and Methodological Issues in Machine Translation of Natural Languages: Papers,0,"In this paper, we describe the first data-driven automatic sign-language-to- speech translation system. While both sign language (SL) recognition and translation techniques exist, both use an intermediate notation systemn not directly intelligible for untrained users. We combine a SL recognizing framework with a state-of-the-art phrase-based machine translation (MT) system, using corpora of both American Sign Language and Irish Sign Languagen data. In a set of experiments we show the overall results and also illustrate the importance of including an vision-based knowledge source in the development of a complete SL translation system."
2007.tmi-papers.28,Exploiting source similarity for {SMT} using context-informed features,2007,29,59,3,1,49191,nicolas stroppa,Proceedings of the 11th Conference on Theoretical and Methodological Issues in Machine Translation of Natural Languages: Papers,0,"In this paper, we introduce context informed features in a log-linear phrase-based SMT framework; these features enable us to exploit source similarity in addition to target similarity modeled by the language model. Wen present a memory-based classification framework that enables the estimation of these features while avoidingn sparseness problems. We evaluate the performance of our approach on Italian-to-English and Chinese-to-English translation tasks using a state-of-the-art phrase-based SMTn system, and report significant improvements for both BLEU and NIST scores when adding the context-informed features."
2007.mtsummit-papers.40,Comparing rule-based and data-driven approaches to {S}panish-to-{B}asque machine translation,2007,23,19,3,0,8822,gorka labaka,Proceedings of Machine Translation Summit XI: Papers,0,"In this paper, we compare the rule-based and data-drivenn approaches in the context of Spanish-to-Basque Machine Translation. The rule-based system we consider has been developed specifically for Spanish-to-Basque machine translation, and is tuned to this language pair. On the contrary, the data-driven system we use is generic, and has not been specifically designed to deal with Basque. Spanish-to-Basque Machine Translation is a challenge for data-drivenn approaches for at least two reasons. First, there is lack ofn bilingual data on which a data-driven MT system can be trained. Second, Basque is a morphologically-rich agglutinative language and translating to Basque requires a huge generation of morphological information, a difficult task for a generic system not specifically tuned to Basque. We present the results of a series of experiments, obtained on two different corpora, one being xe2x80x9cin-domainxe2x80x9d and then other one xe2x80x9cout-of-domainxe2x80x9d with respect to the data-drivenn system. We show that n-gram based automatic evaluation and edit-distance-based human evaluation yield two different sets of results. According to BLEU, the data-driven system outperforms the rule-based system on the in-domain data, while according to the human evaluation, the rule-basedn approach achieves higher scores for both corpora."
2007.mtsummit-papers.44,Combining data-driven {MT} systems for improved sign language translation,2007,25,14,2,1,42572,sara morrissey,Proceedings of Machine Translation Summit XI: Papers,0,"In this paper, we investigate the feasibility of combining two data-driven machine translation (MT) systems for the translation of sign languages (SLs). We take the MT systems of two prominent data-driven research groups, the MaTrEx system developed at DCU and the Statistical Machinen Translation (SMT) system developed at RWTH Aachen University, and apply their respective approaches to the task of translating Irish Sign Language and German Sign Language into English and German. In a set of experiments supported by automatic evaluation results, we show thatn there is a definite value to the prospective merging of MaTrExxe2x80x99s Example-Based MT chunks and distortion limit increase with RWTHxe2x80x99s constraint reordering."
2007.mtsummit-papers.62,Robust language pair-independent sub-tree alignment,2007,23,30,4,1,20890,john tinsley,Proceedings of Machine Translation Summit XI: Papers,0,"Data-driven approaches to machine translation (MT) achieve state-of-the-art results. Many syntax-aware approaches, such as Example-Based MT and Data-Oriented Translation, make use of tree pairs aligned at sub-sentential level. Obtaining sub-sentential alignments manually is time-consuming and error-prone, and requires expert knowledge of both source and target languages. We propose a novel, language pair-independent algorithm which automatically induces alignments between phrase-structure trees. We evaluate the alignments themselves against a manually aligned gold standard, and perform an extrinsic evaluation by using the aligned data to train and test a DOT system. Our results show that translation accuracy is comparable to that of the same translation system trained on manually aligned data, and coverage improves."
2007.iwslt-1.10,{M}a{T}r{E}x: the {DCU} machine translation system for {IWSLT} 2007,2007,0,5,3,1,6587,hany hassan,Proceedings of the Fourth International Workshop on Spoken Language Translation,0,"In this paper, we give a description of the machine translation system developed at DCU that was used for our second participation in the evaluation campaign of the International Workshop on Spoken Language Translation (IWSLT 2007). In this participation, we focus on some new methods to improve system quality. Specifically, we try our word packing technique for different language pairs, we smooth our translation tables with out-of-domain word translations for the Arabic{--}English and Chinese{--}English tasks in order to solve the high number of out of vocabulary items, and finally we deploy a translation-based model for case and punctuation restoration. We participated in both the classical and challenge tasks for the following translation directions: Chinese{--}English, Japanese{--}English and Arabic{--}English. For the last two tasks, we translated both the single-best ASR hypotheses and the correct recognition results; for Chinese{--}English, we just translated the correct recognition results. We report the results of the system for the provided evaluation sets, together with some additional experiments carried out following identification of some simple tokenisation errors in the official runs."
W06-3112,Contextual Bitext-Derived Paraphrases in Automatic {MT} Evaluation,2006,17,40,4,1,29329,karolina owczarzak,Proceedings on the Workshop on Statistical Machine Translation,0,"In this paper we present a novel method for deriving paraphrases during automatic MT evaluation using only the source and reference texts, which are necessary for the evaluation, and word and phrase alignment software. Using target language paraphrases produced through word and phrase alignment a number of alternative reference sentences are constructed automatically for each candidate translation. The method produces lexical and low-level syntactic paraphrases that are relevant to the domain in hand, does not use external knowledge resources, and can be combined with a variety of automatic MT evaluation system."
