W97-0411,Translation Methodology in the Spoken Language Translator: An Evaluation,1997,15,4,3,0.234818,55475,david carter,Spoken Language Translation,0,In this paper we describe how the translation methodology adopted fro the Spoken Language Translator (SLT) addresses the characteristics of the speech translation task in a context where it is esse ...
P96-1030,Fast Parsing Using Pruning and Grammar Specialization,1996,25,18,1,1,11421,manny rayner,34th Annual Meeting of the Association for Computational Linguistics,1,"We show how a general grammar may be automatically adapted for fast parsing of utterances from a specific domain by means of constituent pruning and grammar specialization based on explanation-based learning. These methods together give an order of magnitude increase in speed, and the coverage loss entailed by grammar specialization is reduced to approximately half that reported in previous work. Experiments described here suggest that the loss of coverage has been reduced to the point where it no longer causes significant performance degradation in the context of a real application."
1995.tc-1.11,Using corpora to develop limited-domain speech translation systems,1995,-1,-1,1,1,11421,manny rayner,Proceedings of Translating and the Computer 17,0,None
H94-1040,Combining Knowledge Sources to Reorder N-Best Speech Hypothesis Lists,1994,11,74,1,1,11421,manny rayner,"{H}uman {L}anguage {T}echnology: Proceedings of a Workshop held at {P}lainsboro, {N}ew {J}ersey, {M}arch 8-11, 1994",0,"A simple and general method is described that can combine different knowledge sources to reorder N-best lists of hypotheses produced by a speech recognizer. The method is automatically trainable, acquiring information from both positive and negative examples. In experiments, the method was tested on a 1000-utterance sample of unseen ATIS data."
H93-1042,A Speech to Speech Translation System Built From Standard Components,1993,16,24,1,1,11421,manny rayner,"{H}uman {L}anguage {T}echnology: Proceedings of a Workshop Held at Plainsboro, New Jersey, March 21-24, 1993",0,"This paper describes a speech to speech translation system using standard components and a suite of generalizable customization techniques. The system currently translates air travel planning queries from English to Swedish. The modular architecture is designed to be easy to port to new domains and languages, and consists of a pipelined series of processing phases. The output of each phase consists of multiple hypotheses; statistical preference mechanisms, the data for which is derived from automatic processing of domain corpora, are used between each pair of phases to filter hypotheses. Linguistic knowledge is represented throughout the system in declarative form. We summarize the architectures of the component systems and the interfaces between them, and present initial performance results."
A92-1001,Deriving Database Queries from Logical Forms by Abductive Definition Expansion,1992,9,162,1,1,11421,manny rayner,Third Conference on Applied Natural Language Processing,0,"The paper describes a principled approach to the problem of deriving database queries from logical forms produced by a general NL interface. Our method attempts to construct a database query and a set of plausible assumptions, such that the logical form is equivalent to the query given the assumptions. The domain information needed is provided as declarative meaning postulates, including definitional equivalences. The technical basis for the approach is that a definition of the form Head xe2x88xa7 Conditions xe2x86x94 Body can be read procedurally as Expand Head to Body if it occurs in an environment where Conditions can be inferred. The environment is provided by the other conjuncts occurring together with Head in the original logical form, together with other meaning postulates and the contents of the database. The method has been implemented in CLARE, a language and reasoning system whose linguistic component is the SRI Core Language Engine."
1992.tc-1.14,{E}nglish-{S}wedish translation of dialogue software,1992,9,2,4,0.952381,41856,hiyan alshawi,Proceedings of Translating and the Computer 14: Quality standards and the implementation of technology in translation,0,"The paper describes the BCI, a prototype interactive machine-translation system, constructed by connecting English and Swedish versions of the SRI Core Language Engine through a transfer component. Transfer takes place at the level of Quasi Logical Form (QLF), a contextually sensitive logical form representation which is deep enough for dealing with cross-linguistic differences. Theoretical arguments are presented to support the claim that QLF transfer represents a good compromise between the opposing paradigms of syntactic transfer and semantic interlinguabased MT. An annotated example dialogue is shown. A follow-on project, in which the BCI is used as the core of a spoken-language translation system, is briefly described."
P91-1021,Translation by Quasi Logical Form Transfer,1991,11,40,3,0.952381,41856,hiyan alshawi,29th Annual Meeting of the Association for Computational Linguistics,1,"The paper describes work on applying a general purpose natural language processing system to transfer-based interactive translation. Transfer takes place at the level of Quasi Logical Form (QLF), a contextually sensitive logical form representation which is deep enough for dealing with cross-linguistic differences. Theoretical arguments and experimental results are presented to support the claim that this framework has good properties in terms of modularity, compositionality, reversibility and monotonicity."
J90-2003,An Implementable Semantics for Comparative Constructions,1990,23,16,1,1,11421,manny rayner,Computational Linguistics,0,"We describe a comprehensive treatment of the syntax and semantics of comparative constructions based on theoretical work by Pinkham, which can be implemented in a relatively straightforward fashion within a feature-based phrase-structure grammar. Comparatives are divided up into clausal and phrasal constructions; in contrast to most previous theories, however, phrasals are not regarded as reduced forms of clausals. We begin by defining a Montagovian semantics for phrasal comparatives that directly links interpretation rules to the surface syntactic structure; we then show how this solution can be made computationally more efficient by factoring the interpretation through an intermediate level of representation, using a method similar to that used for dealing with scoping phenomena. Detailed examples are provided, showing how the method can correctly describe the semantics of a variety of superficially widely different comparative constructions. The ideas have all been implemented within a large-scale grammar for Swedish, a toy version of which is presented, along with examples of the output."
H90-1051,Using Explanation-Based Learning to Increase Performance in a Large-Scale {NL} Query System,1990,5,4,1,1,11421,manny rayner,"Speech and Natural Language: Proceedings of a Workshop Held at Hidden Valley, {P}ennsylvania, June 24-27,1990",0,"Explanation-based learning (EBL) is a machine-learning technique, closely connected to other techniques like macro-operator learning, chunking, and partial evaluation; a phrase we have found useful for describing the method to logic programmers is example-guided partial evaluation. The basic ideas of the method are well-described in an overview article which recently appeared in Artificial Intelligence [1], to which we refer the reader who wants to understand the theoretical principles; here, we will only summarize briefly what EBL means in the context of natural-language processing. A detailed presentation can be found in [3] and [4]."
P88-1007,Parsing and Interpreting Comparatives,1988,6,4,1,1,11421,manny rayner,26th Annual Meeting of the Association for Computational Linguistics,1,"We describe a fairly comprehensive handling of the syntax and semantics of comparative constructions. The analysis is largely based on the theory developed by Pinkham, but we advance arguments to support a different handling of phrasal comparatives - in particular, we use direct interpretation instead of C-ellipsis. We explain the reasons for dividing comparative sentences into different categories, and for each category we give an example of the corresponding Montague semantics. The ideas have all been implemented within a large-scale grammar for Swedish."
C88-2111,Using a Logic Grammar to Learn a Lexicon,1988,6,8,1,1,11421,manny rayner,{C}oling {B}udapest 1988 Volume 2: {I}nternational {C}onference on {C}omputational {L}inguistics,0,"It is suggested that the concept of logic grammar as relation between a string and a parse-tree can be extended by admitting the lexicon as part of the relation. This makes it possible to give a simple and elegant formulation of the process of infering a lexicon from example sentences in conjunction with a grammar. Various problems arising from implementation and complexity factors are considered, and examples are shown to support the claim that the method shows potential as a practical tool for automatic lexicon acquisition."
