2021.starsem-1.1,Did the Cat Drink the Coffee? Challenging Transformers with Generalized Event Knowledge,2021,-1,-1,6,0,926,paolo pedinotti,Proceedings of *SEM 2021: The Tenth Joint Conference on Lexical and Computational Semantics,0,"Prior research has explored the ability of computational models to predict a word semantic fit with a given predicate. While much work has been devoted to modeling the typicality relation between verbs and arguments in isolation, in this paper we take a broader perspective by assessing whether and to what extent computational approaches have access to the information about the typicality of entire events and situations described in language (Generalized Event Knowledge). Given the recent success of Transformers Language Models (TLMs), we decided to test them on a benchmark for the dynamic estimation of thematic fit. The evaluation of these models was performed in comparison with SDM, a framework specifically designed to integrate events in sentence meaning representations, and we conducted a detailed error analysis to investigate which factors affect their behavior. Our results show that TLMs can reach performances that are comparable to those achieved by SDM. However, additional analysis consistently suggests that TLMs do not capture important aspects of event knowledge, and their predictions often depend on surface linguistic features, such as frequent words, collocations and syntactic patterns, thereby showing sub-optimal generalization abilities."
2020.lrec-1.85,The Brain-{IHM} Dataset: a New Resource for Studying the Brain Basis of Human-Human and Human-Machine Conversations,2020,-1,-1,6,1,16777,magalie ochs,Proceedings of the 12th Language Resources and Evaluation Conference,0,"This paper presents an original dataset of controlled interactions, focusing on the study of feedback items. It consists on recordings of different conversations between a doctor and a patient, played by actors. In this corpus, the patient is mainly a listener and produces different feedbacks, some of them being (voluntary) incongruent. Moreover, these conversations have been re-synthesized in a virtual reality context, in which the patient is played by an artificial agent. The final corpus is made of different movies of human-human conversations plus the same conversations replayed in a human-machine context, resulting in the first human-human/human-machine parallel corpus. The corpus is then enriched with different multimodal annotations at the verbal and non-verbal levels. Moreover, and this is the first dataset of this type, we have designed an experiment during which different participants had to watch the movies and give an evaluation of the interaction. During this task, we recorded participant{'}s brain signal. The Brain-IHM dataset is then conceived with a triple purpose: 1/ studying feedbacks by comparing congruent vs. incongruent feedbacks 2/ comparing human-human and human-machine production of feedbacks 3/ studying the brain basis of feedback perception."
2020.coling-main.431,Two-level classification for dialogue act recognition in task-oriented dialogues,2020,-1,-1,1,1,929,philippe blache,Proceedings of the 28th International Conference on Computational Linguistics,0,"Dialogue act classification becomes a complex task when dealing with fine-grain labels. Many applications require such level of labelling, typically automatic dialogue systems. We present in this paper a 2-level classification technique, distinguishing between generic and specific dialogue acts (DA). This approach makes it possible to benefit from the very good accuracy of generic DA classification at the first level and proposes an efficient approach for specific DA, based on high-level linguistic features. Our results show the interest of involving such features into the classifiers, outperforming all other feature sets, in particular those classically used in DA classification."
2020.aacl-main.26,"Comparing Probabilistic, Distributional and Transformer-Based Models on Logical Metonymy Interpretation",2020,-1,-1,4,1,927,giulia rambelli,Proceedings of the 1st Conference of the Asia-Pacific Chapter of the Association for Computational Linguistics and the 10th International Joint Conference on Natural Language Processing,0,"In linguistics and cognitive science, Logical metonymies are defined as type clashes between an event-selecting verb and an entity-denoting noun (e.g. The editor finished the article), which are typically interpreted by inferring a hidden event (e.g. reading) on the basis of contextual cues. This paper tackles the problem of logical metonymy interpretation, that is, the retrieval of the covert event via computational methods. We compare different types of models, including the probabilistic and the distributional ones previously introduced in the literature on the topic. For the first time, we also tested on this task some of the recent Transformer-based models, such as BERT, RoBERTa, XLNet, and GPT-2. Our results show a complex scenario, in which the best Transformer-based models and some traditional distributional models perform very similarly. However, the low performance on some of the testing datasets suggests that logical metonymy is still a challenging phenomenon for computational modeling."
W19-3312,Distributional Semantics Meets Construction Grammar. towards a Unified Usage-Based Model of Grammar and Meaning,2019,0,0,3,1,927,giulia rambelli,Proceedings of the First International Workshop on Designing Meaning Representations,0,"In this paper, we propose a new type of semantic representation of Construction Grammar that combines constructions with the vector representations used in Distributional Semantics. We introduce a new framework, Distributional Construction Grammar, where grammar and meaning are systematically modeled from language use, and finally, we discuss the kind of contributions that distributional models can provide to CxG representation from a linguistic and cognitive perspective."
W18-4603,Modeling Violations of Selectional Restrictions with Distributional Semantics,2018,0,2,3,1,180,emmanuele chersoni,Proceedings of the Workshop on Linguistic Complexity and Natural Language Processing,0,"Distributional Semantic Models have been successfully used for modeling selectional preferences in a variety of scenarios, since distributional similarity naturally provides an estimate of the degree to which an argument satisfies the requirement of a given predicate. However, we argue that the performance of such models on rare verb-argument combinations has received relatively little attention: it is not clear whether they are able to distinguish the combinations that are simply atypical, or implausible, from the semantically anomalous ones, and in particular, they have never been tested on the task of modeling their differences in processing complexity. In this paper, we compare two different models of thematic fit by testing their ability of identifying violations of selectional restrictions in two datasets from the experimental studies."
L18-1467,A Semi-autonomous System for Creating a Human-Machine Interaction Corpus in Virtual Reality: Application to the {ACORFORM}ed System for Training Doctors to Break Bad News,2018,0,2,2,1,16777,magalie ochs,Proceedings of the Eleventh International Conference on Language Resources and Evaluation ({LREC} 2018),0,None
W17-6803,Is Structure Necessary for Modeling Argument Expectations in Distributional Semantics?,2017,32,0,3,1,180,emmanuele chersoni,{IWCS} 2017 - 12th International Conference on Computational Semantics - Long papers,0,"Despite the number of NLP studies dedicated to thematic fit estimation, little attention has been paid to the related task of composing and updating verb argument expectations. The few exceptions have mostly modeled this phenomenon with structured distributional models, implicitly assuming a similarly structured representation of events. Recent experimental evidence, however, suggests that human processing system could also exploit an unstructured bag-of-arguments type of event representation to predict upcoming input. In this paper, we re-implement a traditional structured model and adapt it to compare the different hypotheses concerning the degree of structure in our event knowledge, evaluating their relative performance in the task of the argument expectations update."
S17-1021,Logical Metonymy in a Distributional Model of Sentence Comprehension,2017,15,2,3,1,180,emmanuele chersoni,Proceedings of the 6th Joint Conference on Lexical and Computational Semantics (*{SEM} 2017),0,"In theoretical linguistics, logical metonymy is defined as the combination of an event-subcategorizing verb with an entity-denoting direct object (e.g., The author began the book), so that the interpretation of the VP requires the retrieval of a covert event (e.g., writing). Psycholinguistic studies have revealed extra processing costs for logical metonymy, a phenomenon generally explained with the introduction of new semantic structure. In this paper, we present a general distributional model for sentence comprehension inspired by the Memory, Unification and Control model by Hagoort (2013,2016). We show that our distributional framework can account for the extra processing costs of logical metonymy and can identify the covert event in a classification task."
D17-1068,Measuring Thematic Fit with Distributional Feature Overlap,2017,33,1,4,0.666667,181,enrico santus,Proceedings of the 2017 Conference on Empirical Methods in Natural Language Processing,0,"In this paper, we introduce a new distributional method for modeling predicate-argument thematic fit judgments. We use a syntax-based DSM to build a prototypical representation of verb-specific roles: for every verb, we extract the most salient second order contexts for each of its roles (i.e. the most salient dimensions of typical role fillers), and then we compute thematic fit as a weighted overlap between the top features of candidate fillers and role prototypes. Our experiments show that our method consistently outperforms a baseline re-implementing a state-of-the-art system, and achieves better or comparable results to those reported in the literature for the other unsupervised systems. Moreover, it provides an explicit representation of the features characterizing verb-specific semantic roles."
Y16-2021,Testing {APS}yn against Vector Cosine on Similarity Estimation,2016,29,11,5,0.666667,181,enrico santus,"Proceedings of the 30th Pacific Asia Conference on Language, Information and Computation: Oral Papers",0,"In Distributional Semantic Models (DSMs), Vector Cosine is widely used to estimate similarity between word vectors, although this measure was noticed to suffer from several shortcomings. The recent literature has proposed other methods which attempt to mitigate such biases. In this paper, we intend to investigate APSyn, a measure that computes the extent of the intersection between the most associated contexts of two target words, weighting it by context relevance. We evaluated this metric in a similarity estimation task on several popular test sets, and our results show that APSyn is in fact highly competitive, even with respect to the results reported in the literature for word embeddings. On top of it, APSyn addresses some of the weaknesses of Vector Cosine, performing well also on genuine similarity estimation."
W16-4102,Towards a Distributional Model of Semantic Complexity,2016,20,2,2,1,180,emmanuele chersoni,Proceedings of the Workshop on Computational Linguistics for Linguistic Complexity ({CL}4{LC}),0,"In this paper, we introduce for the first time a Distributional Model for computing semantic complexity, inspired by the general principles of the Memory, Unification and Control framework(Hagoort, 2013; Hagoort, 2016). We argue that sentence comprehension is an incremental process driven by the goal of constructing a coherent representation of the event represented by the sentence. The composition cost of a sentence depends on the semantic coherence of the event being constructed and on the activation degree of the linguistic constructions. We also report the results of a first evaluation of the model on the Bicknell dataset (Bicknell et al., 2010)."
L16-1245,4{C}ouv: A New Treebank for {F}rench,2016,0,0,1,1,929,philippe blache,Proceedings of the Tenth International Conference on Language Resources and Evaluation ({LREC}'16),0,"The question of the type of text used as primary data in treebanks is of certain importance. First, it has an influence at the discourse level: an article is not organized in the same way as a novel or a technical document. Moreover, it also has consequences in terms of semantic interpretation: some types of texts can be easier to interpret than others. We present in this paper a new type of treebank which presents the particularity to answer to specific needs of experimental linguistic. It is made of short texts (book backcovers) that presents a strong coherence in their organization and can be rapidly interpreted. This type of text is adapted to short reading sessions, making it easy to acquire physiological data (e.g. eye movement, electroencepholagraphy). Such a resource offers reliable data when looking for correlations between computational models and human language processing."
L16-1370,{M}arsa{G}ram: an excursion in the forests of parsing trees,2016,0,1,1,1,929,philippe blache,Proceedings of the Tenth International Conference on Language Resources and Evaluation ({LREC}'16),0,"The question of how to compare languages and more generally the domain of linguistic typology, relies on the study of different linguistic properties or phenomena. Classically, such a comparison is done semi-manually, for example by extracting information from databases such as the WALS. However, it remains difficult to identify precisely regular parameters, available for different languages, that can be used as a basis towards modeling. We propose in this paper, focusing on the question of syntactic typology, a method for automatically extracting such parameters from treebanks, bringing them into a typology perspective. We present the method and the tools for inferring such information and navigating through the treebanks. The approach has been applied to 10 languages of the Universal Dependencies Treebank. We approach is evaluated by showing how automatic classification correlates with language families."
D16-1205,Representing Verbs with Rich Contexts: an Evaluation on Verb Similarity,2016,22,1,4,1,180,emmanuele chersoni,Proceedings of the 2016 Conference on Empirical Methods in Natural Language Processing,0,"Several studies on sentence processing suggest that the mental lexicon keeps track of the mutual expectations between words. Current DSMs, however, represent context words as separate features, thereby loosing important information for word expectations, such as word interrelations. In this paper, we present a DSM that addresses this issue by defining verb contexts as joint syntactic dependencies. We test our representation in a verb similarity task on two datasets, showing that joint contexts achieve performances comparable to single dependencies or even better. Moreover, they are able to overcome the data sparsity problem of joint feature spaces, in spite of the limited size of our training corpus."
2015.jeptalnrecital-long.20,Typologie automatique des langues {\\`a} partir de treebanks,2015,-1,-1,1,1,929,philippe blache,Actes de la 22e conf{\\'e}rence sur le Traitement Automatique des Langues Naturelles. Articles longs,0,"La typologie des langues repose sur l{'}{\'e}tude de la r{\'e}alisation de propri{\'e}t{\'e}s ou ph{\'e}nom{\`e}nes linguistiques dans plusieurs langues ou familles de langues. Nous abordons dans cet article la question de la typologie syntaxique et proposons une m{\'e}thode permettant d{'}extraire automatiquement ces propri{\'e}t{\'e}s {\`a} partir de treebanks, puis de les analyser en vue de dresser une telle typologie. Nous d{\'e}crivons cette m{\'e}thode ainsi que les outils d{\'e}velopp{\'e}s pour la mettre en {\oe}uvre. Celle-ci a {\'e}t{\'e} appliqu{\'e}e {\`a} l{'}analyse de 10 langues d{\'e}crites dans le Universal Dependencies Treebank. Nous validons ces r{\'e}sultats en montrant comment une technique de classification permet, sur la base des informations extraites, de reconstituer des familles de langues."
2015.jeptalnrecital-court.25,Cr{\\'e}ation d{'}un nouveau treebank {\\`a} partir de quatri{\\`e}mes de couverture,2015,-1,-1,1,1,929,philippe blache,Actes de la 22e conf{\\'e}rence sur le Traitement Automatique des Langues Naturelles. Articles courts,0,"Nous pr{\'e}sentons ici 4-couv, un nouveau corpus arbor{\'e} d{'}environ 3 500 phrases, constitu{\'e} d{'}un ensemble de quatri{\`e}mes de couverture, {\'e}tiquet{\'e} et analys{\'e} automatiquement puis corrig{\'e} et valid{\'e} {\`a} la main. Il r{\'e}pond {\`a} des besoins sp{\'e}cifiques pour des projets de linguistique exp{\'e}rimentale, et vise {\`a} rester compatible avec les autres treebanks existants pour le fran{\c{c}}ais. Nous pr{\'e}sentons ici le corpus lui-m{\^e}me ainsi que les outils utilis{\'e}s pour les diff{\'e}rentes {\'e}tapes de son {\'e}laboration : choix des textes, {\'e}tiquetage, parsing, correction manuelle."
W14-0501,Challenging incrementality in human language processing: two operations for a cognitive architecture,2014,9,0,1,1,929,philippe blache,Proceedings of the 5th Workshop on Cognitive Aspects of Computational Language Learning ({C}og{ACLL}),0,"The description of language complexity and the cognitive load related to the different linguistic phenomena is a key issue for the understanding of language processing. Many studies have focused on the identification of specific parameters that can lead to a simplification or on the contrary to a complexification of the processing (e.g. the different difficulty models proposed in (Gibson, 2000), (Warren and Gibson, 2002), (Hawkins, 2001) ). Similarly, different simplification factors can be identified, such as the notion of activation, relying on syntactic priming effects making it possible to predict (or activate) a word (Vasishth, 2003). Several studies have shown that complexity factors are cumulative (Keller, 2005), but can be offset by simplification (Blache et al., 2006). It is therefore necessary to adopt a global point of view of language processing, explaining the interplay between positive and negative cumulativity, in other words compensation effects. From the computational point of view, some models can account more or less explicitly for these phenomena. This is the case of the Surprisal index (Hale, 2001), offering for each word an assessment of its integration costs into the syntactic structure. This evaluation is done starting from the probability of the possible solutions. On their side, symbolic approaches also provide an estimation of the activation degree, depending on the number and weight of syntactic relations to the current word (Blache et al., 2006); (Blache, 2013). These approaches are based on the classical idea that language processing is incremental and occurs word by word. There are however several experimental evidences showing that a higher level of processing is used by human subjects. Eyetracking data show for example that fixations are done by chunks, not by words (Rauzy and Blache, 2012). Similarly, EEG experiments have shown that processing multiword expressions (for example idioms) relies on global mechanisms (Vespignani et al., 2010); (Rommers et al., 2013). Starting from the question of complexity and its estimation, I will address in this presentation the problem of language processing and its organization. I propose more precisely, using computational complexity models, to define a cohesion index between words. Such an index makes it possible to define chunks (or more generally units) that are built directly, by aggregation, instead of syntactic analysis. In this hypothesis, parsing consists in two different processes: aggregation and integration."
F14-2026,"Multilingual Summarization Experiments on {E}nglish, {A}rabic and {F}rench (R{\\'e}sum{\\'e} Automatique Multilingue Exp{\\'e}rimentations sur l{'}Anglais, l{'}Arabe et le Fran{\\c{c}}ais) [in {F}rench]",2014,-1,-1,3,0,21535,houda oufaida,Proceedings of TALN 2014 (Volume 2: Short Papers),0,None
F13-1017,Chunks and the notion of activation : a facilitation model for sentence processing (Chunks et activation : un mod{\\`e}le de facilitation du traitement linguistique) [in {F}rench],2013,-1,-1,1,1,929,philippe blache,Proceedings of TALN 2013 (Volume 1: Long Papers),0,None
W12-4903,Robustness and processing difficulty models. A pilot study for eye-tracking data on the {F}rench Treebank,2012,19,6,2,0,16764,stephane rauzy,Proceedings of the First Workshop on Eye-tracking and Natural Language Processing,0,"We present in this paper a robust method for predicting reading times. Robustness first comes from the conception of the difficulty model, which is based on a morpho-syntactic surprisal index. This metric is not only a good predictor, as shown in the paper, but also intrinsically robust (because relying on POS-tagging instead of parsing). Second, robustness also concerns data analysis: we propose to enlarge the scope of reading processing units by using syntactic chunks instead of words. As a result, words with null reading time do not need any special treatment or filtering. It appears that working at chunks scale smooths out the variability inherent to the different reader's strategy. The pilot study presented in this paper applies this technique to a new resource we have built, enriching a French treebank with eye-tracking data and difficulty prediction measures."
seinturier-etal-2012-ontological,An ontological approach to model and query multimodal concurrent linguistic annotations,2012,4,0,4,0,42960,julien seinturier,Proceedings of the Eighth International Conference on Language Resources and Evaluation ({LREC}'12),0,"This paper focuses on the representation and querying of knowledge-based multimodal data. This work stands in the OTIM project which aims at processing multimodal annotation of a large conversational French speech corpus. Within OTIM, we aim at providing linguists with a unique framework to encode and manipulate numerous linguistic domains (from prosody to gesture). Linguists commonly use Typed Feature Structures (TFS) to provide an uniform view of multimodal annotations but such a representation cannot be used within an applicative framework. Moreover TFS expressibility is limited to hierarchical and constituency relations and does not suit to any linguistic domain that needs for example to represent temporal relations. To overcome these limits, we propose an ontological approach based on Description logics (DL) for the description of linguistic knowledge and we provide an applicative framework based on OWL DL (Ontology Web Language) and the query language SPARQL."
F12-2023,Enrichissement du {FTB} : un treebank hybride constituants/propri{\\'e}t{\\'e}s (Enriching the {F}rench Treebank with Properties) [in {F}rench],2012,0,0,1,1,929,philippe blache,"Proceedings of the Joint Conference JEP-TALN-RECITAL 2012, volume 2: TALN",0,None
Y11-1017,Predicting Linguistic Difficulty by Means of a Morpho-Syntactic Probabilistic Model,2011,13,5,1,1,929,philippe blache,"Proceedings of the 25th Pacific Asia Conference on Language, Information and Computation",0,"We propose in this paper a new contribution to the evaluation of linguistic diffi- culty. At the opposite of classical approaches relying on syntax, we show that a probabilis- tic morpho-syntactic analysis provides information enough to calculate different parameters, including surprisal. This method constitutes an original and robust model to linguistic com- plexity. It constitutes a solution towards complexity experiments using spoken languages."
W10-1829,Multimodal Annotation of Conversational Data,2010,35,18,1,1,929,philippe blache,Proceedings of the Fourth Linguistic Annotation Workshop,0,"We propose in this paper a broad-coverage approach for multimodal annotation of conversational data. Large annotation projects addressing the question of multimodal annotation bring together many different kinds of information from different domains, with different levels of granularity. We present in this paper the first results of the OTIM project aiming at developing conventions and tools for multimodal annotation."
