2021.eacl-main.92,Zero-shot Neural Passage Retrieval via Domain-targeted Synthetic Question Generation,2021,-1,-1,5,0.602059,9696,ji ma,Proceedings of the 16th Conference of the European Chapter of the Association for Computational Linguistics: Main Volume,0,"A major obstacle to the wide-spread adoption of neural retrieval models is that they require large supervised training sets to surpass traditional term-based techniques, which are constructed from raw corpora. In this paper, we propose an approach to zero-shot learning for passage retrieval that uses synthetic question generation to close this gap. The question generation system is trained on general domain data, but is applied to documents in the targeted domain. This allows us to create arbitrarily large, yet noisy, question-passage relevance pairs that are domain specific. Furthermore, when this is coupled with a simple hybrid term-neural model, first-stage retrieval performance can be improved further. Empirically, we show that this is an effective strategy for building neural passage retrieval models in the absence of large training corpora. Depending on the domain, this technique can even approach the accuracy of supervised models."
2021.acl-long.120,Leveraging Type Descriptions for Zero-shot Named Entity Recognition and Classification,2021,-1,-1,3,0,635,rami aly,Proceedings of the 59th Annual Meeting of the Association for Computational Linguistics and the 11th International Joint Conference on Natural Language Processing (Volume 1: Long Papers),1,"A common issue in real-world applications of named entity recognition and classification (NERC) is the absence of annotated data for the target entity classes during training. Zero-shot learning approaches address this issue by learning models from classes with training data that can predict classes without it. This paper presents the first approach for zero-shot NERC, introducing novel architectures that leverage the fact that textual descriptions for many entity classes occur naturally. We address the zero-shot NERC specific challenge that the not-an-entity class is not well defined as different entity classes are considered in training and testing. For evaluation, we adapt two datasets, OntoNotes and MedMentions, emulating the difficulty of real-world zero-shot learning by testing models on the rarest entity classes. Our proposed approach outperforms baselines adapted from machine reading comprehension and zero-shot text classification. Furthermore, we assess the effect of different class descriptions for this task."
2021.acl-long.474,Focus Attention: Promoting Faithfulness and Diversity in Summarization,2021,-1,-1,5,0,371,rahul aralikatte,Proceedings of the 59th Annual Meeting of the Association for Computational Linguistics and the 11th International Joint Conference on Natural Language Processing (Volume 1: Long Papers),1,"Professional summaries are written with document-level information, such as the theme of the document, in mind. This is in contrast with most seq2seq decoders which simultaneously learn to focus on salient content, while deciding what to generate, at each decoding step. With the motivation to narrow this gap, we introduce Focus Attention Mechanism, a simple yet effective method to encourage decoders to proactively generate tokens that are similar or topical to the input document. Further, we propose a Focus Sampling method to enable generation of diverse summaries, an area currently understudied in summarization. When evaluated on the BBC extreme summarization task, two state-of-the-art models augmented with Focus Attention generate summaries that are closer to the target and more faithful to their input documents, outperforming their vanilla counterparts on ROUGE and multiple faithfulness measures. We also empirically demonstrate that Focus Sampling is more effective in generating diverse and faithful summaries than top-k or nucleus sampling-based decoding methods."
2020.emnlp-main.339,Stepwise Extractive Summarization and Planning with Structured Transformers,2020,-1,-1,6,0.374727,6260,shashi narayan,Proceedings of the 2020 Conference on Empirical Methods in Natural Language Processing (EMNLP),0,"We propose encoder-centric stepwise models for extractive summarization using structured transformers {--} HiBERT and Extended Transformers. We enable stepwise summarization by injecting the previously generated summary into the structured transformer as an auxiliary sub-structure. Our models are not only efficient in modeling the structure of long inputs, but they also do not rely on task-specific redundancy-aware modeling, making them a general purpose extractive content planner for different tasks. When evaluated on CNN/DailyMail extractive summarization, stepwise models achieve state-of-the-art performance in terms of Rouge without any redundancy aware modeling or sentence filtering. This also holds true for Rotowire table-to-text generation, where our models surpass previously reported metrics for content selection, planning and ordering, highlighting the strength of stepwise modeling. Amongst the two structured transformers we test, stepwise Extended Transformers provides the best performance across both datasets and sets a new standard for these challenges."
2020.bionlp-1.15,{B}io{MRC}: A Dataset for Biomedical Machine Reading Comprehension,2020,30,0,4,0.833333,12292,dimitris pappas,Proceedings of the 19th SIGBioMed Workshop on Biomedical Language Processing,0,"We introduceBIOMRC, a large-scale cloze-style biomedical MRC dataset. Care was taken to reduce noise, compared to the previous BIOREAD dataset of Pappas et al. (2018). Experiments show that simple heuristics do not perform well on the new dataset and that two neural MRC models that had been tested on BIOREAD perform much better on BIOMRC, indicating that the new dataset is indeed less noisy or at least that its task is more feasible. Non-expert human performance is also higher on the new dataset compared to BIOREAD, and biomedical experts perform even better. We also introduce a new BERT-based MRC model, the best version of which substantially outperforms all other methods tested, reaching or surpassing the accuracy of biomedical experts in some experiments. We make the new dataset available in three different sizes, also releasing our code, and providing a leaderboard."
2020.acl-main.173,On Faithfulness and Factuality in Abstractive Summarization,2020,54,0,4,1,8653,joshua maynez,Proceedings of the 58th Annual Meeting of the Association for Computational Linguistics,1,"It is well known that the standard likelihood training and approximate decoding objectives in neural text generation models lead to less human-like responses for open-ended tasks such as language modeling and story generation. In this paper we have analyzed limitations of these models for abstractive document summarization and found that these models are highly prone to hallucinate content that is unfaithful to the input document. We conducted a large scale human evaluation of several neural abstractive summarization systems to better understand the types of hallucinations they produce. Our human annotators found substantial amounts of hallucinated content in all model generated summaries. However, our analysis does show that pretrained models are better summarizers not only in terms of raw metrics, i.e., ROUGE, but also in generating faithful and factual summaries as evaluated by humans. Furthermore, we show that textual entailment measures better correlate with faithfulness than standard metrics, potentially leading the way to automatic evaluation metrics as well as training and decoding criteria."
W19-5032,Embedding Biomedical Ontologies by Jointly Encoding Network Structure and Textual Node Descriptors,2019,0,0,4,0,20600,sotiris kotitsas,Proceedings of the 18th BioNLP Workshop and Shared Task,0,"Network Embedding (NE) methods, which map network nodes to low-dimensional feature vectors, have wide applications in network analysis and bioinformatics. Many existing NE methods rely only on network structure, overlooking other information associated with the nodes, e.g., text describing the nodes. Recent attempts to combine the two sources of information only consider local network structure. We extend NODE2VEC, a well-known NE method that considers broader network structure, to also consider textual node descriptors using recurrent neural encoders. Our method is evaluated on link prediction in two networks derived from UMLS. Experimental results demonstrate the effectiveness of the proposed approach compared to previous work."
W18-5304,{AUEB} at {B}io{ASQ} 6: Document and Snippet Retrieval,2018,32,3,3,0,27994,george brokos,Proceedings of the 6th {B}io{ASQ} Workshop A challenge on large-scale biomedical semantic indexing and question answering,0,"We present AUEB{'}s submissions to the BioASQ 6 document and snippet retrieval tasks (parts of Task 6b, Phase A). Our models use novel extensions to deep learning architectures that operate solely over the text of the query and candidate document/snippets. Our systems scored at the top or near the top for all batches of the challenge, highlighting the effectiveness of deep learning for these tasks."
P18-1246,Morphosyntactic Tagging with a Meta-{B}i{LSTM} Model over Context Sensitive Token Encodings,2018,16,3,2,0,16528,bernd bohnet,Proceedings of the 56th Annual Meeting of the Association for Computational Linguistics (Volume 1: Long Papers),1,"The rise of neural networks, and particularly recurrent neural networks, has produced significant advances in part-of-speech tagging accuracy. One characteristic common among these models is the presence of rich initial word encodings. These encodings typically are composed of a recurrent character-based representation with dynamically and pre-trained word embeddings. However, these encodings do not consider a context wider than a single word and it is only through subsequent recurrent layers that word or sub-word information interacts. In this paper, we investigate models that use recurrent neural networks with sentence-level context for initial character and word-based representations. In particular we show that optimal results are obtained by integrating these context sensitive representations through synchronized training with a meta-model that learns to combine their states."
D18-1211,Deep Relevance Ranking Using Enhanced Document-Query Interactions,2018,0,23,1,1,10634,ryan mcdonald,Proceedings of the 2018 Conference on Empirical Methods in Natural Language Processing,0,"We explore several new models for document relevance ranking, building upon the Deep Relevance Matching Model (DRMM) of Guo et al. (2016). Unlike DRMM, which uses context-insensitive encodings of terms and query-document term interactions, we inject rich context-sensitive encodings throughout our models, inspired by PACRR{'}s (Hui et al., 2017) convolutional n-gram matching features, but extended in several ways including multiple views of query and document inputs. We test our models on datasets from the BIOASQ question answering challenge (Tsatsaronis et al., 2015) and TREC ROBUST 2004 (Voorhees, 2005), showing they outperform BM25-based baselines, DRMM, and PACRR."
D17-1309,Natural Language Processing with Small Feed-Forward Networks,2017,21,7,7,0,10226,jan botha,Proceedings of the 2017 Conference on Empirical Methods in Natural Language Processing,0,"We show that small and shallow feed-forward neural networks can achieve near state-of-the-art results on a range of unstructured and structured language processing tasks while being considerably cheaper in memory and computational requirements than deep recurrent models. Motivated by resource-constrained environments like mobile phones, we showcase simple techniques for obtaining such small neural network models, and investigate different tradeoffs when deciding how to allocate a small memory budget."
Q16-1001,Morpho-syntactic Lexicon Generation Using Graph-based Semi-supervised Learning,2016,86,8,2,0,8204,manaal faruqui,Transactions of the Association for Computational Linguistics,0,"Morpho-syntactic lexicons provide information about the morphological and syntactic roles of words in a language. Such lexicons are not available for all languages and even when available, their coverage can be limited. We present a graph-based semi-supervised learning method that uses the morphological, syntactic and semantic relations between words to automatically construct wide coverage lexicons from small seed sets. Our method is language-independent, and we show that we can expand a 1000 word seed lexicon to more than 100 times its size with high quality for 11 languages. In addition, the automatically created lexicons provide features that improve performance in two downstream tasks: morphological tagging and dependency parsing."
P16-1015,Generalized Transition-based Dependency Parsing via Control Parameters,2016,26,3,2,0,16528,bernd bohnet,Proceedings of the 54th Annual Meeting of the Association for Computational Linguistics (Volume 1: Long Papers),1,None
L16-1262,{U}niversal {D}ependencies v1: A Multilingual Treebank Collection,2016,0,257,7,0,10682,joakim nivre,Proceedings of the Tenth International Conference on Language Resources and Evaluation ({LREC}'16),0,"Cross-linguistically consistent annotation is necessary for sound comparative evaluation and cross-lingual learning experiments. It is also useful for multilingual system development and comparative linguistic studies. Universal Dependencies is an open community effort to create cross-linguistically consistent treebank annotation for many languages within a dependency-based lexicalist framework. In this paper, we describe v1 of the universal guidelines, the underlying design principles, and the currently available treebanks for 33 languages."
N15-1068,A Linear-Time Transition System for Crossing Interval Trees,2015,26,9,2,0.775276,5826,emily pitler,Proceedings of the 2015 Conference of the North {A}merican Chapter of the Association for Computational Linguistics: Human Language Technologies,0,"We define a restricted class of non-projective trees that 1) covers many natural language sentences; and 2) can be parsed exactly with a generalization of the popular arc-eager system for projective trees (Nivre, 2003). Crucially, this generalization only adds constant overhead in run-time and space keeping the parserxe2x80x99s total run-time linear in the worst case. In empirical experiments, our proposed transition-based parser is more accurate on average than both the arc-eager system or the swap-based system, an unconstrained nonprojective transition system with a worst-case quadratic runtime (Nivre, 2009)."
P14-2107,Enforcing Structural Diversity in Cube-pruned Dependency Parsing,2014,24,35,2,0,7671,hao zhang,Proceedings of the 52nd Annual Meeting of the Association for Computational Linguistics (Volume 2: Short Papers),0,"In this paper we extend the cube-pruned dependency parsing framework of Zhang et al. (2012; 2013) by forcing inference to maintain both label and structural ambiguity. The resulting parser achieves state-ofthe-art accuracies, in particular on datasets with a large set of dependency labels."
J14-2001,{S}quibs: Constrained Arc-Eager Dependency Parsing,2014,18,10,3,0,10682,joakim nivre,Computational Linguistics,0,"Arc-eager dependency parsers process sentences in a single left-to-right pass over the input and have linear time complexity with greedy decoding or beam search. We show how such parsers can be constrained to respect two different types of conditions on the output dependency graph: span constraints, which require certain spans to correspond to subtrees of the graph, and arc constraints, which require certain arcs to be present in the graph. The constraints are incorporated into the arc-eager transition system as a set of preconditions for each transition and preserve the linear time complexity of the parser."
C14-1168,Adapting taggers to {T}witter with not-so-distant supervision,2014,32,17,3,0,106,barbara plank,"Proceedings of {COLING} 2014, the 25th International Conference on Computational Linguistics: Technical Papers",0,"We experiment with using different sources of distant supervision to guide unsupervised and semi-supervised adaptation of part-of-speech (POS) and named entity taggers (NER) to Twitter. We show that a particularly good source of not-so-distant supervision is linked websites. Specifically, with this source of supervision we are able to improve over the state-of-the-art for Twitter POS tagging (89.76% accuracy, 8% error reduction) and NER (F1=79.4%, 10% error reduction)."
Q13-1001,Token and Type Constraints for Cross-Lingual Part-of-Speech Tagging,2013,28,114,4,1,31725,oscar tackstrom,Transactions of the Association for Computational Linguistics,0,"We consider the construction of part-of-speech taggers for resource-poor languages. Recently, manually constructed tag dictionaries from Wiktionary and dictionaries projected via bitext have been used as type constraints to overcome the scarcity of annotated data in this setting. In this paper, we show that additional token constraints can be projected from a resource-rich source language to a resource-poor target language via word-aligned bitext. We present several models to this end; in particular a partially observed conditional random field model, where coupled token and type constraints provide a partial signal for training. Averaged across eight previously studied Indo-European languages, our model achieves a 25{\%} relative error reduction over the prior state of the art. We further present successful results on seven additional languages from different families, empirically demonstrating the applicability of coupled token and type constraints across a diverse set of languages."
P13-2017,{U}niversal {D}ependency Annotation for Multilingual Parsing,2013,31,151,1,1,10634,ryan mcdonald,Proceedings of the 51st Annual Meeting of the Association for Computational Linguistics (Volume 2: Short Papers),0,"We present a new collection of treebanks with homogeneous syntactic dependency annotation for six languages: German, English, Swedish, Spanish, French and Korean. To show the usefulness of such a resource, we present a case study of crosslingual transfer parsing with more reliable evaluation than has been possible before. This xe2x80x98universalxe2x80x99 treebank is made freely available in order to facilitate research on multilingual dependency parsing. 1"
N13-1126,Target Language Adaptation of Discriminative Transfer Parsers,2013,34,74,2,1,31725,oscar tackstrom,Proceedings of the 2013 Conference of the North {A}merican Chapter of the Association for Computational Linguistics: Human Language Technologies,0,"We study multi-source transfer parsing for resource-poor target languages; specifically methods for target language adaptation of delexicalized discriminative graph-based dependency parsers. We first show how recent insights on selective parameter sharing, based on typological and language-family features, can be applied to a discriminative parser by carefully decomposing its model features. We then show how the parser can be relexicalized and adapted using unlabeled target language data and a learning method that can incorporate diverse knowledge sources through ambiguous labelings. In the latter scenario, we exploit two sources of knowledge: arc marginals derived from the base parser in a self-training algorithm, and arc predictions from multiple transfer parsers in an ensemble-training algorithm. Our final model outperforms the state of the art in multi-source transfer parsing on 15 out of 16 evaluated languages."
D13-1093,Online Learning for Inexact Hypergraph Search,2013,22,21,4,0,7671,hao zhang,Proceedings of the 2013 Conference on Empirical Methods in Natural Language Processing,0,"Online learning algorithms like the perceptron are widely used for structured prediction tasks. For sequential search problems, like left-to-right tagging and parsing, beam search has been successfully combined with perceptron variants that accommodate search errors (Collins and Roark, 2004; Huang et al., 2012). However, perceptron training with inexact search is less studied for bottom-up parsing and, more generally, inference over hypergraphs. In this paper, we generalize the violation-fixing perceptron of Huang et al. (2012) to hypergraphs and apply it to the cube-pruning parser of Zhang and McDonald (2012). This results in the highest reported scores on WSJ evaluation set (UAS 93.50% and LAS 92.41% respectively) without the aid of additional resources."
P12-2047,Using Search-Logs to Improve Query Tagging,2012,11,25,3,0,30689,kuzman ganchev,Proceedings of the 50th Annual Meeting of the Association for Computational Linguistics (Volume 2: Short Papers),0,"Syntactic analysis of search queries is important for a variety of information-retrieval tasks; however, the lack of annotated data makes training query analysis models difficult. We propose a simple, efficient procedure in which part-of-speech tags are transferred from retrieval-result snippets to queries at training time. Unlike previous work, our final model does not require any additional resources at run-time. Compared to a state-of-the-art approach, we achieve more than 20% relative error reduction. Additionally, we annotate a corpus of search queries with part-of-speech tags, providing a resource for future work on syntactic query analysis."
N12-1052,Cross-lingual Word Clusters for Direct Transfer of Linguistic Structure,2012,54,161,2,1,31725,oscar tackstrom,Proceedings of the 2012 Conference of the North {A}merican Chapter of the Association for Computational Linguistics: Human Language Technologies,0,"It has been established that incorporating word cluster features derived from large unlabeled corpora can significantly improve prediction of linguistic structure. While previous work has focused primarily on English, we extend these results to other languages along two dimensions. First, we show that these results hold true for a number of languages across families. Second, and more interestingly, we provide an algorithm for inducing cross-lingual clusters and we show that features derived from these clusters significantly improve the accuracy of cross-lingual structure prediction. Specifically, we show that by augmenting direct-transfer systems with cross-lingual cluster features, the relative error of delexicalized dependency parsers, trained on English treebanks and transferred to foreign languages, can be reduced by up to 13%. When applying the same method to direct transfer of named-entity recognizers, we observe relative improvements of up to 26%."
petrov-etal-2012-universal,A Universal Part-of-Speech Tagset,2012,46,418,3,0.5903,25419,slav petrov,Proceedings of the Eighth International Conference on Language Resources and Evaluation ({LREC}'12),0,"To facilitate future research in unsupervised induction of syntactic structure and to standardize best-practices, we propose a tagset that consists of twelve universal part-of-speech categories. In addition to the tagset, we develop a mapping from 25 different treebank tagsets to this universal set. As a result, when combined with the original treebank data, this universal tagset and mapping produce a dataset consisting of common parts-of-speech for 22 different languages. We highlight the use of this resource via three experiments, that (1) compare tagging accuracies across languages, (2) present an unsupervised grammar induction approach that does not use gold standard part-of-speech tags, and (3) use the universal tags to transfer dependency parsers between languages, achieving state-of-the-art results."
D12-1030,Generalized Higher-Order Dependency Parsing with Cube Pruning,2012,40,44,2,0,7671,hao zhang,Proceedings of the 2012 Joint Conference on Empirical Methods in Natural Language Processing and Computational Natural Language Learning,0,"State-of-the-art graph-based parsers use features over higher-order dependencies that rely on decoding algorithms that are slow and difficult to generalize. On the other hand, transition-based dependency parsers can easily utilize such features without increasing the linear complexity of the shift-reduce system beyond a constant. In this paper, we attempt to address this imbalance for graph-based parsing by generalizing the Eisner (1996) algorithm to handle arbitrary features over higher-order dependencies. The generalization is at the cost of asymptotic efficiency. To account for this, cube pruning for decoding is utilized (Chiang, 2007). For the first time, label tuple and structural features such as valencies can be scored efficiently with third-order features in a graph-based parser. Our parser achieves the state-of-art unlabeled accuracy of 93.06% and labeled accuracy of 91.86% on the standard test set for English, at a faster speed than a reimplementation of the third-order model of Koo et al. (2010)."
