2021.computel-1.3,{LARA} in the Service of Revivalistics and Documentary Linguistics: Community Engagement and Endangered Languages,2021,-1,-1,3,0,11419,ghilad zuckermann,Proceedings of the 4th Workshop on the Use of Computational Methods in the Study of Endangered Languages Volume 1 (Papers),0,None
2020.lrec-1.40,Constructing Multimodal Language Learner Texts Using {LARA}: Experiences with Nine Languages,2020,-1,-1,12,0,16669,elham akhlaghi,Proceedings of the 12th Language Resources and Evaluation Conference,0,"LARA (Learning and Reading Assistant) is an open source platform whose purpose is to support easy conversion of plain texts into multimodal online versions suitable for use by language learners. This involves semi-automatically tagging the text, adding other annotations and recording audio. The platform is suitable for creating texts in multiple languages via crowdsourcing techniques that can be used for teaching a language via reading and listening. We present results of initial experiments by various collaborators where we measure the time required to produce substantial LARA resources, up to the length of short novels, in Dutch, English, Farsi, French, German, Icelandic, Irish, Swedish and Turkish. The first results are encouraging. Although there are some startup problems, the conversion task seems manageable for the languages tested so far. The resulting enriched texts are posted online and are freely available in both source and compiled form."
P16-2027,An Open Web Platform for Rule-Based Speech-to-Sign Translation,2016,7,4,1,1,11421,manny rayner,Proceedings of the 54th Annual Meeting of the Association for Computational Linguistics (Volume 2: Short Papers),0,"We present an open web platform for developing, compiling, and running rulebased speech to sign language translation applications. Speech recognition is performed using the Nuance Recognizer 10.2 toolkit, and signed output, including both manual and non-manual components, is rendered using the JASigning avatar system. The platform is designed to make the component technologies readily accessible to sign language experts who are not necessarily computer scientists. Translation grammars are written in a version of Synchronous Context-Free Grammar adapted to the peculiarities of sign language. All processing is carried out on a remote server, with content uploaded and accessed through a web interface. Initial experiences show that simple translation grammars can be implemented on a time-scale of a few hours to a few days and produce signed output readily comprehensible to Deaf informants. Overall, the platform drastically lowers the barrier to entry for researchers interested in building applications that generate high-quality signed language."
L16-1036,A Shared Task for Spoken {CALL}?,2016,0,9,3,1,34762,claudia baur,Proceedings of the Tenth International Conference on Language Resources and Evaluation ({LREC}'16),0,"We argue that the field of spoken CALL needs a shared task in order to facilitate comparisons between different groups and methodologies, and describe a concrete example of such a task, based on data collected from a speech-enabled online tool which has been used to help young Swiss German teens practise skills in English conversation. Items are prompt-response pairs, where the prompt is a piece of German text and the response is a recorded English audio file. The task is to label pairs as {``}accept{''} or {``}reject{''}, accepting responses which are grammatically and linguistically correct to match a set of hidden gold standard answers as closely as possible. Initial resources are provided so that a scratch system can be constructed with a minimal investment of effort, and in particular without necessarily using a speech recogniser. Training data for the task will be released in June 2016, and test data in January 2017."
baur-etal-2014-using,Using a Serious Game to Collect a Child Learner Speech Corpus,2014,14,6,2,1,34762,claudia baur,Proceedings of the Ninth International Conference on Language Resources and Evaluation ({LREC}'14),0,"We present an English-L2 child learner speech corpus, produced by 14 year old Swiss German-L1 students in their third year of learning English, which is currently in the process of being collected. The collection method uses a web-enabled multimodal language game implemented using the CALL-SLT platform, in which subjects hold prompted conversations with an animated agent. Prompts consist of a short animated Engligh-language video clip together with a German-language piece of text indicating the semantic content of the requested response. Grammar-based speech understanding is used to decide whether responses are accepted or rejected, and dialogue flow is controlled using a simple XML-based scripting language; the scripts are written to allow multiple dialogue paths, the choice being made randomly. The system is gamified using a score-and-badge framework with four levels of badges. We describe the application, the data collection and annotation procedures, and the initial tranche of data. The full corpus, when complete, should contain at least 5,000 annotated utterances."
2014.tc-1.24,A tool for building multilingual voice questionnaires,2014,4,2,3,0,40331,alejandro armando,Proceedings of Translating and the Computer 36,0,"We describe a prototype platform for creating multilingual voice questionnaires. Content is defined using a simple form-based language with units for questions, question-groups and answers; questionnaire definitions are compiled into efficient speech recognition packages and tables, and the resulting applications can be deployed over the web on both desktop and mobile platforms. We sketch our initial questionnaire application, which is designed for gathering information related to availability of anti-malaria measures in sub-Saharan Africa. It contains 114 question-groups and 218 questions."
2014.lilt-10.2,{CALL}-{SLT}: A Spoken {CALL} System Based on Grammar and Speech Recognition,2014,-1,-1,1,1,11421,manny rayner,"Linguistic Issues in Language Technology, Volume 10, 2014",0,"We describe CALL-SLT, a speech-enabled Computer-Assisted Language Learning application where the central idea is to prompt the student with an abstract representation of what they are supposed to say, and then use a combination of grammar-based speech recognition and rule-based translation to rate their response. The system has been developed to the level of a mature prototype, freely deployed on the web, with versions for several languages. We present an overview of the core system architecture and the various types of content we have developed. Finally, we describe several evaluations, the last of which is a study carried out over about a week using 130 subjects recruited through the Amazon Mechanical Turk, in which CALL-SLT was contrasted against a control version where the speech recognition component was disabled. The improvement in student learning performance between the two groups was significant at p {\textless} 0.02."
W13-2816,Two Approaches to Correcting Homophone Confusions in a Hybrid Machine Translation System,2013,14,1,5,0,2866,pierrette bouillon,Proceedings of the Second Workshop on Hybrid Approaches to Translation,0,"In the context of a hybrid French-to-English SMT system for translating online forum posts, we present two methods for addressing the common problem of homophone confusions in colloquial written language. The first is based on hand-coded rules; the second on weighted graphs derived from a large-scale pronunciation resource, with weights trained from a small bicorpus of domain language. With automatic evaluation, the weighted graph method yields an improvement of about 0.63 BLEU points, while the rulebased method scores about the same as the baseline. On contrastive manual evaluation, both methods give highly significant improvements (p < 0.0001) and score about equally when compared against each other."
rayner-etal-2012-evaluating,Evaluating Appropriateness Of System Responses In A Spoken {CALL} Game,2012,8,5,1,1,11421,manny rayner,Proceedings of the Eighth International Conference on Language Resources and Evaluation ({LREC}'12),0,"We describe an experiment carried out using a French version of CALL-SLT, a web-enabled CALL game in which students at each turn are prompted to give a semi-free spoken response which the system then either accepts or rejects. The central question we investigate is whether the response is appropriate; we do this by extracting pairs of utterances where both members of the pair are responses by the same student to the same prompt, and where one response is accepted and one rejected. When the two spoken responses are presented in random order, native speakers show a reasonable degree of agreement in judging that the accepted utterance is better than the rejected one. We discuss the significance of the results and also present a small study supporting the claim that native speakers are nearly always recognised by the system, while non-native speakers are rejected a significant proportion of the time."
fuchs-etal-2012-scalable,A Scalable Architecture For Web Deployment of Spoken Dialogue Systems,2012,8,20,3,0,43004,matthew fuchs,Proceedings of the Eighth International Conference on Language Resources and Evaluation ({LREC}'12),0,"We describe a scalable architecture, particularly well-suited to cloud-based computing, which can be used for Web-deployment of spoken dialogue systems. In common with similar platforms, like WAMI and the Nuance Mobile Developer Platform, we use a client/server approach in which speech recognition is carried out on the server side; our architecture, however, differs from these systems in offering considerably more elaborate server-side functionality, based on large-scale grammar-based language processing and generic dialogue management. We describe two substantial applications, built using our framework, which we argue would have been hard to construct in WAMI or NMDP. Finally, we present a series of evaluations carried out using CALL-SLT, a speech translation game, where we contrast performance in Web and desktop versions. Task Error Rate in the Web version is only slightly inferior that in the desktop one, and the average additional latency is under half a second. The software is generally available for research purposes."
tsourakis-rayner-2012-corpus,A Corpus for a Gesture-Controlled Mobile Spoken Dialogue System,2012,18,0,2,1,2869,nikos tsourakis,Proceedings of the Eighth International Conference on Language Resources and Evaluation ({LREC}'12),0,"Speech and hand gestures offer the most natural modalities for everyday human-to-human interaction. The availability of diverse spoken dialogue applications and the proliferation of accelerometers on consumer electronics allow the introduction of new interaction paradigms based on speech and gestures. Little attention has been paid however to the manipulation of spoken dialogue systems through gestures. Situation-induced disabilities or real disabilities are determinant factors that motivate this type of interaction. In this paper we propose six concise and intuitively meaningful gestures that can be used to trigger the commands in any SDS. Using different machine learning techniques we achieve a classification error for the gesture patterns of less than 5{\%}, and we also compare our own set of gestures to ones proposed by users. Finally, we examine the social acceptability of the specific interaction scheme and encounter high levels of acceptance for public use."
2012.amta-papers.25,Using Source-Language Transformations to Address Register Mismatches in {SMT},2012,6,5,1,1,11421,manny rayner,Proceedings of the 10th Conference of the Association for Machine Translation in the Americas: Research Papers,0,"Mismatches between training and test data are a ubiquitous problem for real SMT applications. In this paper, we examine a type of mismatch that commonly arises when translating from French and similar languages: available training data is mostly formal register, but test data may well be informal register. We consider methods for defining surface transformations that map common informal language constructions into their formal language counterparts, or vice versa; we then describe two ways to use these mappings, either to create artificial training data or to pre-process source text at run-time. An initial evaluation performed using crowd-sourced comparisons of alternate translations produced by a French-to-English SMT system suggests that both methods can improve performance, with run-time pre-processing being the more effective of the two."
2011.freeopmt-1.5,Bootstrapping a statistical speech translator from a rule-based one,2011,-1,-1,1,1,11421,manny rayner,Proceedings of the Second International Workshop on Free/Open-Source Rule-Based Machine Translation,0,None
tsourakis-etal-2010-examining,Examining the Effects of Rephrasing User Input on Two Mobile Spoken Language Systems,2010,11,0,3,1,2869,nikos tsourakis,Proceedings of the Seventh International Conference on Language Resources and Evaluation ({LREC}'10),0,"During the construction of a spoken dialogue system much effort is spent on improving the quality of speech recognition as possible. However, even if an application perfectly recognizes the input, its understanding may be far from what the user originally meant. The user should be informed about what the system actually understood so that an error will not have a negative impact in the later stages of the dialogue. One important aspect that this work tries to address is the effect of presenting the systems understanding during interaction with users. We argue that for specific kinds of applications its important to confirm the understanding of the system before obtaining the output. In this way the user can avoid misconceptions and problems occurring in the dialogue flow and he can enhance his confidence in the system. Nevertheless this has an impact on the interaction, as the mental workload increases, and the users behavior may adapt to the systems coverage. We focus on two applications that implement the notion of rephrasing users input in a different way. Our study took place among 14 subjects that used both systems on a Nokia N810 Internet Tablet."
rayner-etal-2010-multilingual,A Multilingual {CALL} Game Based on Speech Translation,2010,13,31,1,1,11421,manny rayner,Proceedings of the Seventh International Conference on Language Resources and Evaluation ({LREC}'10),0,"We describe a multilingual Open Source CALL game, CALL-SLT, which reuses speech translation technology developed using the Regulus platform to create an automatic conversation partner that allows intermediate-level language students to improve their fluency. We contrast CALL-SLT with Wang's and Seneff's ``translation game'' system, in particular focussing on three issues. First, we argue that the grammar-based recognition architecture offered by Regulus is more suitable for this type of application; second, that it is preferable to prompt the student in a language-neutral form, rather than in the L1; and third, that we can profitably record successful interactions by native speakers and store them to be reused as online help for students. The current system, which will be demoed at the conference, supports four L2s (English, French, Japanese and Swedish) and two L1s (English and French). We conclude by describing an evaluation exercise, where a version of CALL-SLT configured for English L2 and French L1 was used by several hundred high school students. About half of the subjects reported positive impressions of the system."
2010.eamt-1.39,A Bootstrapped Interlingua-Based {SMT} Architecture,2010,-1,-1,1,1,11421,manny rayner,Proceedings of the 14th Annual conference of the European Association for Machine Translation,0,None
W09-2607,Using Artificially Generated Data to Evaluate Statistical Machine Translation,2009,16,2,1,1,11421,manny rayner,Proceedings of the 2009 Workshop on Grammar Engineering Across Frameworks ({GEAF} 2009),0,"Although Statistical Machine Translation (SMT) is now the dominant paradigm within Machine Translation, we argue that it is far from clear that it can outperform Rule-Based Machine Translation (RBMT) on small- to medium-vocabulary applications where high precision is more important than recall. A particularly important practical example is medical speech translation. We report the results of experiments where we configured the various grammars and rule-sets in an Open Source medium-vocabulary multi-lingual medical speech translation system to generate large aligned bilingual corpora for English xe2x86x92 French and English xe2x86x92 Japanese, which were then used to train SMT models based on the common combination of Giza, Moses and SRILM. The resulting SMTs were unable fully to reproduce the performance of the RBMT, with performance topping out, even for English xe2x86x92 French, with less than 70% of the SMT translations of previously unseen sentences agreeing with RBMT translations. When the outputs of the two systems differed, human judges reported the SMT result as frequently being worse than the RBMT result, and hardly ever better; moreover, the added robustness of the SMT only yielded a small improvement in recall, with a large penalty in precision."
W09-1503,Using Paraphrases of Deep Semantic Representions to Support Regression Testing in Spoken Dialogue Systems,2009,15,2,2,0,46954,beth hockey,"Proceedings of the Workshop on Software Engineering, Testing, and Quality Assurance for Natural Language Processing ({SETQA}-{NLP} 2009)",0,"Rule-based spoken dialogue systems require a good regression testing framework if they are to be maintainable. We argue that there is a tension between two extreme positions when constructing the database of test examples. On the one hand, if the examples consist of input/output tuples representing many levels of internal processing, they are fine-grained enough to catch most processing errors, but unstable under most system modifications. If the examples are pairs of user input and final system output, they are much more stable, but too coarse-grained to catch many errors. In either case, there are fairly severe difficulties in judging examples correctly. We claim that a good compromise can be reached by implementing a paraphrasing mechanism which maps internal semantic representations into surface forms, and carrying out regression testing using paraphrases of semantic forms rather than the semantic forms themselves. We describe an implementation of the idea using the Open Source Regulus toolkit, where paraphrases are produced using Regulus grammars compiled in generation mode. Paraphrases can also be used at run-time to produce confirmations. By compiling the paraphrase grammar a second time, as a recogniser, it is possible in a simple and natural way to guarantee that confirmations are always within system coverage."
2009.mtsummit-posters.16,Using Artificial Data to Compare the Difficulty of Using Statistical Machine Translation in Different Language-Pairs,2009,0,1,1,1,11421,manny rayner,Proceedings of Machine Translation Summit XII: Posters,0,None
W08-1702,Making Speech Look Like Text in the Regulus Development Environment,2008,16,0,2,0,47729,elisabeth kron,Coling 2008: Proceedings of the workshop on Grammar Engineering Across Frameworks,0,"We present an overview of the development environment for Regulus, an Open Source platform for construction of grammar-based speech-enabled systems, focussing on recent work whose goal has been to introduce uniformity between text and speech views of Regulus-based applications. We argue the advantages of being able to switch quickly between text and speech modalities in interactive and offline testing, and describe how the new functionalities enable rapid prototyping of spoken dialogue systems and speech translators."
W08-1506,The 2008 {M}ed{SLT} System,2008,7,0,1,1,11421,manny rayner,Coling 2008: Proceedings of the workshop on Speech Processing for Safety Critical Translation and Pervasive Applications,0,"MedSLT is a grammar-based medical speech translation system intended for use in doctor-patient diagnosis dialogues, which provides coverage of several different subdomains and multiple language pairs. Vocabulary ranges from about 350 to 1000 surface words, depending on the language and subdomain. We will demo three different versions of the system: an anyto-any multilingual version involving the languages Japanese, English, French and Arabic, a bidirectional English $ Spanish version, and a mobile version running on a hand-held PDA. We will also demo the Regulus development environment, focussing on features which support rapid prototyping of grammar-based speech translation systems."
W08-1511,A Small-Vocabulary Shared Task for Medical Speech Translation,2008,0,5,1,1,11421,manny rayner,Coling 2008: Proceedings of the workshop on Speech Processing for Safety Critical Translation and Pervasive Applications,0,We outline a possible small-vocabulary shared task for the emerging medical speech translation community. Data would consist of about 2000 recorded and transcribed utterances collected during an evaluation of an English
bouillon-etal-2008-developing,Developing Non-{E}uropean Translation Pairs in a Medium-Vocabulary Medical Speech Translation System,2008,10,9,9,0,2866,pierrette bouillon,Proceedings of the Sixth International Conference on Language Resources and Evaluation ({LREC}'08),0,"We describe recent work on MedSLT, a medium-vocabulary interlingua-based medical speech translation system, focussing on issues that arise when handling languages of which the grammar engineer has little or no knowledge. We show how we can systematically create and maintain multiple forms of grammars, lexica and interlingual representations, with some versions being used by language informants, and some by grammar engineers. In particular, we describe the advantages of structuring the interlingua definition as a simple semantic grammar, which includes a human-readable surface form. We show how this allows us to rationalise the process of evaluating translations between languages lacking common speakers, and also makes it possible to create a simple generic tool for debugging to-interlingua translation rules. Examples presented focus on the concrete case of translation between Japanese and Arabic in both directions."
tsourakis-etal-2008-building,Building Mobile Spoken Dialogue Applications Using Regulus,2008,10,13,4,1,2869,nikos tsourakis,Proceedings of the Sixth International Conference on Language Resources and Evaluation ({LREC}'08),0,"Regulus is an Open Source platform that supports construction of rule-based medium-vocabulary spoken dialogue applications. It has already been used to build several substantial speech-enabled applications, including NASAs Clarissa procedure navigator and Geneva Universitys MedSLT medical speech translator. System like these would be far more useful if they were available on a hand-held device, rather than, as with the present version, on a laptop. In this paper we describe the Open Source framework we have developed, which makes it possible to run Regulus applications on generally available mobile devices, using a distributed client-server architecture that offers transparent and reliable integration with different types of ASR systems. We describe the architecture, an implemented calendar application prototype hosted on a mobile device, and an evaluation. The evaluation shows that performance on the mobile device is as good as performance on a normal desktop PC."
C08-1090,Almost Flat Functional Semantics for Speech Translation,2008,10,6,1,1,11421,manny rayner,Proceedings of the 22nd International Conference on Computational Linguistics (Coling 2008),0,"We introduce a novel semantic representation formalism, Almost Flat Functional semantics (AFF), which is designed as an intelligent compromise between linguistically motivated predicate/argument semantics and ad hoc engineering solutions based on flat feature/value lists; the central idea is to tag each semantic element with the functional marking which most closely surrounds it. We argue that AFF is well-suited for medium-vocabulary speech translation applications, and describe simple and general algorithms for parsing, generating and performing transfer using AFF representations. The formalism has been fully implemented within a medium-vocabulary interlingua-based Open Source speech translation system which translates between English, French, Japanese and Arabic."
2008.eamt-1.24,Comparing two different bidirectional versions of the limited-domain medical spoken language translator {M}ed{SLT},2008,12,3,4,1,37884,marianne starlander,Proceedings of the 12th Annual conference of the European Association for Machine Translation,0,"This paper reports preliminary results of an evalu ation during which two different bidirectional versions of the limited-dom ain medical spoken language translator MedSLT were compared in a hospital setting. The more restricted version (V.1) only allows Yes-No answers and short elliptical sentence s, while the less restricted version (V.2) allows Yes-No answers, short elliptical sentences a nd full sentences. Although WER is marginally better for V.1, task performance is marg inally worse. There appear to be two main reasons for this disparity; short sentences ar e often badly recognised and patients tend to find it difficult to limit themselves to ellipsi s, even if they receive clear instructions about not using full sentences."
