W13-1505,A System for the Simplification of Numerical Expressions at Different Levels of Understandability,2013,17,4,4,1,31769,susana bautista,Proceedings of the Workshop on Natural Language Processing for Improving Textual Accessibility,0,"The purpose of this paper is to motivate and describe a system that simplifies numerical expression in texts, along with an evaluation study in which experts in numeracy and literacy assessed the outputs of this system. We have worked with a collection of newspaper articles with a significant number of numerical expressions. The results are discussed in comparison to conclusions obtained from a prior empirical survey."
W12-1518,Planning Accessible Explanations for Entailments in {OWL} Ontologies,2012,14,5,2,0,22810,tu nguyen,{INLG} 2012 Proceedings of the Seventh International Natural Language Generation Conference,0,"A useful enhancement of an NLG system for verbalising ontologies would be a module capable of explaining undesired entailments of the axioms encoded by the developer. This task raises interesting issues of content planning. One approach, useful as a baseline, is simply to list the subset of axioms relevant to inferring the entailment; however, in many cases it will still not be obvious, even to OWL experts, why the entailment follows. We suggest an approach in which further statements are added in order to construct a proof tree, with every step based on a relatively simple deduction rule of known difficulty; we also describe an empirical study through which the difficulty of these simple deduction patterns has been measured."
J12-1004,Generating Numerical Approximations,2012,18,20,1,1,41078,richard power,Computational Linguistics,0,"We describe a computational model for planning phrases like more than a quarter and 25.9 per cent which describe proportions at different levels of precision. The model lays out the key choices in planning a numerical description, using formal definitions of mathematical form (e.g., the distinction between fractions and percentages) and roundness adapted from earlier studies. The task is modeled as a constraint satisfaction problem, with solutions subsequently ranked by preferences (e.g., for roundness). Detailed constraints are based on a corpus of numerical expressions collected in the NumGen project,1 and evaluated through empirical studies in which subjects were asked to produce (or complete) numerical expressions in specified contexts."
W11-2811,Deriving rhetorical relationships from semantic content,2011,16,5,1,1,41078,richard power,Proceedings of the 13th {E}uropean Workshop on Natural Language Generation,0,"This paper investigates to what extent rhetorical relations can be assigned purely on the basis of propositional content, without any reference to speaker goals or other pragmatic information. This task confronts any NLG system designed to generate coherent text from a set of formally represented statements; we consider it here in the context of an ontology verbaliser, for which the input is a set of axioms encoded in the web ontology language OWL. A simple set-theoretical model of the possible semantic relationships between two statements is proposed; this model allows 46 logically consistent relationships, of which we hypothesise that 11 are rhetorically coherent. This hypothesis is tested through an empirical survey which also provides evidence on how the coherent patterns are expressed linguistically."
W11-2821,Levels of organisation in ontology verbalisation,2011,17,11,3,1,41079,sandra williams,Proceedings of the 13th {E}uropean Workshop on Natural Language Generation,0,"The SWAT Tools ontology verbaliser generates a hierarchically organised hypertext designed for easy comprehension and navigation. The document structure, inspired by encyclopedias and glossaries, is organised at a number of levels. At the top level, a heading is generated for every concept in the ontology; at the next level, each entry is subdivided into logically-based headings like 'Definition' and 'Examples'; at the next, sentences are aggregated when they have parts in common; at the lowest level, phrases are hyperlinked to concept headings. One consequence of this organisation is that some statements are repeated because they are relevant to more than one entry; this means that the text is longer than one in which statements are simply listed. This trade-off between organisation and brevity is investigated in a user study."
W11-2314,Experimental Identification of the Use of Hedges in the Simplification of Numerical Expressions,2011,8,2,4,1,31769,susana bautista,Proceedings of the Second Workshop on Speech and Language Processing for Assistive Technologies,0,"Numerical information is very common in all kinds of documents from newspapers and magazines to household bills and wage slips. However, many people find it difficult to understand, particularly people with poor education and disabilities. Sometimes numerical information is presented with hedges that modify the meaning. A numerical hedge is a word or phrase employed to indicate explicitly that some loss of precision has taken place (e.g., around) and it may also indicate the direction of approximation (e.g., more than). This paper presents a study of the use of numerical hedges that is part of research investigating the process of rewriting difficult numerical expressions in simpler ways. We carried out a survey in which experts in numeracy were asked to simplify a range of proportion expressions and analysed the results to obtain guidelines for automating the simplification task."
W10-4222,Grouping Axioms for More Coherent Ontology Descriptions,2010,10,14,2,1,41079,sandra williams,Proceedings of the 6th International Natural Language Generation Conference,0,"Ontologies and datasets for the Semantic Web are encoded in OWL formalisms that are not easily comprehended by people. To make ontologies accessible to human domain experts, several research groups have developed ontology verbalisers using Natural Language Generation. In practice ontologies are usually composed of simple axioms, so that realising them separately is relatively easy; there remains however the problem of producing texts that are coherent and efficient. We describe in this paper some methods for producing sentences that aggregate over sets of axioms that share the same logical structure. Because these methods are based on logical structure rather than domain-specific concepts or language-specific syntax, they are generic both as regards domain and language."
P10-2024,Complexity Assumptions in Ontology Verbalisation,2010,11,16,1,1,41078,richard power,Proceedings of the {ACL} 2010 Conference Short Papers,0,"We describe the strategy currently pursued for verbalising OWL ontologies by sentences in Controlled Natural Language (i.e., combining generic rules for realising logical patterns with ontology-specific lexicons for realising atomic terms for individuals, classes, and properties) and argue that its success depends on assumptions about the complexity of terms and axioms in the ontology. We then show, through analysis of a corpus of ontologies, that although these assumptions could in principle be violated, they are overwhelmingly respected in practice by ontology developers."
williams-power-2010-fact,A Fact-aligned Corpus of Numerical Expressions,2010,10,0,2,1,41079,sandra williams,Proceedings of the Seventh International Conference on Language Resources and Evaluation ({LREC}'10),0,"We describe a corpus of numerical expressions, developed as part of the NUMGEN project. The corpus contains newspaper articles and scientific papers in which exactly the same numerical facts are presented many times (both within and across texts). Some annotations of numerical facts are original: for example, numbers are automatically classified as round or non-round by an algorithm derived from Jansen and Pollmann (2001); also, numerical hedges such as about or a little under are marked up and classified semantically using arithmetical relations. Through explicit alignment of phrases describing the same fact, the corpus can support research on the influence of various contextual factors (e.g., document position, intended readership) on the way in which numerical facts are expressed. As an example we present results from an investigation showing that when a fact is mentioned more than once in a text, there is a clear tendency for precision to increase from first to subsequent mentions, and for mathematical level either to remain constant or to increase."
C10-2116,"Expressing {OWL} axioms by {E}nglish sentences: dubious in theory, feasible in practice",2010,13,28,1,1,41078,richard power,Coling 2010: Posters,0,"With OWL (Web Ontology Language) established as a standard for encoding ontologies on the Semantic Web, interest has begun to focus on the task of verbalising OWL code in controlled English (or other natural language). Current approaches to this task assume that axioms in OWL can be mapped to sentences in English. We examine three potential problems with this approach (concerning logical sophistication, information structure, and size), and show that although these could in theory lead to insuperable difficulties, in practice they seldom arise, because ontology developers use OWL in ways that favour a transparent mapping. This result is evidenced by an analysis of patterns from a corpus of over 600,000 axioms in about 200 ontologies."
W09-0602,Towards a Generation-Based Semantic Web Authoring Tool,2009,17,11,1,1,41078,richard power,Proceedings of the 12th {E}uropean Workshop on Natural Language Generation ({ENLG} 2009),0,"Widespread use of Semantic Web technologies requires interfaces through which knowledge can be viewed and edited without deep understanding of Description Logic and formalisms like OWL and RDF. Several groups are pursuing approaches based on Controlled Natural Languages (CNLs), so that editing can be performed by typing in sentences which are automatically interpreted as statements in OWL. We suggest here a variant of this approach which relies entirely on Natural Language Generation (NLG), and propose requirements for a system that can reliably generate transparent realisations of statements in Description Logic."
W09-0620,Precision and Mathematical Form in First and Subsequent Mentions of Numerical Facts and their Relation to Document Structure,2009,5,11,2,1,41079,sandra williams,Proceedings of the 12th {E}uropean Workshop on Natural Language Generation ({ENLG} 2009),0,"In a corpus study we found that authors vary both mathematical form and precision when expressing numerical quantities. Indeed, within the same document, a quantity is often described vaguely in some places and more accurately in others. Vague descriptions tend to occur early in a document and to be expressed in simpler mathematical forms (e.g., fractions or ratios), whereas more accurate descriptions of the same proportions tend to occur later, often expressed in more complex forms (e.g., decimal percentages). Our results can be used in Natural Language Generation (1) to generate repeat descriptions within the same document, and (2) to generate descriptions of numerical quantities for different audiences according to mathematical ability."
W08-0508,"Fast, Scalable and Reliable Generation of Controlled Natural Language",2008,10,1,2,0,47812,david hardcastle,"Software Engineering, Testing, and Quality Assurance for Natural Language Processing",0,"In this paper we describe a natural language generation system which takes as its input a set of assertions encoded as a semantic graph and outputs a data structure connecting the semantic graph to a text which expresses those assertions, encoded as a TAG syntactic tree. The scope of the system is restricted to controlled natural language, and this allows the generator to work within a tightly restricted domain of locality. We can exploit this feature of the system to ensure fast and efficient generation, and also to make the generator reliable by providing a rapid algorithm which can exhaustively test at compile time the completeness of the linguistic resources with respect to the range of potential meanings. The system can be exported for deployment with a minimal build of the semantic and linguistic resources that is verified to ensure that no run-time errors will result from missing resources. The framework is targeted at using natural language generation technology to build semantic web applications where machine-readable information can be automatically expressed in natural language on demand."
williams-power-2008-deriving,Deriving Rhetorical Complexity Data from the {RST}-{DT} Corpus,2008,6,3,2,1,41079,sandra williams,Proceedings of the Sixth International Conference on Language Resources and Evaluation ({LREC}'08),0,"This paper describes a study of the levels at which different rhetorical relations occur in rhetorical structure trees. In a previous empirical study (Williams and Reiter, 2003) of the RST-DT (Rhetorical Structure Theory Discourse Treebank) Corpus (Carlson et al., 2003), we noticed that certain rhetorical relations tended to occur more frequently at higher levels in a rhetorical structure tree, whereas others seemed to occur more often at lower levels. The present study takes a closer look at the data, partly to test this observation, and partly to investigate related issues such as the relative complexity of satellite and nucleus for each type of relation. One practical application of this investigation would be to guide discourse planning in Natural Language Generation (NLG), so that it reflects more accurately the structures found in documents written by human authors. We present our preliminary findings and discuss their relevance for discourse planning."
W07-2314,Abstract verbs,2007,8,7,1,1,41078,richard power,Proceedings of the Eleventh {E}uropean Workshop on Natural Language Generation ({ENLG} 07),0,"Existing generation systems use verbs almost exclusively to describe actions/events or to ascribe properties. In doing so, they achieve a direct concrete style of the kind often recommended in style manuals. However in many genres, including academic writing, it is common to find verbs expressing abstract relationships, with events etc. pushed down into nominalisations. This paper illustrates two important classes of abstract verb, one expressing discourse relations, the other expressing participant roles, and discusses some theoretical and practical reasons for studying such verbs and including them in generation systems."
W07-2328,Generating monologue and dialogue to present personalised medical information to patients,2007,6,21,3,1,41079,sandra williams,Proceedings of the Eleventh {E}uropean Workshop on Natural Language Generation ({ENLG} 07),0,"Medical information is notoriously difficult to convey to patients because the content is complex, emotionally sensitive, and hard to explain without recourse to technical terms. We describe a pilot system for communicating the contents of electronic health records (EHRs) to patients. It generates two alternative presentations, which we have compared in a preliminary evaluation study: the first takes the form of a monologue, which elaborates the information taken from the patient's EHR by adding explanations of some concepts and procedures; the second takes the form of a scripted dialogue, in which the content is recast as a series of questions, answers and statements assigned to two characters in the dialogue, a senior and a junior nurse. Our discourse planning method designs these presentations in tandem, first producing a monologue plan which is then elaborated into a dialogue plan."
J07-1006,Composing Questions through Conceptual Authoring,2007,40,68,3,0,44909,catalina hallett,Computational Linguistics,0,"This article describes a method for composing fluent and complex natural language questions, while avoiding the standard pitfalls of free text queries. The method, based on Conceptual Authoring, is targeted at question-answering systems where reliability and transparency are critical, and where users cannot be expected to undergo extensive training in question composition. This scenario is found in most corporate domains, especially in applications that are risk-averse. We present a proof-of-concept system we have developed: a question-answering interface to a large repository of medical histories in the area of cancer. We show that the method allows users to successfully and reliably compose complex queries with minimal training."
P06-2090,Implementing a Characterization of Genre for Automatic Genre Identification of Web Pages,2006,22,21,2,0,15671,marina santini,Proceedings of the {COLING}/{ACL} 2006 Main Conference Poster Sessions,0,"In this paper, we propose an implementable characterization of genre suitable for automatic genre identification of web pages. This characterization is implemented as an inferential model based on a modified version of Bayes' theorem. Such a model can deal with genre hybridism and individualization, two important forces behind genre evolution. Results show that this approach is effective and is worth further research."
I05-5010,Automatic generation of large-scale paraphrases,2005,14,20,1,1,41078,richard power,Proceedings of the Third International Workshop on Paraphrasing ({IWP}2005),0,"Research on paraphrase has mostly focussed on lexical or syntactic variation within individual sentences. Our concern is with larger-scale paraphrases, from multiple sentences or paragraphs to entire documents. In this papern we address the problem of generating paraphrases of large chunks of texts. We ground our discussion through an worked example of extending an existing NLG system to accept as input a source text, and to generate a range of fluent semantically-equivalent alternatives, varying not only at the lexical and syntactic levels, but also in document structure and layout."
P04-3030,Wysiwym with wider coverage,2004,6,3,1,1,41078,richard power,Proceedings of the {ACL} Interactive Poster and Demonstration Sessions,0,"We describe an extension of the WYSIWYM technology for knowledge editing through natural language feedback. Previous applications have addressed relatively simple tasks requiring a very limited range of nominal and clause patterns. We show that by adding a further editing operation called reconfiguration, the technology can achieve a far wider coverage more in line with other general-purpose generators. The extension will be included in a Java-based library package for producing WYSIWYM applications."
J04-4001,Optimizing Referential Coherence in Text Generation,2004,32,60,2,0.740741,52335,rodger kibble,Computational Linguistics,0,"This article describes an implemented system which uses centering theory for planning of coherent texts and choice of referring expressions. We argue that text and sentence planning need to be driven in part by the goal of maintaining referential continuity and thereby facilitating pronoun resolution: Obtaining a favorable ordering of clauses, and of arguments within clauses, is likely to increase opportunities for nonambiguous pronoun use. Centering theory provides the basis for such an integrated approach. Generating coherent texts according to centering theory is treated as a constraint satisfaction problem. The well-known Rule 2 of centering theory is reformulated in terms of a set of constraintsxe2x80x94cohesion, salience, cheapness, and continuityxe2x80x94and we show sample outputs obtained under a particular weighting of these constraints. This framework facilitates detailed research into evaluation metrics and will therefore provide a productive research tool in addition to the immediate practical benefit of improving the fluency and readability of generated texts. The technique is generally applicable to natural language generation systems, which perform hierarchical text structuring based on a theory of coherence relations with certain additional assumptions."
J03-2003,Document Structure,2003,29,81,1,1,41078,richard power,Computational Linguistics,0,"A method of automated document structure identification based on visual cues is disclosed herein. The two dimensional layout of the document is analyzed to discern visual cues related to the structure of the document, and the text of the document is tokenized so that similarly structured elements are treated similarly. The method can be applied in the generation of extensible mark-up language files, natural language parsing and search engine ranking mechanisms."
E03-2005,{WYSIWYM} - building user interfaces with natural language feedback,2003,8,3,2,0.263842,32465,roger evans,Demonstrations,0,"WYSIWYM ('What you see is what you meant') is a user-interface technique which uses natural language generation (NLG) technology to provide feedback for user interactions. To date, the technology has been applied in a number of demonstrator applications, using customised, non-portable implementations. In this demonstration, we introduce a WYSIWYM library package, designed to be used as a modular component of a larger JAVA-based application. We show how the overall design of the package aims to support a range of possible applications using simple configuration options and JAVA subclassing, and illustrate the approach using examples ranging from the simplest proof-of-concept application to a complex web-delivered authoring tool for pharmaceutical leaflets."
2003.eamt-1.13,Multilingual generation of controlled languages,2003,0,16,1,1,41078,richard power,EAMT Workshop: Improving MT through other language technology tools: resources and tools for building MT,0,"We describe techniques based on natural language generation which allow a user to author a document in controlled language for multiple natural languages. The author is expected to be an expert in the application domain but not in the controlled language or in more than one of the supported natural languages. Because the system can produce multiple expressions of the same input in multiple languages, the author can choose among alternative expressions satisfying the constraints of the controlled language. Because the system offers only legitimate choices of wording, correction is unnecessary. Consequently, acceptance of error reports and corrections by trained authors are non-issues."
bouayad-agha-etal-2002-pills,{PILLS}: Multilingual generation of medical information documents with overlapping content,2002,5,25,2,1,39891,nadjet bouayadagha,Proceedings of the Third International Conference on Language Resources and Evaluation ({LREC}{'}02),0,"In the pharmaceutical industry, products have to be described by a range of document types with overlapping content. Moreover, much of this documentation has to be produced in many languages. This situation is commonplace in many commercial domains, and leads to well-known problems in maintaining a set of related documents and their translations. We describe a potential solution explored in the PILLS project. All relevant knowledge about a product is entered only once, through a natural-language interface to a knowledge base. From this xe2x80x98master modelxe2x80x99, specialised models for a range of document types are derived automatically; from each specialised model, documents are generated automatically in all supported languages. As an illustration of this approach, the PILLS demonstrator generates three medical document types in English, German and French."
P01-1015,From {RAGS} to {RICHES}: Exploiting the Potential of a Flexible Generation Architecture,2001,12,19,5,0,42348,lynne cahill,Proceedings of the 39th Annual Meeting of the Association for Computational Linguistics,1,"The RAGS proposals for generic specification of NLG systems includes a detailed account of data representation, but only an outline view of processing aspects. In this paper we introduce a modular processing architecture with a concrete implementation which aims to meet the RAGS goals of transparency and reusability. We illustrate the model with the RICHES system -- a generation system built from simple linguistically-motivated modules."
W00-1411,An integrated framework for text planning and pronominalisation,2000,13,38,2,0.740741,52335,rodger kibble,{INLG}{'}2000 Proceedings of the First International Conference on Natural Language Generation,0,"This paper describes an implemented system which uses centering theory for planning of coherent texts and choice of referring expressions. We argue that text and sentence planning need to be driven in part by the goal of maintaining referential continuity and thereby facilitating pronoun resolution: obtaining a favourable ordering of clauses, and of arguments within clauses, is likely to increase opportunities for non-ambiguous pronoun use. Centering theory provides the basis for such an integrated approach. Generating coherent texts according to centering theory is treated as a constraint satisfaction problem."
