2021.acl-long.242,{O}nline {L}earning Meets {M}achine {T}ranslation Evaluation: Finding the Best Systems with the Least Human Effort,2021,-1,-1,3,0,13058,vania mendoncca,Proceedings of the 59th Annual Meeting of the Association for Computational Linguistics and the 11th International Joint Conference on Natural Language Processing (Volume 1: Long Papers),1,"In Machine Translation, assessing the quality of a large amount of automatic translations can be challenging. Automatic metrics are not reliable when it comes to high performing systems. In addition, resorting to human evaluators can be expensive, especially when evaluating multiple systems. To overcome the latter challenge, we propose a novel application of online learning that, given an ensemble of Machine Translation systems, dynamically converges to the best systems, by taking advantage of the human feedback available. Our experiments on WMT{'}19 datasets show that our online approach quickly converges to the top-3 ranked systems for the language pairs considered, despite the lack of human feedback for many translations."
2021.acl-demo.9,{MT}-{T}elescope: {A}n interactive platform for contrastive evaluation of {MT} systems,2021,-1,-1,4,0,7230,ricardo rei,Proceedings of the 59th Annual Meeting of the Association for Computational Linguistics and the 11th International Joint Conference on Natural Language Processing: System Demonstrations,0,"We present MT-Telescope, a visualization platform designed to facilitate comparative analysis of the output quality of two Machine Translation (MT) systems. While automated MT evaluation metrics are commonly used to evaluate MT systems at a corpus-level, our platform supports fine-grained segment-level analysis and interactive visualisations that expose the fundamental differences in the performance of the compared systems. MT-Telescope also supports dynamic corpus filtering to enable focused analysis on specific phenomena such as; translation of named entities, handling of terminology, and the impact of input segment length on translation quality. Furthermore, the platform provides a bootstrapped t-test for statistical significance as a means of evaluating the rigor of the resulting system ranking. MT-Telescope is open source, written in Python, and is built around a user friendly and dynamic web interface. Complementing other existing tools, our platform is designed to facilitate and promote the broader adoption of more rigorous analysis practices in the evaluation of MT quality."
2020.signlang-1.6,{PE}2{LGP} Animator: A Tool To Animate A {P}ortuguese {S}ign {L}anguage Avatar,2020,-1,-1,4,0,14798,pedro cabral,"Proceedings of the LREC2020 9th Workshop on the Representation and Processing of Sign Languages: Sign Language Resources in the Service of the Language Community, Technological Challenges and Application Perspectives",0,"Software for the production of sign languages is much less common than for spoken languages. Such software usually relies on 3D humanoid avatars to produce signs which, inevitably, necessitates the use of animation. One barrier to the use of popular animation tools is their complexity and steep learning curve, which can be hard to master for inexperienced users. Here, we present PE2LGP, an authoring system that features a 3D avatar that signs Portuguese Sign Language. Our Animator is designed specifically to craft sign language animations using a key frame method, and is meant to be easy to use and learn to users without animation skills. We conducted a preliminary evaluation of the Animator, where we animated seven Portuguese Sign Language sentences and asked four sign language users to evaluate their quality. This evaluation revealed that the system, in spite of its simplicity, is indeed capable of producing comprehensible messages."
2020.lrec-1.669,{AIA}-{BDE}: A Corpus of {FAQ}s in {P}ortuguese and their Variations,2020,-1,-1,6,0,16926,hugo oliveira,Proceedings of the 12th Language Resources and Evaluation Conference,0,"We present AIA-BDE, a corpus of 380 domain-oriented FAQs in Portuguese and their variations, i.e., paraphrases or entailed questions, created manually, by humans, or automatically, with Google Translate. Its aims to be used as a benchmark for FAQ retrieval and automatic question-answering, but may be useful in other contexts, such as the development of task-oriented dialogue systems, or models for natural language inference in an interrogative context. We also report on two experiments. Matching variations with their original questions was not trivial with a set of unsupervised baselines, especially for manually created variations. Besides high performances obtained with ELMo and BERT embeddings, an Information Retrieval system was surprisingly competitive when considering only the first hit. In the second experiment, text classifiers were trained with the original questions, and tested when assigning each variation to one of three possible sources, or assigning them as out-of-domain. Here, the difference between manual and automatic variations was not so significant."
2020.lrec-1.739,{H}am{N}o{S}y{S}2{S}i{GML}: Translating {H}am{N}o{S}ys Into {S}i{GML},2020,-1,-1,2,0,18092,carolina neves,Proceedings of the 12th Language Resources and Evaluation Conference,0,"Sign Languages are visual languages and the main means of communication used by Deaf people. However, the majority of the information available online is presented through written form. Hence, it is not of easy access to the Deaf community. Avatars that can animate sign languages have gained an increase of interest in this area due to their flexibility in the process of generation and edition. Synthetic animation of conversational agents can be achieved through the use of notation systems. HamNoSys is one of these systems, which describes movements of the body through symbols. Its XML-compliant, SiGML, is a machine-readable input of HamNoSys able to animate avatars. Nevertheless, current tools have no freely available open source libraries that allow the conversion from HamNoSys to SiGML. Our goal is to develop a tool of open access, which can perform this conversion independently from other platforms. This system represents a crucial intermediate step in the bigger pipeline of animating signing avatars. Two cases studies are described in order to illustrate different applications of our tool."
S19-2019,{L}2{F}/{INESC}-{ID} at {S}em{E}val-2019 Task 2: Unsupervised Lexical Semantic Frame Induction using Contextualized Word Representations,2019,0,1,7,0,16740,eugenio ribeiro,Proceedings of the 13th International Workshop on Semantic Evaluation,0,"Building large datasets annotated with semantic information, such as FrameNet, is an expensive process. Consequently, such resources are unavailable for many languages and specific domains. This problem can be alleviated by using unsupervised approaches to induce the frames evoked by a collection of documents. That is the objective of the second task of SemEval 2019, which comprises three subtasks: clustering of verbs that evoke the same frame and clustering of arguments into both frame-specific slots and semantic roles. We approach all the subtasks by applying a graph clustering algorithm on contextualized embedding representations of the verbs and arguments. Using such representations is appropriate in the context of this task, since they provide cues for word-sense disambiguation. Thus, they can be used to identify different frames evoked by the same words. Using this approach we were able to outperform all of the baselines reported for the task on the test set in terms of Purity F1, as well as in terms of BCubed F1 in most cases."
K19-1054,{B}eam{S}eg: A Joint Model for Multi-Document Segmentation and Topic Identification,2019,0,0,3,0,26339,pedro mota,Proceedings of the 23rd Conference on Computational Natural Language Learning (CoNLL),0,"We propose BeamSeg, a joint model for segmentation and topic identification of documents from the same domain. The model assumes that lexical cohesion can be observed across documents, meaning that segments describing the same topic use a similar lexical distribution over the vocabulary. The model implements lexical cohesion in an unsupervised Bayesian setting by drawing from the same language model segments with the same topic. Contrary to previous approaches, we assume that language models are not independent, since the vocabulary changes in consecutive segments are expected to be smooth and not abrupt. We achieve this by using a dynamic Dirichlet prior that takes into account data contributions from other topics. BeamSeg also models segment length properties of documents based on modality (textbooks, slides, \textit{etc.}). The evaluation is carried out in three datasets. In two of them, improvements of up to 4.8{\%} and 7.3{\%} are obtained in the segmentation and topic identifications tasks, indicating that both tasks should be jointly modeled."
S17-2032,{L}2{F}/{INESC}-{ID} at {S}em{E}val-2017 Tasks 1 and 2: Lexical and semantic features in word and textual similarity,2017,0,2,3,1,17984,pedro fialho,Proceedings of the 11th International Workshop on Semantic Evaluation ({S}em{E}val-2017),0,"This paper describes our approach to the SemEval-2017 {``}Semantic Textual Similarity{''} and {``}Multilingual Word Similarity{''} tasks. In the former, we test our approach in both English and Spanish, and use a linguistically-rich set of features. These move from lexical to semantic features. In particular, we try to take advantage of the recent Abstract Meaning Representation and SMATCH measure. Although without state of the art results, we introduce semantic structures in textual similarity and analyze their impact. Regarding word similarity, we target the English language and combine WordNet information with Word Embeddings. Without matching the best systems, our approach proved to be simple and effective."
W16-6640,{QGASP}: a Framework for Question Generation Based on Different Levels of Linguistic Information,2016,7,2,2,0,32252,hugo rodrigues,Proceedings of the 9th International Natural Language Generation conference,0,None
W16-1814,A study on the production of collocations by {E}uropean {P}ortuguese learners,2016,2,0,2,1,33948,angela costa,Proceedings of the 12th Workshop on Multiword Expressions,0,None
L16-1044,Building a Corpus of Errors and Quality in Machine Translation: Experiments on Error Impact,2016,9,0,3,1,33948,angela costa,Proceedings of the Tenth International Conference on Language Resources and Evaluation ({LREC}'16),0,"In this paper we describe a corpus of automatic translations annotated with both error type and quality. The 300 sentences that we have selected were generated by Google Translate, Systran and two in-house Machine Translation systems that use Moses technology. The errors present on the translations were annotated with an error taxonomy that divides errors in five main linguistic categories (Orthography, Lexis, Grammar, Semantics and Discourse), reflecting the language level where the error is located. After the error annotation process, we accessed the translation quality of each sentence using a four point comprehension scale from 1 to 5. Both tasks of error and quality annotation were performed by two different annotators, achieving good levels of inter-annotator agreement. The creation of this corpus allowed us to use it as training data for a translation quality classifier. We concluded on error severity by observing the outputs of two machine learning classifiers: a decision tree and a regression model."
W15-5124,From {E}uropean {P}ortuguese to {P}ortuguese {S}ign {L}anguage,2015,8,2,2,0,36538,ines almeida,Proceedings of {SLPAT} 2015: 6th Workshop on Speech and Language Processing for Assistive Technologies,0,"Several efforts have been done towards the development of platforms that allow the translation of specific sign languages to the correspondent spoken language (and vice-versa). In this (demo) paper, we describe a freely available system that translates, in real time, European Portuguese (text) into Portuguese Sign Language (LGP), by using an avatar. We focus in how some linguistic elements are dealt in LGP, and in the Natural Language Processing (NLP) step implemented in our system. The systemxe2x80x99s interface will be used to demonstrate it. Although only a small set of linguistic phenomena are implemented, it can be seen how the system copes with it."
W15-2815,Coupling Natural Language Processing and Animation Synthesis in {P}ortuguese {S}ign {L}anguage Translation,2015,13,5,2,0,36538,ines almeida,Proceedings of the Fourth Workshop on Vision and Language,0,"In this paper we present a free, open source platform, that translates in real time (written) European Portuguese into Portuguese Sign Language, being the signs produced by an avatar. We discuss basic needs of such a system in terms of Natural Language Processing and Animation Synthesis, and propose an architecture for it. Moreover, we have selected a set of existing tools that couple with our free, open-source philosophy, and implemented a prototype with them. Several case studies were conducted. A preliminary evaluation was done and, although the translation possibilities are still scarce and some adjustments still need to be done, our platform was already much welcomed by the deaf community."
curto-etal-2014-just,"{JUST}.{ASK}, a {QA} system that learns to answer new questions from previous interactions",2014,14,0,4,1,39414,sergio curto,Proceedings of the Ninth International Conference on Language Resources and Evaluation ({LREC}'14),0,"We present JUST.ASK, a publicly available Question Answering system, which is freely available. Its architecture is composed of the usual Question Processing, Passage Retrieval and Answer Extraction components. Several details on the information generated and manipulated by each of these components are also provided to the user when interacting with the demonstration. Since JUST.ASK also learns to answer new questions based on users feedback, (s)he is invited to identify the correct answers. These will then be used to retrieve answers to future questions."
costa-etal-2014-translation,Translation errors from {E}nglish to {P}ortuguese: an annotated corpus,2014,7,2,3,1,33948,angela costa,Proceedings of the Ninth International Conference on Language Resources and Evaluation ({LREC}'14),0,"Analysing the translation errors is a task that can help us finding and describing translation problems in greater detail, but can also suggest where the automatic engines should be improved. Having these aims in mind we have created a corpus composed of 150 sentences, 50 from the TAP magazine, 50 from a TED talk and the other 50 from the from the TREC collection of factoid questions. We have automatically translated these sentences from English into Portuguese using Google Translate and Moses. After we have analysed the errors and created the error annotation taxonomy, the corpus was annotated by a linguist native speaker of Portuguese. Although Google{'}s overall performance was better in the translation task (we have also calculated the BLUE and NIST scores), there are some error types that Moses was better at coping with, specially discourse level errors."
P13-4011,"Meet {EDGAR}, a tutoring agent at {MONSERRATE}",2013,9,5,2,1,17984,pedro fialho,Proceedings of the 51st Annual Meeting of the Association for Computational Linguistics: System Demonstrations,0,None
costa-etal-2012-english,An {E}nglish-{P}ortuguese parallel corpus of questions: translation guidelines and application in {SMT},2012,7,4,5,1,33948,angela costa,Proceedings of the Eighth International Conference on Language Resources and Evaluation ({LREC}'12),0,"The task of Statistical Machine Translation depends on large amounts of training corpora. Despite the availability of several parallel corpora, these are typically composed of declarative sentences, which may not be appropriate when the goal is to translate other types of sentences, e.g., interrogatives. There have been efforts to create corpora of questions, specially in the context of the evaluation of Question-Answering systems. One of those corpora is the UIUC dataset, composed of nearly 6,000 questions, widely used in the task of Question Classification. In this work, we make available the Portuguese version of the UIUC dataset, which we manually translated, as well as the translation guidelines. We show the impact of this corpus in the performance of a state-of-the-art SMT system when translating questions. Finally, we present a taxonomy of translation errors, according to which we analyze the output of the automatic translation before and after using the corpus as training data."
fialho-etal-2012-extending,Extending a wordnet framework for simplicity and scalability,2012,13,0,4,1,17984,pedro fialho,Proceedings of the Eighth International Conference on Language Resources and Evaluation ({LREC}'12),0,"The WordNet knowledge model is currently implemented in multiple software frameworks providing procedural access to language instances of it. Frameworks tend to be focused on structural/design aspects of the model thus describing low level interfaces for linguistic knowledge retrieval. Typically the only high level feature directly accessible is word lookup while traversal of semantic relations leads to verbose/complex combinations of data structures, pointers and indexes which are irrelevant in an NLP context. Here is described an extension to the JWNL framework that hides technical requirements of access to WordNet features with an essentially word/sense based API applying terminology from the official online interface. This high level API is applied to the original English version of WordNet and to an SQL based Portuguese lexicon, translated into a WordNet based representation usable by JWNL."
silva-etal-2012-dealing,Dealing with unknown words in statistical machine translation,2012,10,4,2,0,8865,joao silva,Proceedings of the Eighth International Conference on Language Resources and Evaluation ({LREC}'12),0,"In Statistical Machine Translation, words that were not seen during training are unknown words, that is, words that the system will not know how to translate. In this paper we contribute to this research problem by profiting from orthographic cues given by words. Thus, we report a study of the impact of word distance metrics in cognates' detection and, in addition, on the possibility of obtaining possible translations of unknown words through Logical Analogy. Our approach is tested in the translation of corpora from Portuguese to English (and vice-versa)."
W11-2705,Exploring linguistically-rich patterns for question generation,2011,11,8,3,1,39414,sergio curto,Proceedings of the {UCNLG}+{E}val: Language Generation and Evaluation Workshop,0,"Linguistic patterns reflect the regularities of Natural Language and their applicability is acknowledged in several Natural Language Processing tasks. Particularly, in the task of Question Generation, many systems depend on patterns to generate questions from text. The approach we follow relies on patterns that convey lexical, syntactic and semantic information, automatically learned from large-scale corpora.n n In this paper we discuss the impact of varying several parameters during pattern learning and matching in the Question Generation task. In particular, we introduce semantics (by means of named entities) in our lexico-syntactic patterns. We evaluate and compare the number and quality of the learned patterns and the matched text segments. Also, we detail the influence of the patterns in the generation of natural language questions."
P11-2079,Reordering Modeling using Weighted Alignment Matrices,2011,11,2,5,1,13846,wang ling,Proceedings of the 49th Annual Meeting of the Association for Computational Linguistics: Human Language Technologies,0,"In most statistical machine translation systems, the phrase/rule extraction algorithm uses alignments in the 1-best form, which might contain spurious alignment points. The usage of weighted alignment matrices that encode all possible alignments has been shown to generate better phrase tables for phrase-based systems. We propose two algorithms to generate the well known MSD reordering model using weighted alignment matrices. Experiments on the IWSLT 2010 evaluation datasets for two language pairs with different alignment algorithms show that our methods produce more accurate reordering models, as can be shown by an increase over the regular MSD models of 0.4 BLEU points in the BTEC French to English test set, and of 1.5 BLEU points in the DIALOG Chinese to English test set."
2011.iwslt-papers.3,Named entity translation using anchor texts,2011,11,10,6,1,13846,wang ling,Proceedings of the 8th International Workshop on Spoken Language Translation: Papers,0,"This work describes a process to extract Named Entity (NE) translations from the text available in web links (anchor texts). It translates a NE by retrieving a list of web documents in the target language, extracting the anchor texts from the links to those documents and finding the best translation from the anchor texts, using a combination of features, some of which, are specific to anchor texts. Experiments performed on a manually built corpora, suggest that over 70{\%} of the NEs, ranging from unpopular to popular entities, can be translated correctly using sorely anchor texts. Tests on a Machine Translation task indicate that the system can be used to improve the quality of the translations of state-of-the-art statistical machine translation systems."
2011.eamt-1.19,{BP}2{EP} - Adaptation of {B}razilian {P}ortuguese texts to {E}uropean {P}ortuguese,2011,-1,-1,5,0,26032,luis marujo,Proceedings of the 15th Annual conference of the European Association for Machine Translation,0,None
mendes-etal-2010-named,Named Entity Recognition in Questions: Towards a Golden Collection,2010,6,5,2,1,39415,ana mendes,Proceedings of the Seventh International Conference on Language Resources and Evaluation ({LREC}'10),0,"Named Entity Recognition (NER) plays a relevant role in several Natural Language Processing tasks. Question-Answering (QA) is an example of such, since answers are frequently named entities in agreement with the semantic category expected by a given question. In this context, the recognition of named entities is usually applied in free text data. NER in natural language questions can also aid QA and, thus, should not be disregarded. Nevertheless, it has not yet been given the necessary importance. In this paper, we approach the identification and classification of named entities in natural language questions. We hypothesize that NER results can benefit with the inclusion of previously labeled questions in the training corpus. We present a broad study addressing that hypothesis, focusing on the balance to be achieved between the amount of free text and questions in order to build a suitable training corpus. This work also contributes by providing a set of nearly 5,500 annotated questions with their named entities, freely available for research purposes."
2010.iwslt-papers.14,Towards a general and extensible phrase-extraction algorithm,2010,29,11,4,1,13846,wang ling,Proceedings of the 7th International Workshop on Spoken Language Translation: Papers,0,"Phrase-based systems deeply depend on the quality of their phrase tables and therefore, the process of phrase extraction is always a fundamental step. In this paper we present a general and extensible phrase extraction algorithm, where we have highlighted several control points. The instantiation of these control points allows the simulation of previous approaches, as in each one of these points different strategies/heuristics can be tested. We show how previous approaches fit in this algorithm, compare several of them and, in addition, we propose alternative heuristics, showing their impact on the final translation results. Considering two different test scenarios from the IWSLT 2010 competition (BTEC, Fr-En and DIALOG, Cn-En), we have obtained an improvement in the results of 2.4 and 2.8 BLEU points, respectively."
2010.iwslt-evaluation.9,The {INESC}-{ID} machine translation system for the {IWSLT} 2010,2010,7,0,4,1,13846,wang ling,Proceedings of the 7th International Workshop on Spoken Language Translation: Evaluation Campaign,0,"In this paper we describe the Instituto de Engenharia de Sistemas e Computadores Investigac ̧a ̃o e Desenvolvimento (INESC-ID) system that participated in the IWSLT 2010 evaluation campaign. Our main goal for this evaluation was to employ several state-of-the-art methods applied to phrase-based machine translation in order to improve the translation quality. Aside from the IBM M4 alignment model, two constrained alignment models were tested, which produced better overall results. These results were further improved by using weighted alignment matrixes during phrase extraction, rather than the single best alignment. Finally, we tested several filters that ruled out phrase pairs based on puntuation. Our system was evaluated on the BTEC and DIALOG tasks, having achieved a better overall ranking in the DIALOG task."
