D15-1191,Context-Dependent Knowledge Graph Embedding,2015,18,26,3,0,34499,yuanfei luo,Proceedings of the 2015 Conference on Empirical Methods in Natural Language Processing,0,"We consider the problem of embedding knowledge graphs (KGs) into continuous vector spaces. Existing methods can only deal with explicit relationships within each triple, i.e., local connectivity patterns, but cannot handle implicit relationships across different triples, i.e., contextual connectivity patterns. This paper proposes context-dependent KG embedding, a twostage scheme that takes into account both types of connectivity patterns and obtains more accurate embeddings. We evaluate our approach on the tasks of link prediction and triple classification, and achieve significant and consistent improvements over state-of-the-art methods."
D14-1118,A Regularized Competition Model for Question Difficulty Estimation in Community Question Answering Services,2014,35,16,3,1,7574,quan wang,Proceedings of the 2014 Conference on Empirical Methods in Natural Language Processing ({EMNLP}),0,"Estimating questionsxe2x80x99 di culty levels is an important task in community question answering (CQA) services. Previous studies propose to solve this problem based on the question-user comparisons extracted from the question answering threads. However, they su er from data sparseness problem as each question only gets a limited number of comparisons. Moreover, they cannot handle newly posted questions which get no comparisons. In this paper, we propose a novel question di culty estimation approach called Regularized Competition Model (RCM), which naturally combines question-user comparisons and questionsxe2x80x99 textual descriptions into a unified framework. By incorporating textual information, RCM can e ectivelydeal with data sparseness problem. We further employ a K-Nearest Neighbor approach to estimate di culty levels of newly posted questions, again by leveraging textual similarities. Experiments on two publicly available data sets show that for both well-resolved and newly-posted questions, RCM performs the estimation task significantly better than existing methods, demonstrating the advantage of incorporating textual information. More interestingly, we observe that RCM might provide an automatic way to quantitatively measure the knowledge levels of words."
C10-2130,Using Clustering to Improve Retrieval Evaluation without Relevance Judgments,2010,14,4,3,0,46481,zhiwei shi,Coling 2010: Posters,0,"Retrieval evaluation without relevance judgments is a hard but also very meaningful work. In this paper, we use clustering technique to improve the performance of judgment free retrieval evaluation. By using one system to represent all the systems that are similar to it, we can largely reduce the negative effect of similar retrieval results in Retrieval evaluation. Experimental results demonstrated that our method outperformed all the previous judgment free evaluation methods significantly. Its overall average performance outperformed the best previous result by 20.5%. Besides, our work is a general framework that can be applied to any other judgment free evaluation method for performance improvement."
I08-1026,A Study on Effectiveness of Syntactic Relationship in Dependence Retrieval Model,2008,5,0,2,0,48669,fan ding,Proceedings of the Third International Joint Conference on Natural Language Processing: Volume-{I},0,"To relax the Term Independence Assumption, Term Dependency is introduced and it has improved retrieval precision dramatically. There are two kinds of term dependencies, one is defined by term proximity, and the other is defined by linguistic dependencies. In this paper, we take a comparative study to re-examine these two kinds of term dependencies in dependence language model framework. Syntactic relationships, derived from a dependency parser, Minipar, are used as linguistic term dependencies. Our study shows: 1) Linguistic dependencies get a better result than term proximity. 2) Dependence retrieval model achieves more improvement in sentence-based verbose queries than keywordbased short queries."
D08-1111,Information Retrieval Oriented Word Segmentation based on Character Association Strength Ranking,2008,12,6,2,0,48705,yixuan liu,Proceedings of the 2008 Conference on Empirical Methods in Natural Language Processing,0,"This paper presents a novel, ranking-style word segmentation approach, called RSVM-Seg, which is well tailored to Chinese information retrieval(CIR). This strategy makes segmentation decision based on the ranking of the internal associative strength between each pair of adjacent characters of the sentence. On the training corpus composed of query items, a ranking model is learned by a widely-used tool Ranking SVM, with some useful statistical features, such as mutual information, difference of t-test, frequency and dictionary information. Experimental results show that, this method is able to eliminate overlapping ambiguity much more effectively, compared to the current word segmentation methods. Furthermore, as this strategy naturally generates segmentation results with different granularity, the performance of CIR systems is improved and achieves the state of the art."
P03-1058,Exploiting Parallel Texts for Word Sense Disambiguation: An Empirical Study,2003,19,141,2,0,7314,hwee ng,Proceedings of the 41st Annual Meeting of the Association for Computational Linguistics,1,"A central problem of word sense disambiguation (WSD) is the lack of manually sense-tagged data required for supervised learning. In this paper, we evaluate an approach to automatically acquire sense-tagged training data from English-Chinese parallel corpora, which are then used for disambiguating the nouns in the SENSEVAL-2 English lexical sample task. Our investigation reveals that this method of acquiring sense-tagged data is promising. On a subset of the most difficult SENSEVAL-2 nouns, the accuracy difference between the two approaches is only 14.0%, and the difference could narrow further to 6.5% if we disregard the advantage that manually sense-tagged data have in their sense coverage. Our analysis also highlights the importance of the issue of domain dependence in evaluating WSD programs."
