P19-1182,Expressing Visual Relationships via Language,2019,0,4,4,0,3489,hao tan,Proceedings of the 57th Annual Meeting of the Association for Computational Linguistics,1,"Describing images with text is a fundamental problem in vision-language research. Current studies in this domain mostly focus on single image captioning. However, in various real applications (e.g., image editing, difference interpretation, and retrieval), generating relational captions for two images, can also be very useful. This important problem has not been explored mostly due to lack of datasets and effective models. To push forward the research in this direction, we first introduce a new language-guided image editing dataset that contains a large number of real image pairs with corresponding editing instructions. We then propose a new relational speaker model based on an encoder-decoder architecture with static relational attention and sequential multi-head attention. We also extend the model with dynamic relational attention, which calculates visual alignment while decoding. Our models are evaluated on our newly collected and two public datasets consisting of image pairs annotated with relationship sentences. Experimental results, based on both automatic and human evaluation, demonstrate that our model outperforms all baselines and existing methods on all the datasets."
D19-1610,A Gated Self-attention Memory Network for Answer Selection,2019,0,3,3,1,715,tuan lai,Proceedings of the 2019 Conference on Empirical Methods in Natural Language Processing and the 9th International Joint Conference on Natural Language Processing (EMNLP-IJCNLP),0,"Answer selection is an important research problem, with applications in many areas. Previous deep learning based approaches for the task mainly adopt the Compare-Aggregate architecture that performs word-level comparison followed by aggregation. In this work, we take a departure from the popular Compare-Aggregate architecture, and instead, propose a new gated self-attention memory network for the task. Combined with a simple transfer learning technique from a large-scale online corpus, our model outperforms previous methods by a large margin, achieving new state-of-the-art results on two standard answer selection datasets: TrecQA and WikiQA."
W18-5033,Conversational Image Editing: Incremental Intent Identification in a New Dialogue Task,2018,0,4,2,0,1597,ramesh manuvinakurike,Proceedings of the 19th Annual {SIG}dial Meeting on Discourse and Dialogue,0,"We present {``}conversational image editing{''}, a novel real-world application domain combining dialogue, visual information, and the use of computer vision. We discuss the importance of dialogue incrementality in this task, and build various models for incremental intent identification based on deep learning and traditional classification algorithms. We show how our model based on convolutional neural networks outperforms models based on random forests, long short term memory networks, and conditional random fields. By training embeddings based on image-related dialogue corpora, we outperform pre-trained out-of-the-box embeddings, for intention identification tasks. Our experiments also provide evidence that incremental intent processing may be more efficient for the user and could save time in accomplishing tasks."
W18-4701,{D}ial{E}dit: Annotations for Spoken Conversational Image Editing,2018,0,3,3,0,28126,ramesh manuvirakurike,Proceedings 14th Joint {ACL} - {ISO} Workshop on Interoperable Semantic Annotation,0,None
W18-3105,A Simple End-to-End Question Answering Model for Product Information,2018,0,2,2,1,715,tuan lai,Proceedings of the First Workshop on Economics and Natural Language Processing,0,"When evaluating a potential product purchase, customers may have many questions in mind. They want to get adequate information to determine whether the product of interest is worth their money. In this paper we present a simple deep learning model for answering questions regarding product facts and specifications. Given a question and a product specification, the model outputs a score indicating their relevance. To train and evaluate our proposed model, we collected a dataset of 7,119 questions that are related to 153 different products. Experimental results demonstrate that {--}despite its simplicity{--} the performance of our model is shown to be comparable to a more complex state-of-the-art baseline."
N18-2097,A Discourse-Aware Attention Model for Abstractive Summarization of Long Documents,2018,19,16,4,0,2187,arman cohan,"Proceedings of the 2018 Conference of the North {A}merican Chapter of the Association for Computational Linguistics: Human Language Technologies, Volume 2 (Short Papers)",0,"Neural abstractive summarization models have led to promising results in summarizing relatively short documents. We propose the first model for abstractive summarization of single, longer-form documents (e.g., research papers). Our approach consists of a new hierarchical encoder that models the discourse structure of a document, and an attentive discourse-aware decoder to generate the summary. Empirical results on two large-scale datasets of scientific papers show that our model significantly outperforms state-of-the-art models."
N18-1115,The Context-Dependent Additive Recurrent Neural Net,2018,0,2,5,1,4061,quan tran,"Proceedings of the 2018 Conference of the North {A}merican Chapter of the Association for Computational Linguistics: Human Language Technologies, Volume 1 (Long Papers)",0,"Contextual sequence mapping is one of the fundamental problems in Natural Language Processing (NLP). Here, instead of relying solely on the information presented in the text, the learning agents have access to a strong external signal given to assist the learning process. In this paper, we propose a novel family of Recurrent Neural Network unit: the Context-dependent Additive Recurrent Neural Network (CARNN) that is designed specifically to address this type of problem. The experimental results on public datasets in the dialog problem (Babi dialog Task 6 and Frame), contextual language model (Switchboard and Penn Tree Bank) and question answering (Trec QA) show that our novel CARNN-based architectures outperform previous methods."
L18-1438,{P}hotoshop{Q}ui{A}: A Corpus of Non-Factoid Questions and Answers for Why-Question Answering,2018,0,0,4,0,29990,andrei dulceanu,Proceedings of the Eleventh International Conference on Language Resources and Evaluation ({LREC} 2018),0,None
L18-1683,Edit me: A Corpus and a Framework for Understanding Natural Language Image Editing,2018,0,5,3,0,1597,ramesh manuvinakurike,Proceedings of the Eleventh International Conference on Language Resources and Evaluation ({LREC} 2018),0,None
C18-1181,A Review on Deep Learning Techniques Applied to Answer Selection,2018,0,15,2,1,715,tuan lai,Proceedings of the 27th International Conference on Computational Linguistics,0,"Given a question and a set of candidate answers, answer selection is the task of identifying which of the candidates answers the question correctly. It is an important problem in natural language processing, with applications in many areas. Recently, many deep learning based methods have been proposed for the task. They produce impressive performance without relying on any feature engineering or expensive external resources. In this paper, we aim to provide a comprehensive review on deep learning methods applied to answer selection."
P10-2057,Decision Detection Using Hierarchical Graphical Models,2010,16,4,1,1,3187,trung bui,Proceedings of the {ACL} 2010 Conference Short Papers,0,"We investigate hierarchical graphical models (HGMs) for automatically detecting decisions in multi-party discussions. Several types of dialogue act (DA) are distinguished on the basis of their roles in formulating decisions. HGMs enable us to model dependencies between observed features of discussions, decision DAs, and subdialogues that result in a decision. For the task of detecting decision regions, an HGM classifier was found to outperform non-hierarchical graphical models and support vector machines, raising the F1-score to 0.80 from 0.55."
W09-3934,Extracting Decisions from Multi-Party Dialogue Using Directed Graphical Models and Semantic Similarity,2009,17,18,1,1,3187,trung bui,Proceedings of the {SIGDIAL} 2009 Conference,0,"We use directed graphical models (DGMs) to automatically detect decision discussions in multi-party dialogue. Our approach distinguishes between different dialogue act (DA) types based on their role in the formulation of a decision. DGMs enable us to model dependencies, including sequential ones. We summarize decisions by extracting suitable phrases from DAs that concern the issue under discussion and its resolution. Here we use a semantic-similarity metric to improve results on both manual and ASR transcripts."
D09-1118,Real-time decision detection in multi-party dialogue,2009,17,10,3,0,45102,matthew frampton,Proceedings of the 2009 Conference on Empirical Methods in Natural Language Processing,0,"We describe a process for automatically detecting decision-making sub-dialogues in multi-party, human-human meetings in real-time. Our basic approach to decision detection involves distinguishing between different utterance types based on the roles that they play in the formulation of a decision. In this paper, we describe how this approach can be implemented in real-time, and show that the resulting system's performance compares well with other detectors, including an off-line version."
2007.sigdial-1.37,Practical Dialogue Manager Development using {POMDP}s,2007,7,7,1,1,3187,trung bui,Proceedings of the 8th SIGdial Workshop on Discourse and Dialogue,0,"Partially Observable Markov Decision Processes (POMDPs) are attractive for dialogue management because they are made to deal with noise and partial information. This paper addresses the problem of using them in a practical development cycle. We apply factored POMDP models to three applications. We examine our experiences with respect to design choices and issues, and compare performance with hand-crafted policies."
