I08-4015,The Character-based {CRF} Segmenter of {MSRA}{\\&}{NEU} for the 4th Bakeoff,2008,10,6,3,1,48568,zhenxing wang,Proceedings of the Sixth {SIGHAN} Workshop on {C}hinese Language Processing,0,"This paper describes the Chinese Word Segmenter for the fourth International Chinese Language Processing Bakeoff. Base on Conditional Random Field (CRF) model, a basic segmenter is designed as a problem of character-based tagging. To further improve the performance of our segmenter, we employ a word-based approach to increase the in-vocabulary (IV) word recall and a post-processing to increase the out-of-vocabulary (OOV) word recall. We participate in the word segmentation closed test on all five corpora and our system achieved four second best and one the fifth in all the five corpora."
I08-2124,Towards Automated Semantic Analysis on Biomedical Research Articles,2008,24,3,3,0,46907,donghui feng,Proceedings of the Third International Joint Conference on Natural Language Processing: Volume-{II},0,"In this paper, we present an empirical study on adapting Conditional Random Fields (CRF) models to conduct semantic analysis on biomedical articles using active learning. We explore uncertaintybased active learning with the CRF model to dynamically select the most informative training examples. This abridges the power of the supervised methods and expensive human annotation cost."
I08-1048,Learning a Stopping Criterion for Active Learning for Word Sense Disambiguation and Text Classification,2008,19,32,1,1,5752,jingbo zhu,Proceedings of the Third International Joint Conference on Natural Language Processing: Volume-{I},0,"In this paper, we address the problem of knowing when to stop the process of active learning. We propose a new statistical learning approach, called minimum expected error strategy, to defining a stopping criterion through estimation of the classifierxe2x80x99s expected error on future unlabeled examples in the active learning process. In experiments on active learning for word sense disambiguation and text classification tasks, experimental results show that the new proposed stopping criterion can reduce approximately 50% human labeling costs in word sense disambiguation with degradation of 0.5% average accuracy, and approximately 90% costs in text classification with degradation of 2% average accuracy."
C08-1142,Multi-Criteria-Based Strategy to Stop Active Learning for Data Annotation,2008,21,33,1,1,5752,jingbo zhu,Proceedings of the 22nd International Conference on Computational Linguistics (Coling 2008),0,"In this paper, we address the issue of deciding when to stop active learning for building a labeled training corpus. Firstly, this paper presents a new stopping criterion, classification-change, which considers the potential ability of each unlabeled example on changing decision boundaries. Secondly, a multi-criteria-based combination strategy is proposed to solve the problem of predefining an appropriate threshold for each confidence-based stopping criterion, such as max-confidence, min-error, and overall-uncertainty. Finally, we examine the effectiveness of these stopping criteria on uncertainty sampling and heterogeneous uncertainty sampling for active learning. Experimental results show that these stopping criteria work well on evaluation data sets, and the combination strategies outperform individual criteria."
C08-1143,Active Learning with Sampling by Uncertainty and Density for Word Sense Disambiguation and Text Classification,2008,21,87,1,1,5752,jingbo zhu,Proceedings of the 22nd International Conference on Computational Linguistics (Coling 2008),0,"This paper addresses two issues of active learning. Firstly, to solve a problem of uncertainty sampling that it often fails by selecting outliers, this paper presents a new selective sampling technique, sampling by uncertainty and density (SUD), in which a k-Nearest-Neighbor-based density measure is adopted to determine whether an unlabeled example is an outlier. Secondly, a technique of sampling by clustering (SBC) is applied to build a representative initial training data set for active learning. Finally, we implement a new algorithm of active learning with SUD and SBC techniques. The experimental results from three real-world data sets show that our method outperforms competing methods, particularly at the early stages of active learning."
D07-1082,Active Learning for Word Sense Disambiguation with Methods for Addressing the Class Imbalance Problem,2007,28,129,1,1,5752,jingbo zhu,Proceedings of the 2007 Joint Conference on Empirical Methods in Natural Language Processing and Computational Natural Language Learning ({EMNLP}-{C}o{NLL}),0,"In this paper, we analyze the effect of resampling techniques, including undersampling and over-sampling used in active learning for word sense disambiguation (WSD). Experimental results show that under-sampling causes negative effects on active learning, but over-sampling is a relatively good choice. To alleviate the withinclass imbalance problem of over-sampling, we propose a bootstrap-based oversampling (BootOS) method that works better than ordinary over-sampling in active learning for WSD. Finally, we investigate when to stop active learning, and adopt two strategies, max-confidence and min-error, as stopping conditions for active learning. According to experimental results, we suggest a prediction solution by considering max-confidence as the upper bound and min-error as the lower bound for stopping conditions."
W06-0141,Designing Special Post-Processing Rules for {SVM}-Based {C}hinese Word Segmentation,2006,4,6,5,1,11745,muhua zhu,Proceedings of the Fifth {SIGHAN} Workshop on {C}hinese Language Processing,0,"We participated in the Third International Chinese Word Segmentation Bakeoff. Specifically, we evaluated our Chinese word segmenter NEUCipSeg in the close track, on all four corpora, namely Academis Sinica (AS), City University of Hong Kong (CITYU), Microsoft Research (MSRA), and University of Pennsylvania/University of Colorado (UPENN). Based on Support Vector Machines (SVMs), a basic segmenter is designed regarding Chinese word segmentation as a problem of character-based tagging. Moreover, we proposed postprocessing rules specially taking into account the properties of results brought out by the basic segmenter. Our system achieved good ranks in all four corpora."
I05-3015,Some Studies on {C}hinese Domain Knowledge Dictionary and Its Application to Text Classification,2005,8,3,1,1,5752,jingbo zhu,Proceedings of the Fourth {SIGHAN} Workshop on {C}hinese Language Processing,0,"In this paper, we study some issues on Chinese domain knowledge dictionary and its application to text classification task. First a domain knowledge hierarchy description framework and our Chinese domain knowledge dictionary named NEUKD are introduced. Second, to alleviate the cost of construction of domain knowledge dictionary by hand, we use a boostrapping-based algorithm to learn new domain associated terms from a large amount of unlabeled data. Third, we propose two models (BOTW and BOF) which use domain knowledge as textual features for text categorization. But due to limitation of size of domain knowledge dictionary, we further study machine learning technique to solve the problem, and propose a BOL model which could be considered as the extended version of BOF model. Naive Bayes classifier based on BOW model is used as baseline system in the comparison experiments. Experimental results show that domain knowledge is very useful for text categorization, and BOL model performs better than other three models, including BOW, BOTW and BOF models."
I05-1026,Using Multiple Discriminant Analysis Approach for Linear Text Segmentation,2005,23,4,1,1,5752,jingbo zhu,Second International Joint Conference on Natural Language Processing: Full Papers,0,"Research on linear text segmentation has been an on-going focus in NLP for the last decade, and it has great potential for a wide range of applications such as document summarization, information retrieval and text understanding. However, for linear text segmentation, there are two critical problems involving automatic boundary detection and automatic determination of the number of segments in a document. In this paper, we propose a new domain-independent statistical model for linear text segmentation. In our model, Multiple Discriminant Analysis (MDA) criterion function is used to achieve global optimization in finding the best segmentation by means of the largest word similarity within a segment and the smallest word similarity between segments. To alleviate the high computational complexity problem introduced by the model, genetic algorithms (GAs) are used. Comparative experimental results show that our method based on MDA criterion functions has achieved higher Pk measure (Beeferman) than that of the baseline system using TextTiling algorithm."
W02-1820,A Knowledge-based Approach to Text Classification,2002,10,8,1,1,5752,jingbo zhu,{COLING}-02: The First {SIGHAN} Workshop on {C}hinese Language Processing,0,The paper presents a simple and effective knowledge-based approach for the task of text classification. The approach uses topic identification algorithm named FIFA to text classification. In this paper the basic process of text classification task and FIFA algorithm are described in detail. At last some results of experiment and evaluations are discussed.
