D09-1081,Estimating Semantic Distance Using Soft Semantic Constraints in Knowledge-Source {--} Corpus Hybrid Models,2009,288,13,3,1,34833,yuval marton,Proceedings of the 2009 Conference on Empirical Methods in Natural Language Processing,0,"Strictly corpus-based measures of semantic distance conflate co-occurrence information pertaining to the many possible senses of target words. We propose a corpus-thesaurus hybrid method that uses soft constraints to generate word-senseaware distributional profiles (DPs) from coarser concept DPs (derived from a Roget-like thesaurus) and sense-unaware traditional word DPs (derived from raw text). Although it uses a knowledge source, the method is not vocabulary-limited: if the target word is not in the thesaurus, the method falls back gracefully on the word's co-occurrence information. This allows the method to access valuable information encoded in a lexical resource, such as a thesaurus, while still being able to effectively handle domain-specific terms and named entities. Experiments on word-pair ranking by semantic distance show the new hybrid method to be superior to others."
P08-1114,Soft Syntactic Constraints for Hierarchical Phrased-Based Translation,2008,28,111,2,1,34833,yuval marton,Proceedings of ACL-08: HLT,1,"In adding syntax to statistical MT, there is a tradeoff between taking advantage of linguistic analysis, versus allowing the model to exploit linguistically unmotivated mappings learned from parallel training data. A number of previous efforts have tackled this tradeoff by starting with a commitment to linguistically motivated analyses and then nding appropriate ways to soften that commitment. We present an approach that explores the tradeoff from the other direction, starting with a context-free translation model learned directly from aligned parallel text, and then adding soft constituent-level constraints based on parses of the source language. We obtain substantial improvements in performance for translation from Chinese and Arabic to English."
P08-1115,Generalizing Word Lattice Translation,2008,37,141,3,0,47926,christopher dyer,Proceedings of ACL-08: HLT,1,"Word lattice decoding has proven useful in spoken language translation; we argue that it provides a compelling model for translation of text genres, as well. We show that prior work in translating lattices using finite state techniques can be naturally extended to more expressive synchronous context-free grammarbased models. Additionally, we resolve a significant complication that non-linear word lattice inputs introduce in reordering models. Our experiments evaluating the approach demonstrate substantial gains for ChineseEnglish and Arabic-English translation."
I08-3008,Cross-Language Parser Adaptation between Related Languages,2008,17,86,2,0,5828,daniel zeman,Proceedings of the {IJCNLP}-08 Workshop on {NLP} for Less Privileged Languages,0,"The present paper describes an approach to adapting a parser to a new language. Presumably the target language is much poorer in linguistic resources than the source language. The technique has been tested on two European languages due to test data availability; however, it is easily applicable to any pair of sufficiently related languages, including some of the Indic language group. Our adaptation technique using existing annotations in the source language achieves performance equivalent to that obtained by training on 1546 trees in the target language."
D08-1024,Online Large-Margin Training of Syntactic and Structural Translation Features,2008,36,234,3,0.234375,3180,david chiang,Proceedings of the 2008 Conference on Empirical Methods in Natural Language Processing,0,"Minimum-error-rate training (MERT) is a bottleneck for current development in statistical machine translation because it is limited in the number of weights it can reliably optimize. Building on the work of Watanabe et al., we explore the use of the MIRA algorithm of Crammer et al. as an alternative to MERT. We first show that by parallel processing and exploiting more of the parse forest, we can obtain results using MIRA that match or surpass MERT in terms of both translation quality and computational cost. We then test the method on two classes of features that address deficiencies in the Hiero hierarchical phrase-based model: first, we simultaneously train a large number of Marton and Resnik's soft syntactic constraints, and, second, we introduce a novel structural distortion model. In both cases we obtain significant improvements in translation performance. Optimizing them in combination, for a total of 56 feature weights, we improve performance by 2.6 Bleu on a subset of the NIST 2006 Arabic-English evaluation data."
2008.amta-papers.13,Are Multiple Reference Translations Necessary? Investigating the Value of Paraphrased Reference Translations in Parameter Optimization,2008,-1,-1,2,0.897436,16057,nitin madnani,Proceedings of the 8th Conference of the Association for Machine Translation in the Americas: Research Papers,0,"Most state-of-the-art statistical machine translation systems use log-linear models, which are defined in terms of hypothesis features and weights for those features. It is standard to tune the feature weights in order to maximize a translation quality metric, using held-out test sentences and their corresponding reference translations. However, obtaining reference translations is expensive. In our earlier work (Madnani et al., 2007), we introduced a new full-sentence paraphrase technique, based on English-to-English decoding with an MT system, and demonstrated that the resulting paraphrases can be used to cut the number of human reference translations needed in half. In this paper, we take the idea a step further, asking how far it is possible to get with just a single good reference translation for each item in the development set. Our analysis suggests that it is necessary to invest in four or more human translations in order to significantly improve on a single translation augmented by monolingual paraphrases."
W07-0716,Using Paraphrases for Parameter Tuning in Statistical Machine Translation,2007,25,70,3,0.952381,16057,nitin madnani,Proceedings of the Second Workshop on Statistical Machine Translation,0,"Most state-of-the-art statistical machine translation systems use log-linear models, which are defined in terms of hypothesis features and weights for those features. It is standard to tune the feature weights in order to maximize a translation quality metric, using held-out test sentences and their corresponding reference translations. However, obtaining reference translations is expensive. In this paper, we introduce a new full-sentence paraphrase technique, based on English-to-English decoding with an MT system, and we demonstrate that the resulting paraphrases can be used to drastically reduce the number of human reference translations needed for parameter tuning, without a significant decrease in translation quality."
S07-1071,"Tor, {T}or{M}d: Distributional Profiles of Concepts for Unsupervised Word Sense Disambiguation",2007,12,6,3,0.454545,13005,saif mohammad,Proceedings of the Fourth International Workshop on Semantic Evaluations ({S}em{E}val-2007),0,"Words in the context of a target word have long been used as features by supervised word-sense classifiers. Mohammad and Hirst (2006a) proposed a way to determine the strength of association between a sense or concept and co-occurring words---the distributional profile of a concept (DPC)---without the use of manually annotated data. We implemented an unsupervised naive Bayes word sense classifier using these DPCs that was best or within one percentage point of the best unsupervised systems in the Multilingual Chinese-English Lexical Sample Task (task #5) and the English Lexical Sample Task (task #17). We also created a simple PMI-based classifier to attempt the English Lexical Substitution Task (task #10); however, its performance was poor."
2006.amta-papers.11,"Word-Based Alignment, Phrase-Based Translation: What{'}s the Link?",2006,30,48,2,1,1313,adam lopez,Proceedings of the 7th Conference of the Association for Machine Translation in the Americas: Technical Papers,0,"State-of-the-art statistical machine translation is based on alignments between phrases {--} sequences of words in the source and target sentences. The learning step in these systems often relies on alignments between words. It is often assumed that the quality of this word alignment is critical for translation. However, recent results suggest that the relationship between alignment quality and translation quality is weaker than previously thought. We investigate this question directly, comparing the impact of high-quality alignments with a carefully constructed set of degraded alignments. In order to tease apart various interactions, we report experiments investigating the impact of alignments on different aspects of the system. Our results confirm a weak correlation, but they also illustrate that more data and better feature engineering may be more beneficial than better alignment."
W05-0812,Improved {HMM} Alignment Models for Languages with Scarce Resources,2005,14,25,2,1,1313,adam lopez,Proceedings of the {ACL} Workshop on Building and Using Parallel Texts,0,"We introduce improvements to statistical word alignment based on the Hidden Markov Model. One improvement incorporates syntactic knowledge. Results on the workshop data show that alignment performance exceeds that of a state-of-the art system based on more complex models, resulting in over a 5.5% absolute reduction in error on Romanian-English."
P05-3009,The {L}inguist{'}s {S}earch {E}ngine: An Overview,2005,14,37,1,1,8279,philip resnik,Proceedings of the {ACL} Interactive Poster and Demonstration Sessions,0,"The Linguist's Search Engine (LSE) was designed to provide an intuitive, easy-to-use interface that enables language researchers to seek linguistically interesting examples on the Web, based on syntactic and lexical criteria. We briefly describe its user interface and architecture, as well as recent developments that include LSE search capabilities for Chinese."
H05-2007,Pattern Visualization for Machine Translation Output,2005,7,6,2,1,1313,adam lopez,Proceedings of {HLT}/{EMNLP} 2005 Interactive Demonstrations,0,"We describe a method for identifying systematic patterns in translation data using part-of-speech tag sequences. We incorporate this analysis into a diagnostic tool intended for developers of machine translation systems, and demonstrate how our application can be used by developers to explore patterns in machine translation output."
H05-1098,"The {H}iero Machine Translation System: Extensions, Evaluation, and Analysis",2005,27,54,5,0.234375,3180,david chiang,Proceedings of Human Language Technology Conference and Conference on Empirical Methods in Natural Language Processing,0,"Hierarchical organization is a well known property of language, and yet the notion of hierarchical structure has been largely absent from the best performing machine translation systems in recent community-wide evaluations. In this paper, we discuss a new hierarchical phrase-based statistical machine translation system (Chiang, 2005), presenting recent extensions to the original proposal, new evaluation results in a community-wide evaluation, and a novel technique for fine-grained comparative analysis of MT systems."
H05-1109,{OCR} Post-Processing for Low Density Languages,2005,19,18,2,1,51121,okan kolak,Proceedings of Human Language Technology Conference and Conference on Empirical Methods in Natural Language Processing,0,"We present a lexicon-free post-processing method for optical character recognition (OCR), implemented using weighted finite state machines. We evaluate the technique in a number of scenarios relevant for natural language processing, including creation of new OCR capabilities for low density languages, improvement of OCR performance for a native commercial system, acquisition of knowledge from a foreign-language dictionary, creation of a parallel text, and machine translation from OCR output."
W04-0821,The {U}niversity of {M}aryland Senseval-3 system descriptions,2004,8,2,3,0,51634,clara cabezas,"Proceedings of {SENSEVAL}-3, the Third International Workshop on the Evaluation of Systems for the Semantic Analysis of Text",0,None
P04-1048,Inducing Frame Semantic Verb Classes from {W}ord{N}et and {LDOCE},2004,15,24,3,1,50483,rebecca green,Proceedings of the 42nd Annual Meeting of the Association for Computational Linguistics ({ACL}-04),1,"This paper presents SemFrame, a system that induces frame semantic verb classes from WordNet and LDOCE. Semantic frames are thought to have significant potential in resolving the paraphrase problem challenging many language-based applications.When compared to the handcrafted FrameNet, SemFrame achieves its best recall-precision balance with 83.2% recall (based on SemFrame's coverage of FrameNet frames) and 73.8% precision (based on SemFrame verbs' semantic relatedness to frame-evoking verbs). The next best performing semantic verb classes achieve 56.9% recall and 55.0% precision."
N03-2026,Desparately Seeking {C}ebuano,2003,2,7,5,0.625,12879,douglas oard,Companion Volume of the Proceedings of {HLT}-{NAACL} 2003 - Short Papers,0,This paper describes an effort to rapidly develop language resources and component technology to support searching Cebuano news stories using English queries. Results from the first 60 hours of the exercise are presented.
N03-1018,A Generative Probabilistic {OCR} Model for {NLP} Applications,2003,22,55,3,1,51121,okan kolak,Proceedings of the 2003 Human Language Technology Conference of the North {A}merican Chapter of the Association for Computational Linguistics,0,"In this paper, we introduce a generative probabilistic optical character recognition (OCR) model that describes an end-to-end process in the noisy channel framework, progressing from generation of true text through its transformation into the noisy output of an OCR system. The model is designed for use in error correction, with a focus on post-processing the output of black-box OCR systems in order to make it more useful for NLP tasks. We present an implementation of the model based on finite-state models, demonstrate the model's ability to significantly reduce character and word error rate, and provide evaluation results involving automatic extraction of translation lexicons from printed text."
J03-3002,The Web as a Parallel Corpus,2003,39,492,1,1,8279,philip resnik,Computational Linguistics,0,"Parallel corpora have become an essential resource for work in multilingual natural language processing. In this article, we report on our work using the STRAND system for mining parallel text on the World Wide Web,first reviewing the original algorithm and results and then presenting a set of significant enhancements. These enhancements include the use of supervised learning based on structural features of documents to improve classification performance, a new content-based measure of translational equivalence, and adaptation of the system to take advantage of the Internet Archive for mining parallel text from the Web on a large scale. Finally, the value of these techniques is demonstrated in the construction of a significant parallel corpus for a low-density language pair."
P02-1033,An Unsupervised Method for Word Sense Tagging using Parallel Corpora,2002,26,209,2,0,7377,mona diab,Proceedings of the 40th Annual Meeting of the Association for Computational Linguistics,1,"We present an unsupervised method for word sense disambiguation that exploits translation correspondences in parallel corpora. The technique takes advantage of the fact that cross-language lexicalizations of the same concept tend to be consistent, preserving some core element of its semantics, and yet also variable, reflecting differing translator preferences and the influence of context. Working with parallel corpora introduces an extra complication for evaluation, since it is difficult to find a corpus that is both sense tagged and parallel with another language; therefore we use pseudo-translations, created by machine translation systems, in order to make possible the evaluation of the approach against a standard test set. The results demonstrate that word-level translation correspondences are a valuable source of information for sense disambiguation."
P02-1050,Evaluating Translational Correspondence using Annotation Projection,2002,25,105,2,0,238,rebecca hwa,Proceedings of the 40th Annual Meeting of the Association for Computational Linguistics,1,"Recently, statistical machine translation models have begun to take advantage of higher level linguistic structures such as syntactic dependencies. Underlying these models is an assumption about the directness of translational correspondence between sentences in the two languages; however, the extent to which this assumption is valid and useful is not well understood. In this paper, we present an empirical study that quantifies the degree to which syntactic dependencies are preserved when parses are projected directly from English to Chinese. Our results show that although the direct correspondence assumption is often too restrictive, a small set of principled, elementary linguistic transformations can boost the quality of the projected Chinese parses by 76% relative to the unimproved baseline."
S01-1014,Supervised Sense Tagging using Support Vector Machines,2001,10,23,2,0,51634,clara cabezas,Proceedings of {SENSEVAL}-2 Second International Workshop on Evaluating Word Sense Disambiguation Systems,0,"We describe the University of Maryland's supervised sense tagger, which participated in the SENSEVAL-2 lexical sample evaluations for English, Spanish, and Swedish; we also present unofficial results for Basque. We designed a highly modular combination of language-independent feature extraction and supervised learning using support vector machines in order to permit rapid ramp-up, language independence, and capability for future expansion."
P01-1032,Mapping Lexical Entries in a Verbs Database to {W}ord{N}et Senses,2001,19,12,4,1,50483,rebecca green,Proceedings of the 39th Annual Meeting of the Association for Computational Linguistics,1,"This paper describes automatic techniques for mapping 9611 entries in a database of English verbs to WordNet senses. The verbs were initially grouped into 491 classes based on syntactic features. Mapping these verbs into WordNet senses provides a resource that supports disambiguation in multilingual applications such as machine translation and cross-language information retrieval. Our techniques make use of (1) a training set of 1791 disambiguated entries, representing 1442 verb entries from 167 classes; (2) word sense probabilities, from frequency counts in a tagged corpus; (3) semantic similarity of WordNet senses for verbs within the same class; (4) probabilistic correlations between WordNet data and attributes of the verb classes. The best results achieved 72% precision and 58% recall, versus a lower bound of 62% precision and 38% recall for assigning the most frequently occurring WordNet sense, and an upper bound of 87% precision and 75% recall for human judgment."
J01-4009,Book Reviews: Parallel Text Processing: Alignment and Use of Translation Corpora,2001,2,0,1,1,8279,philip resnik,Computational Linguistics,0,None
H01-1033,Improved Cross-Language Retrieval using Backoff Translation,2001,7,36,1,1,8279,philip resnik,Proceedings of the First International Conference on Human Language Technology Research,0,"The limited coverage of available translation lexicons can pose a serious challenge in some cross-language information retrieval applications. We present two techniques for combining evidence from dictionary-based and corpus-based translation lexicons, and show that backoff translation outperforms a technique based on merging lexicons."
H01-1060,Rapidly Retargetable Interactive Translingual Retrieval,2001,2,4,3,0,11446,ginaanne levow,Proceedings of the First International Conference on Human Language Technology Research,0,"This paper describes a system for rapidly retargetable interactive translingual retrieval. Basic functionality can be achieved for a new document language in a single day, and further improvements require only a relatively modest additional investment. We applied the techniques first to search Chinese collections using English queries, and have successfully added French, German, and Italian document collections. We achieve this capability through separation of language-dependent and language-independent components and through the application of asymmetric techniques that leverage an extensive English retrieval infrastructure."
P99-1068,Mining the Web for Bilingual Text,1999,5,233,1,1,8279,philip resnik,Proceedings of the 37th Annual Meeting of the Association for Computational Linguistics,1,"STRAND (Resnik, 1998) is a language-independent system for automatic discovery of text in parallel translation on the World Wide Web. This paper extends the preliminary STRAND results by adding automatic language identification, scaling up by orders of magnitude, and formally evaluating performance. The most recent end-product is an automatically acquired parallel corpus comprising 2491 English-French document pairs, approximately 1.5 million words per language."
resnik-1998-parallel,Parallel strands: a preliminary investigation into mining the Web for bilingual text,1998,10,90,1,1,8279,philip resnik,Proceedings of the Third Conference of the Association for Machine Translation in the Americas: Technical Papers,0,"Parallel corpora are a valuable resource for machine translation, but at present their availability and utility is limited by genre- and domain-specificity, licensing restrictions, and the basic dificulty of locating parallel texts in all but the most dominant of the world{'}s languages. A parallel corpus resource not yet explored is the World Wide Web, which hosts an abundance of pages in parallel translation, offering a potential solution to some of these problems and unique opportunities of its own. This paper presents the necessary first step in that exploration: a method for automatically finding parallel translated documents on the Web. The technique is conceptually simple, fully language independent, and scalable, and preliminary evaluation results indicate that the method may be accurate enough to apply without human intervention."
W97-0907,A Language Identification Application Built on the {J}ava Client / Server Platform,1997,-1,-1,2,0,55536,gary adams,From Research to Commercial Applications: Making {NLP} Work in Practice,0,None
W97-0209,Selectional Preference and Sense Disambiguation,1997,-1,-1,1,1,8279,philip resnik,"Tagging Text with Lexical Semantics: Why, What, and How?",0,None
W97-0213,A Perspective on Word Sense Disambiguation Methods and Their Evaluation,1997,-1,-1,1,1,8279,philip resnik,"Tagging Text with Lexical Semantics: Why, What, and How?",0,None
W97-0217,Evaluating Automatic Semantic Taggers,1997,-1,-1,1,1,8279,philip resnik,"Tagging Text with Lexical Semantics: Why, What, and How?",0,None
A97-1050,Semi-Automatic Acquisition of Domain-Specific Translation Lexicons,1997,22,36,1,1,8279,philip resnik,Fifth Conference on Applied Natural Language Processing,0,"We investigate the utility of an algorithm for translation lexicon acquisition (SABLE), used previously on a very large corpus to acquire general translation lexicons, when that algorithm is applied to a much smaller corpus to produce candidates for domain-specific translation lexicons."
W95-0105,Disambiguating Noun Groupings with Respect to {W}ordnet Senses,1995,17,27,1,1,8279,philip resnik,Third Workshop on Very Large Corpora,0,"Word groupings useful for language processing tasks are increasingly available, as thesauri appear on-line, and as distributional word clustering techniques improve. However, for many tasks, one is interested in relationships among word {em senses}, not words. This paper presents a method for automatic sense disambiguation of nouns appearing within sets of related nouns --- the kind of data one finds in on-line thesauri, or as the output of distributional clustering algorithms. Disambiguation is performed with respect to WordNet senses, which are fairly fine-grained; however, the method also permits the assignment of higher-level WordNet categories rather than sense labels. The method is illustrated primarily by example, though results of a more rigorous evaluation are also presented."
C94-2195,A Rule-Based Approach to Prepositional Phrase Attachment Disambiguation,1994,18,163,2,0,51339,eric brill,{COLING} 1994 Volume 2: The 15th {I}nternational {C}onference on {C}omputational {L}inguistics,0,"In this paper, we describe a new corpus-based approach to prepositional phrase attachment disambiguation, and present results comparing performance of this algorithm with other corpus-based approaches to this problem."
