N19-1411,Stochastic {W}asserstein Autoencoder for Probabilistic Sentence Generation,2019,0,3,3,0,10555,hareesh bahuleyan,"Proceedings of the 2019 Conference of the North {A}merican Chapter of the Association for Computational Linguistics: Human Language Technologies, Volume 1 (Long and Short Papers)",0,"The variational autoencoder (VAE) imposes a probabilistic distribution (typically Gaussian) on the latent space and penalizes the Kullback-Leibler (KL) divergence between the posterior and prior. In NLP, VAEs are extremely difficult to train due to the problem of KL collapsing to zero. One has to implement various heuristics such as KL weight annealing and word dropout in a carefully engineered manner to successfully train a VAE for text. In this paper, we propose to use the Wasserstein autoencoder (WAE) for probabilistic sentence generation, where the encoder could be either stochastic or deterministic. We show theoretically and empirically that, in the original WAE, the stochastically encoded Gaussian distribution tends to become a Dirac-delta function, and we propose a variant of WAE that encourages the stochasticity of the encoder. Experimental results show that the latent space learned by WAE exhibits properties of continuity and smoothness as in VAEs, while simultaneously achieving much higher BLEU scores for sentence reconstruction."
D19-2005,Discreteness in Neural Natural Language Processing,2019,0,0,2,0.537576,1040,lili mou,Proceedings of the 2019 Conference on Empirical Methods in Natural Language Processing and the 9th International Joint Conference on Natural Language Processing (EMNLP-IJCNLP): Tutorial Abstracts,0,"This tutorial provides a comprehensive guide to the process of discreteness in neural NLP.As a gentle start, we will briefly introduce the background of deep learning based NLP, where we point out the ubiquitous discreteness of natural language and its challenges in neural information processing. Particularly, we will focus on how such discreteness plays a role in the input space, the latent space, and the output space of a neural network. In each part, we will provide examples, discuss machine learning techniques, as well as demonstrate NLP applications."
Q18-1011,Modeling Past and Future for Neural Machine Translation,2018,0,12,2,0,13513,zaixiang zheng,Transactions of the Association for Computational Linguistics,0,"Existing neural machine translation systems do not explicitly model what has been translated and what has not during the decoding phase. To address this problem, we propose a novel mechanism that separates the source information into two parts: translated Past contents and untranslated Future contents, which are modeled by two additional recurrent layers. The Past and Future contents are fed to both the attention model and the decoder states, which provides Neural Machine Translation (NMT) systems with the knowledge of translated and untranslated contents. Experimental results show that the proposed approach significantly improves the performance in Chinese-English, German-English, and English-German translation tasks. Specifically, the proposed model outperforms the conventional coverage model in terms of both the translation quality and the alignment error rate."
L18-1145,Dynamic Oracle for Neural Machine Translation in Decoding Phase,2018,-1,-1,2,0,3585,ziyi dou,Proceedings of the Eleventh International Conference on Language Resources and Evaluation ({LREC} 2018),0,None
D18-1492,On Tree-Based Neural Sentence Modeling,2018,35,1,2,0,8227,haoyue shi,Proceedings of the 2018 Conference on Empirical Methods in Natural Language Processing,0,"Neural networks with tree-based sentence encoders have shown better results on many downstream tasks. Most of existing tree-based encoders adopt syntactic parsing trees as the explicit structure prior. To study the effectiveness of different tree structures, we replace the parsing trees with trivial trees (i.e., binary balanced tree, left-branching tree and right-branching tree) in the encoders. Though trivial trees contain no syntactic information, those encoders get competitive or even better results on all of the ten downstream tasks we investigated. This surprising result indicates that explicit syntax guidance may not be the main contributor to the superior performances of tree-based neural sentence modeling. Further analysis show that tree modeling gives better results when crucial words are closer to the final representation. Additional experiments give more clues on how to design an effective tree-based encoder. Our code is open-source and available at \url{https://github.com/ExplorerFreda/TreeEnc}."
P17-2092,Chunk-Based Bi-Scale Decoder for Neural Machine Translation,2017,22,6,1,1,7253,hao zhou,Proceedings of the 55th Annual Meeting of the Association for Computational Linguistics (Volume 2: Short Papers),0,"In typical neural machine translation (NMT), the decoder generates a sentence word by word, packing all linguistic granularities in the same time-scale of RNN. In this paper, we propose a new type of decoder for NMT, which splits the decode state into two parts and updates them in two different time-scales. Specifically, we first predict a chunk time-scale state for phrasal modeling, on top of which multiple word time-scale states are generated. In this way, the target sentence is translated hierarchically from chunks to words, with information in different granularities being leveraged. Experiments show that our proposed model significantly improves the translation performance over the state-of-the-art NMT model."
D17-1079,Word-Context Character Embeddings for {C}hinese Word Segmentation,2017,0,16,1,1,7253,hao zhou,Proceedings of the 2017 Conference on Empirical Methods in Natural Language Processing,0,"Neural parsers have benefited from automatically labeled data via dependency-context word embeddings. We investigate training character embeddings on a word-based context in a similar way, showing that the simple method improves state-of-the-art neural word segmentation models significantly, beating tri-training baselines for leveraging auto-segmented data."
P16-1132,A Search-Based Dynamic Reranking Model for Dependency Parsing,2016,24,2,1,1,7253,hao zhou,Proceedings of the 54th Annual Meeting of the Association for Computational Linguistics (Volume 1: Long Papers),1,None
L16-1104,Evaluating a Deterministic Shift-Reduce Neural Parser for Constituent Parsing,2016,22,0,1,1,7253,hao zhou,Proceedings of the Tenth International Conference on Language Resources and Evaluation ({LREC}'16),0,"Greedy transition-based parsers are appealing for their very fast speed, with reasonably high accuracies. In this paper, we build a fast shift-reduce neural constituent parser by using a neural network to make local decisions. One challenge to the parsing speed is the large hidden and output layer sizes caused by the number of constituent labels and branching options. We speed up the parser by using a hierarchical output layer, inspired by the hierarchical log-bilinear neural language model. In standard WSJ experiments, the neural parser achieves an almost 2.4 time speed up (320 sen/sec) compared to a non-hierarchical baseline without significant accuracy loss (89.06 vs 89.13 F-score)."
C16-1191,Context-aware Natural Language Generation for Spoken Dialogue Systems,2016,13,7,1,1,7253,hao zhou,"Proceedings of {COLING} 2016, the 26th International Conference on Computational Linguistics: Technical Papers",0,"Natural language generation (NLG) is an important component of question answering(QA) systems which has a significant impact on system quality. Most tranditional QA systems based on templates or rules tend to generate rigid and stylised responses without the natural variation of human language. Furthermore, such methods need an amount of work to generate the templates or rules. To address this problem, we propose a Context-Aware LSTM model for NLG. The model is completely driven by data without manual designed templates or rules. In addition, the context information, including the question to be answered, semantic values to be addressed in the response, and the dialogue act type during interaction, are well approached in the neural network model, which enables the model to produce variant and informative responses. The quantitative evaluation and human evaluation show that CA-LSTM obtains state-of-the-art performance."
P15-1117,A Neural Probabilistic Structured-Prediction Model for Transition-Based Dependency Parsing,2015,35,46,1,1,7253,hao zhou,Proceedings of the 53rd Annual Meeting of the Association for Computational Linguistics and the 7th International Joint Conference on Natural Language Processing (Volume 1: Long Papers),1,"Neural probabilistic parsers are attractive for their capability of automatic feature combination and small data sizes. A transition-based greedy neural parser has given better accuracies over its linear counterpart. We propose a neural probabilistic structured-prediction model for transition-based dependency parsing, which integrates search and learning. Beam search is used for decoding, and contrastive learning is performed for maximizing the sentence-level log-likelihood. In standard Penn Treebank experiments, the structured neural parser achieves a 1.8% accuracy improvement upon a competitive greedy neural parser baseline, giving performance comparable to the best linear parser."
W12-6312,Adapting Conventional {C}hinese Word Segmenter for Segmenting Micro-blog Text: Combining Rule-based and Statistic-based Approaches,2012,10,0,6,0,38442,ning xi,Proceedings of the Second {CIPS}-{SIGHAN} Joint Conference on {C}hinese Language Processing,0,"We describe two adaptation strategies which are used in our word segmentation system in participating the Microblog word segmentation bake-off: Domain invariant information is extracted from the in-domain unlabelled corpus, and is incorporated as supplementary features to conventional word segmenter based on Conditional Random Field (CRF), we call it statistic-based adaptation. Some heuristic rules are further used to post-process the word segmentation result in order to better handle the characters in emoticons, name entities and special punctuation patterns which extensively exist in micro-blog text, and we call it rule-based adaptation. Experimentally, using both adaptation strategies, our system achieved 92.46 points of F-score, compared with 88.73 points of F-score of the unadapted CRF word segmenter on the pre-released development data. Our system achieved 92.51 points of F-score on the final test data."
