2021.naacl-srw.9,Open-Domain Question Answering with Pre-Constructed Question Spaces,2021,-1,-1,4,0,3185,jinfeng xiao,Proceedings of the 2021 Conference of the North American Chapter of the Association for Computational Linguistics: Student Research Workshop,0,"Open-domain question answering aims at locating the answers to user-generated questions in massive collections of documents. Retriever-readers and knowledge graph approaches are two big families of solutions to this task. A retriever-reader first applies information retrieval techniques to locate a few passages that are likely to be relevant, and then feeds the retrieved text to a neural network reader to extract the answer. Alternatively, knowledge graphs can be constructed and queried to answer users{'} questions. We propose an algorithm with a novel reader-retriever design that differs from both families. Our reader-retriever first uses an offline reader to read the corpus and generate collections of all answerable questions associated with their answers, and then uses an online retriever to respond to user queries by searching the pre-constructed question spaces for answers that are most likely to be asked in the given way. We further combine one retriever-reader and two reader-retrievers into a hybrid model called R6 for the best performance. Experiments with two large-scale public datasets show that R6 achieves state-of-the-art accuracy."
2021.naacl-main.170,{KPQA}: A Metric for Generative Question Answering Using Keyphrase Weights,2021,-1,-1,5,1,3779,hwanhee lee,Proceedings of the 2021 Conference of the North American Chapter of the Association for Computational Linguistics: Human Language Technologies,0,"In the automatic evaluation of generative question answering (GenQA) systems, it is difficult to assess the correctness of generated answers due to the free-form of the answer. Especially, widely used n-gram similarity metrics often fail to discriminate the incorrect answers since they equally consider all of the tokens. To alleviate this problem, we propose KPQA metric, a new metric for evaluating the correctness of GenQA. Specifically, our new metric assigns different weights to each token via keyphrase prediction, thereby judging whether a generated answer sentence captures the key meaning of the reference answer. To evaluate our metric, we create high-quality human judgments of correctness on two GenQA datasets. Using our human-evaluation datasets, we show that our proposed metric has a significantly higher correlation with human judgments than existing metrics in various datasets. Code for KPQA-metric will be available at https://github.com/hwanheelee1993/KPQA."
2021.naacl-main.274,A Context-Dependent Gated Module for Incorporating Symbolic Semantics into Event Coreference Resolution,2021,-1,-1,3,1,715,tuan lai,Proceedings of the 2021 Conference of the North American Chapter of the Association for Computational Linguistics: Human Language Technologies,0,"Event coreference resolution is an important research problem with many applications. Despite the recent remarkable success of pre-trained language models, we argue that it is still highly beneficial to utilize symbolic features for the task. However, as the input for coreference resolution typically comes from upstream components in the information extraction pipeline, the automatically extracted symbolic features can be noisy and contain errors. Also, depending on the specific context, some features can be more informative than others. Motivated by these observations, we propose a novel context-dependent gated module to adaptively control the information flows from the input symbolic features. Combined with a simple noisy training method, our best models achieve state-of-the-art results on two datasets: ACE 2005 and KBP 2016."
2021.naacl-main.283,{X}-{METRA}-{ADA}: Cross-lingual Meta-Transfer learning Adaptation to Natural Language Understanding and Question Answering,2021,-1,-1,4,0,4088,meryem mhamdi,Proceedings of the 2021 Conference of the North American Chapter of the Association for Computational Linguistics: Human Language Technologies,0,"Multilingual models, such as M-BERT and XLM-R, have gained increasing popularity, due to their zero-shot cross-lingual transfer learning capabilities. However, their generalization ability is still inconsistent for typologically diverse languages and across different benchmarks. Recently, meta-learning has garnered attention as a promising technique for enhancing transfer learning under low-resource scenarios: particularly for cross-lingual transfer in Natural Language Understanding (NLU). In this work, we propose X-METRA-ADA, a cross-lingual MEta-TRAnsfer learning ADAptation approach for NLU. Our approach adapts MAML, an optimization-based meta-learning approach, to learn to adapt to new languages. We extensively evaluate our framework on two challenging cross-lingual NLU tasks: multilingual task-oriented dialog and typologically diverse question answering. We show that our approach outperforms naive fine-tuning, reaching competitive performance on both tasks for most languages. Our analysis reveals that X-METRA-ADA can leverage limited data for faster adaptation."
2021.findings-acl.98,Out of Order: How important is the sequential order of words in a sentence in Natural Language Understanding tasks?,2021,-1,-1,2,0,7730,thang pham,Findings of the Association for Computational Linguistics: ACL-IJCNLP 2021,0,None
2021.emnlp-main.144,Few-Shot Intent Detection via Contrastive Pre-Training and Fine-Tuning,2021,-1,-1,2,0,8654,jianguo zhang,Proceedings of the 2021 Conference on Empirical Methods in Natural Language Processing,0,"In this work, we focus on a more challenging few-shot intent detection scenario where many intents are fine-grained and semantically similar. We present a simple yet effective few-shot intent detection schema via contrastive pre-training and fine-tuning. Specifically, we first conduct self-supervised contrastive pre-training on collected intent datasets, which implicitly learns to discriminate semantically similar utterances without using any labels. We then perform few-shot intent detection together with supervised contrastive learning, which explicitly pulls utterances from the same intent closer and pushes utterances across different intents farther. Experimental results show that our proposed method achieves state-of-the-art performance on three challenging intent detection datasets under 5-shot and 10-shot settings."
2021.emnlp-main.520,{S}tream{H}over: Livestream Transcript Summarization and Annotation,2021,-1,-1,4,0,9735,sangwoo cho,Proceedings of the 2021 Conference on Empirical Methods in Natural Language Processing,0,"With the explosive growth of livestream broadcasting, there is an urgent need for new summarization technology that enables us to create a preview of streamed content and tap into this wealth of knowledge. However, the problem is nontrivial due to the informal nature of spoken language. Further, there has been a shortage of annotated datasets that are necessary for transcript summarization. In this paper, we present StreamHover, a framework for annotating and summarizing livestream transcripts. With a total of over 500 hours of videos annotated with both extractive and abstractive summaries, our benchmark dataset is significantly larger than currently existing annotated corpora. We explore a neural extractive summarization model that leverages vector-quantized variational autoencoder to learn latent vector representations of spoken utterances and identify salient utterances from the transcripts to form summaries. We show that our model generalizes better and improves performance over strong baselines. The results of this study provide an avenue for future research to improve summarization solutions for efficient browsing of livestreams."
2021.bionlp-1.28,{UCSD}-Adobe at {MEDIQA} 2021: Transfer Learning and Answer Sentence Selection for Medical Summarization,2021,-1,-1,4,0.833333,2776,khalil mrini,Proceedings of the 20th Workshop on Biomedical Language Processing,0,"In this paper, we describe our approach to question summarization and multi-answer summarization in the context of the 2021 MEDIQA shared task (Ben Abacha et al., 2021). We propose two kinds of transfer learning for the abstractive summarization of medical questions. First, we train on HealthCareMagic, a large question summarization dataset collected from an online healthcare service platform. Second, we leverage the ability of the BART encoder-decoder architecture to model both generation and classification tasks to train on the task of Recognizing Question Entailment (RQE) in the medical domain. We show that both transfer learning methods combined achieve the highest ROUGE scores. Finally, we cast the question-driven extractive summarization of multiple relevant answer documents as an Answer Sentence Selection (AS2) problem. We show how we can preprocess the MEDIQA-AnS dataset such that it can be trained in an AS2 setting. Our AS2 model is able to generate extractive summaries achieving high ROUGE scores."
2021.acl-short.29,{UMIC}: An Unreferenced Metric for Image Captioning via Contrastive Learning,2021,-1,-1,4,1,3779,hwanhee lee,Proceedings of the 59th Annual Meeting of the Association for Computational Linguistics and the 11th International Joint Conference on Natural Language Processing (Volume 2: Short Papers),0,"Despite the success of various text generation metrics such as BERTScore, it is still difficult to evaluate the image captions without enough reference captions due to the diversity of the descriptions. In this paper, we introduce a new metric UMIC, an Unreferenced Metric for Image Captioning which does not require reference captions to evaluate image captions. Based on Vision-and-Language BERT, we train UMIC to discriminate negative captions via contrastive learning. Also, we observe critical problems of the previous benchmark dataset (i.e., human annotations) on image captioning metric, and introduce a new collection of human annotations on the generated captions. We validate UMIC on four datasets, including our new dataset, and show that UMIC has a higher correlation than all previous metrics that require multiple references."
2021.acl-long.119,A Gradually Soft Multi-Task and Data-Augmented Approach to Medical Question Understanding,2021,-1,-1,4,0.833333,2776,khalil mrini,Proceedings of the 59th Annual Meeting of the Association for Computational Linguistics and the 11th International Joint Conference on Natural Language Processing (Volume 1: Long Papers),1,"Users of medical question answering systems often submit long and detailed questions, making it hard to achieve high recall in answer retrieval. To alleviate this problem, we propose a novel Multi-Task Learning (MTL) method with data augmentation for medical question understanding. We first establish an equivalence between the tasks of question summarization and Recognizing Question Entailment (RQE) using their definitions in the medical domain. Based on this equivalence, we propose a data augmentation algorithm to use just one dataset to optimize for both tasks, with a weighted MTL loss. We introduce gradually soft parameter-sharing: a constraint for decoder parameters to be close, that is gradually loosened as we move to the highest layer. We show through ablation studies that our proposed novelties improve performance. Our method outperforms existing MTL methods across 4 datasets of medical question pairs, in ROUGE scores, RQE accuracy and human evaluation. Finally, we show that our method fares better than single-task learning under 4 low-resource settings."
2020.nli-1.4,Efficient Deployment of Conversational Natural Language Interfaces over Databases,2020,-1,-1,2,0,16424,anthony colas,Proceedings of the First Workshop on Natural Language Interfaces,0,"Many users communicate with chatbots and AI assistants in order to help them with various tasks. A key component of the assistant is the ability to understand and answer a user{'}s natural language questions for question-answering (QA). Because data can be usually stored in a structured manner, an essential step involves turning a natural language question into its corresponding query language. However, in order to train most natural language-to-query-language state-of-the-art models, a large amount of training data is needed first. In most domains, this data is not available and collecting such datasets for various domains can be tedious and time-consuming. In this work, we propose a novel method for accelerating the training dataset collection for developing the natural language-to-query-language machine learning models. Our system allows one to generate conversational multi-term data, where multiple turns define a dialogue session, enabling one to better utilize chatbot interfaces. We train two current state-of-the-art NL-to-QL models, on both an SQL and SPARQL-based datasets in order to showcase the adaptability and efficacy of our created data."
2020.lrec-1.51,Adjusting Image Attributes of Localized Regions with Low-level Dialogue,2020,29,0,3,0,4683,tzuhsiang lin,Proceedings of the 12th Language Resources and Evaluation Conference,0,"Natural Language Image Editing (NLIE) aims to use natural language instructions to edit images. Since novices are inexperienced with image editing techniques, their instructions are often ambiguous and contain high-level abstractions which require complex editing steps. Motivated by this inexperience aspect, we aim to smooth the learning curve by teaching the novices to edit images using low-level command terminologies. Towards this end, we develop a task-oriented dialogue system to investigate low-level instructions for NLIE. Our system grounds language on the level of edit operations, and suggests options for users to choose from. Though compelled to express in low-level terms, user evaluation shows that 25{\%} of users found our system easy-to-use, resonating with our motivation. Analysis shows that users generally adapt to utilizing the proposed low-level language interface. We also identified object segmentation as the key factor to user satisfaction. Our work demonstrates advantages of low-level, direct language-action mapping approach that can be applied to other problem domains beyond image editing such as audio editing or industrial design."
2020.lrec-1.664,Propagate-Selector: Detecting Supporting Sentences for Question Answering via Graph Neural Networks,2020,-1,-1,4,1,3780,seunghyun yoon,Proceedings of the 12th Language Resources and Evaluation Conference,0,"In this study, we propose a novel graph neural network called propagate-selector (PS), which propagates information over sentences to understand information that cannot be inferred when considering sentences in isolation. First, we design a graph structure in which each node represents an individual sentence, and some pairs of nodes are selectively connected based on the text structure. Then, we develop an iterative attentive aggregation and a skip-combine method in which a node interacts with its neighborhood nodes to accumulate the necessary information. To evaluate the performance of the proposed approaches, we conduct experiments with the standard HotpotQA dataset. The empirical results demonstrate the superiority of our proposed approach, which obtains the best performances, compared to the widely used answer-selection models that do not consider the intersentential relationship."
2020.findings-emnlp.65,Rethinking Self-Attention: Towards Interpretability in Neural Parsing,2020,-1,-1,4,0.833333,2776,khalil mrini,Findings of the Association for Computational Linguistics: EMNLP 2020,0,"Attention mechanisms have improved the performance of NLP tasks while allowing models to remain explainable. Self-attention is currently widely used, however interpretability is difficult due to the numerous attention distributions. Recent work has shown that model representations can benefit from label-specific information, while facilitating interpretation of predictions. We introduce the Label Attention Layer: a new form of self-attention where attention heads represent labels. We test our novel layer by running constituency and dependency parsing experiments and show our new model obtains new state-of-the-art results for both tasks on both the Penn Treebank (PTB) and Chinese Treebank. Additionally, our model requires fewer self-attention layers compared to existing work. Finally, we find that the Label Attention heads learn relations between syntactic categories and show pathways to analyze errors."
2020.findings-emnlp.87,Scene Graph Modification Based on Natural Language Commands,2020,-1,-1,6,0,3742,xuanli he,Findings of the Association for Computational Linguistics: EMNLP 2020,0,"Structured representations like graphs and parse trees play a crucial role in many Natural Language Processing systems. In recent years, the advancements in multi-turn user interfaces necessitate the need for controlling and updating these structured representations given new sources of information. Although there have been many efforts focusing on improving the performance of the parsers that map text to graphs or parse trees, very few have explored the problem of directly manipulating these representations. In this paper, we explore the novel problem of graph modification, where the systems need to learn how to update an existing scene graph given a new user{'}s command. Our novel models based on graph-based sparse transformer and cross attention information fusion outperform previous systems adapted from the machine translation and graph generation literature. We further contribute our large graph modification datasets to the research community to encourage future research for this new problem."
2020.eval4nlp-1.4,{V}i{LBERTS}core: Evaluating Image Caption Using Vision-and-Language {BERT},2020,-1,-1,5,1,3779,hwanhee lee,Proceedings of the First Workshop on Evaluation and Comparison of NLP Systems,0,"In this paper, we propose an evaluation metric for image captioning systems using both image and text information. Unlike the previous methods that rely on textual representations in evaluating the caption, our approach uses visiolinguistic representations. The proposed method generates image-conditioned embeddings for each token using ViLBERT from both generated and reference texts. Then, these contextual embeddings from each of the two sentence-pair are compared to compute the similarity score. Experimental results on three benchmark datasets show that our method correlates significantly better with human judgments than all existing metrics."
2020.emnlp-main.274,Variational Hierarchical Dialog Autoencoder for Dialog State Tracking Data Augmentation,2020,45,0,4,0,6903,kang yoo,Proceedings of the 2020 Conference on Empirical Methods in Natural Language Processing (EMNLP),0,"Recent works have shown that generative data augmentation, where synthetic samples generated from deep generative models complement the training dataset, benefit NLP tasks. In this work, we extend this approach to the task of dialog state tracking for goaloriented dialogs. Due to the inherent hierarchical structure of goal-oriented dialogs over utterances and related annotations, the deep generative model must be capable of capturing the coherence among different hierarchies and types of dialog features. We propose the Variational Hierarchical Dialog Autoencoder (VHDA) for modeling the complete aspects of goal-oriented dialogs, including linguistic features and underlying structured annotations, namely speaker information, dialog acts, and goals. The proposed architecture is designed to model each aspect of goal-oriented dialogs using inter-connected latent variables and learns to generate coherent goal-oriented dialogs from the latent spaces. To overcome training issues that arise from training complex variational models, we propose appropriate training strategies. Experiments on various dialog datasets show that our model improves the downstream dialog trackers{'} robustness via generative data augmentation. We also discover additional benefits of our unified approach to modeling goal-oriented dialogs {--} dialog response generation and user simulation, where our model outperforms previous strong baselines."
2020.coling-main.56,A Joint Learning Approach based on Self-Distillation for Keyphrase Extraction from Scientific Documents,2020,-1,-1,2,1,715,tuan lai,Proceedings of the 28th International Conference on Computational Linguistics,0,"Keyphrase extraction is the task of extracting a small set of phrases that best describe a document. Most existing benchmark datasets for the task typically have limited numbers of annotated documents, making it challenging to train increasingly complex neural networks. In contrast, digital libraries store millions of scientific articles online, covering a wide range of topics. While a significant portion of these articles contain keyphrases provided by their authors, most other articles lack such kind of annotations. Therefore, to effectively utilize these large amounts of unlabeled articles, we propose a simple and efficient joint learning approach based on the idea of self-distillation. Experimental results show that our approach consistently improves the performance of baseline models for keyphrase extraction. Furthermore, our best models outperform previous methods for the task, achieving new state-of-the-art results on two public benchmarks: Inspec and SemEval-2017."
2020.acl-main.728,History for Visual Dialog: Do we really need it?,2020,53,0,2,0,5964,shubham agarwal,Proceedings of the 58th Annual Meeting of the Association for Computational Linguistics,1,"Visual Dialogue involves {``}understanding{''} the dialogue history (what has been discussed previously) and the current question (what is asked), in addition to grounding information in the image, to accurately generate the correct response. In this paper, we show that co-attention models which explicitly encode dialoh history outperform models that don{'}t, achieving state-of-the-art performance (72 {\%} NDCG on val set). However, we also expose shortcomings of the crowdsourcing dataset collection procedure, by showing that dialogue history is indeed only required for a small amount of the data, and that the current evaluation metric encourages generic replies. To that end, we propose a challenging subset (VisdialConv) of the VisdialVal set and the benchmark NDCG of 63{\%}."
2020.aacl-demo.2,{A}uto{NLU}: An On-demand Cloud-based Natural Language Understanding System for Enterprises,2020,-1,-1,3,0,21554,nham le,Proceedings of the 1st Conference of the Asia-Pacific Chapter of the Association for Computational Linguistics and the 10th International Joint Conference on Natural Language Processing: System Demonstrations,0,"With the renaissance of deep learning, neural networks have achieved promising results on many natural language understanding (NLU) tasks. Even though the source codes of many neural network models are publicly available, there is still a large gap from open-sourced models to solving real-world problems in enterprises. Therefore, to fill this gap, we introduce AutoNLU, an on-demand cloud-based system with an easy-to-use interface that covers all common use-cases and steps in developing an NLU model. AutoNLU has supported many product teams within Adobe with different use-cases and datasets, quickly delivering them working models. To demonstrate the effectiveness of AutoNLU, we present two case studies. i) We build a practical NLU model for handling various image-editing requests in Photoshop. ii) We build powerful keyphrase extraction models that achieve state-of-the-art results on two public benchmarks. In both cases, end users only need to write a small amount of code to convert their datasets into a common format used by AutoNLU."
2020.aacl-demo.3,{ISA}: An Intelligent Shopping Assistant,2020,-1,-1,2,1,715,tuan lai,Proceedings of the 1st Conference of the Asia-Pacific Chapter of the Association for Computational Linguistics and the 10th International Joint Conference on Natural Language Processing: System Demonstrations,0,"Despite the growth of e-commerce, brick-and-mortar stores are still the preferred destinations for many people. In this paper, we present ISA, a mobile-based intelligent shopping assistant that is designed to improve shopping experience in physical stores. ISA assists users by leveraging advanced techniques in computer vision, speech processing, and natural language processing. An in-store user only needs to take a picture or scan the barcode of the product of interest, and then the user can talk to the assistant about the product. The assistant can also guide the user through the purchase process or recommend other similar products to the user. We take a data-driven approach in building the engines of ISA{'}s natural language processing component, and the engines achieve good performance."
