"2021.naacl-main.454","Multi-Grained Knowledge Distillation for Named Entity Recognition","2021","-1","-1","6","0","4592","xuan zhou","Proceedings of the 2021 Conference of the North American Chapter of the Association for Computational Linguistics: Human Language Technologies","0"
"2021.naacl-industry.18","Language Scaling for Universal Suggested Replies Model","2021","-1","-1","5","0","4725","qianlan ying","Proceedings of the 2021 Conference of the North American Chapter of the Association for Computational Linguistics: Human Language Technologies: Industry Papers","0"
"2021.findings-emnlp.66","Recommend for a Reason: Unlocking the Power of Unsupervised Aspect-Sentiment Co-Extraction","2021","-1","-1","6","1","6556","zeyu li","Findings of the Association for Computational Linguistics: EMNLP 2021","0"
"2021.findings-emnlp.70","Improving Empathetic Response Generation by Recognizing Emotion Cause in Conversations","2021","-1","-1","4","0","6568","jun gao","Findings of the Association for Computational Linguistics: EMNLP 2021","0"
"2021.findings-emnlp.147","{S}ent2{S}pan: Span Detection for {PICO} Extraction in the Biomedical Text without Span Annotations","2021","-1","-1","4","0","6794","shifeng liu","Findings of the Association for Computational Linguistics: EMNLP 2021","0"
"2021.findings-emnlp.413","Counterfactual Adversarial Learning with Representation Interpolation","2021","-1","-1","1","1","4596","wei wang","Findings of the Association for Computational Linguistics: EMNLP 2021","0"
"2021.emnlp-main.546","Powering Comparative Classification with Sentiment Analysis via Domain Adaptive Knowledge Transfer","2021","-1","-1","4","1","6556","zeyu li","Proceedings of the 2021 Conference on Empirical Methods in Natural Language Processing","0"
"2021.acl-short.118","Addressing Semantic Drift in Generative Question Answering with Auxiliary Extraction","2021","-1","-1","4","1","2033","chenliang li","Proceedings of the 59th Annual Meeting of the Association for Computational Linguistics and the 11th International Joint Conference on Natural Language Processing (Volume 2: Short Papers)","0"
"2021.acl-long.97","A Dataset and Baselines for Multilingual Reply Suggestion","2021","-1","-1","2","0","12843","mozhi zhang","Proceedings of the 59th Annual Meeting of the Association for Computational Linguistics and the 11th International Joint Conference on Natural Language Processing (Volume 1: Long Papers)","1"
"2021.acl-long.308","{VECO}: Variable and Flexible Cross-lingual Pre-training for Language Understanding and Generation","2021","-1","-1","2","0","2472","fuli luo","Proceedings of the 59th Annual Meeting of the Association for Computational Linguistics and the 11th International Joint Conference on Natural Language Processing (Volume 1: Long Papers)","1"
"2021.acl-long.493","{S}tructural{LM}: Structural Pre-training for Form Understanding","2021","-1","-1","4","1","2033","chenliang li","Proceedings of the 59th Annual Meeting of the Association for Computational Linguistics and the 11th International Joint Conference on Natural Language Processing (Volume 1: Long Papers)","1"
"2020.rocling-1.1","Analyzing the Morphological Structures in Seediq Words","2020","-1","-1","4","0","14297","chuanjie lin","Proceedings of the 32nd Conference on Computational Linguistics and Speech Processing (ROCLING 2020)","0"
"2020.ijclclp-2.1","Analyzing the Morphological Structures in Seediq Words","2020","-1","-1","4","0","14297","chuanjie lin","International Journal of Computational Linguistics {\\&} {C}hinese Language Processing, Volume 25, Number 2, December 2020","0"
"2020.findings-emnlp.140","{S}tyle{DGPT}: Stylized Response Generation with Pre-trained Language Models","2020","-1","-1","7","0","19573","ze yang","Findings of the Association for Computational Linguistics: EMNLP 2020","0"
"2020.findings-emnlp.412","Long Document Ranking with Query-Directed Sparse Transformer","2020","-1","-1","4","1","19934","jyunyu jiang","Findings of the Association for Computational Linguistics: EMNLP 2020","0"
"2020.emnlp-main.444","Unsupervised Natural Language Inference via Decoupled Multimodal Contrastive Learning","2020","-1","-1","3","0","20466","wanyun cui","Proceedings of the 2020 Conference on Empirical Methods in Natural Language Processing (EMNLP)","0"
"2020.emnlp-main.700","{PALM}: Pre-training an Autoencoding{\\&}Autoregressive Language Model for Context-conditioned Generation","2020","37","1","5","1","12636","bin bi","Proceedings of the 2020 Conference on Empirical Methods in Natural Language Processing (EMNLP)","0"
"2020.acl-main.75","{``}The Boating Store Had Its Best Sail Ever{''}: Pronunciation-attentive Contextualized Pun Recognition","2020","51","0","5","1","20482","yichao zhou","Proceedings of the 58th Annual Meeting of the Association for Computational Linguistics","1"
"2020.acl-main.689","Learning a Multi-Domain Curriculum for Neural Machine Translation","2020","-1","-1","1","1","4596","wei wang","Proceedings of the 58th Annual Meeting of the Association for Computational Linguistics","1"
"2020.aacl-main.45","Self-Supervised Learning for Pairwise Data Refinement","2020","-1","-1","3","0","9695","gustavo abrego","Proceedings of the 1st Conference of the Asia-Pacific Chapter of the Association for Computational Linguistics and the 10th International Joint Conference on Natural Language Processing","0"
"P19-1123","Dynamically Composing Domain-Data Selection with Clean-Data Selection by {``}Co-Curricular Learning{''} for Neural Machine Translation","2019","0","4","1","1","4596","wei wang","Proceedings of the 57th Annual Meeting of the Association for Computational Linguistics","1"
"P19-1251","Enhancing Air Quality Prediction with Social Media and Natural Language Processing","2019","0","0","3","1","19934","jyunyu jiang","Proceedings of the 57th Annual Meeting of the Association for Computational Linguistics","1"
"P19-1299","Multi-Source Cross-Lingual Model Transfer: Learning What to Share","2019","0","6","4","0","9649","xilun chen","Proceedings of the 57th Annual Meeting of the Association for Computational Linguistics","1"
"P19-1529","How to Best Use Syntax in Semantic Role Labelling","2019","22","0","5","0","10656","yufei wang","Proceedings of the 57th Annual Meeting of the Association for Computational Linguistics","1"
"N19-1136","Joint Multi-Label Attention Networks for Social Text Annotation","2019","0","1","2","0","8774","hang dong","Proceedings of the 2019 Conference of the North {A}merican Chapter of the Association for Computational Linguistics: Human Language Technologies, Volume 1 (Long and Short Papers)","0"
"D19-1255","Incorporating External Knowledge into Machine Reading for Generative Question Answering","2019","0","3","4","1","12636","bin bi","Proceedings of the 2019 Conference on Empirical Methods in Natural Language Processing and the 9th International Joint Conference on Natural Language Processing (EMNLP-IJCNLP)","0"
"D19-1496","Learning to Discriminate Perturbations for Blocking Adversarial Attacks in Text Classification","2019","34","0","4","1","20482","yichao zhou","Proceedings of the 2019 Conference on Empirical Methods in Natural Language Processing and the 9th International Joint Conference on Natural Language Processing (EMNLP-IJCNLP)","0"
"W18-6314","Denoising Neural Machine Translation Training with Trusted Data and Online Data Selection","2018","19","3","1","1","4596","wei wang","Proceedings of the Third Conference on Machine Translation: Research Papers","0"
"P18-1151","{GTR}-{LSTM}: A Triple Encoder for Sentence Generation from {RDF} Data","2018","0","12","4","0","6845","bayu trisedya","Proceedings of the 56th Annual Meeting of the Association for Computational Linguistics (Volume 1: Long Papers)","1"
"P18-1158","Multi-Granularity Hierarchical Attention Fusion Networks for Reading Comprehension and Question Answering","2018","31","59","1","1","4596","wei wang","Proceedings of the 56th Annual Meeting of the Association for Computational Linguistics (Volume 1: Long Papers)","1"
"N18-1164","Learning to Disentangle Interleaved Conversational Threads with a {S}iamese Hierarchical Network and Similarity Ranking","2018","0","14","4","1","19934","jyunyu jiang","Proceedings of the 2018 Conference of the North {A}merican Chapter of the Association for Computational Linguistics: Human Language Technologies, Volume 1 (Long Papers)","0"
"D18-1521","Learning Gender-Neutral Word Embeddings","2018","0","40","4","0.37037","4156","jieyu zhao","Proceedings of the 2018 Conference on Empirical Methods in Natural Language Processing","0"
"W16-1310","The Physics of Text: Ontological Realism in Information Extraction","2016","10","0","4","0","33154","stuart russell","Proceedings of the 5th Workshop on Automated Knowledge Base Construction","0"
"F13-1026","Semantic relation clustering for unsupervised information extraction (Regroupement s{\\'e}mantique de relations pour l{'}extraction d{'}information non supervis{\\'e}e) [in {F}rench]","2013","0","0","1","1","4596","wei wang","Proceedings of TALN 2013 (Volume 1: Long Papers)","0"
"D13-1092","Implicit Feature Detection via a Constrained Topic Model and {SVM}","2013","10","7","1","1","4596","wei wang","Proceedings of the 2013 Conference on Empirical Methods in Natural Language Processing","0"
"W12-6314","Rules-based {C}hinese Word Segmentation on {M}icro{B}log for {CIPS}-{SIGHAN} on {CLP}2012","2012","7","1","4","0","1625","jing zhang","Proceedings of the Second {CIPS}-{SIGHAN} Joint Conference on {C}hinese Language Processing","0"
"P12-1061","Community Answer Summarization for Multi-Sentence Question with Group {L}1 Regularization","2012","27","7","3","0","42697","wen chan","Proceedings of the 50th Annual Meeting of the Association for Computational Linguistics (Volume 1: Long Papers)","1"
"wang-etal-2012-evaluation","Evaluation of Unsupervised Information Extraction","2012","13","4","1","1","4596","wei wang","Proceedings of the Eighth International Conference on Language Resources and Evaluation ({LREC}'12)","0"
"2012.amta-papers.18","Improved Domain Adaptation for Statistical Machine Translation","2012","11","19","1","1","4596","wei wang","Proceedings of the 10th Conference of the Association for Machine Translation in the Americas: Research Papers","0"
"2011.jeptalnrecital-court.8","Filtrage de relations pour l{'}extraction d{'}information non supervis{\\'e}e (Filtering relations for unsupervised information extraction)","2011","-1","-1","1","1","4596","wei wang","Actes de la 18e conf{\\'e}rence sur le Traitement Automatique des Langues Naturelles. Articles courts","0"
"P10-2055","A Semi-Supervised Key Phrase Extraction Approach: Learning from Title Phrases through a Document Semantic Network","2010","8","14","4","0","45671","decong li","Proceedings of the {ACL} 2010 Conference Short Papers","0"
"J10-2004","Re-structuring, Re-labeling, and Re-aligning for Syntax-Based Machine Translation","2010","43","44","1","1","4596","wei wang","Computational Linguistics","0"
"N09-1025","11,001 New Features for Statistical Machine Translation","2009","32","223","3","0","3180","david chiang","Proceedings of Human Language Technologies: The 2009 Annual Conference of the North {A}merican Chapter of the Association for Computational Linguistics","0"
"D07-1078","Binarizing Syntax Trees to Improve Syntax-Based Machine Translation Accuracy","2007","16","69","1","1","4596","wei wang","Proceedings of the 2007 Joint Conference on Empirical Methods in Natural Language Processing and Computational Natural Language Learning ({EMNLP}-{C}o{NLL})","0"
"D07-1079","What Can Syntax-Based {MT} Learn from Phrase-Based {MT}?","2007","22","79","3","0","11017","steve deneefe","Proceedings of the 2007 Joint Conference on Empirical Methods in Natural Language Processing and Computational Natural Language Learning ({EMNLP}-{C}o{NLL})","0"
"W06-1606","{SPMT}: Statistical Machine Translation with Syntactified Target Language Phrases","2006","16","206","2","0","31937","daniel marcu","Proceedings of the 2006 Conference on Empirical Methods in Natural Language Processing","0"
"P06-1121","Scalable Inference and Training of Context-Rich Syntactic Translation Models","2006","10","416","6","0","4268","michel galley","Proceedings of the 21st International Conference on Computational Linguistics and 44th Annual Meeting of the Association for Computational Linguistics","1"
"N06-1001","Capitalizing Machine Translation","2006","13","50","1","1","4596","wei wang","Proceedings of the Human Language Technology Conference of the {NAACL}, Main Conference","0"
"W04-3226","Improving Word Alignment Models using Structured Monolingual Corpora","2004","0","5","1","1","4596","wei wang","Proceedings of the 2004 Conference on Empirical Methods in Natural Language Processing","0"
"2003.mtsummit-papers.23","A unified statistical model for generalized translation memory system","2003","-1","-1","2","0","11234","jinxia huang","Proceedings of Machine Translation Summit IX: Papers","0"
"C02-1010","Structure Alignment Using Bilingual Chunking","2002","12","18","1","1","4596","wei wang","{COLING} 2002: The 19th International Conference on Computational Linguistics","0"
