N07-1035,Estimating the Reliability of {MDP} Policies: a Confidence Interval Approach,2007,13,15,1,1,191,joel tetreault,Human Language Technologies 2007: The Conference of the North {A}merican Chapter of the Association for Computational Linguistics; Proceedings of the Main Conference,0,"Past approaches for using reinforcement learning to derive dialog control policies have assumed that there was enough collected data to derive a reliable policy. In this paper we present a methodology for numerically constructing confidence intervals for the expected cumulative reward for a learned policy. These intervals are used to (1) better assess the reliability of the expected cumulative reward, and (2) perform a refined comparison between policies derived from different Markov Decision Processes (MDP) models. We applied this methodology to a prior experiment where the goal was to select the best features to include in the MDP statespace. Our results show that while some of the policies developed in the prior work exhibited very large confidence intervals, the policy developed from the best feature set had a much smaller confidence interval and thus showed very high reliability. xc2xa9 2007 Association for Computational Linguistics."
N06-1035,Comparing the Utility of State Features in Spoken Dialogue Using Reinforcement Learning,2006,16,25,1,1,191,joel tetreault,"Proceedings of the Human Language Technology Conference of the {NAACL}, Main Conference",0,"Recent work in designing spoken dialogue systems has focused on using Reinforcement Learning to automatically learn the best action for a system to take at any point in the dialogue to maximize dialogue success. While policy development is very important, choosing the best features to model the user state is equally important since it impacts the actions a system should make. In this paper, we compare the relative utility of adding three features to a model of user state in the domain of a spoken dialogue tutoring system. In addition, we also look at the effects of these features on what type of a question a tutoring system should ask at any state and compare it with our previous work on using feedback as the system action."
E06-1037,Using Reinforcement Learning to Build a Better Model of Dialogue State,2006,14,30,1,1,191,joel tetreault,11th Conference of the {E}uropean Chapter of the Association for Computational Linguistics,0,"Given the growing complexity of tasks that spoken dialogue systems are trying to handle, Reinforcement Learning (RL) has been increasingly used as a way of automatically learning the best policy for a system to make. While most work has focused on generating better policies for a dialogue manager, very little work has been done in using RL to construct a better dialogue state. This paper presents a RL approach for determining what dialogue features are important to a spoken dialogue tutoring system. Our experiments show that incorporating dialogue factors such as dialogue acts, emotion, repeated concepts and performance play a significant role in tutoring and should be taken into account when designing dialogue systems."
W04-0304,Incremental Parsing with Reference Interaction,2004,24,17,2,0,50885,scott stoness,Proceedings of the Workshop on Incremental Parsing: Bringing Engineering and Cognition Together,0,We present a general architecture for incremental interaction between modules in a speech-to-intention continuous understanding dialogue system. This architecture is then instantiated in the form of an incremental parser which receives suitability feedback on NP constituents from a reference resolution module. Oracle results indicate that perfect NP suitability judgments can provide a labelled-bracket error reduction of as much as 42% and an efficiency improvement of 30%. Preliminary experiments in which the parser incorporates feedback judgments based on the set of referents found in the discourse context achieve a maximum error reduction of 9.3% and efficiency gain of 4.6%. The parser is also able to incrementally instantiate the semantics of underspecified pronouns based on matches from the discourse context. These results suggest that the architecture holds promise as a platform for incremental parsing supporting continuous understanding.
W04-0214,Discourse Annotation in the Monroe Corpus,2004,14,10,1,1,191,joel tetreault,Proceedings of the Workshop on Discourse Annotation,0,"We describe a method for annotating spoken dialog corpora using both automatic and manual annotation. Our semi-automated method for corpus development results in a corpus combining rich semantics, discourse information and reference annotation, and allows us to explore issues relating these."
swift-etal-2004-semi,Semi-automatic Syntactic and Semantic Corpus Annotation with a Deep Parser,2004,9,12,3,0,41163,mary swift,Proceedings of the Fourth International Conference on Language Resources and Evaluation ({LREC}{'}04),0,"We describe a semi-automatic method for linguistically rich corpus annotation using a broad-coverage deep parser to generate syntactic structure, semantic representation and discourse information for task-oriented dialogs. The parser-generated analyses are checked by trained annotators. Incomplete coverage and incorrect analyses are addressed through lexicon and grammar development, after which the dialogs undergo another cycle of parsing and checking. Currently we have 85% correct annotations in our emergency rescue task domain and 70% in our medication scheduling domain. This iterative process of corpus annotation allows us to create domain-specific gold-standard corpora for test suites and corpus-based experiments as part of general system development."
garg-etal-2004-evaluation,"Evaluation of Transcription and Annotation Tools for a Multi-modal, Multi-party Dialogue Corpus",2004,5,9,5,0,30605,saurabh garg,Proceedings of the Fourth International Conference on Language Resources and Evaluation ({LREC}{'}04),0,"Abstract : This paper reviews none available transcription annotation tools, considering in particular the special difficulties arising from transcribing and annotating multi-party, multi-model dialogue. Tools are evaluated as to the ability to support the user's annotation scheme, ability to visualize the form of the data, compatibility with other tools, flexibility of data representation, and general user-friendliness."
J01-4003,A Corpus-Based Evaluation of Centering and Pronoun Resolution,2001,22,85,1,1,191,joel tetreault,Computational Linguistics,0,"In this paper we compare pronoun resolution algorithms and introduce a centering algorithm (Left-Right Centering) that adheres to the constraints and rules of centering theory and is an alternative to Brennan, Friedman, and Pollard's (1987) algorithm. We then use the Left-Right Centering algorithm to see if two psycholinguistic claims on Cf-list ranking will actually improve pronoun resolution accuracy. Our results from this investigation lead to the development of a new syntax-based ranking of the Cf-list and corpus-based evidence that contradicts the psycholinguistic claims."
P99-1079,Analysis of Syntax-Based Pronoun Resolution Methods,1999,10,42,1,1,191,joel tetreault,Proceedings of the 37th Annual Meeting of the Association for Computational Linguistics,1,"This paper presents a pronoun resolution algorithm that adheres to the constraints and rules of Centering Theory (Grosz et al., 1995) and is an alternative to Brennan et al.'s 1987 algorithm. The advantages of this new model, the Left-Right Centering Algorithm (LRC), lie in its incremental processing of utterances and in its low computational overhead. The algorithm is compared with three other pronoun resolution methods: Hobbs' syntax-based algorithm, Strube's S-list approach, and the BFP Centering algorithm. All four methods were implemented in a system and tested on an annotated subset of the Treebank corpus consisting of 2026 pronouns. The noteworthy results were that Hobbs and LRC performed the best."
E99-1031,A Flexible Architecture for Reference Resolution,1999,10,9,2,0,45130,donna byron,Ninth Conference of the {E}uropean Chapter of the Association for Computational Linguistics,0,"This paper describes an architecture for performing anaphora resolution in a flexible way. Systems which conform to these guidelines are well-encapsulated and portable, and can be used to compare anaphora resolution techniques for new language understanding applications. Our implementation of the architecture in a pronoun resolution testing platform demonstrates the flexibility of the approach."
