C18-1028,{P}ar4{S}im {--} Adaptive Paraphrasing for Text Simplification,2018,0,0,2,1,282,seid yimam,Proceedings of the 27th International Conference on Computational Linguistics,0,"Learning from a real-world data stream and continuously updating the model without explicit supervision is a new challenge for NLP applications with machine learning components. In this work, we have developed an adaptive learning system for text simplification, which improves the underlying learning-to-rank model from usage data, i.e. how users have employed the system for the task of simplification. Our experimental result shows that, over a period of time, the performance of the embedded paraphrase ranking model increases steadily improving from a score of 62.88{\%} up to 75.70{\%} based on the NDCG@10 evaluation metrics. To our knowledge, this is the first study where an NLP component is adaptively improved through usage."
yimam-etal-2017-entity,Entity-Centric Information Access with Human in the Loop for the Biomedical Domain,2017,14,2,5,1,282,seid yimam,Proceedings of the Biomedical {NLP} Workshop associated with {RANLP} 2017,0,"In this paper, we describe the concept of entity-centric information access for the biomedical domain. With entity recognition technologies approaching acceptable levels of accuracy, we put forward a paradigm of document browsing and searching where the entities of the domain and their relations are explicitly modeled to provide users the possibility of collecting exhaustive information on relations of interest. We describe three working prototypes along these lines: NEW/S/LEAK, which was developed for investigative journalists who need a quick overview of large leaked document collections; STORYFINDER, which is a personalized organizer for information found in web pages that allows adding entities as well as relations, and is capable of personalized information management; and adaptive annotation capabilities of WEBANNO, which is a general-purpose linguistic annotation tool. We will discuss future steps towards the adaptation of these tools to biomedical data, which is subject to a recently started project on biomedical knowledge acquisition. A key difference to other approaches is the centering around the user in a Human-in-the-Loop machine learning approach, where users define and extend categories and enable the system to improve via feedback and interaction."
W17-6933,There{'}s no {`}Count or Predict{'} but task-based selection for distributional models,2017,26,1,2,1,24663,martin riedl,{IWCS} 2017 {---} 12th International Conference on Computational Semantics {---} Short papers,0,None
W17-1909,Using Linked Disambiguated Distributional Networks for Word Sense Disambiguation,2017,28,5,4,1,1663,alexander panchenko,"Proceedings of the 1st Workshop on Sense, Concept and Entity Representations and their Applications",0,"We introduce a new method for unsupervised knowledge-based word sense disambiguation (WSD) based on a resource that links two types of sense-aware lexical networks: one is induced from a corpus using distributional semantics, the other is manually constructed. The combination of two networks reduces the sparsity of sense representations used for WSD. We evaluate these enriched representations within two lexical sample sense disambiguation benchmarks. Our results indicate that (1) features extracted from the corpus-based resource help to significantly outperform a model based solely on the lexical resource; (2) our method achieves results comparable or better to four state-of-the-art unsupervised knowledge-based WSD systems including three hybrid systems that also rely on text corpora. In contrast to these hybrid methods, our approach does not require access to web search engines, texts mapped to a sense inventory, or machine translation systems."
W17-0202,Replacing {OOV} Words For Dependency Parsing With Distributional Semantics,2017,18,2,3,0,21982,prasanth kolachina,Proceedings of the 21st Nordic Conference on Computational Linguistics,0,None
W17-0213,Using Pseudowords for Algorithm Comparison: An Evaluation Framework for Graph-based Word Sense Induction,2017,25,2,2,0,16575,flavio cecchini,Proceedings of the 21st Nordic Conference on Computational Linguistics,0,None
S17-2009,{IIT}-{UHH} at {S}em{E}val-2017 Task 3: Exploring Multiple Features for Community Question Answering and Implicit Dialogue Identification,2017,0,6,2,0,32227,titas nandi,Proceedings of the 11th International Workshop on Semantic Evaluation ({S}em{E}val-2017),0,"In this paper we present the system for Answer Selection and Ranking in Community Question Answering, which we build as part of our participation in SemEval-2017 Task 3. We develop a Support Vector Machine (SVM) based system that makes use of textual, domain-specific, word-embedding and topic-modeling features. In addition, we propose a novel method for dialogue chain identification in comment threads. Our primary submission won subtask C, outperforming other systems in all the primary evaluation metrics. We performed well in other English subtasks, ranking third in subtask A and eighth in subtask B. We also developed open source toolkits for all the three English subtasks by the name cQARank [\url{https://github.com/TitasNandi/cQARank}]."
S17-2025,{STS}-{UHH} at {S}em{E}val-2017 Task 1: Scoring Semantic Textual Similarity Using Supervised and Unsupervised Ensemble,2017,9,0,3,1,32228,sarah kohail,Proceedings of the 11th International Workshop on Semantic Evaluation ({S}em{E}val-2017),0,"This paper reports the STS-UHH participation in the SemEval 2017 shared Task 1 of Semantic Textual Similarity (STS). Overall, we submitted 3 runs covering monolingual and cross-lingual STS tracks. Our participation involves two approaches: unsupervised approach, which estimates a word alignment-based similarity score, and supervised approach, which combines dependency graph similarity and coverage features with lexical similarity measures using regression methods. We also present a way on ensembling both models. Out of 84 submitted runs, our team best multi-lingual run has been ranked 12th in overall performance with correlation of 0.61, 7th among 31 participating teams."
S17-2153,{IITPB} at {S}em{E}val-2017 Task 5: Sentiment Prediction in Financial Text,2017,0,5,5,0.833333,24889,abhishek kumar,Proceedings of the 11th International Workshop on Semantic Evaluation ({S}em{E}val-2017),0,"This paper reports team IITPB{'}s participation in the SemEval 2017 Task 5 on {`}Fine-grained sentiment analysis on financial microblogs and news{'}. We developed 2 systems for the two tracks. One system was based on an ensemble of Support Vector Classifier and Logistic Regression. This system relied on Distributional Thesaurus (DT), word embeddings and lexicon features to predict a floating sentiment value between -1 and +1. The other system was based on Support Vector Regression using word embeddings, lexicon features, and PMI scores as features. The system was ranked 5th in track 1 and 8th in track 2."
yimam-etal-2017-multilingual,Multilingual and Cross-Lingual Complex Word Identification,2017,6,3,4,1,282,seid yimam,"Proceedings of the International Conference Recent Advances in Natural Language Processing, {RANLP} 2017",0,"Complex Word Identification (CWI) is an important task in lexical simplification and text accessibility. Due to the lack of CWI datasets, previous works largely depend on Simple English Wikipedia and edit histories for obtaining {`}gold standard{'} annotations, which are of doubtable quality, and limited only to English. We collect complex words/phrases (CP) for English, German and Spanish, annotated by both native and non-native speakers, and propose language independent features that can be used to train multilingual and cross-lingual CWI models. We show that the performance of cross-lingual CWI systems (using a model trained on one language and applying it on the other languages) is comparable to the performance of monolingual CWI systems."
P17-1145,{W}atset: Automatic Induction of Synsets from a Graph of Synonyms,2017,20,0,3,1,756,dmitry ustalov,Proceedings of the 55th Annual Meeting of the Association for Computational Linguistics (Volume 1: Long Papers),1,"This paper presents a new graph-based approach that induces synsets using synonymy dictionaries and word embeddings. First, we build a weighted graph of synonyms extracted from commonly available resources, such as Wiktionary. Second, we apply word sense induction to deal with ambiguous words. Finally, we cluster the disambiguated version of the ambiguous input graph into synsets. Our meta-clustering approach lets us use an efficient hard clustering algorithm to perform a fuzzy clustering of the graph. Despite its simplicity, our approach shows excellent results, outperforming five competitive state-of-the-art methods in terms of F-score on three gold standard datasets for English and Russian derived from large-scale manually constructed lexical resources."
I17-2068,{CWIG}3{G}2 - Complex Word Identification Task across Three Text Genres and Two User Groups,2017,0,8,4,1,282,seid yimam,Proceedings of the Eighth International Joint Conference on Natural Language Processing (Volume 2: Short Papers),0,"Complex word identification (CWI) is an important task in text accessibility. However, due to the scarcity of CWI datasets, previous studies have only addressed this problem on Wikipedia sentences and have solely taken into account the needs of non-native English speakers. We collect a new CWI dataset (CWIG3G2) covering three text genres News, WikiNews, and Wikipedia) annotated by both native and non-native English speakers. Unlike previous datasets, we cover single words, as well as complex phrases, and present them for judgment in a paragraph context. We present the first study on cross-genre and cross-group CWI, showing measurable influences in native language and genre types."
E17-2087,Negative Sampling Improves Hypernymy Extraction Based on Projection Learning,2017,33,7,3,1,756,dmitry ustalov,"Proceedings of the 15th Conference of the {E}uropean Chapter of the Association for Computational Linguistics: Volume 2, Short Papers",0,"We present a new approach to extraction of hypernyms based on projection learning and word embeddings. In contrast to classification-based approaches, projection-based methods require no candidate hyponym-hypernym pairs. While it is natural to use both positive and negative training examples in supervised relation extraction, the impact of positive examples on hypernym prediction was not studied so far. In this paper, we show that explicit negative examples used for regularization of the model significantly improve performance compared to the state-of-the-art approach of Fu et al. (2014) on three datasets from different languages."
E17-1009,Unsupervised Does Not Mean Uninterpretable: The Case for Word Sense Induction and Disambiguation,2017,56,16,5,1,1663,alexander panchenko,"Proceedings of the 15th Conference of the {E}uropean Chapter of the Association for Computational Linguistics: Volume 1, Long Papers",0,"The current trend in NLP is the use of highly opaque models, e.g. neural networks and word embeddings. While these models yield state-of-the-art results on a range of tasks, their drawback is poor interpretability. On the example of word sense induction and disambiguation (WSID), we show that it is possible to develop an interpretable model that matches the state-of-the-art models in accuracy. Namely, we present an unsupervised, knowledge-free WSID approach, which is interpretable at three levels: word sense inventory, sense feature representations, and disambiguation procedure. Experiments show that our model performs on par with state-of-the-art word sense embeddings and other unsupervised systems while offering the possibility to justify its decisions in human-readable form."
E17-1056,The {C}ontrast{M}edium Algorithm: Taxonomy Induction From Noisy Knowledge Graphs With Just A Few Links,2017,40,6,3,1,17226,stefano faralli,"Proceedings of the 15th Conference of the {E}uropean Chapter of the Association for Computational Linguistics: Volume 1, Long Papers",0,"In this paper, we present ContrastMedium, an algorithm that transforms noisy semantic networks into full-fledged, clean taxonomies. ContrastMedium is able to identify the embedded taxonomy structure from a noisy knowledge graph without explicit human supervision such as, for instance, a set of manually selected input root and leaf concepts. This is achieved by leveraging structural information from a companion reference taxonomy, to which the input knowledge graph is linked (either automatically or manually). When used in conjunction with methods for hypernym acquisition and knowledge base linking, our methodology provides a complete solution for end-to-end taxonomy induction. We conduct experiments using automatically acquired knowledge graphs, as well as a SemEval benchmark, and show that our method is able to achieve high performance on the task of taxonomy induction."
D17-2016,"Unsupervised, Knowledge-Free, and Interpretable Word Sense Disambiguation",2017,12,10,7,1,1663,alexander panchenko,Proceedings of the 2017 Conference on Empirical Methods in Natural Language Processing: System Demonstrations,0,"Interpretability of a predictive model is a powerful feature that gains the trust of users in the correctness of the predictions. In word sense disambiguation (WSD), knowledge-based systems tend to be much more interpretable than knowledge-free counterparts as they rely on the wealth of manually-encoded elements representing word senses, such as hypernyms, usage examples, and images. We present a WSD system that bridges the gap between these two so far disconnected groups of methods. Namely, our system, providing access to several state-of-the-art WSD models, aims to be interpretable as a knowledge-based system while it remains completely unsupervised and knowledge-free. The presented tool features a Web interface for all-word disambiguation of texts that makes the sense predictions human readable by providing interpretable word sense inventories, sense representations, and disambiguation results. We provide a public API, enabling seamless integration."
W16-5301,Vectors or Graphs? On Differences of Representations for Distributional Semantic Models,2016,34,2,1,1,2565,chris biemann,Proceedings of the 5th Workshop on Cognitive Aspects of the Lexicon ({C}og{AL}ex - V),0,"Distributional Semantic Models (DSMs) have recently received increased attention, together with the rise of neural architectures for scalable training of dense vector embeddings. While some of the literature even includes terms like {`}vectors{'} and {`}dimensionality{'} in the definition of DSMs, there are some good reasons why we should consider alternative formulations of distributional models. As an instance, I present a scalable graph-based solution to distributional semantics. The model belongs to the family of {`}count-based{'} DSMs, keeps its representation sparse and explicit, and thus fully interpretable. I will highlight some important differences between sparse graph-based and dense vector approaches to DSMs: while dense vector-based models are computationally easier to handle and provide a nice uniform representation that can be compared and combined in many ways, they lack interpretability, provenance and robustness. On the other hand, graph-based sparse models have a more straightforward interpretation, handle sense distinctions more naturally and can straightforwardly be linked to knowledge bases, while lacking the ability to compare arbitrary lexical units and a compositionality operation. Since both representations have their merits, I opt for exploring their combination in the outlook."
W16-5308,Towards a resource based on users{'} knowledge to overcome the Tip of the Tongue problem.,2016,34,1,2,0,33495,michael zock,Proceedings of the 5th Workshop on Cognitive Aspects of the Lexicon ({C}og{AL}ex - V),0,"Language production is largely a matter of words which, in the case of access problems, can be searched for in an external resource (lexicon, thesaurus). In this kind of dialogue the user provides the momentarily available knowledge concerning the target and the system responds with the best guess(es) it can make given this input. As tip-of-the-tongue (ToT)-studies have shown, people always have some knowledge concerning the target (meaning fragments, number of syllables, ...) even if its complete form is eluding them. We will show here how to tap on this knowledge to build a resource likely to help authors (speakers/writers) to overcome the ToT-problem. Yet, before doing so we need a better understanding of the various kinds of knowledge people have when looking for a word. To this end, we asked crowdworkers to provide some cues to describe a given target and to specify then how each one of them relates to the target, in the hope that this could help others to find the elusive word. Next, we checked how well a given search strategy worked when being applied to differently built lexical networks. The results showed quite dramatic differences, which is not really surprising. After all, different networks are built for different purposes; hence each one of them is more or less suited for a given task. What was more surprising though is the fact that the relational information given by the users did not allow us to find the elusive word in WordNet better than without it."
W16-4011,A Web-based Tool for the Integrated Annotation of Semantic and Syntactic Structures,2016,11,21,7,0.493827,11279,richard castilho,Proceedings of the Workshop on Language Technology Resources and Tools for Digital Humanities ({LT}4{DH}),0,"We introduce the third major release of WebAnno, a generic web-based annotation tool for distributed teams. New features in this release focus on semantic annotation tasks (e.g. semantic role labelling or event annotation) and allow the tight integration of semantic annotations with syntactic annotations. In particular, we introduce the concept of slot features, a novel constraint mechanism that allows modelling the interaction between semantic and syntactic annotations, as well as a new annotation user interface. The new features were developed and used in an annotation project for semantic roles on German texts. The paper briefly introduces this project and reports on experiences performing annotations with the new tool. On a comparative evaluation, our tool reaches significant speedups over WebAnno 2 for a semantic annotation task."
W16-2613,{E}mpiri{ST}: {AIPHES} - Robust Tokenization and {POS}-Tagging for Different Genres,2016,10,4,3,1,18079,steffen remus,Proceedings of the 10th Web as Corpus Workshop,0,None
W16-1801,Learning Paraphrasing for Multiword Expressions,2016,31,1,4,1,282,seid yimam,Proceedings of the 12th Workshop on Multiword Expressions,0,"In this paper, we investigate the impact of context for the paraphrase ranking task, comparing and quantifying results forn multi-word expressions and single words. We focus on systematic integration of existing paraphrase resources to producen paraphrase candidates and later ask human annotators to judge paraphrasability in context.n We first conduct a paraphrase-scoring annotation task with and without context for targets that are i) single- and multi-wordn expressions ii) verbs and nouns. We quantify how differently annotators score paraphrases when context information is provided.n Furthermore, we report on experiments with automatic paraphrase ranking. If we regard the problem as a binary classificationn task, we obtain an F1xe2x80x93score of 81.56% and 79.87% for multi-word expressions and single words resp. using kNN classifier. Approaching the problem as a learning-to-rank task, we attain MAP scores up to 87.14% and 91.58% for multiword expressions and single words resp. using LambdaMART, thus yielding highquality contextualized paraphrased selection. Further, we provide the first dataset with paraphrase judgments for multi-word targets in context."
W16-1816,Impact of {MWE} Resources on Multiword Recognition,2016,13,4,2,1,24663,martin riedl,Proceedings of the 12th Workshop on Multiword Expressions,0,"In this paper, we demonstrate the impact of Multiword Expression (MWE) resources in the task of MWE recognition in text. We present results based on the Wiki50 corpus for MWE resources, generated using unsupervised methods from raw text and resources that are extracted using manual text markup and lexical resources. We show that resources acquired from manual annotation yield the best MWE tagging performance. However, a more finegrained analysis that differentiates MWEs according to their part of speech (POS) reveals that automatically acquired MWE lists outperform the resources generated from human knowledge for three out of four classes."
W16-1620,Making Sense of Word Embeddings,2016,41,39,3,0,33974,maria pelevina,Proceedings of the 1st Workshop on Representation Learning for {NLP},0,"We present a simple yet effective approach for learning word sense embeddings. In contrast to existing techniques, which either directly learn sense representations from corpora or rely on sense inventories from lexical resources, our approach can induce a sense inventory from existing word embeddings via clustering of ego-networks of related words. An integrated WSD mechanism enables labeling of words in context with learned sense vectors, which gives rise to downstream applications. Experiments show that the performance of our method is comparable to state-of-the-art unsupervised WSD systems."
S16-1174,{IIT}-{TUDA} at {S}em{E}val-2016 Task 5: Beyond Sentiment Lexicon: Combining Domain Dependency and Distributional Semantics Features for Aspect Based Sentiment Analysis,2016,15,24,5,0,12110,ayush kumar,Proceedings of the 10th International Workshop on Semantic Evaluation ({S}em{E}val-2016),0,None
S16-1206,"{TAXI} at {S}em{E}val-2016 Task 13: a Taxonomy Induction Method based on Lexico-Syntactic Patterns, Substrings and Focused Crawling",2016,32,19,8,1,1663,alexander panchenko,Proceedings of the 10th International Workshop on Semantic Evaluation ({S}em{E}val-2016),0,"We present a system for taxonomy construction that reached the first place in all subtasks of the SemEval 2016 challenge on Taxonomy Extraction Evaluation. Our simple yet effective approach harvests hypernyms with substring inclusion and Hearst-style lexicosyntactic patterns from domain-specific texts obtained via language model based focused crawling. Extracted taxonomies are evaluated on English, Dutch, French and Italian for three domains each (Food, Environment and Science). Evaluations against a gold standard and by human judgment show that our method outperforms more complex and knowledge-rich approaches on most domains and languages. Furthermore, to adapt the method to a new domain or language, only a small amount of manual labour is needed."
P16-4028,new/s/leak {--} Information Extraction and Visualization for Investigative Data Journalists,2016,9,6,9,1,282,seid yimam,Proceedings of {ACL}-2016 System Demonstrations,0,None
P16-1012,Language Transfer Learning for Supervised Lexical Substitution,2016,31,2,2,0,4459,gerold hintz,Proceedings of the 54th Annual Meeting of the Association for Computational Linguistics (Volume 1: Long Papers),1,"We propose a framework for lexical substitution that is able to perform transfer learning across languages. Datasets for this task are available in at least three languages (English, Italian, and German). Previous work has addressed each of these tasks in isolation. In contrast, we regard the union of three shared tasks as a combined multilingual dataset. We show that a supervised system can be trained effectively, even if training and evaluation data are from different languages. Successful transfer learning between languages suggests that the learned model is in fact independent of the underlying language. We combine state-of-the-art unsupervised features obtained from syntactic word embeddings and distributional thesauri in a supervised delexicalized ranking system. Our system improves over state of the art in the full lexical substitution task in all three languages."
N16-1075,Unsupervised Compound Splitting With Distributional Semantics Rivals Supervised Methods,2016,13,12,2,1,24663,martin riedl,Proceedings of the 2016 Conference of the North {A}merican Chapter of the Association for Computational Linguistics: Human Language Technologies,0,None
L16-1572,Domain-Specific Corpus Expansion with Focused Webcrawling,2016,0,3,2,1,18079,steffen remus,Proceedings of the Tenth International Conference on Language Resources and Evaluation ({LREC}'16),0,"This work presents a straightforward method for extending or creating in-domain web corpora by focused webcrawling. The focused webcrawler uses statistical N-gram language models to estimate the relatedness of documents and weblinks and needs as input only N-grams or plain texts of a predefined domain and seed URLs as starting points. Two experiments demonstrate that our focused crawler is able to stay focused in domain and language. The first experiment shows that the crawler stays in a focused domain, the second experiment demonstrates that language models trained on focused crawls obtain better perplexity scores on in-domain corpora. We distribute the focused crawler as open source software."
