2021.findings-emnlp.337,{NUANCED}: Natural Utterance Annotation for Nuanced Conversation with Estimated Distributions,2021,-1,-1,5,0,7252,zhiyu chen,Findings of the Association for Computational Linguistics: EMNLP 2021,0,"Existing conversational systems are mostly agent-centric, which assumes the user utterances will closely follow the system ontology. However, in real-world scenarios, it is highly desirable that users can speak freely and naturally. In this work, we attempt to build a user-centric dialogue system for conversational recommendation. As there is no clean mapping for a user{'}s free form utterance to an ontology, we first model the user preferences as estimated distributions over the system ontology and map the user{'}s utterances to such distributions. Learning such a mapping poses new challenges on reasoning over various types of knowledge, ranging from factoid knowledge, commonsense knowledge to the users{'} own situations. To this end, we build a new dataset named NUANCED that focuses on such realistic settings, with 5.1k dialogues, 26k turns of high-quality user responses. We conduct experiments, showing both the usefulness and challenges of our problem setting. We believe NUANCED can serve as a valuable resource to push existing research from the agent-centric system to the user-centric system. The code and data are publicly available."
2021.findings-acl.30,Entity-Aware Abstractive Multi-Document Summarization,2021,-1,-1,1,1,7253,hao zhou,Findings of the Association for Computational Linguistics: ACL-IJCNLP 2021,0,None
2021.findings-acl.242,Contrastive Aligned Joint Learning for Multilingual Summarization,2021,-1,-1,3,0,8092,danqing wang,Findings of the Association for Computational Linguistics: ACL-IJCNLP 2021,0,None
2021.findings-acl.277,Probabilistic Graph Reasoning for Natural Proof Generation,2021,-1,-1,7,0,8176,changzhi sun,Findings of the Association for Computational Linguistics: ACL-IJCNLP 2021,0,None
2021.emnlp-main.95,Learning Logic Rules for Document-Level Relation Extraction,2021,-1,-1,5,0,8833,dongyu ru,Proceedings of the 2021 Conference on Empirical Methods in Natural Language Processing,0,"Document-level relation extraction aims to identify relations between entities in a whole document. Prior efforts to capture long-range dependencies have relied heavily on implicitly powerful representations learned through (graph) neural networks, which makes the model less transparent. To tackle this challenge, in this paper, we propose LogiRE, a novel probabilistic model for document-level relation extraction by learning logic rules. LogiRE treats logic rules as latent variables and consists of two modules: a rule generator and a relation extractor. The rule generator is to generate logic rules potentially contributing to final predictions, and the relation extractor outputs final predictions based on the generated logic rules. Those two modules can be efficiently optimized with the expectation-maximization (EM) algorithm. By introducing logic rules into neural networks, LogiRE can explicitly capture long-range dependencies as well as enjoy better interpretation. Empirical results show that significantly outperforms several strong baselines in terms of relation performance and logical consistency. Our code is available at https://github.com/rudongyu/LogiRE."
2021.emnlp-main.184,{EARL}: Informative Knowledge-Grounded Conversation Generation with Entity-Agnostic Representation Learning,2021,-1,-1,1,1,7253,hao zhou,Proceedings of the 2021 Conference on Empirical Methods in Natural Language Processing,0,"Generating informative and appropriate responses is challenging but important for building human-like dialogue systems. Although various knowledge-grounded conversation models have been proposed, these models have limitations in utilizing knowledge that infrequently occurs in the training data, not to mention integrating unseen knowledge into conversation generation. In this paper, we propose an Entity-Agnostic Representation Learning (EARL) method to introduce knowledge graphs to informative conversation generation. Unlike traditional approaches that parameterize the specific representation for each entity, EARL utilizes the context of conversations and the relational structure of knowledge graphs to learn the category representation for entities, which is generalized to incorporating unseen entities in knowledge graphs into conversation generation. Automatic and manual evaluations demonstrate that our model can generate more informative, coherent, and natural responses than baseline models."
2021.eacl-main.251,{ENPAR}:Enhancing Entity and Entity Pair Representations for Joint Entity Relation Extraction,2021,-1,-1,4,0,10882,yijun wang,Proceedings of the 16th Conference of the European Chapter of the Association for Computational Linguistics: Main Volume,0,"Current state-of-the-art systems for joint entity relation extraction (Luan et al., 2019; Wad-den et al., 2019) usually adopt the multi-task learning framework. However, annotations for these additional tasks such as coreference resolution and event extraction are always equally hard (or even harder) to obtain. In this work, we propose a pre-training method ENPAR to improve the joint extraction performance. ENPAR requires only the additional entity annotations that are much easier to collect. Unlike most existing works that only consider incorporating entity information into the sentence encoder, we further utilize the entity pair information. Specifically, we devise four novel objectives,i.e., masked entity typing, masked entity prediction, adversarial context discrimination, and permutation prediction, to pre-train an entity encoder and an entity pair encoder. Comprehensive experiments show that the proposed pre-training method achieves significant improvement over BERT on ACE05, SciERC, and NYT, and outperforms current state-of-the-art on ACE05."
2021.deelio-1.4,Augmenting Topic Aware Knowledge-Grounded Conversations with Dynamic Built Knowledge Graphs,2021,-1,-1,2,0,11247,junjie wu,Proceedings of Deep Learning Inside Out (DeeLIO): The 2nd Workshop on Knowledge Extraction and Integration for Deep Learning Architectures,0,"Dialog topic management and background knowledge selection are essential factors for the success of knowledge-grounded open-domain conversations. However, existing models are primarily performed with symmetric knowledge bases or stylized with pre-defined roles between conversational partners, while people usually have their own knowledge before a real chit-chat. To address this problem, we propose a dynamic knowledge graph-based topical conversation model (DKGT). Given a dialog history context, our model first builds knowledge graphs from the context as an imitation of human{'}s ability to form logical relationships between known and unknown topics during a conversation. This logical information will be fed into a topic predictor to promote topic management, then facilitate background knowledge selection and response generation. To the best of our knowledge, this is the first attempt to dynamically form knowledge graphs between chatting topics to assist dialog topic management during a conversation. Experimental results manifest that our model can properly schedule conversational topics and pick suitable knowledge to generate informative responses comparing to several strong baselines."
2021.acl-long.19,{U}ni{RE}: A Unified Label Space for Entity Relation Extraction,2021,-1,-1,4,0,10882,yijun wang,Proceedings of the 59th Annual Meeting of the Association for Computational Linguistics and the 11th International Joint Conference on Natural Language Processing (Volume 1: Long Papers),1,"Many joint entity relation extraction models setup two separated label spaces for the two sub-tasks (i.e., entity detection and relation classification). We argue that this setting may hinder the information interaction between entities and relations. In this work, we propose to eliminate the different treatment on the two sub-tasks{'} label spaces. The input of our model is a table containing all word pairs from a sentence. Entities and relations are represented by squares and rectangles in the table. We apply a unified classifier to predict each cell{'}s label, which unifies the learning of two sub-tasks. For testing, an effective (yet fast) approximate decoder is proposed for finding squares and rectangles from tables. Experiments on three benchmarks (ACE04, ACE05, SciERC) show that, using only half the number of parameters, our model achieves competitive accuracy with the best extractor, and is faster."
2021.acl-long.155,Glancing Transformer for Non-Autoregressive Neural Machine Translation,2021,-1,-1,2,0,12916,lihua qian,Proceedings of the 59th Annual Meeting of the Association for Computational Linguistics and the 11th International Joint Conference on Natural Language Processing (Volume 1: Long Papers),1,"Recent work on non-autoregressive neural machine translation (NAT) aims at improving the efficiency by parallel decoding without sacrificing the quality. However, existing NAT methods are either inferior to Transformer or require multiple decoding passes, leading to reduced speedup. We propose the Glancing Language Model (GLM) for single-pass parallel generation models. With GLM, we develop Glancing Transformer (GLAT) for machine translation. With only single-pass parallel decoding, GLAT is able to generate high-quality translation with 8{\mbox{$\times$}}-15{\mbox{$\times$}} speedup. Note that GLAT does not modify the network architecture, which is a training method to learn word interdependency. Experiments on multiple WMT language directions show that GLAT outperforms all previous single pass non-autoregressive methods, and is nearly comparable to Transformer, reducing the gap to 0.25-0.9 BLEU points."
2021.acl-long.571,Vocabulary Learning via Optimal Transport for Neural Machine Translation,2021,-1,-1,2,0,13512,jingjing xu,Proceedings of the 59th Annual Meeting of the Association for Computational Linguistics and the 11th International Joint Conference on Natural Language Processing (Volume 1: Long Papers),1,"The choice of token vocabulary affects the performance of machine translation. This paper aims to figure out what is a good vocabulary and whether we can find the optimal vocabulary without trial training. To answer these questions, we first provide an alternative understanding of vocabulary from the perspective of information theory. It motivates us to formulate the quest of vocabularization {--} finding the best token dictionary with a proper size {--} as an optimal transport (OT) problem. We propose VOLT, a simple and efficient solution without trial training. Empirical results show that VOLT beats widely-used vocabularies in diverse scenarios, including WMT-14 English-German translation, TED bilingual translation, and TED multilingual translation. For example, VOLT achieves 70{\%} vocabulary size reduction and 0.5 BLEU gain on English-German translation. Also, compared to BPE-search, VOLT reduces the search time from 384 GPU hours to 30 GPU hours on English-German translation. Codes are available at https://github.com/Jingjing-NLP/VOLT."
2020.wmt-1.24,{W}e{C}hat Neural Machine Translation Systems for {WMT}20,2020,-1,-1,11,0,3627,fandong meng,Proceedings of the Fifth Conference on Machine Translation,0,"We participate in the WMT 2020 shared newstranslation task on Chinese→English. Our system is based on the Transformer (Vaswaniet al., 2017a) with effective variants and the DTMT (Meng and Zhang, 2019) architecture. In our experiments, we employ data selection, several synthetic data generation approaches (i.e., back-translation, knowledge distillation, and iterative in-domain knowledge transfer), advanced finetuning approaches and self-bleu based model ensemble. Our constrained Chinese→English system achieves 36.9 case-sensitive BLEU score, which is thehighest among all submissions."
2020.findings-emnlp.441,Active Sentence Learning by Adversarial Uncertainty Sampling in Discrete Space,2020,26,0,4,0,8833,dongyu ru,Findings of the Association for Computational Linguistics: EMNLP 2020,0,"Active learning for sentence understanding aims at discovering informative unlabeled data for annotation and therefore reducing the demand for labeled data. We argue that the typical uncertainty sampling method for active learning is time-consuming and can hardly work in real-time, which may lead to ineffective sample selection. We propose adversarial uncertainty sampling in discrete space (AUSDS) to retrieve informative unlabeled samples more efficiently. AUSDS maps sentences into latent space generated by the popular pre-trained language models, and discover informative unlabeled text samples for annotation via adversarial attack. The proposed approach is extremely efficient compared with traditional uncertainty sampling with more than 10x speedup. Experimental results on five datasets show that AUSDS outperforms strong baselines on effectiveness."
2020.emnlp-main.210,Pre-training Multilingual Neural Machine Translation by Leveraging Alignment Information,2020,-1,-1,6,0,12716,zehui lin,Proceedings of the 2020 Conference on Empirical Methods in Natural Language Processing (EMNLP),0,"We investigate the following question for machine translation (MT): can we develop a single universal MT model to serve as the common seed and obtain derivative and improved models on arbitrary language pairs? We propose mRASP, an approach to pre-train a universal multilingual neural machine translation model. Our key idea in mRASP is its novel technique of random aligned substitution, which brings words and phrases with similar meanings across multiple languages closer in the representation space. We pre-train a mRASP model on 32 language pairs jointly with only public datasets. The model is then fine-tuned on downstream language pairs to obtain specialized MT models. We carry out extensive experiments on 42 translation directions across a diverse settings, including low, medium, rich resource, and as well as transferring to exotic language pairs. Experimental results demonstrate that mRASP achieves significant performance improvement compared to directly training on those target pairs. It is the first time to verify that multiple lowresource language pairs can be utilized to improve rich resource MT. Surprisingly, mRASP is even able to improve the translation quality on exotic languages that never occur in the pretraining corpus. Code, data, and pre-trained models are available at https://github. com/linzehui/mRASP."
2020.emnlp-main.733,On the Sentence Embeddings from Pre-trained Language Models,2020,-1,-1,2,0,20701,bohan li,Proceedings of the 2020 Conference on Empirical Methods in Natural Language Processing (EMNLP),0,"Pre-trained contextual representations like BERT have achieved great success in natural language processing. However, the sentence embeddings from the pre-trained language models without fine-tuning have been found to poorly capture semantic meaning of sentences. In this paper, we argue that the semantic information in the BERT embeddings is not fully exploited. We first reveal the theoretical connection between the masked language model pre-training objective and the semantic similarity task theoretically, and then analyze the BERT sentence embeddings empirically. We find that BERT always induces a non-smooth anisotropic semantic space of sentences, which harms its performance of semantic similarity. To address this issue, we propose to transform the anisotropic sentence embedding distribution to a smooth and isotropic Gaussian distribution through normalizing flows that are learned with an unsupervised objective. Experimental results show that our proposed BERT-flow method obtains significant performance gains over the state-of-the-art sentence embeddings on a variety of semantic textual similarity tasks. The code is available at \url{https://github.com/bohanli/BERT-flow}."
2020.acl-main.28,Unsupervised Paraphrasing by Simulated Annealing,2020,-1,-1,4,0,22548,xianggen liu,Proceedings of the 58th Annual Meeting of the Association for Computational Linguistics,1,"We propose UPSA, a novel approach that accomplishes Unsupervised Paraphrasing by Simulated Annealing. We model paraphrase generation as an optimization problem and propose a sophisticated objective function, involving semantic similarity, expression diversity, and language fluency of paraphrases. UPSA searches the sentence space towards this objective by performing a sequence of local editing. We evaluate our approach on various datasets, namely, Quora, Wikianswers, MSCOCO, and Twitter. Extensive results show that UPSA achieves the state-of-the-art performance compared with previous unsupervised methods in terms of both automatic and human evaluations. Further, our approach outperforms most existing domain-adapted supervised models, showing the generalizability of UPSA."
2020.acl-main.314,Do you have the right scissors? Tailoring Pre-trained Language Models via {M}onte-{C}arlo Methods,2020,-1,-1,3,0,22811,ning miao,Proceedings of the 58th Annual Meeting of the Association for Computational Linguistics,1,"It has been a common approach to pre-train a language model on a large corpus and fine-tune it on task-specific data. In practice, we observe that fine-tuning a pre-trained model on a small dataset may lead to over- and/or under-estimate problem. In this paper, we propose MC-Tailor, a novel method to alleviate the above issue in text generation tasks by truncating and transferring the probability mass from over-estimated regions to under-estimated ones. Experiments on a variety of text generation datasets show that MC-Tailor consistently and significantly outperforms the fine-tuning approach."
2020.acl-main.635,{K}d{C}onv: A {C}hinese Multi-domain Dialogue Dataset Towards Multi-turn Knowledge-driven Conversation,2020,43,1,1,1,7253,hao zhou,Proceedings of the 58th Annual Meeting of the Association for Computational Linguistics,1,"The research of knowledge-driven conversational systems is largely limited due to the lack of dialog data which consists of multi-turn conversations on multiple topics and with knowledge annotations. In this paper, we propose a Chinese multi-domain knowledge-driven conversation dataset, KdConv, which grounds the topics in multi-turn conversations to knowledge graphs. Our corpus contains 4.5K conversations from three domains (film, music, and travel), and 86K utterances with an average turn number of 19.0. These conversations contain in-depth discussions on related topics and natural transition between multiple topics. To facilitate the following research on this corpus, we provide several benchmark models. Comparative results show that the models can be enhanced by introducing background knowledge, yet there is still a large space for leveraging knowledge to model multi-turn conversations for further research. Results also show that there are obvious performance differences between different domains, indicating that it is worth further explore transfer learning and domain adaptation. The corpus and benchmark models are publicly available."
2020.acl-demos.1,{X}iaomingbot: {A} {M}ultilingual {R}obot {N}ews {R}eporter,2020,-1,-1,5,0,10136,runxin xu,Proceedings of the 58th Annual Meeting of the Association for Computational Linguistics: System Demonstrations,0,"This paper proposes the building of Xiaomingbot, an intelligent, multilingual and multimodal software robot equipped with four inte- gral capabilities: news generation, news translation, news reading and avatar animation. Its system summarizes Chinese news that it automatically generates from data tables. Next, it translates the summary or the full article into multiple languages, and reads the multi- lingual rendition through synthesized speech. Notably, Xiaomingbot utilizes a voice cloning technology to synthesize the speech trained from a real person{'}s voice data in one input language. The proposed system enjoys several merits: it has an animated avatar, and is able to generate and read multilingual news. Since it was put into practice, Xiaomingbot has written over 600,000 articles, and gained over 150,000 followers on social media platforms."
W19-8604,Rethinking Text Attribute Transfer: A Lexical Analysis,2019,32,2,2,0,4049,yao fu,Proceedings of the 12th International Conference on Natural Language Generation,0,"Text attribute transfer is modifying certain linguistic attributes (e.g. sentiment, style, author-ship, etc.) of a sentence and transforming them from one type to another. In this paper, we aim to analyze and interpret what is changed during the transfer process. We start from the observation that in many existing models and datasets, certain words within a sentence play important roles in determining the sentence attribute class. These words are referred as the Pivot Words. Based on these pivot words, we propose a lexical analysis framework, the Pivot Analysis, to quantitatively analyze the effects of these words in text attribute classification and transfer. We apply this framework to existing datasets and models and show that: (1) the pivot words are strong features for the classification of sentence attributes; (2) to change the attribute of a sentence, many datasets only requires to change certain pivot words; (3) consequently, many transfer models only perform the lexical-level modification,while leaving higher-level sentence structures unchanged. Our work provides an in-depth understanding of linguistic attribute transfer and further identifies the future requirements and challenges of this task"
P19-1125,Imitation Learning for Non-Autoregressive Neural Machine Translation,2019,0,3,3,0,25623,bingzhen wei,Proceedings of the 57th Annual Meeting of the Association for Computational Linguistics,1,"Non-autoregressive translation models (NAT) have achieved impressive inference speedup. A potential issue of the existing NAT algorithms, however, is that the decoding is conducted in parallel, without directly considering previous context. In this paper, we propose an imitation learning framework for non-autoregressive machine translation, which still enjoys the fast translation speed but gives comparable translation performance compared to its auto-regressive counterpart. We conduct experiments on the IWSLT16, WMT14 and WMT16 datasets. Our proposed model achieves a significant speedup over the autoregressive models, while keeping the translation quality comparable to the autoregressive models. By sampling sentence length in parallel at inference time, we achieve the performance of 31.85 BLEU on WMT16 Ro$\rightarrow$En and 30.68 BLEU on IWSLT16 En$\rightarrow$De."
P19-1559,Generating Fluent Adversarial Examples for Natural Languages,2019,0,9,2,0,25876,huangzhao zhang,Proceedings of the 57th Annual Meeting of the Association for Computational Linguistics,1,"Efficiently building an adversarial attacker for natural language processing (NLP) tasks is a real challenge. Firstly, as the sentence space is discrete, it is difficult to make small perturbations along the direction of gradients. Secondly, the fluency of the generated examples cannot be guaranteed. In this paper, we propose MHA, which addresses both problems by performing Metropolis-Hastings sampling, whose proposal is designed with the guidance of gradients. Experiments on IMDB and SNLI show that our proposed MHAoutperforms the baseline model on attacking capability. Adversarial training with MHA also leads to better robustness and performance."
P19-1602,Generating Sentences from Disentangled Syntactic and Semantic Spaces,2019,38,1,2,0,4606,yu bao,Proceedings of the 57th Annual Meeting of the Association for Computational Linguistics,1,"Variational auto-encoders (VAEs) are widely used in natural language generation due to the regularization of the latent space. However, generating sentences from the continuous latent space does not explicitly model the syntactic information. In this paper, we propose to generate sentences from disentangled syntactic and semantic spaces. Our proposed method explicitly models syntactic information in the VAE{'}s latent space by using the linearized tree sequence, leading to better performance of language generation. Additionally, the advantage of sampling in the disentangled syntactic and semantic latent spaces enables us to perform novel applications, such as the unsupervised paraphrase generation and syntax transfer generation. Experimental results show that our proposed model achieves similar or better performance in various tasks, compared with state-of-the-art related work."
P19-1617,Dynamically Fused Graph Network for Multi-hop Reasoning,2019,22,14,4,0.784314,8834,lin qiu,Proceedings of the 57th Annual Meeting of the Association for Computational Linguistics,1,"Text-based question answering (TBQA) has been studied extensively in recent years. Most existing approaches focus on finding the answer to a question within a single paragraph. However, many difficult questions require multiple supporting evidence from scattered text among two or more documents. In this paper, we propose Dynamically Fused Graph Network (DFGN), a novel method to answer those questions requiring multiple scattered evidence and reasoning over them. Inspired by human{'}s step-by-step reasoning behavior, DFGN includes a dynamic fusion layer that starts from the entities mentioned in the given query, explores along the entity graph dynamically built from the text, and gradually finds relevant supporting entities from the given documents. We evaluate DFGN on HotpotQA, a public TBQA dataset requiring multi-hop reasoning. DFGN achieves competitive results on the public board. Furthermore, our analysis shows DFGN produces interpretable reasoning chains."
