2021.iwslt-1.9,The {N}iu{T}rans End-to-End Speech Translation System for {IWSLT} 2021 Offline Task,2021,-1,-1,7,1,5747,chen xu,Proceedings of the 18th International Conference on Spoken Language Translation (IWSLT 2021),0,"This paper describes the submission of the NiuTrans end-to-end speech translation system for the IWSLT 2021 offline task, which translates from the English audio to German text directly without intermediate transcription. We use the Transformer-based model architecture and enhance it by Conformer, relative position encoding, and stacked acoustic and textual encoding. To augment the training data, the English transcriptions are translated to German translations. Finally, we employ ensemble decoding to integrate the predictions from several models trained with the different datasets. Combining these techniques, we achieve 33.84 BLEU points on the MuST-C En-De test set, which shows the enormous potential of the end-to-end model."
2021.findings-emnlp.357,Bag of Tricks for Optimizing Transformer Efficiency,2021,-1,-1,4,1,7297,ye lin,Findings of the Association for Computational Linguistics: EMNLP 2021,0,"Improving Transformer efficiency has become increasingly attractive recently. A wide range of methods has been proposed, e.g., pruning, quantization, new architectures and etc. But these methods are either sophisticated in implementation or dependent on hardware. In this paper, we show that the efficiency of Transformer can be improved by combining some simple and hardware-agnostic methods, including tuning hyper-parameters, better design choices and training strategies. On the WMT news translation tasks, we improve the inference efficiency of a strong Transformer system by 3.80x on CPU and 2.52x on GPU."
2021.emnlp-main.191,{R}ank{NAS}: Efficient Neural Architecture Search by Pairwise Ranking,2021,-1,-1,7,1,9034,chi hu,Proceedings of the 2021 Conference on Empirical Methods in Natural Language Processing,0,"This paper addresses the efficiency challenge of Neural Architecture Search (NAS) by formulating the task as a ranking problem. Previous methods require numerous training examples to estimate the accurate performance of architectures, although the actual goal is to find the distinction between {``}good{''} and {``}bad{''} candidates. Here we do not resort to performance predictors. Instead, we propose a performance ranking method (RankNAS) via pairwise ranking. It enables efficient architecture search using much fewer training examples. Moreover, we develop an architecture selection method to prune the search space and concentrate on more promising candidates. Extensive experiments on machine translation and language modeling tasks show that RankNAS can design high-performance architectures while being orders of magnitude faster than state-of-the-art NAS systems."
2021.ccl-1.30,å©ç¨å¾åæè¿°ä¸ç¥è¯å¾è°±å¢å¼ºè¡¨ç¤ºçè§è§é®ç­(Exploiting Image Captions and External Knowledge as Representation Enhancement for Visual Question Answering),2021,-1,-1,6,0,11744,gechao wang,Proceedings of the 20th Chinese National Conference on Computational Linguistics,0,"{``}è§è§é®ç­ä½ä¸ºå¤æ¨¡æä»»å¡,éè¦æ·±åº¦çè§£å¾ååææ¬é®é¢ä»èæ¨çåºç­æ¡ãç¶èå¨è®¸å¤æ
åµä¸,ä»
å¨å¾ååé®é¢ä¸è¿è¡ç®åæ¨çé¾ä»¥å¾å°æ­£ç¡®çç­æ¡,äºå®ä¸è¿æå
¶å®ææçä¿¡æ¯å¯ä»¥è¢«å©ç¨,ä¾å¦å¾åæè¿°ãå¤é¨ç¥è¯ç­ãéå¯¹ä»¥ä¸é®é¢,æ¬ææåºäºå©ç¨å¾åæè¿°åå¤é¨ç¥è¯å¢å¼ºè¡¨ç¤ºçè§è§é®ç­æ¨¡åãè¯¥æ¨¡åä»¥é®é¢ä¸ºå¯¼å,åºäºååæ³¨æåæºå¶åå«å¨å¾ååå
¶æè¿°ä¸è¿è¡ç¼ç ,å¹¶ä¸å©ç¨ç¥è¯å¾è°±åµå
¥,å°å¤é¨ç¥è¯ç¼ç å°æ¨¡åå½ä¸­,ä¸°å¯äºæ¨¡åçç¹å¾è¡¨ç¤º,å¢å¼ºæ¨¡åçæ¨çè½åãå¨OKVQAæ°æ®éä¸çå®éªç»æè¡¨ææ¬ææ¹æ³ç¸æ¯åºçº¿ç³»ç»æ1.71{\%}çåç¡®çæå,ä¸å
åå·¥ä½ä¸­çä¸»æµæ¨¡åç¸æ¯ä¹æ1.88{\%}çåç¡®çæå,è¯æäºæ¬ææ¹æ³çæææ§ã{''}"
2021.acl-long.162,Weight Distillation: Transferring the Knowledge in Neural Network Parameters,2021,-1,-1,7,1,7297,ye lin,Proceedings of the 59th Annual Meeting of the Association for Computational Linguistics and the 11th International Joint Conference on Natural Language Processing (Volume 1: Long Papers),1,"Knowledge distillation has been proven to be effective in model acceleration and compression. It transfers knowledge from a large neural network to a small one by using the large neural network predictions as targets of the small neural network. But this way ignores the knowledge inside the large neural networks, e.g., parameters. Our preliminary study as well as the recent success in pre-training suggests that transferring parameters are more effective in distilling knowledge. In this paper, we propose Weight Distillation to transfer the knowledge in parameters of a large neural network to a small neural network through a parameter generator. On the WMT16 En-Ro, NIST12 Zh-En, and WMT14 En-De machine translation tasks, our experiments show that weight distillation learns a small network that is 1.88 2.94x faster than the large network but with competitive BLEU performance. When fixing the size of small networks, weight distillation outperforms knowledge distillation by 0.51 1.82 BLEU points."
2021.acl-long.204,Stacked Acoustic-and-Textual Encoding: Integrating the Pre-trained Models into Speech Translation Encoders,2021,-1,-1,8,1,5747,chen xu,Proceedings of the 59th Annual Meeting of the Association for Computational Linguistics and the 11th International Joint Conference on Natural Language Processing (Volume 1: Long Papers),1,"Encoder pre-training is promising in end-to-end Speech Translation (ST), given the fact that speech-to-translation data is scarce. But ST encoders are not simple instances of Automatic Speech Recognition (ASR) or Machine Translation (MT) encoders. For example, we find that ASR encoders lack the global context representation, which is necessary for translation, whereas MT encoders are not designed to deal with long but locally attentive acoustic sequences. In this work, we propose a Stacked Acoustic-and-Textual Encoding (SATE) method for speech translation. Our encoder begins with processing the acoustic sequence as usual, but later behaves more like an MT encoder for a global representation of the input sequence. In this way, it is straightforward to incorporate the pre-trained models into the system. Also, we develop an adaptor module to alleviate the representation inconsistency between the pre-trained ASR encoder and MT encoder, and develop a multi-teacher knowledge distillation method to preserve the pre-training knowledge. Experimental results on the LibriSpeech En-Fr and MuST-C En-De ST tasks show that our method achieves state-of-the-art BLEU scores of 18.3 and 25.2. To our knowledge, we are the first to develop an end-to-end ST system that achieves comparable or even better BLEU performance than the cascaded ST counterpart when large-scale ASR and MT data is available."
2020.wmt-1.37,The {N}iu{T}rans Machine Translation Systems for {WMT}20,2020,-1,-1,18,0,4467,yuhao zhang,Proceedings of the Fifth Conference on Machine Translation,0,"This paper describes NiuTrans neural machine translation systems of the WMT20 news translation tasks. We participated in Japanese{\textless}-{\textgreater}English, English-{\textgreater}Chinese, Inuktitut-{\textgreater}English and Tamil-{\textgreater}English total five tasks and rank first in Japanese{\textless}-{\textgreater}English both sides. We mainly utilized iterative back-translation, different depth and widen model architectures, iterative knowledge distillation and iterative fine-tuning. And we find that adequately widened and deepened the model simultaneously, the performance will significantly improve. Also, iterative fine-tuning strategy we implemented is effective during adapting domain. For Inuktitut-{\textgreater}English and Tamil-{\textgreater}English tasks, we built multilingual models separately and employed pretraining word embedding to obtain better performance."
2020.wmt-1.117,The {N}iu{T}rans System for the {WMT}20 Quality Estimation Shared Task,2020,-1,-1,12,1,9034,chi hu,Proceedings of the Fifth Conference on Machine Translation,0,"This paper describes the submissions of the NiuTrans Team to the WMT 2020 Quality Estimation Shared Task. We participated in all tasks and all language pairs. We explored the combination of transfer learning, multi-task learning and model ensemble. Results on multiple tasks show that deep transformer machine translation models and multilingual pretraining methods significantly improve translation quality estimation performance. Our system achieved remarkable results in multiple level tasks, e.g., our submissions obtained the best results on all tracks in the sentence-level Direct Assessment task."
2020.ngt-1.24,The {N}iu{T}rans System for {WNGT} 2020 Efficiency Task,2020,-1,-1,8,1,9034,chi hu,Proceedings of the Fourth Workshop on Neural Generation and Translation,0,"This paper describes the submissions of the NiuTrans Team to the WNGT 2020 Efficiency Shared Task. We focus on the efficient implementation of deep Transformer models (Wang et al., 2019; Li et al., 2019) using NiuTensor, a flexible toolkit for NLP tasks. We explored the combination of deep encoder and shallow decoder in Transformer models via model compression and knowledge distillation. The neural machine translation decoding also benefits from FP16 inference, attention caching, dynamic batching, and batch pruning. Our systems achieve promising results in both translation quality and efficiency, e.g., our fastest system can translate more than 40,000 tokens per second with an RTX 2080 Ti while maintaining 42.9 BLEU on newstest2018."
2020.findings-emnlp.385,Training Flexible Depth Model by Multi-Task Learning for Neural Machine Translation,2020,-1,-1,3,1,19917,qiang wang,Findings of the Association for Computational Linguistics: EMNLP 2020,0,"The standard neural machine translation model can only decode with the same depth configuration as training. Restricted by this feature, we have to deploy models of various sizes to maintain the same translation latency, because the hardware conditions on different terminal devices (e.g., mobile phones) may vary greatly. Such individual training leads to increased model maintenance costs and slower model iterations, especially for the industry. In this work, we propose to use multi-task learning to train a flexible depth model that can adapt to different depth configurations during inference. Experimental results show that our approach can simultaneously support decoding in 24 depth configurations and is superior to the individual training and another flexible depth model training method{---}{---}LayerDrop."
2020.emnlp-main.72,Shallow-to-Deep Training for Neural Machine Translation,2020,-1,-1,8,1,12925,bei li,Proceedings of the 2020 Conference on Empirical Methods in Natural Language Processing (EMNLP),0,"Deep encoders have been proven to be effective in improving neural machine translation (NMT) systems, but training an extremely deep encoder is time consuming. Moreover, why deep models help NMT is an open question. In this paper, we investigate the behavior of a well-tuned deep Transformer system. We find that stacking layers is helpful in improving the representation ability of NMT models and adjacent layers perform similarly. This inspires us to develop a shallow-to-deep training method that learns deep models by stacking shallow models. In this way, we successfully train a Transformer system with a 54-layer encoder. Experimental results on WMT{'}16 English-German and WMT{'}14 English-French translation tasks show that it is 1:4 faster than training from scratch, and achieves a BLEU score of 30:33 and 43:29 on two tasks. The code is publicly available at \url{https://github.com/libeineu/SDT-Training}."
2020.coling-main.352,Dynamic Curriculum Learning for Low-Resource Neural Machine Translation,2020,-1,-1,9,1,5747,chen xu,Proceedings of the 28th International Conference on Computational Linguistics,0,"Large amounts of data has made neural machine translation (NMT) a big success in recent years. But it is still a challenge if we train these models on small-scale corpora. In this case, the way of using data appears to be more important. Here, we investigate the effective use of training data for low-resource NMT. In particular, we propose a dynamic curriculum learning (DCL) method to reorder training samples in training. Unlike previous work, we do not use a static scoring function for reordering. Instead, the order of training samples is dynamically determined in two ways - loss decline and model competence. This eases training by highlighting easy samples that the current model has enough competence to learn. We test our DCL method in a Transformer-based system. Experimental results show that DCL outperforms several strong baselines on three low-resource machine translation benchmarks and different sized data of WMT{'}16 En-De."
2020.coling-main.377,Layer-Wise Multi-View Learning for Neural Machine Translation,2020,-1,-1,5,1,19917,qiang wang,Proceedings of the 28th International Conference on Computational Linguistics,0,"Traditional neural machine translation is limited to the topmost encoder layer{'}s context representation and cannot directly perceive the lower encoder layers. Existing solutions usually rely on the adjustment of network architecture, making the calculation more complicated or introducing additional structural restrictions. In this work, we propose layer-wise multi-view learning to solve this problem, circumventing the necessity to change the model structure. We regard each encoder layer{'}s off-the-shelf output, a by-product in layer-by-layer encoding, as the redundant view for the input sentence. In this way, in addition to the topmost encoder layer (referred to as the primary view), we also incorporate an intermediate encoder layer as the auxiliary view. We feed the two views to a partially shared decoder to maintain independent prediction. Consistency regularization based on KL divergence is used to encourage the two views to learn from each other. Extensive experimental results on five translation tasks show that our approach yields stable improvements over multiple strong baselines. As another bonus, our method is agnostic to network architectures and can maintain the same inference speed as the original model."
2020.coling-main.526,A Simple and Effective Approach to Robust Unsupervised Bilingual Dictionary Induction,2020,-1,-1,8,1,7298,yanyang li,Proceedings of the 28th International Conference on Computational Linguistics,0,"Unsupervised Bilingual Dictionary Induction methods based on the initialization and the self-learning have achieved great success in similar language pairs, e.g., English-Spanish. But they still fail and have an accuracy of 0{\%} in many distant language pairs, e.g., English-Japanese. In this work, we show that this failure results from the gap between the actual initialization performance and the minimum initialization performance for the self-learning to succeed. We propose Iterative Dimension Reduction to bridge this gap. Our experiments show that this simple method does not hamper the performance of similar language pairs and achieves an accuracy of 13.64 55.53{\%} between English and four distant languages, i.e., Chinese, Japanese, Vietnamese and Thai."
2020.acl-main.322,Does Multi-Encoder Help? A Case Study on Context-Aware Neural Machine Translation,2020,22,0,6,1,12925,bei li,Proceedings of the 58th Annual Meeting of the Association for Computational Linguistics,1,"In encoder-decoder neural models, multiple encoders are in general used to represent the contextual information in addition to the individual sentence. In this paper, we investigate multi-encoder approaches in document-level neural machine translation (NMT). Surprisingly, we find that the context encoder does not only encode the surrounding sentences but also behaves as a noise generator. This makes us rethink the real benefits of multi-encoder in context-aware translation - some of the improvements come from robust training. We compare several methods that introduce noise and/or well-tuned dropout setup into the training of these encoders. Experimental results show that noisy training plays an important role in multi-encoder-based NMT, especially when the training data is small. Also, we establish a new state-of-the-art on IWSLT Fr-En task by careful use of noise generation and dropout methods."
2020.acl-main.592,Learning Architectures from an Extended Search Space for Language Modeling,2020,-1,-1,7,1,9038,yinqiao li,Proceedings of the 58th Annual Meeting of the Association for Computational Linguistics,1,"Neural architecture search (NAS) has advanced significantly in recent years but most NAS systems restrict search to learning architectures of a recurrent or convolutional cell. In this paper, we extend the search space of NAS. In particular, we present a general approach to learn both intra-cell and inter-cell architectures (call it ESS). For a better search result, we design a joint learning method to perform intra-cell and inter-cell NAS simultaneously. We implement our model in a differentiable architecture search system. For recurrent neural language modeling, it outperforms a strong baseline significantly on the PTB and WikiText data, with a new state-of-the-art on PTB. Moreover, the learned architectures show good transferability to other systems. E.g., they improve state-of-the-art systems on the CoNLL and WNUT named entity recognition (NER) tasks and CoNLL chunking task, indicating a promising line of research on large-scale pre-learned architectures."
W19-5325,The {N}iu{T}rans Machine Translation Systems for {WMT}19,2019,0,1,17,1,12925,bei li,"Proceedings of the Fourth Conference on Machine Translation (Volume 2: Shared Task Papers, Day 1)",0,"This paper described NiuTrans neural machine translation systems for the WMT 2019 news translation tasks. We participated in 13 translation directions, including 11 supervised tasks, namely ENâ{ZH, DE, RU, KK, LT}, GUâEN and the unsupervised DEâCS sub-track. Our systems were built on Deep Transformer and several back-translation methods. Iterative knowledge distillation and ensemble+reranking were also employed to obtain stronger models. Our unsupervised submissions were based on NMT enhanced by SMT. As a result, we achieved the highest BLEU scores in {KKâEN, GUâEN} directions, ranking 2nd in {RUâEN, DEâCS} and 3rd in {ZHâEN, LTâEN, ENâRU, ENâDE} among all constrained submissions."
P19-1176,Learning Deep Transformer Models for Machine Translation,2019,36,11,4,1,19917,qiang wang,Proceedings of the 57th Annual Meeting of the Association for Computational Linguistics,1,"Transformer is the state-of-the-art model in recent machine translation evaluations. Two strands of research are promising to improve models of this kind: the first uses wide networks (a.k.a. Transformer-Big) and has been the de facto standard for development of the Transformer system, and the other uses deeper language representation but faces the difficulty arising from learning deep networks. Here, we continue the line of research on the latter. We claim that a truly deep Transformer model can surpass the Transformer-Big counterpart by 1) proper use of layer normalization and 2) a novel way of passing the combination of previous layers to the next. On WMT{'}16 English-German and NIST OpenMT{'}12 Chinese-English tasks, our deep system (30/25-layer encoder) outperforms the shallow Transformer-Big/Base baseline (6-layer encoder) by 0.4-2.4 BLEU points. As another bonus, the deep model is 1.6X smaller in size and 3X faster in training than Transformer-Big."
P19-1352,Shared-Private Bilingual Word Embeddings for Neural Machine Translation,2019,35,1,6,0,7025,xuebo liu,Proceedings of the 57th Annual Meeting of the Association for Computational Linguistics,1,"Word embedding is central to neural machine translation (NMT), which has attracted intensive research interest in recent years. In NMT, the source embedding plays the role of the entrance while the target embedding acts as the terminal. These layers occupy most of the model parameters for representation learning. Furthermore, they indirectly interface via a soft-attention mechanism, which makes them comparatively isolated. In this paper, we propose shared-private bilingual word embeddings, which give a closer relationship between the source and target embeddings, and which also reduce the number of model parameters. For similar source and target words, their embeddings tend to share a part of the features and they cooperatively learn these common representation units. Experiments on 5 language pairs belonging to 6 different language families and written in 5 different alphabets demonstrate that the proposed model provides a significant performance boost over the strong baselines with dramatically fewer model parameters."
D19-1367,Improved Differentiable Architecture Search for Language Modeling and Named Entity Recognition,2019,0,3,5,0,9174,yufan jiang,Proceedings of the 2019 Conference on Empirical Methods in Natural Language Processing and the 9th International Joint Conference on Natural Language Processing (EMNLP-IJCNLP),0,"In this paper, we study differentiable neural architecture search (NAS) methods for natural language processing. In particular, we improve differentiable architecture search by removing the softmax-local constraint. Also, we apply differentiable NAS to named entity recognition (NER). It is the first time that differentiable NAS methods are adopted in NLP tasks other than language modeling. On both the PTB language modeling and CoNLL-2003 English NER data, our method outperforms strong baselines. It achieves a new state-of-the-art on the NER task."
Y18-1010,Detecting Free Translation in Parallel Corpora from Attention Scores,2018,0,0,3,0,15542,qi chen,"Proceedings of the 32nd Pacific Asia Conference on Language, Information and Computation",0,None
W18-6430,The {N}iu{T}rans Machine Translation System for {WMT}18,2018,0,3,9,1,19917,qiang wang,Proceedings of the Third Conference on Machine Translation: Shared Task Papers,0,"This paper describes the submission of the NiuTrans neural machine translation system for the WMT 2018 Chinese â English news translation tasks. Our baseline systems are based on the Transformer architecture. We further improve the translation performance 2.4-2.6 BLEU points from four aspects, including architectural improvements, diverse ensemble decoding, reranking, and post-processing. Among constrained submissions, we rank 2nd out of 16 submitted systems on Chinese â English task and 3rd out of 16 on English â Chinese task, respectively."
P18-2047,A Simple and Effective Approach to Coverage-Aware Neural Machine Translation,2018,0,3,6,1,7298,yanyang li,Proceedings of the 56th Annual Meeting of the Association for Computational Linguistics (Volume 2: Short Papers),0,"We offer a simple and effective method to seek a better balance between model confidence and length preference for Neural Machine Translation (NMT). Unlike the popular length normalization and coverage models, our model does not require training nor reranking the limited n-best outputs. Moreover, it is robust to large beam sizes, which is not well studied in previous work. On the Chinese-English and English-German translation tasks, our approach yields +0.4 1.5 BLEU improvements over the state-of-the-art baselines."
C18-1255,Multi-layer Representation Fusion for Neural Machine Translation,2018,0,13,6,1,19917,qiang wang,Proceedings of the 27th International Conference on Computational Linguistics,0,"Neural machine translation systems require a number of stacked layers for deep models. But the prediction depends on the sentence representation of the top-most layer with no access to low-level representations. This makes it more difficult to train the model and poses a risk of information loss to prediction. In this paper, we propose a multi-layer representation fusion (MLRF) approach to fusing stacked layers. In particular, we design three fusion functions to learn a better representation from the stack. Experimental results show that our approach yields improvements of 0.92 and 0.56 BLEU points over the strong Transformer baseline on IWSLT German-English and NIST Chinese-English MT tasks respectively. The result is new state-of-the-art in German-English translation."
