W11-1204,Building and Using Comparable Corpora for Domain-Specific Bilingual Lexicon Extraction,2011,17,14,1,1,443,darja fivser,Proceedings of the 4th Workshop on Building and Using Comparable Corpora: Comparable Corpora and the Web,0,"This paper presents a series of experiments aimed at inducing and evaluating domain-specific bilingual lexica from comparable corpora. First, a small English-Slovene comparable corpus from health magazines was manually constructed and then used to compile a large comparable corpus on health-related topics from web corpora. Next, a bilingual lexicon for the domain was extracted from the corpus by comparing context vectors in the two languages. Evaluation of the results shows that a 2-way translation of context vectors significantly improves precision of the extracted translation equivalents. We also show that it is sufficient to increase the corpus for one language in order to obtain a higher recall, and that the increase of the number of new words is linear in the size of the corpus. Finally, we demonstrate that by lowering the frequency threshold for context vectors, the drop in precision is much slower than the increase of recall."
R11-1018,Bilingual lexicon extraction from comparable corpora for closely related languages,2011,12,20,1,1,443,darja fivser,Proceedings of the International Conference Recent Advances in Natural Language Processing 2011,0,"In this paper we present a knowledge-light approach to extract a bilingual lexicon for closely related languages from comparable corpora. While in most related work an existing dictionary is used to translate context vectors, we take advantage of the similarities between languages instead and build a seed lexicon from words that are identical in both languages and then further extend it with context-based cognates and translations of the most frequent words. We also use cognates for reranking translation candidates obtained via context similarity and extract translation equivalents for all content words, not just nouns as in most related work. The results are very encouraging, suggesting that other similar languages could benefit from the same approach. By enlarging the seed lexicon with cognates and translations of the most frequent words and by cognate-based reranking of translation candidates we were able to improve the average baseline precision from 0.592 to 0.797 on the mean reciprocal rank for the ten top-ranking translation candidates for nouns, verbs and adjectives with a 46% recall on the gold standard of 1000 random entries from a traditional dictionary."
erjavec-etal-2010-jos,The {JOS} Linguistically Tagged Corpus of {S}lovene,2010,6,34,2,0.472026,15753,tomavz erjavec,Proceedings of the Seventh International Conference on Language Resources and Evaluation ({LREC}'10),0,"The JOS language resources are meant to facilitate developments of HLT and corpus linguistics for the Slovene language and consist of the morphosyntactic specifications, defining the Slovene morphosyntactic features and tagset; two annotated corpora (jos100k and jos1M); and two web services (a concordancer and text annotation tool). The paper introduces these components, and concentrates on jos100k, a 100,000 word sampled balanced monolingual Slovene corpus, manually annotated for three levels of linguistic description. On the morphosyntactic level, each word is annotated with its morphosyntactic description and lemma; on the syntactic level the sentences are annotated with dependency links; on the semantic level, all the occurrences of 100 top nouns in the corpus are annotated with their wordnet synset from the Slovene semantic lexicon sloWNet. The JOS corpora and specifications have a standardised encoding (Text Encoding Initiative Guidelines TEI P5) and are available for research from http://nl.ijs.si/jos/ under the Creative Commons licence."
fiser-etal-2010-learning,Learning to Mine Definitions from {S}lovene Structured and Unstructured Knowledge-Rich Resources,2010,20,6,1,1,443,darja fivser,Proceedings of the Seventh International Conference on Language Resources and Evaluation ({LREC}'10),0,"The paper presents an innovative approach to extract Slovene definition candidates from domain-specific corpora using morphosyntactic patterns, automatic terminology recognition and semantic tagging with wordnet senses. First, a classification model was trained on examples from Slovene Wikipedia which was then used to find well-formed definitions among the extracted candidates. The results of the experiment are encouraging, with accuracy ranging from 67{\%} to 71{\%}. The paper also addresses some drawbacks of the approach and suggests ways to overcome them in future work."
vintar-fiser-2008-harvesting,Harvesting Multi-Word Expressions from Parallel Corpora,2008,13,14,2,1,21021,vspela vintar,Proceedings of the Sixth International Conference on Language Resources and Evaluation ({LREC}'08),0,"The paper presents a set of approaches to extend the automatically created Slovene wordnet with nominal multi-word expressions. In the first approach multi-word expressions from Princeton WordNet are translated with a technique that is based on word-alignment and lexico-syntactic patterns. This is followed by extracting new terms from a monolingual corpus using keywordness ranking and contextual patterns. Finally, the multi-word expressions are assigned a hypernym and added to our wordnet. Manual evaluation and comparison of the results shows that the translation approach is the most straightforward and accurate. However, it is successfully complemented by the two monolingual approaches which are able to identify more term candidates in the corpus that would otherwise go unnoticed. Some weaknesses of the proposed wordnet extension techniques are also addressed."
2008.jeptalnrecital-long.18,Construction d{'}un wordnet libre du fran{\\c{c}}ais {\\`a} partir de ressources multilingues,2008,-1,-1,2,0.0749817,250,benoit sagot,Actes de la 15{\\`e}me conf{\\'e}rence sur le Traitement Automatique des Langues Naturelles. Articles longs,0,"Cet article d{\'e}crit la construction d{'}un Wordnet Libre du Fran{\c{c}}ais (WOLF) {\`a} partir du Princeton WordNet et de diverses ressources multilingues. Les lex{\`e}mes polys{\'e}miques ont {\'e}t{\'e} trait{\'e}s au moyen d{'}une approche reposant sur l{'}alignement en mots d{'}un corpus parall{\`e}le en cinq langues. Le lexique multilingue extrait a {\'e}t{\'e} d{\'e}sambigu{\""\i}s{\'e} s{\'e}mantiquement {\`a} l{'}aide des wordnets des langues concern{\'e}es. Par ailleurs, une approche bilingue a {\'e}t{\'e} suffisante pour construire de nouvelles entr{\'e}es {\`a} partir des lex{\`e}mes monos{\'e}miques. Nous avons pour cela extrait des lexiques bilingues {\`a} partir deWikip{\'e}dia et de th{\'e}saurus. Le wordnet obtenu a {\'e}t{\'e} {\'e}valu{\'e} par rapport au wordnet fran{\c{c}}ais issu du projet EuroWordNet. Les r{\'e}sultats sont encourageants, et des applications sont d{'}ores et d{\'e}j{\`a} envisag{\'e}es."
erjavec-fiser-2006-building,Building {S}lovene {W}ord{N}et,2006,19,18,2,0,15753,tomavz erjavec,Proceedings of the Fifth International Conference on Language Resources and Evaluation ({LREC}{'}06),0,"A WordNet is a lexical database in which nouns, verbs, adjectives and adverbs are organized in a conceptual hierarchy, linking semantically and lexically related concepts. Such semantic lexicons have become oneof the most valuable resources for a wide range of NLP research and applications, such as semantic tagging, automatic word-sense disambiguation, information retrieval and document summarisation. Following the WordNet design for the English languagedeveloped at Princeton, WordNets for a number of other languages havebeen developed in the past decade, taking the idea into the domain ofmultilingual processing. This paper reports on the prototype SloveneWordNet which currently contains about 5,000 top-level concepts. Theresource has been automatically translated from the Serbian WordNet, with the help of a bilingual dictionary, synset literals ranked according to the frequency of corpus occurrence, and results manually corrected. The paper presents the results obtained, discusses some problems encountered along the way and points out some possibilitiesof automated acquisition and refinement of synsets in the future."
