P15-1038,It Depends: Dependency Parser Comparison Using A Web-based Evaluation Tool,2015,38,52,2,0,1137,jinho choi,Proceedings of the 53rd Annual Meeting of the Association for Computational Linguistics and the 7th International Joint Conference on Natural Language Processing (Volume 1: Long Papers),1,"The last few years have seen a surge in the number of accurate, fast, publicly available dependency parsers. At the same time, the use of dependency parsing in NLP applications has increased. It can be difficult for a non-expert to select a good xe2x80x9coff-the-shelfxe2x80x9d parser. We present a comparative analysis of ten leading statistical dependency parsers on a multi-genre corpus of English. For our analysis, we developed a new web-based tool that gives a convenient way of comparing dependency parser outputs. Our analysis will help practitioners choose a parser to optimize their desired speed/accuracy tradeoff, and our tool will help practitioners examine and compare parser output."
P14-2029,Predicting Grammaticality on an Ordinal Scale,2014,20,27,6,0.594173,34075,michael heilman,Proceedings of the 52nd Annual Meeting of the Association for Computational Linguistics (Volume 2: Short Papers),0,"Automated methods for identifying whether sentences are grammatical have various potential applications (e.g., machine translation, automated essay scoring, computer-assisted language learning). In this work, we construct a statistical model of grammaticality using various linguistic features (e.g., misspelling counts, parser outputs, n-gram language model scores). We also present a new publicly available dataset of learner sentences judged for grammaticality on an ordinal scale. In evaluations, we compare our system to the one from Post (2011) and find that our approach yields state-of-the-art performance."
E14-4010,Non-Monotonic Parsing of Fluent Umm {I} mean Disfluent Sentences,2014,20,6,2,0.666667,3273,mohammad rasooli,"Proceedings of the 14th Conference of the {E}uropean Chapter of the Association for Computational Linguistics, volume 2: Short Papers",0,"Parsing disfluent sentences is a challenging task which involves detecting disfluencies as well as identifying the syntactic structure of the sentence. While there have been several studies recently into solely detecting disfluencies at a high performance level, there has been relatively little work into joint parsing and disfluency detection that has reached that state-ofthe-art performance in disfluency detection. We improve upon recent work in this joint task through the use of novel features and learning cascades to produce a model which performs at 82.6 F-score. It outperforms the previous best in disfluency detection on two different evaluations."
C14-3004,Automated Grammatical Error Correction for Language Learners,2014,-1,-1,1,1,191,joel tetreault,"Proceedings of {COLING} 2014, the 25th International Conference on Computational Linguistics: Tutorial Abstracts",0,None
W13-3601,The {C}o{NLL}-2013 Shared Task on Grammatical Error Correction,2013,20,104,5,0,7314,hwee ng,Proceedings of the Seventeenth Conference on Computational Natural Language Learning: Shared Task,0,"The CoNLL-2013 shared task was devoted to grammatical error correction. In this paper, we give the task definition, present the data sets, and describe the evaluation metric and scorer used in the shared task. We also give an overview of the various approaches adopted by the participating teams, and present the evaluation results."
W13-1706,A Report on the First Native Language Identification Shared Task,2013,12,81,1,1,191,joel tetreault,Proceedings of the Eighth Workshop on Innovative Use of {NLP} for Building Educational Applications,0,"Native Language Identification, or NLI, is the task of automatically classifying the L1 of a writer based solely on his or her essay written in another language. This problem area has seen a spike in interest in recent years as it can have an impact on educational applications tailored towards non-native speakers of a language, as well as authorship profiling. While there has been a growing body of work in NLI, it has been difficult to compare methodologies because of the different approaches to pre-processing the data, different sets of languages identified, and different splits of the data used. In this shared task, the first ever for Native Language Identification, we sought to address the above issues by providing a large corpus designed specifically for NLI, in addition to providing an environment for systems to be directly compared. In this paper, we report the results of the shared task. A total of 29 teams from around the world competed across three different sub-tasks."
N13-1055,Robust Systems for Preposition Error Correction Using {W}ikipedia Revisions,2013,26,26,3,0.160439,4873,aoife cahill,Proceedings of the 2013 Conference of the North {A}merican Chapter of the Association for Computational Linguistics: Human Language Technologies,0,"We show that existing methods for training preposition error correction systems, whether using well-edited text or error-annotated corpora, do not generalize across very different test sets. We present a new, large errorannotated corpus and use it to train systems that generalize across three different test sets, each from a different domain and with different error characteristics. This new corpus is automatically extracted from Wikipedia revisions and contains over one million instances of preposition corrections."
D13-1013,Joint Parsing and Disfluency Detection in Linear Time,2013,19,19,2,0.666667,3273,mohammad rasooli,Proceedings of the 2013 Conference on Empirical Methods in Natural Language Processing,0,"We introduce a novel method to jointly parse and detect disfluencies in spoken utterances. Our model can use arbitrary features for parsing sentences and adapt itself with out-ofdomain data. We show that our method, based on transition-based parsing, performs at a high level of accuracy for both the parsing and disfluency detection tasks. Additionally, our method is the fastest for the joint task, running in linear time."
W12-2005,Exploring Grammatical Error Correction with Not-So-Crummy Machine Translation,2012,14,15,2,1,16057,nitin madnani,Proceedings of the Seventh Workshop on Building Educational Applications Using {NLP},0,"To date, most work in grammatical error correction has focused on targeting specific error types. We present a probe study into whether we can use round-trip translations obtained from Google Translate via 8 different pivot languages for whole-sentence grammatical error correction. We develop a novel alignment algorithm for combining multiple round-trip translations into a lattice using the TERp machine translation metric. We further implement six different methods for extracting whole-sentence corrections from the lattice. Our preliminary experiments yield fairly satisfactory results but leave significant room for improvement. Most importantly, though, they make it clear the methods we propose have strong potential and require further study."
W12-2027,Precision Isn{'}t Everything: A Hybrid Approach to Grammatical Error Detection,2012,12,7,3,0.594173,34075,michael heilman,Proceedings of the Seventh Workshop on Building Educational Applications Using {NLP},0,"Some grammatical error detection methods, including the ones currently used by the Educational Testing Service's e-rater system (Attali and Burstein, 2006), are tuned for precision because of the perceived high cost of false positives (i.e., marking fluent English as ungrammatical). Precision, however, is not optimal for all tasks, particularly the HOO 2012 Shared Task on grammatical errors, which uses F-score for evaluation. In this paper, we extend e-rater's preposition and determiner error detection modules with a large-scale n-gram method (Bergsma et al., 2009) that complements the existing rule-based and classifier-based methods. On the HOO 2012 Shared Task, the hybrid method performed better than its component methods in terms of F-score, and it was competitive with submissions from other HOO 2012 participants."
N12-1003,Identifying High-Level Organizational Elements in Argumentative Discourse,2012,10,34,3,1,16057,nitin madnani,Proceedings of the 2012 Conference of the North {A}merican Chapter of the Association for Computational Linguistics: Human Language Technologies,0,"Argumentative discourse contains not only language expressing claims and evidence, but also language used to organize these claims and pieces of evidence. Differentiating between the two may be useful for many applications, such as those that focus on the content (e.g., relation extraction) of arguments and those that focus on the structure of arguments (e.g., automated essay scoring). We propose an automated approach to detecting high-level organizational elements in argumentative discourse that combines a rule-based system and a probabilistic sequence model in a principled manner. We present quantitative results on a dataset of human-annotated persuasive essays, and qualitative analyses of performance on essays and on political debates."
N12-1019,Re-examining Machine Translation Metrics for Paraphrase Identification,2012,22,111,2,1,16057,nitin madnani,Proceedings of the 2012 Conference of the North {A}merican Chapter of the Association for Computational Linguistics: Human Language Technologies,0,"We propose to re-examine the hypothesis that automated metrics developed for MT evaluation can prove useful for paraphrase identification in light of the significant work on the development of new MT metrics over the last 4 years. We show that a meta-classifier trained using nothing but recent MT metrics outperforms all previous paraphrase identification approaches on the Microsoft Research Paraphrase corpus. In addition, we apply our system to a second corpus developed for the task of plagiarism detection and obtain extremely positive results. Finally, we conduct extensive error analysis and uncover the top systematic sources of error for a paraphrase identification approach relying solely on MT metrics. We release both the new dataset and the error analysis annotations for use by the community."
N12-1029,"Correcting Comma Errors in Learner Essays, and Restoring Commas in Newswire Text",2012,29,7,2,0,38683,ross israel,Proceedings of the 2012 Conference of the North {A}merican Chapter of the Association for Computational Linguistics: Human Language Technologies,0,"While the field of grammatical error detection has progressed over the past few years, one area of particular difficulty for both native and non-native learners of English, comma placement, has been largely ignored. We present a system for comma error correction in English that achieves an average of 89% precision and 25% recall on two corpora of unedited student essays. This system also achieves state-of-the-art performance in the sister task of restoring commas in well-formed text. For both tasks, we show that the use of novel features which encode long-distance information improves upon the more lexically-driven features used in prior work."
C12-1038,Problems in Evaluating Grammatical Error Detection Systems,2012,45,31,4,0,2196,martin chodorow,Proceedings of {COLING} 2012,0,"Many evaluation issues for grammatical error detection have previously been overlooked, making it hard to draw meaningful comparisons between different approaches, even when they are evaluated on the same corpus. To begin with, the three-way contingency between a writerxe2x80x99s sentence, the annotatorxe2x80x99s correction, and the systemxe2x80x99s output makes evaluation more complex than in some other NLP tasks, which we address by presenting an intuitive evaluation scheme. Of particular importance to error detection is the skew of the data xe2x80x90 the low frequency of errors as compared to non-errors xe2x80x90 which distorts some traditional measures of performance and limits their usefulness, leading us to recommend the reporting of raw measurements (true positives, false negatives, false positives, true negatives). Other issues that are particularly vexing for error detection focus on defining these raw measurements: specifying the size or scope of an error, properly treating errors as graded rather than discrete phenomena, and counting non-errors. We discuss recommendations for best practices with regard to reporting the results of system evaluation for these cases, recommendations which depend upon making clear onexe2x80x99s assumptions and applications for error detection. By highlighting the problems with current error detection evaluation, the field will be better able to move forward."
C12-1158,"Native Tongues, Lost and Found: Resources and Empirical Evaluations in Native Language Identification",2012,23,0,1,1,191,joel tetreault,Proceedings of {COLING} 2012,0,"In this paper we present work on the task of Native Language Identification (NLI). We present an alternative corpus to the ICLE which has been used in most work up until now. We believe that our corpus, TOEFL11, is more suitable for the task of NLI and will allow researchers to better compare systems and results. We show that many of the features that have been commonly used in this task generalize to new and larger corpora. In addition, we examine possible ways of increasing current system performance (e.g., additional features and feature combination methods), and achieve overall state-of-the-art results (accuracy of 90.1%) on the ICLE corpus using an ensemble classifier that includes previously examined features and a novel feature (n-gram language models). We also show that training on a large corpus and testing on a smaller one works well, but not vice versa. Finally, we show that system performance varies across proficiency scores."
W11-2111,{E}-rating Machine Translation,2011,26,17,2,0,43862,kristen parton,Proceedings of the Sixth Workshop on Statistical Machine Translation,0,"We describe our submissions to the WMT11 shared MT evaluation task: MTeRater and MTeRater-Plus. Both are machine-learned metrics that use features from e-raterxc2xae, an automated essay scoring engine designed to assess writing proficiency. Despite using only features from e-rater and without comparing to translations, MTeRater achieves a sentence-level correlation with human rankings equivalent to BLEU. Since MTeRater only assesses fluency, we build a meta-metric, MTeRater-Plus, that incorporates adequacy by combining MTeRater with other MT evaluation metrics and heuristics. This meta-metric has a higher correlation with human rankings than either MTeRater or individual MT metrics alone. However, we also find that e-rater features may not have significant impact on correlation in every case."
P11-2089,They Can Help: Using Crowdsourcing to Improve the Evaluation of Grammatical Error Detection Systems,2011,24,24,3,1,16057,nitin madnani,Proceedings of the 49th Annual Meeting of the Association for Computational Linguistics: Human Language Technologies,0,"Despite the rising interest in developing grammatical error detection systems for non-native speakers of English, progress in the field has been hampered by a lack of informative metrics and an inability to directly compare the performance of systems developed by different researchers. In this paper we address these problems by presenting two evaluation methodologies, both based on a novel use of crowdsourcing."
D11-1119,Exploiting Syntactic and Distributional Information for Spelling Correction with Web-Scale N-gram Models,2011,32,12,2,0,4068,wei xu,Proceedings of the 2011 Conference on Empirical Methods in Natural Language Processing,0,We propose a novel way of incorporating dependency parse and word co-occurrence information into a state-of-the-art web-scale n-gram model for spelling correction. The syntactic and distributional information provides extra evidence in addition to that provided by a web-scale n-gram corpus and especially helps with data sparsity problems. Experimental results show that introducing syntactic features into n-gram based models significantly reduces errors by up to 12.4% over the current state-of-the-art. The word co-occurrence information shows potential but only improves overall accuracy slightly.
W10-1006,Rethinking Grammatical Error Annotation and Evaluation with the {A}mazon {M}echanical {T}urk,2010,8,22,1,1,191,joel tetreault,Proceedings of the {NAACL} {HLT} 2010 Fifth Workshop on Innovative Use of {NLP} for Building Educational Applications,0,"In this paper we present results from two pilot studies which show that using the Amazon Mechanical Turk for preposition error annotation is as effective as using trained raters, but at a fraction of the time and cost. Based on these results, we propose a new evaluation method which makes it feasible to compare two error detection systems tested on different learner data sets."
W10-1010,Towards Using Structural Events To Assess Non-native Speech,2010,14,10,2,0,4812,lei chen,Proceedings of the {NAACL} {HLT} 2010 Fifth Workshop on Innovative Use of {NLP} for Building Educational Applications,0,"We investigated using structural events, e.g., clause and disfluency structure, from transcriptions of spontaneous non-native speech, to compute features for measuring speaking proficiency. Using a set of transcribed audio files collected from the TOEFL Practice Test Online (TPO), we conducted a sophisticated annotation of structural events, including clause boundaries and types, as well as disfluencies. Based on words and the annotated structural events, we extracted features related to syntactic complexity, e.g., the mean length of clause (MLC) and dependent clause frequency (DEPC), and a feature related to disfluencies, the interruption point frequency per clause (IPC). Among these features, the IPC shows the highest correlation with holistic scores (r = -0.344). Furthermore, we increased the correlation with human scores by normalizing IPC by (1) MLC (r = -0.386), (2) DEPC (r = -0.429), and (3) both (r = -0.462). In this research, the features derived from structural events of speech transcriptions are found to predict holistic scores measuring speaking proficiency. This suggests that structural events estimated on speech word strings provide a potential way for assessing non-native speech."
P10-2065,Using Parse Features for Preposition Selection and Error Detection,2010,18,69,1,1,191,joel tetreault,Proceedings of the {ACL} 2010 Conference Short Papers,0,We evaluate the effect of adding parse features to a leading model of preposition usage. Results show a significant improvement in the preposition selection task on native speaker text and a modest increment in precision and recall in an ESL error detection task. Analysis of the parser output indicates that it is robust enough in the face of noisy non-native writing to extract useful information.
N10-1099,Using Entity-Based Features to Model Coherence in Student Essays,2010,8,49,2,0,30726,jill burstein,Human Language Technologies: The 2010 Annual Conference of the North {A}merican Chapter of the Association for Computational Linguistics,0,"We show how the Barzilay and Lapata entity-based coherence algorithm (2008) can be applied to a new, noisy data domain --- student essays. We demonstrate that by combining Barzilay and Lapata's entity-based features with novel features related to grammar errors and word usage, one can greatly improve the performance of automated coherence prediction for student essays for different populations."
han-etal-2010-using,Using an Error-Annotated Learner Corpus to Develop an {ESL}/{EFL} Error Correction System,2010,18,40,2,0,18861,narae han,Proceedings of the Seventh International Conference on Language Resources and Evaluation ({LREC}'10),0,"This paper presents research on building a model of grammatical error correction, for preposition errors in particular, in English text produced by language learners. Unlike most previous work which trains a statistical classifier exclusively on well-formed text written by native speakers, we train a classifier on a large-scale, error-tagged corpus of English essays written by ESL learners, relying on contextual and grammatical features surrounding preposition usage. First, we show that such a model can achieve high performance values: 93.3{\%} precision and 14.8{\%} recall for error detection and 81.7{\%} precision and 13.2{\%} recall for error detection and correction when tested on preposition replacement errors. Second, we show that this model outperforms models trained on well-edited text produced by native speakers of English. We discuss the implications of our approach in the area of language error modeling and the issues stemming from working with a noisy data set whose error annotations are not exhaustive."
W09-3010,Human Evaluation of Article and Noun Number Usage: Influences of Context and Construction Variability,2009,11,9,2,0,2821,john lee,Proceedings of the Third Linguistic Annotation Workshop ({LAW} {III}),0,Evaluating systems that correct errors in non-native writing is difficult because of the possibility of multiple correct answers and the variability in human agreement. This paper seeks to improve the best practice of such evaluation by analyzing the frequency of multiple correct answers and identifying factors that influence agreement levels in judging the usage of articles and noun number.
W08-1205,Native Judgments of Non-Native Usage: Experiments in Preposition Error Detection,2008,14,56,1,1,191,joel tetreault,Coling 2008: Proceedings of the workshop on Human Judgements in Computational Linguistics,0,"Evaluation and annotation are two of the greatest challenges in developing NLP instructional or diagnostic tools to mark grammar and usage errors in the writing of non-native speakers. Past approaches have commonly used only one rater to annotate a corpus of learner errors to compare to system output. In this paper, we show how using only one rater can skew system evaluation and then we present a sampling approach that makes it possible to evaluate a system more efficiently."
C08-1109,The Ups and Downs of Preposition Error Detection in {ESL} Writing,2008,19,137,1,1,191,joel tetreault,Proceedings of the 22nd International Conference on Computational Linguistics (Coling 2008),0,"In this paper we describe a methodology for detecting preposition errors in the writing of non-native English speakers. Our system performs at 84% precision and close to 19% recall on a large set of student essays. In addition, we address the problem of annotation and evaluation in this domain by showing how current approaches of using only one rater can skew system evaluation. We present a sampling approach to circumvent some of the issues that complicate evaluation of error detection systems."
W07-1604,Detection of Grammatical Errors Involving Prepositions,2007,8,113,2,0,2196,martin chodorow,Proceedings of the Fourth {ACL}-{SIGSEM} Workshop on Prepositions,0,"This paper presents ongoing work on the detection of preposition errors of non-native speakers of English. Since prepositions account for a substantial proportion of all grammatical errors by ESL (English as a Second Language) learners, developing an NLP application that can reliably detect these types of errors will provide an invaluable learning resource to ESL students. To address this problem, we use a maximum entropy classifier combined with rule-based filters to detect preposition errors in a corpus of student essays. Although our work is preliminary, we achieve a precision of 0.8 with a recall of 0.3."
N07-2001,Comparing User Simulation Models For Dialog Strategy Learning,2007,7,34,2,0,47232,hua ai,"Human Language Technologies 2007: The Conference of the North {A}merican Chapter of the Association for Computational Linguistics; Companion Volume, Short Papers",0,"This paper explores what kind of user simulation model is suitable for developing a training corpus for using Markov Decision Processes (MDPs) to automatically learn dialog strategies. Our results suggest that with sparse training data, a model that aims to randomly explore more dialog state spaces with certain constraints actually performs at the same or better than a more complex model that simulates realistic user behaviors in a statistical way."
N07-2011,Exploring Affect-Context Dependencies for Adaptive System Development,2007,11,10,4,0,33719,kate forbesriley,"Human Language Technologies 2007: The Conference of the North {A}merican Chapter of the Association for Computational Linguistics; Companion Volume, Short Papers",0,"We use X2 to investigate the context dependency of student affect in our computer tutoring dialogues, targeting uncertainty in student answers in 3 automatically monitorable contexts. Our results show significant dependencies between uncertain answers and specific contexts. Identification and analysis of these dependencies is our first step in developing an adaptive version of our dialogue system."
