blache-etal-2010-otim,The {OTIM} Formal Annotation Model: A Preliminary Step before Annotation Scheme,2010,9,2,1,1,929,philippe blache,Proceedings of the Seventh International Conference on Language Resources and Evaluation ({LREC}'10),0,"Large annotation projects, typically those addressing the question of multimodal annotation in which many different kinds of information have to be encoded, have to elaborate precise and high level annotation schemes. Doing this requires first to define the structure of the information: the different objects and their organization. This stage has to be as much independent as possible from the coding language constraints. This is the reason why we propose a preliminary formal annotation model, represented with typed feature structures. This representation requires a precise definition of the different objects, their properties (or features) and their relations, represented in terms of type hierarchies. This approach has been used to specify the annotation scheme of a large multimodal annotation project (OTIM) and experimented in the annotation of a multimodal corpus (CID, Corpus of Interactional Data). This project aims at collecting, annotating and exploiting a dialogue video corpus in a multimodal perspective (including speech and gesture modalities). The corpus itself, is made of 8 hours of dialogues, fully transcribed and richly annotated (phonetics, syntax, pragmatics, gestures, etc.)."
C10-2008,A Formal Scheme for Multimodal Grammars,2010,19,1,1,1,929,philippe blache,Coling 2010: Posters,0,"We present in this paper a formal approach for the representation of multimodal information. This approach, thanks to the to use of typed feature structures and hypergraphs, generalizes existing ones (typically annotation graphs) in several ways. It first proposes an homogenous representation of different types of information (nodes and relations) coming from different domains (speech, gestures). Second, it makes it possible to specify constraints representing the interaction between the different modalities, in the perspective of developing multimodal grammars."
2010.jeptalnrecital-long.9,Un mod{\\`e}le de caract{\\'e}risation de la complexit{\\'e} syntaxique,2010,-1,-1,1,1,929,philippe blache,Actes de la 17e conf{\\'e}rence sur le Traitement Automatique des Langues Naturelles. Articles longs,0,"Cet article pr{\'e}sente un mod{\`e}le de la complexit{\'e} syntaxique. Il r{\'e}unit un ensemble d{'}indices de complexit{\'e} et les repr{\'e}sente {\`a} l{'}aide d{'}un cadre formel homog{\`e}ne, offrant ainsi la possibilit{\'e} d{'}une quantification automatique : le mod{\`e}le propos{\'e} permet d{'}associer {\`a} chaque phrase un indice refl{\'e}tant sa complexit{\'e}."
W09-3033,A general scheme for broad-coverage multimodal annotation,2009,5,1,1,1,929,philippe blache,Proceedings of the Third Linguistic Annotation Workshop ({LAW} {III}),0,We present in this paper a formal and computational scheme in the perspective of broad-coverage multimodal annotation. We propose in particular to introduce the notion of annotation hypergraphs in which primary and secondary data are represented by means of the same structure.
2009.jeptalnrecital-long.28,Des relations d{'}alignement pour d{\\'e}crire l{'}interaction des domaines linguistiques : vers des Grammaires Multimodales,2009,-1,-1,1,1,929,philippe blache,Actes de la 16{\\`e}me conf{\\'e}rence sur le Traitement Automatique des Langues Naturelles. Articles longs,0,"Un des probl{\`e}mes majeurs de la linguistique aujourd{'}hui r{\'e}side dans la prise en compte de ph{\'e}nom{\`e}nes relevant de domaines et de modalit{\'e}s diff{\'e}rentes. Dans la litt{\'e}rature, la r{\'e}ponse consiste {\`a} repr{\'e}senter les relations pouvant exister entre ces domaines de fa{\c{c}}on externe, en termes de relation de structure {\`a} structure, s{'}appuyant donc sur une description distincte de chaque domaine ou chaque modalit{\'e}. Nous proposons dans cet article une approche diff{\'e}rente permettant repr{\'e}senter ces ph{\'e}nom{\`e}nes dans un cadre formel unique, permettant de rendre compte au sein d{'}une m{\^e}me grammaire tous les ph{\'e}nom{\`e}nes concern{\'e}s. Cette repr{\'e}sentation pr{\'e}cise de l{'}interaction entre domaines et modalit{\'e}s s{'}appuie sur la d{\'e}finition de relations d{'}alignement."
blache-etal-2008-creating,Creating and Exploiting Multimodal Annotated Corpora,2008,17,6,1,1,929,philippe blache,Proceedings of the Sixth International Conference on Language Resources and Evaluation ({LREC}'08),0,"The paper presents a project of the Laboratoire Parole {\&} Langage which aims at collecting, annotating and exploiting a corpus of spoken French in a multimodal perspective. The project directly meets the present needs in linguistics where a growing number of researchers become aware of the fact that a theory of communication which aims at describing real interactions should take into account the complexity of these interactions. However, in order to take into account such a complexity, linguists should have access to spoken corpora annotated in different fields. The paper presents the annotation schemes used in phonetics, morphology and syntax, prosody, gestuality at the LPL together with the type of linguistic description made from the annotations seen in two examples."
sitbon-etal-2008-evaluation,Evaluation of Lexical Resources and Semantic Networks on a Corpus of Mental Associations,2008,8,3,3,1,34164,laurianne sitbon,Proceedings of the Sixth International Conference on Language Resources and Evaluation ({LREC}'08),0,"When a user cannot find a word, he may think of semantically related words that could be used into an automatic process to help him. This paper presents an evaluation of lexical resources and semantic networks for modelling mental associations. A corpus of associations has been constructed for its evaluation. It is composed of 20 low frequency target words each associated 5 times by 20 users. In the experiments we look for the target word in propositions made from the associated words thanks to 5 different resources. The results show that even if each resource has a useful specificity, the global recall is low. An experiment to extract common semantic features of several associations showed that we cannot expect to see the target word below a rank of 20 propositions."
sitbon-etal-2008-evaluating,Evaluating Robustness Of A {QA} System Through A Corpus Of Real-Life Questions,2008,7,1,3,1,34164,laurianne sitbon,Proceedings of the Sixth International Conference on Language Resources and Evaluation ({LREC}'08),0,"This paper presents the sequential evaluation of the question answering system SQuaLIA. This system is based on the same sequential process as most statistical question answering systems, involving 4 main steps from question analysis to answer extraction.The evaluation is based on a corpus made from 20 questions taken in the set of an evaluation campaign and which were well answered by SQuaLIA. Each of the 20 questions has been typed by 17 native participants, non natives and dyslexics. They were vocally instructed the target of each question. Each of the 4 analysis steps of the system involves a loss of accuracy, until an average of 60 of right answers at the end of the process. The main cause of this loss seems to be the orthographic mistakes users make on nouns."
2008.jeptalnrecital-long.29,Influence de la qualit{\\'e} de l{'}{\\'e}tiquetage sur le chunking : une corr{\\'e}lation d{\\'e}pendant de la taille des chunks,2008,8,14,1,1,929,philippe blache,Actes de la 15{\\`e}me conf{\\'e}rence sur le Traitement Automatique des Langues Naturelles. Articles longs,0,"Nous montrons dans cet article qu{'}il existe une corr{\'e}lation {\'e}troite existant entre la qualit{\'e} de l{'}{\'e}tiquetage morpho-syntaxique et les performances des chunkers. Cette corr{\'e}lation devient lin{\'e}aire lorsque la taille des chunks est limit{\'e}e. Nous appuyons notre d{\'e}monstration sur la base d{'}une exp{\'e}rimentation conduite suite {\`a} la campagne d{'}{\'e}valuation Passage 2007 (de la Clergerie et al., 2008). Nous analysons pour cela les comportements de deux analyseurs ayant particip{\'e} {\`a} cette campagne. L{'}interpr{\'e}tation des r{\'e}sultats montre que la t{\^a}che de chunking, lorsqu{'}elle vise des chunks courts, peut {\^e}tre assimil{\'e}e {\`a} une t{\^a}che de {``}super-{\'e}tiquetage{''}."
2007.jeptalnrecital-poster.26,Traitements phrastiques phon{\\'e}tiques pour la r{\\'e}{\\'e}criture de phrases dysorthographi{\\'e}es,2007,-1,-1,3,1,34164,laurianne sitbon,Actes de la 14{\\`e}me conf{\\'e}rence sur le Traitement Automatique des Langues Naturelles. Posters,0,"Cet article d{\'e}crit une m{\'e}thode qui combine des hypoth{\`e}ses graph{\'e}miques et phon{\'e}tiques au niveau de la phrase, {\`a} l{'}aide d{'}une r{\'e}pr{\'e}sentation en automates {\`a} {\'e}tats finis et d{'}un mod{\`e}le de langage, pour la r{\'e}{\'e}criture de phrases tap{\'e}es au clavier par des dysorthographiques. La particularit{\'e} des {\'e}crits dysorthographi{\'e}s qui emp{\^e}che les correcteurs orthographiques d{'}{\^e}tre efficaces pour cette t{\^a}che est une segmentation en mots parfois incorrecte. La r{\'e}{\'e}criture diff{\`e}re de la correction en ce sens que les phrases r{\'e}{\'e}crites ne sont pas {\`a} destination de l{'}utilisateur mais d{'}un syst{\`e}me automatique, tel qu{'}un moteur de recherche. De ce fait l{'}{\'e}valuation est conduite sur des versions filtr{\'e}es et lemmatis{\'e}es des phrases. Le taux d{'}erreurs mots moyen passe de 51 {\%} {\`a} 20 {\%} avec notre m{\'e}thode, et est de 0 {\%} sur 43 {\%} des phrases test{\'e}es."
W06-2304,A Robust and Efficient Parser for Non-Canonical Inputs,2006,15,2,1,1,929,philippe blache,Proceedings of the Workshop on {ROMAND} 2006:Robust Methods in Analysis of Natural language Data,0,"We present in this paper a parser relying on a constraint-based formalism called Property Grammar. We show how constraints constitute an efficient solution in parsing non canonical material such as spoken language transcription or e-mails. This technique, provided that it is implemented with some control mechanisms, is very efficient. Some results are presented, from the French parsing evaluation campaign EASy."
P06-1008,Acceptability Prediction by Means of Grammaticality Quantification,2006,15,12,1,1,929,philippe blache,Proceedings of the 21st International Conference on Computational Linguistics and 44th Annual Meeting of the Association for Computational Linguistics,1,"We propose in this paper a method for quantifying sentence grammaticality. The approach based on Property Grammars, a constraint-based syntactic formalism, makes it possible to evaluate a grammaticality index for any kind of sentence, including ill-formed ones. We compare on a sample of sentences the grammaticality indices obtained from PG formalism and the acceptability judgements measured by means of a psycholinguistic analysis. The results show that the derived grammaticality index is a fairly good tracer of acceptability scores."
vanrullen-etal-2006-constraint,Constraint-Based Parsing as an Efficient Solution: Results from the Parsing Evaluation Campaign {EAS}y,2006,11,11,2,1,43435,tristan vanrullen,Proceedings of the Fifth International Conference on Language Resources and Evaluation ({LREC}{'}06),0,This paper describes the unfolding of the EASy evaluation campaign for french parsers as well as the techniques employed for the participation of laboratory LPL to this campaign. Three symbolic parsers based on a same resource and a same formalism (Property Grammars) are described and evaluated. The first results of this evaluation are analyzed and lead to the conclusion that symbolic parsing in a constraint-based formalism is efficient and robust.
2006.jeptalnrecital-poster.5,M{\\'e}canismes de contr{\\^o}le pour l{'}analyse en Grammaires de Propri{\\'e}t{\\'e}s,2006,-1,-1,1,1,929,philippe blache,Actes de la 13{\\`e}me conf{\\'e}rence sur le Traitement Automatique des Langues Naturelles. Posters,0,"Les m{\'e}thodes d{'}analyse syntaxiques hybrides, reposant {\`a} la fois sur des techniques statistiques et symboliques, restent peu exploit{\'e}es. Dans la plupart des cas, les informations statistiques sont int{\'e}gr{\'e}es {\`a} un squelette contextfree et sont utilis{\'e}es pour contr{\^o}ler le choix des r{\`e}gles ou des structures. Nous proposons dans cet article une m{\'e}thode permettant de calculer un indice de corr{\'e}lation entre deux objets linguistiques (cat{\'e}gories, propri{\'e}t{\'e}s). Nous d{\'e}crivons une utilisation de cette notion dans le cadre de l{'}analyse des Grammaires de Propri{\'e}t{\'e}s. L{'}indice de corr{\'e}lation nous permet dans ce cas de contr{\^o}ler {\`a} la fois la s{\'e}lection des constituants d{'}une cat{\'e}gorie, mais {\'e}galement la satisfaction des propri{\'e}t{\'e}s qui la d{\'e}crivent."
2006.jeptalnrecital-long.31,Vers une pr{\\'e}diction automatique de la difficult{\\'e} d{'}une question en langue naturelle,2006,-1,-1,5,1,34164,laurianne sitbon,Actes de la 13{\\`e}me conf{\\'e}rence sur le Traitement Automatique des Langues Naturelles. Articles longs,0,"Nous proposons et testons deux m{\'e}thodes de pr{\'e}diction de la capacit{\'e} d{'}un syst{\`e}me {\`a} r{\'e}pondre {\`a} une question factuelle. Une telle pr{\'e}diciton permet de d{\'e}terminer si l{'}on doit initier un dialogue afin de pr{\'e}ciser ou de reformuler la question pos{\'e}e par l{'}utilisateur. La premi{\`e}re approche que nous proposons est une adaptation d{'}une m{\'e}thode de pr{\'e}diction dans le domaine de la recherche documentaire, bas{\'e}e soit sur des machines {\`a} vecteurs supports (SVM) soit sur des arbres de d{\'e}cision, avec des crit{\`e}res tels que le contenu des questions ou des documents, et des mesures de coh{\'e}sion entre les documents ou passages de documents d{'}o{\`u} sont extraits les r{\'e}ponses. L{'}autre approche vise {\`a} utiliser le type de r{\'e}ponse attendue pour d{\'e}cider de la capacit{\'e} du syst{\`e}me {\`a} r{\'e}pondre. Les deux approches ont {\'e}t{\'e} test{\'e}es sur les donn{\'e}es de la campagne Technolangue EQUER des syst{\`e}mes de questions-r{\'e}ponses en fran{\c{c}}ais. L{'}approche {\`a} base de SVM est celle qui obtient les meilleurs r{\'e}sultats. Elle permet de distinguer au mieux les questions faciles, celles auxquelles notre syst{\`e}me apporte une bonne r{\'e}ponse, des questions difficiles, celles rest{\'e}es sans r{\'e}ponses ou auxquelles le syst{\`e}me a r{\'e}pondu de mani{\`e}re incorrecte. A l{'}oppos{\'e} on montre que pour notre syst{\`e}me, le type de r{\'e}ponse attendue (personnes, quantit{\'e}s, lieux...) n{'}est pas un facteur d{\'e}terminant pour la difficult{\'e} d{'}une question."
2005.jeptalnrecital-long.10,Combiner analyse superficielle et profonde : bilan et perspectives,2005,-1,-1,1,1,929,philippe blache,Actes de la 12{\\`e}me conf{\\'e}rence sur le Traitement Automatique des Langues Naturelles. Articles longs,0,"L{'}analyse syntaxique reste un probl{\`e}me complexe au point que nombre d{'}applications n{'}ont recours qu{'}{\`a} des analyseurs superficiels. Nous faisons dans cet article le point sur les notions d{'}analyse superficielles et profondes en proposant une premi{\`e}re caract{\'e}risation de la notion de complexit{\'e} op{\'e}rationnelle pour l{'}analyse syntaxique automatique permettant de distinguer objets et relations plus ou moins difficiles {\`a} identifier. Sur cette base, nous proposons un bilan des diff{\'e}rentes techniques permettant de caract{\'e}riser et combiner analyse superficielle et profonde."
2005.jeptalnrecital-court.22,"Une plateforme pour l{'}acquisition, la maintenance et la validation de ressources lexicales",2005,-1,-1,2,1,43435,tristan vanrullen,Actes de la 12{\\`e}me conf{\\'e}rence sur le Traitement Automatique des Langues Naturelles. Articles courts,0,"Nous pr{\'e}sentons une plateforme de d{\'e}veloppement de lexique offrant une base lexicale accompagn{\'e}e d{'}un certain nombre d{'}outils de maintenance et d{'}utilisation. Cette base, qui comporte aujourd{'}hui 440.000 formes du Fran{\c{c}}ais contemporain, est destin{\'e}e {\`a} {\^e}tre diffus{\'e}e et remise {\`a} jour r{\'e}guli{\`e}rement. Nous exposons d{'}abord les outils et les techniques employ{\'e}es pour sa constitution et son enrichissement, notamment la technique de calcul des fr{\'e}quences lexicales par cat{\'e}gorie morphosyntaxique. Nous d{\'e}crivons ensuite diff{\'e}rentes approches pour constituer un sous-lexique de taille r{\'e}duite, dont la particularit{\'e} est de couvrir plus de 90{\%} de l{'}usage. Un tel lexique noyau offre en outre la possibilit{\'e} d{'}{\^e}tre r{\'e}ellement compl{\'e}t{\'e} manuellement avec des informations s{\'e}mantiques, de valence, pragmatiques etc."
2004.jeptalnrecital-long.21,Densit{\\'e} d{'}information syntaxique et gradient de grammaticalit{\\'e},2004,-1,-1,1,1,929,philippe blache,Actes de la 11{\\`e}me conf{\\'e}rence sur le Traitement Automatique des Langues Naturelles. Articles longs,0,"Cet article propose l{'}introduction d{'}une notion de densit{\'e} syntaxique permettant de caract{\'e}riser la complexit{\'e} d{'}un {\'e}nonc{\'e} et au-del{\`a} d{'}introduire la sp{\'e}cification d{'}un gradient de grammaticalit{\'e}. Un tel gradient s{'}av{\`e}re utile dans plusieurs cas : quantification de la difficult{\'e} d{'}interpr{\'e}tation d{'}une phrase, gradation de la quantit{\'e} d{'}information syntaxique contenue dans un {\'e}nonc{\'e}, explication de la variabilit{\'e} et la d{\'e}pendances entre les domaines linguistiques, etc. Cette notion exploite la possibilit{\'e} de caract{\'e}risation fine de l{'}information syntaxique en termes de contraintes : la densit{\'e} est fonction des contraintes satisfaites par une r{\'e}alisation pour une grammaire donn{\'e}e. Les r{\'e}sultats de l{'}application de cette notion {\`a} quelques corpus sont analys{\'e}s."
W03-3004,Meta-Level Contstraints for Linguistic Domain Interaction,2003,0,2,1,1,929,philippe blache,Proceedings of the Eighth International Conference on Parsing Technologies,0,"This paper presents a technique for the representation and the implementation of interaction relations between different domains of linguistic analysis. This solution relies on the localization of the linguistic objects in the context. The relations are then implemented by means of interaction constraints, each domain information being expressed independently."
2003.jeptalnrecital-poster.5,Vers une th{\\'e}orie cognitive de la langue bas{\\'e}e sur les contraintes,2003,-1,-1,1,1,929,philippe blache,Actes de la 10{\\`e}me conf{\\'e}rence sur le Traitement Automatique des Langues Naturelles. Posters,0,"Cet article fournit des {\'e}l{\'e}ments d{'}explication pour la description des relations entre les diff{\'e}rents domaines de l{'}analyse linguistique. Il propose une architecture g{\'e}n{\'e}rale en vue d{'}une th{\'e}orie form{\'e}e de plusieurs niveaux : d{'}un c{\^o}t{\'e} les grammaires de chacun des domaines et de l{'}autre des relations sp{\'e}cifiant les interactions entre ces domaines. Dans cette approche, chacun des domaines est porteur d{'}une partie de l{'}information, celle-ci r{\'e}sultant {\'e}galement de l{'}interaction entre les domaines."
van-rullen-blache-2002-evaluation,An evaluation of different symbolic shallow parsing techniques,2002,9,5,2,0,53367,tristan rullen,Proceedings of the Third International Conference on Language Resources and Evaluation ({LREC}{'}02),0,This paper presents an evaluation of four shallow parsers The interest of each of these parsers led us to imagine a parameterized multiplexer for syntactic information based on the principle of merging the common boundaries of the outputs given by each of these programs. The question of evaluating the parsers as well as the multiplexer came in the foreground with the problem of not owning reference corpora. We attempt here to demonstrate the interest of observing the xe2x80x98common boundariesxe2x80x99 produced by different parsers as good indices for the evaluation of these algorithms. Such an evaluation is proposed and tested with a set of two experiences.
C02-1104,From Shallow to Deep Parsing Using Constraint Satisfaction,2002,18,12,2,0,50482,jeanmarie balfourier,{COLING} 2002: The 19th International Conference on Computational Linguistics,0,"We present in this paper a technique allowing to choose the parsing granularity within the same approach relying on a constraint-based formalism. Its main advantage lies in the fact that the same linguistic resources are used whatever the granularity. Such a method is useful in particular for systems such as text-to-speech that usually need a simple bracketing, but in some cases requires a precise syntactic structure. We illustrate this method in comparing the results for three different granularity levels and give some figures about their respective performance in parsing a tagged corpus."
2002.jeptalnrecital-long.18,Variabilit{\\'e} et d{\\'e}pendances des composants linguistiques,2002,-1,-1,1,1,929,philippe blache,Actes de la 9{\\`e}me conf{\\'e}rence sur le Traitement Automatique des Langues Naturelles. Articles longs,0,"Nous pr{\'e}sentons dans cet article un cadre d{'}explication des relations entre les diff{\'e}rents composants de l{'}analyse linguistique (prosodie, syntaxe, s{\'e}mantique, etc.). Nous proposons un principe sp{\'e}cifiant un {\'e}quilibre pour un objet linguistique donn{\'e} entre ces diff{\'e}rents composants sous la forme d{'}un poids (pr{\'e}cisant l{'}aspect marqu{\'e} de l{'}objet d{\'e}crit) d{\'e}fini pour chacun d{'}entre eux et d{'}un seuil (correspondant {\`a} la somme de ces poids) {\`a} atteindre. Une telle approche permet d{'}expliquer certains ph{\'e}nom{\`e}nes de variabilit{\'e} : le choix d{'}une {``}tournure{''} {\`a} l{'}int{\'e}rieur d{'}un des composants peut varier {\`a} condition que son poids n{'}emp{\^e}che pas d{'}atteindre le seuil sp{\'e}cifi{\'e}. Ce type d{'}information, outre son int{\'e}r{\^e}t purement linguistique, constitue le premier {\'e}l{\'e}ment de r{\'e}ponse pour l{'}introduction de la variabilit{\'e} dans des applications comme les syst{\`e}mes de g{\'e}n{\'e}ration ou de synth{\`e}se de la parole."
W01-1820,Property Grammars: A Flexible Constraint-Based Approach to Parsing,2001,0,19,1,1,929,philippe blache,Proceedings of the Seventh International Workshop on Parsing Technologies,0,None
2001.jeptalnrecital-long.8,D{\\'e}pendances {\\`a} distance dans les grammaires de propri{\\'e}t{\\'e}s : l{'}exemple des disloqu{\\'e}es,2001,-1,-1,1,1,929,philippe blache,Actes de la 8{\\`e}me conf{\\'e}rence sur le Traitement Automatique des Langues Naturelles. Articles longs,0,"Cet article propose une description des d{\'e}pendances {\`a} distances s{'}appuyant sur une approche totalement d{\'e}clarative, les grammaires de propri{\'e}t{\'e}s, d{\'e}crivant l{'}information linguistique sous la forme de contraintes. L{'}approche d{\'e}crite ici consiste {\`a} introduire de fa{\c{c}}on dynamique en cours d{'}analyse de nouvelles contraintes, appel{\'e}es propri{\'e}t{\'e}s distantes. Cette notion est illustr{\'e}e par la description du ph{\'e}nom{\`e}ne des disloqu{\'e}es en fran{\c{c}}ais."
2000.iwpt-1.30,Property Grammars: a Solution for Parsing with Constraints,2000,-1,-1,1,1,929,philippe blache,Proceedings of the Sixth International Workshop on Parsing Technologies,0,
P98-1019,Parsing Ambiguous Structures using Controlled Disjunctions and Unary Quasi-Trees,1998,12,7,1,1,929,philippe blache,"36th Annual Meeting of the Association for Computational Linguistics and 17th International Conference on Computational Linguistics, Volume 1",1,"The problem of parsing ambiguous structures concerns (i) their representation and (ii) the specification of mechanisms allowing to delay and control their evaluation. We first propose to use a particular kind of disjunctions called controlled disjunctions: these formulae allows the representation and the implementation of specific constraints that can occur between ambiguous values. But an efficient control of ambiguous structures also has to take into account lexical as well as syntactic information concerning this object. We then propose the use of unary quasi-trees specifying constraints at these different levels. The two devices allow an efficient implementation of the control of the ambiguity. Moreover, they are independent from a particular formalism and can be used whatever the linguistic theory."
C98-1019,Parsing Ambiguous Structures using Controlled Disjunctions and Unary Quasi-Trees,1998,12,7,1,1,929,philippe blache,{COLING} 1998 Volume 1: The 17th International Conference on Computational Linguistics,0,"The problem of parsing ambiguous structures concerns (i) their representation and (ii) the specification of mechanisms allowing to delay and control their evaluation. We first propose to use a particular kind of disjunctions called controlled disjunctions: these formulae allows the representation and the implementation of specific constraints that can occur between ambiguous values. But an efficient control of ambiguous structures also has to take into account lexical as well as syntactic information concerning this object. We then propose the use of unary quasi-trees specifying constraints at these different levels. The two devices allow an efficient implementation of the control of the ambiguity. Moreover, they are independent from a particular formalism and can be used whatever the linguistic theory."
