D17-1150,Towards Bidirectional Hierarchical Representations for Attention-based Neural Machine Translation,2017,15,3,5,0,4173,baosong yang,Proceedings of the 2017 Conference on Empirical Methods in Natural Language Processing,0,"This paper proposes a hierarchical attentional neural translation model which focuses on enhancing source-side hierarchical representations by covering both local and global semantic information using a bidirectional tree-based encoder. To maximize the predictive likelihood of target words, a weighted variant of an attention mechanism is used to balance the attentive information between lexical and phrase vectors. Using a tree-based rare word encoding, the proposed model is extended to sub-word level to alleviate the out-of-vocabulary (OOV) problem. Empirical results reveal that the proposed model significantly outperforms sequence-to-sequence attention-based and tree-based neural translation models in English-Chinese translation tasks."
P15-4025,{N}iu{P}arser: A {C}hinese Syntactic and Semantic Parsing Toolkit,2015,10,8,1,1,5752,jingbo zhu,Proceedings of {ACL}-{IJCNLP} 2015 System Demonstrations,0,"We present a new toolkit NiuParser for Chinese syntactic and semantic analysis. It can handle a wide range of Natural Language Processing (NLP) tasks in Chinese, including word segmentation, partof-speech tagging, named entity recognition, chunking, constituent parsing, dependency parsing, and semantic role labeling. The NiuParser system runs fast and shows state-of-the-art performance on several benchmarks. Moreover, it is very easy to use for both research and industrial purposes. Advanced features include the Software Development Kit (SDK) interfaces and a multi-thread implementation for system speed-up."
P14-2092,A Hybrid Approach to Skeleton-based Translation,2014,23,4,2,1,4608,tong xiao,Proceedings of the 52nd Annual Meeting of the Association for Computational Linguistics (Volume 2: Short Papers),0,"In this paper we explicitly consider sentence skeleton information for Machine Translation (MT). The basic idea is that we translate the key elements of the input sentence using a skeleton translation model, and then cover the remain segments using a full translation model. We apply our approach to a state-of-the-art phrase-based system and demonstrate very promising BLEU improvements and TER reductions on the NIST Chinese-English MT evaluation data."
P14-2128,Punctuation Processing for Projective Dependency Parsing,2014,15,10,3,1,9696,ji ma,Proceedings of the 52nd Annual Meeting of the Association for Computational Linguistics (Volume 2: Short Papers),0,"Modern statistical dependency parsers as- sign lexical heads to punctuations as well as words. Punctuation parsing errors lead to low parsing accuracy on words. In this work, we propose an alternative approach to addressing punctuation in dependency parsing. Rather than assigning lexical heads to punctuations, we treat punctu- ations as properties of their neighbour- ing words, used as features to guide the parser to build the dependency graph. In- tegrating our method with an arc-standard parser yields a 93.06% unlabelled attach- ment score, which is the best accuracy by a single-model transition-based parser re- ported so far."
P14-1014,Tagging The Web: Building A Robust Web Tagger with Neural Network,2014,34,17,3,1,9696,ji ma,Proceedings of the 52nd Annual Meeting of the Association for Computational Linguistics (Volume 1: Long Papers),1,"In this paper, we address the problem of web-domain POS tagging using a twophase approach. The first phase learns representations that capture regularities underlying web text. The representation is integrated as features into a neural network that serves as a scorer for an easy-first POS tagger. Parameters of the neural network are trained using guided learning in the second phase. Experiment on the SANCL 2012 shared task show that our approach achieves 93.15% average tagging accuracy, which is the best accuracy reported so far on this data set, higher than those given by ensembled syntactic parsers."
D14-1021,Syntactic {SMT} Using a Discriminative Text Generation Model,2014,36,5,4,0.210495,884,yue zhang,Proceedings of the 2014 Conference on Empirical Methods in Natural Language Processing ({EMNLP}),0,"We study a novel architecture for syntactic SMT. In contrast to the dominant approach in the literature, the system does not rely on translation rules, but treat translation as an unconstrained target sentence generation task, using soft features to capture lexical and syntactic correspondences between the source and target languages. Target syntax features and bilingual translation features are trained consistently in a discriminative model. Experiments using the IWSLT 2010 dataset show that the system achieves BLEU comparable to the state-of-the-art syntactic SMT systems."
C14-1195,Effective Incorporation of Source Syntax into Hierarchical Phrase-based Translation,2014,34,4,3,1,4608,tong xiao,"Proceedings of {COLING} 2014, the 25th International Conference on Computational Linguistics: Technical Papers",0,In this paper we explicitly consider source language syntactic information in both rule extraction and decoding for hierarchical phrase-based translation. We obtain tree-to-string rules by the GHKM method and use them to complement Hiero-style rules. All these rules are then employed to decode new sentences with source language parse trees. We experiment with our approach in a state-of-the-art Chinese-English system and demonstrate 1.2 and 0.8 BLEU improvements on the NIST newswire and web evaluation data of MT08 and MT12.
P13-2020,Easy-First {POS} Tagging and Dependency Parsing with Beam Search,2013,16,11,2,1,9696,ji ma,Proceedings of the 51st Annual Meeting of the Association for Computational Linguistics (Volume 2: Short Papers),0,"In this paper, we combine easy-first dependency parsing and POS tagging algorithms with beam search and structured perceptron. We propose a simple variant of xe2x80x9cearly-updatexe2x80x9d to ensure valid update in the training process. The proposed solution can also be applied to combine beam search and structured perceptron with other systems that exhibit spurious ambiguity. On CTB, we achieve 94.01% tagging accuracy and 86.33% unlabeled attachment score with a relatively small beam width. On PTB, we also achieve state-of-the-art performance."
P13-1043,Fast and Accurate Shift-Reduce Constituent Parsing,2013,32,82,5,1,11745,muhua zhu,Proceedings of the 51st Annual Meeting of the Association for Computational Linguistics (Volume 1: Long Papers),1,"Shift-reduce dependency parsers give comparable accuracies to their chartbased counterparts, yet the best shiftreduce constituent parsers still lag behind the state-of-the-art. One important reason is the existence of unary nodes in phrase structure trees, which leads to different numbers of shift-reduce actions between different outputs for the same input. This turns out to have a large empirical impact on the framework of global training and beam search. We propose a simple yet effective extension to the shift-reduce process, which eliminates size differences between action sequences in beam-search. Our parser gives comparable accuracies to the state-of-the-art chart parsers. With linear run-time complexity, our parser is over an order of magnitude faster than the fastest chart parser."
W12-6336,{NEU} Systems in {SIGHAN} Bakeoff 2012,2012,8,0,5,1,9696,ji ma,Proceedings of the Second {CIPS}-{SIGHAN} Joint Conference on {C}hinese Language Processing,0,"This paper describes the methods used for the parsing the Sinica Treebank for the bakeoff task of SigHan 2012. Based on the statistics of the training data and the experimental results, we show that the major difficulties in parsing the Sinica Treebank comes from both the data sparse problem caused by the fine-grained annotation and the tagging ambiguity."
P12-3004,{N}iu{T}rans: An Open Source Toolkit for Phrase-based and Syntax-based Machine Translation,2012,19,49,2,1,4608,tong xiao,Proceedings of the {ACL} 2012 System Demonstrations,0,"We present a new open source toolkit for phrase-based and syntax-based machine translation. The toolkit supports several state-of-the-art models developed in statistical machine translation, including the phrase-based model, the hierachical phrase-based model, and various syntax-based models. The key innovation provided by the toolkit is that the decoder can work with various grammars and offers different choices of decoding algrithms, such as phrase-based decoding, decoding as parsing/tree-parsing and forest-based decoding. Moreover, several useful utilities were distributed with the toolkit, including a discriminative reordering model, a simple and fast language model, and an implementation of minimum error rate training for weight tuning."
P12-2055,Learning Better Rule Extraction with Translation Span Alignment,2012,21,1,1,1,5752,jingbo zhu,Proceedings of the 50th Annual Meeting of the Association for Computational Linguistics (Volume 2: Short Papers),0,This paper presents an unsupervised approach to learning translation span alignments from parallel data that improves syntactic rule extraction by deleting spurious word alignment links and adding new valuable links based on bilingual translation span correspondences. Experiments on Chinese-English translation demonstrate improvements over standard methods for tree-to-string and tree-to-tree translation.
C12-1106,Easy-First {C}hinese {POS} Tagging and Dependency Parsing,2012,16,10,3,1,9696,ji ma,Proceedings of {COLING} 2012,0,"The easy-first non-directional dependency parser has demonstrated its ad vantage over transition based dependency parsers which parse sentences from left to right. This work investigates easy-first method on Chinese POS tagging, dependency parsing and j oint tagging and dependency parsing. In particular, we generalize the easy-first dependency parsing algorithm to a general framework and apply this framework to Chinese POS tagging and dependency parsing. We then propose the first joint tagging and dependency parsing algorithm under the easy-first framework. We train the joint model with both supervised objective an d additional loss which only relates to one of the individual tasks (either tagging or parsing). In this way, we can bias the joint model towards the preferred task. Experimental results show that bo th the tagger and the parser achieve state-of-the-art accuracy and runs fast . And our joint model achieves tagging accuracy of 94.27 which is the best result reported so far."
C12-1194,Exploiting Lexical Dependencies from Large-Scale Data for Better Shift-Reduce Constituency Parsing,2012,32,6,2,1,11745,muhua zhu,Proceedings of {COLING} 2012,0,"This paper proposes a method to improve shift-reduce constituency parsing by using lexical dependencies. The lexical dependency information is obtained from a large amount of auto-parsed data that is generated by a baseline shift-reduce parser on unlabeled data. We then incorporate a set of novel features defined on this information into the shift-reduce parsing model. The features can help to disambiguate action conflicts during decoding. Experimental results show that the new features achieve absolute improvements over a strong baseline by 0.9% and 1.1% on English and Chinese respectively. Moreover, the improved parser outperforms all previously reported shift-reduce constituency parsers. Title and Abstract in Chinese xe5x88xa9xe7x94xa8xe5xa4xa7xe8xa7x84xe6xa8xa1xe6x95xb0xe6x8dxaexe8xafx8dxe6xb1x87xe4xbex9dxe5xadx98xe5x85xb3xe7xb3xbbxe6x94xb9xe8xbfx9bxe7xa7xbbxe8xbfx9b-xe5xbdx92xe7xbaxa6xe6x88x90xe5x88x86xe5x8fxa5xe6xb3x95xe5x88x86xe6x9ex90 xe6x9cxacxe6x96x87xe6x8fx90xe5x87xbaxe4xbax86xe4xb8x80xe7xa7x8dxe5x88xa9xe7x94xa8xe8xafx8dxe6xb1x87xe4xbex9dxe5xadx98xe5x85xb3xe7xb3xbbxe6x94xb9xe8xbfx9bxe7xa7xbbxe8xbfx9b-xe5xbdx92xe7xbaxa6xe6x88x90xe5x88x86xe5x8fxa5xe6xb3x95xe5x88x86xe6x9ex90xe7x9ax84xe6x96xb9xe6xb3x95xe3x80x82xe9xa6x96xe5x85x88,xe6x88x91xe4xbbxacxe5x88xa9xe7x94xa8 xe5x9fxbaxe5x87x86xe7xb3xbbxe7xbbx9fxe5x9cxa8xe5xa4xa7xe8xa7x84xe6xa8xa1xe6x97xa0xe6xa0x87xe6xb3xa8xe6x95xb0xe6x8dxaexe4xb8x8axe8xbfx9bxe8xa1x8cxe8x87xaaxe5x8axa8xe5x8fxa5xe6xb3x95xe5x88x86xe6x9ex90xe5xb9xb6xe4xbbx8exe5x88x86xe6x9ex90xe7xbbx93xe6x9ex9cxe4xb8xadxe6x8axbdxe5x8fx96xe8xafx8dxe6xb1x87xe4xbex9dxe5xadx98xe5x85xb3xe7xb3xbbxe3x80x82xe5x85xb6 xe5x90x8e,xe6x88x91xe4xbbxacxe5x9cxa8xe8xafx8dxe6xb1x87xe4xbex9dxe5xadx98xe4xbfxa1xe6x81xafxe7x9ax84xe5x9fxbaxe7xa1x80xe4xb8x8axe5xaex9axe4xb9x89xe4xbax86xe4xb8x80xe7xbbx84xe6x96xb0xe7x89xb9xe5xbex81xe5xb9xb6xe5xb0x86xe8xbfx99xe4xbax9bxe7x89xb9xe5xbex81xe6x95xb4xe5x90x88xe5x88xb0xe7xa7xbbxe8xbfx9b-xe5xbdx92xe7xbaxa6xe5x8fxa5xe6xb3x95 xe5x88x86xe6x9ex90xe6xa8xa1xe5x9ex8b xe4xb8xadxe3x80x82xe6x96xb0xe7x89xb9xe5xbex81xe7x94xa8xe4xbax8exe5xb8xaexe5x8axa9xe6xb6x88xe9x99xa4xe7xa7xbbxe8xbfx9b-xe5xbdx92xe7xbaxa6xe8xbfx87xe7xa8x8bxe4xb8xadxe7x9ax84xe5x8axa8xe4xbdx9cxe6xadxa7xe4xb9x89xe3x80x82xe5xaex9exe9xaax8cxe7xbbx93xe6x9ex9cxe8xa1xa8xe6x98x8e,xe6x96xb0xe7x89xb9xe5xbex81 xe5x9cxa8xe8x8bxb1xe6x96x87xe5x92x8cxe4xb8xadxe6x96x87xe6x95xb0xe6x8dxaexe4xb8x8axe5x88x86xe5x88xabxe5x8fx96xe5xbex97xe4xbax860.9% xe5x92x8c1.1%xe7x9ax84xe6x80xa7xe8x83xbdxe6x94xb9xe8xbfx9bxe3x80x82xe6x9cx80xe7xbbx88xe5xbex97xe5x88xb0xe7x9ax84xe5x8fxa5xe6xb3x95xe5x88x86xe6x9ex90xe5x99xa8xe7x9ax84xe6x80xa7xe8x83xbd xe4xbcx98xe4xbax8exe7x9bxb8xe5x85xb3xe7xa0x94xe7xa9xb6xe5xb7xa5xe4xbdx9cxe4xb8xadxe6x89x80xe6x8axa5xe5x91x8axe7x9ax84xe7xa7xbbxe8xbfx9b-xe5xbdx92xe7xbaxa6xe5x8fxa5xe6xb3x95xe5x88x86xe6x9ex90xe5x99xa8xe7x9ax84xe6x80xa7xe8x83xbdxe3x80x82"
P11-2073,Improving Decoding Generalization for Tree-to-String Translation,2011,21,2,1,1,5752,jingbo zhu,Proceedings of the 49th Annual Meeting of the Association for Computational Linguistics: Human Language Technologies,0,"To address the parse error issue for tree-to-string translation, this paper proposes a similarity-based decoding generation (SDG) solution by reconstructing similar source parse trees for decoding at the decoding time instead of taking multiple source parse trees as input for decoding. Experiments on Chinese-English translation demonstrated that our approach can achieve a significant improvement over the standard method, and has little impact on decoding speed in practice. Our approach is very easy to implement, and can be applied to other paradigms such as tree-to-tree models."
P11-2126,Better Automatic Treebank Conversion Using A Feature-Based Approach,2011,20,5,2,1,11745,muhua zhu,Proceedings of the 49th Annual Meeting of the Association for Computational Linguistics: Human Language Technologies,0,"For the task of automatic treebank conversion, this paper presents a feature-based approach which encodes bracketing structures in a tree-bank into features to guide the conversion of this treebank to a different standard. Experiments on two Chinese treebanks show that our approach improves conversion accuracy by 1.31% over a strong baseline."
2011.mtsummit-papers.13,Document-level Consistency Verification in Machine Translation,2011,-1,-1,2,1,4608,tong xiao,Proceedings of Machine Translation Summit XIII: Papers,0,None
W10-4110,Mining Large-scale Parallel Corpora from Multilingual Patents: An {E}nglish-{C}hinese example and its application to {SMT},2010,16,14,5,0.666667,44655,bin lu,{CIPS}-{SIGHAN} Joint Conference on {C}hinese Language Processing,0,None
W10-4135,High {OOV}-Recall {C}hinese Word Segmenter,2010,4,2,4,0,45171,xiaoming xu,{CIPS}-{SIGHAN} Joint Conference on {C}hinese Language Processing,0,None
W10-4143,{C}hinese Syntactic Parsing Evaluation,2010,14,6,2,0,22015,qiang zhou,{CIPS}-{SIGHAN} Joint Conference on {C}hinese Language Processing,0,None
W10-4153,A Multi-stage Clustering Framework for {C}hinese Personal Name Disambiguation,2010,4,0,6,0.784314,11746,huizhen wang,{CIPS}-{SIGHAN} Joint Conference on {C}hinese Language Processing,0,None
W10-4168,{NEUNLPL}ab {C}hinese Word Sense Induction System for {SIGHAN} Bakeoff 2010,2010,7,0,3,0,7671,hao zhang,{CIPS}-{SIGHAN} Joint Conference on {C}hinese Language Processing,0,None
P10-1076,Boosting-Based System Combination for Machine Translation,2010,33,9,2,1,4608,tong xiao,Proceedings of the 48th Annual Meeting of the Association for Computational Linguistics,1,"In this paper, we present a simple and effective method to address the issue of how to generate diversified translation systems from a single Statistical Machine Translation (SMT) engine for system combination. Our method is based on the framework of boosting. First, a sequence of weak translation systems is generated from a baseline system in an iterative manner. Then, a strong translation system is built from the ensemble of these weak translation systems. To adapt boosting to SMT system combination, several key components of the original boosting algorithms are redesigned in this work. We evaluate our method on Chinese-to-English Machine Translation (MT) tasks in three baseline systems, including a phrase-based system, a hierarchical phrase-based system and a syntax-based system. The experimental results on three NIST evaluation test sets show that our method leads to significant improvements in translation accuracy over the baseline systems."
C10-2154,An Empirical Study of Translation Rule Extraction with Multiple Parsers,2010,21,3,2,1,4608,tong xiao,Coling 2010: Posters,0,"Translation rule extraction is an important issue in syntax-based Statistical Machine Translation (SMT). Recent studies show that rule coverage is one of the key factors affecting the success of syntax-based systems. In this paper, we first present a simple and effective method to improve rule coverage by using multiple parsers in translation rule extraction, and then empirically investigate the effectiveness of our method on Chinese-English translation tasks. Experimental results show that extracting translation rules using multiple parsers improves a string-to-tree system by over 0.9 BLEU points on both NIST 2004 and 2005 test corpora."
C10-2176,Automatic Treebank Conversion via Informed Decoding,2010,14,2,2,1,11745,muhua zhu,Coling 2010: Posters,0,"In this paper, we focus on the challenge of automatically converting a constituency treebank (source treebank) to fit the standard of another constituency treebank (target treebank). We formalize the conversion problem as an informed decoding procedure: information from original annotations in a source treebank is incorporated into the decoding phase of a parser trained on a target treebank during the parser assigning parse trees to sentences in the source treebank. Experiments on two Chinese treebanks show significant improvements in conversion accuracy over baseline systems, especially when training data used for building the parser is small in size."
C10-1151,Heterogeneous Parsing via Collaborative Decoding,2010,14,3,2,1,11745,muhua zhu,Proceedings of the 23rd International Conference on Computational Linguistics (Coling 2010),0,"There often exist multiple corpora for the same natural language processing (NLP) tasks. However, such corpora are generally used independently due to distinctions in annotation standards. For the purpose of full use of readily available human annotations, it is significant to simultaneously utilize multiple corpora of different annotation standards. In this paper, we focus on the challenge of constituent syntactic parsing with treebanks of different annotations and propose a collaborative decoding (or co-decoding) approach to improve parsing accuracy by leveraging bracket structure consensus between multiple parsing decoders trained on individual treebanks. Experimental results show the effectiveness of the proposed approach, which outperforms state-of-the-art baselines, especially on long sentences."
W09-3532,{C}hinese-{E}nglish Organization Name Translation Based on Correlative Expansion,2009,19,7,4,0.833333,8981,feiliang ren,Proceedings of the 2009 Named Entities Workshop: Shared Task on Transliteration ({NEWS} 2009),0,"This paper presents an approach to translating Chinese organization names into English based on correlative expansion. Firstly, some candidate translations are generated by using statistical translation method. And several correlative named entities for the input are retrieved from a correlative named entity list. Secondly, three kinds of expansion methods are used to generate some expanded queries. Finally, these queries are submitted to a search engine, and the refined translation results are mined and re-ranked by using the returned web pages. Experimental results show that this approach outperforms the compared system in overall translation accuracy."
D09-1038,Better Synchronous Binarization for Machine Translation,2009,17,10,4,1,4608,tong xiao,Proceedings of the 2009 Conference on Empirical Methods in Natural Language Processing,0,"Binarization of Synchronous Context Free Grammars (SCFG) is essential for achieving polynomial time complexity of decoding for SCFG parsing based machine translation systems. In this paper, we first investigate the excess edge competition issue caused by a left-heavy binary SCFG derived with the method of Zhang et al. (2006). Then we propose a new binarization method to mitigate the problem by exploring other alternative equivalent binary SCFGs. We present an algorithm that iteratively improves the resulting binary SCFG, and empirically show that our method can improve a string-to-tree statistical machine translations system based on the synchronous binarization method in Zhang et al. (2006) on the NIST machine translation evaluation tasks."
2009.mtsummit-wpt.3,The Construction of a {C}hinese-{E}nglish Patent Parallel Corpus,2009,20,8,3,0.666667,44655,bin lu,Proceedings of the Third Workshop on Patent Translation,0,"In this paper, we describe the construction of a parallel Chinese-English patent sentence corpus which is created from noisy parallel patents. First, we use a publicly available sentence aligner to find parallel sentence candidates in the noisy parallel data. Then we compare and evaluate three individual measures and different ensemble techniques to sort the parallel sentence candidates according to the confidence score and filter out those with low scores as the noisy data. The experiment shows that the combination of measures outperforms the individual measures, and that filtering out low-quality sentence pairs is readily justified as it can improve SMT performance. Finally, we arrive at the final corpus consisting of 160K sentence pairs in which about 90% are correct or partially correct alignments."
I08-4004,An Effective Hybrid Machine Learning Approach for Coreference Resolution,2008,14,3,2,0.833333,8981,feiliang ren,Proceedings of the Sixth {SIGHAN} Workshop on {C}hinese Language Processing,0,"We present a hybrid machine learning approach for coreference resolution. In our method, we use CRFs as basic training model, use active learning method to generate combined features so as to make existed features used more effectively; at last, we proposed a novel clustering algorithm which used both the linguistics knowledge and the statistical knowledge. We built a coreference resolution system based on the proposed method and evaluate its performance from three aspects: the contributions of active learning; the effects of different clustering algorithms; and the resolution performance of different kinds of NPs. Experimental results show that additional performance gain can be obtained by using active learning method; clustering algorithm has a great effect on coreference resolutionxe2x80x99s performance and our clustering algorithm is very effective; and the key of coreference resolution is to improve the performance of the normal nounxe2x80x99s resolution, especially the pronounxe2x80x99s resolution."
I08-4009,Which Performs Better on In-Vocabulary Word Segmentation: Based on Word or Character?,2008,11,1,3,1,48568,zhenxing wang,Proceedings of the Sixth {SIGHAN} Workshop on {C}hinese Language Processing,0,"Since the first Chinese Word Segmentation (CWS) Bakeoff on 2003, CWS has experienced a prominent flourish because Bakeoff provides a platform for the participants, which helps them recognize the merits and drawbacks of their segmenters. However, the evaluation metric of bakeoff is not sufficient enough to measure the performance thoroughly, sometimes even misleading. One typical example caused by this insufficiency is that there is a popular belief existing in the research field that segmentation based on word can yield a better result than character-based tagging (CT) on in-vocabulary (IV) word segmentation even within closed tests of Bakeoff. Many efforts were paid to balance the performance on IV and out-ofvocabulary (OOV) words by combining these two methods according to this belief. In this paper, we provide a more detailed evaluation metric of IV and OOV words than Bakeoff to analyze CT method and combination method, which is a typical way to seek such balance. Our evaluation metric shows that CT outperforms dictionary-based (or so called word-based in general) segmentation on both IV and OOV words within Bakeoff * The work is done when the first author is working in MSRA as an intern. closed tests. Furthermore, our analysis shows that using confidence measure to combine the two segmentation results should be under certain limitation."
