D14-1182,Sometimes Average is Best: The Importance of Averaging for Prediction using {MCMC} Inference in Topic Modeling,2014,29,8,3,1,37071,vietan nguyen,Proceedings of the 2014 Conference on Empirical Methods in Natural Language Processing ({EMNLP}),0,"Markov chain Monte Carlo (MCMC) approximates the posterior distribution of latent variable models by generating many samples and averaging over them. In practice, however, it is often more convenient to cut corners, using only a single sample or following a suboptimal averaging strategy. We systematically study different strategies for averaging MCMC samples and show empirically that averaging properly leads to significant improvements in prediction."
W13-2214,Towards Efficient Large-Scale Feature-Rich Statistical Machine Translation,2013,25,0,4,1,26610,vladimir eidelman,Proceedings of the Eighth Workshop on Statistical Machine Translation,0,"We present the system we developed to provide efficient large-scale feature-rich discriminative training for machine translation. We describe how we integrate with MapReduce using Hadoop streaming to allow arbitrarily scaling the tuning set and utilizing a sparse feature set. We report our findings on German-English and RussianEnglish translation, and discuss benefits, as well as obstacles, to tuning on larger development sets drawn from the parallel training data."
P13-4034,Mr. {MIRA}: Open-Source Large-Margin Structured Learning on {M}ap{R}educe,2013,19,4,4,1,26610,vladimir eidelman,Proceedings of the 51st Annual Meeting of the Association for Computational Linguistics: System Demonstrations,0,"We present an open-source framework for large-scale online structured learning. Developed with the flexibility to handle cost-augmented inference problems such as statistical machine translation (SMT), our large-margin learner can be used with any decoder. Integration with MapReduce using Hadoop streaming allows efficient scaling with increasing size of training data. Although designed with a focus on SMT, the decoder-agnostic design of our learner allows easy future extension to other structured learning problems such as sequence labeling and parsing."
P13-1110,Online Relative Margin Maximization for Statistical Machine Translation,2013,39,4,3,1,26610,vladimir eidelman,Proceedings of the 51st Annual Meeting of the Association for Computational Linguistics (Volume 1: Long Papers),1,"Recent advances in large-margin learning have shown that better generalization can be achieved by incorporating higher order information into the optimization, such as the spread of the data. However, these solutions are impractical in complex structured prediction problems such as statistical machine translation. We present an online gradient-based algorithm for relative margin maximization, which bounds the spread of the projected data while maximizing the margin. We evaluate our optimizer on Chinese-English and ArabicEnglish translation tasks, each with small and large feature sets, and show that our learner is able to achieve significant improvements of 1.2-2 BLEU and 1.7-4.3 TER on average over state-of-the-art optimizers with the large feature set."
N13-3009,{A}rgviz: Interactive Visualization of Topic Dynamics in Multi-party Conversations,2013,15,2,4,1,37071,vietan nguyen,Proceedings of the 2013 {NAACL} {HLT} Demonstration Session,0,"We introduce an efficient, interactive frameworkxe2x80x94Argvizxe2x80x94for experts to analyze the dynamic topical structure of multi-party conversations. Users inject their needs, expertise, and insights into models via iterative topic refinement. The refined topics feed into a segmentation model, whose outputs are shown to users via multiple coordinated views."
N13-1060,Modeling Syntactic and Semantic Structures in Hierarchical Phrase-based Translation,2013,25,17,2,1,9182,junhui li,Proceedings of the 2013 Conference of the North {A}merican Chapter of the Association for Computational Linguistics: Human Language Technologies,0,"Incorporating semantic structure into a linguistics-free translation model is challenging, since semantic structures are closely tied to syntax. In this paper, we propose a two-level approach to exploiting predicate-argument structure reordering in a hierarchical phrase-based translation model. First, we introduce linguistically motivated constraints into a hierarchical model, guiding translation phrase choices in favor of those that respect syntactic boundaries. Second, based on such translation phrases, we propose a predicate-argument structure reordering model that predicts reordering not only between an argument and its predicate, but also between two arguments. Experiments on Chinese-to-English translation demonstrate that both advances significantly improve translation accuracy."
D13-1133,Using Topic Modeling to Improve Prediction of Neuroticism and Depression in College Students,2013,24,37,1,1,8279,philip resnik,Proceedings of the 2013 Conference on Empirical Methods in Natural Language Processing,0,"We investigate the value-add of topic modeling in text analysis for depression, and for neuroticism as a strongly associated personality measure. Using Pennebakerxe2x80x99s Linguistic Inquiry and Word Count (LIWC) lexicon to provide baseline features, we show that straightforward topic modeling using Latent Dirichlet Allocation (LDA) yields interpretable, psychologically relevant xe2x80x9cthemesxe2x80x9d that add value in prediction of clinical assessments."
P12-2023,Topic Models for Dynamic Translation Model Adaptation,2012,17,65,3,1,26610,vladimir eidelman,Proceedings of the 50th Annual Meeting of the Association for Computational Linguistics (Volume 2: Short Papers),0,"We propose an approach that biases machine translation systems toward relevant translations based on topic-specific contexts, where topics are induced in an unsupervised way using topic models; this can be thought of as inducing subcorpora for adaptation without any human annotation. We use these topic distributions to compute topic-dependent lexical weighting probabilities and directly incorporate them into our translation model as features. Conditioning lexical probabilities on the topic biases translations toward topic-relevant output, resulting in significant improvements of up to 1 BLEU and 3 TER on Chinese to English translation over a strong baseline."
P12-1009,{SITS}: A Hierarchical Nonparametric Model using Speaker Identity for Topic Segmentation in Multiparty Conversations,2012,46,29,3,1,37071,vietan nguyen,Proceedings of the 50th Annual Meeting of the Association for Computational Linguistics (Volume 1: Long Papers),1,"One of the key tasks for analyzing conversational data is segmenting it into coherent topic segments. However, most models of topic segmentation ignore the social aspect of conversations, focusing only on the words used. We introduce a hierarchical Bayesian nonparametric model, Speaker Identity for Topic Segmentation (SITS), that discovers (1) the topics used in a conversation, (2) how these topics are shared across conversations, (3) when these topics shift, and (4) a person-specific tendency to introduce new topics. We evaluate against current unsupervised segmentation models to show that including person-specific information improves segmentation performance on meeting corpora and on political debates. Moreover, we provide evidence that SITS captures an individual's tendency to introduce new topics in political contexts, via analysis of the 2008 US presidential debates and the television program Crossfire."
N12-1046,Encouraging Consistent Translation Choices,2012,29,32,3,0.757576,30398,ferhan ture,Proceedings of the 2012 Conference of the North {A}merican Chapter of the Association for Computational Linguistics: Human Language Technologies,0,"It has long been observed that monolingual text exhibits a tendency toward one sense per discourse, and it has been argued that a related one translation per discourse constraint is operative in bilingual contexts as well. In this paper, we introduce a novel method using forced decoding to confirm the validity of this constraint, and we demonstrate that it can be exploited in order to improve machine translation quality. Three ways of incorporating such a preference into a hierarchical phrase-based MT model are proposed, and the approach where all three are combined yields the greatest improvements for both Arabic-English and Chinese-English translation experiments."
W11-2140,Noisy {SMS} Machine Translation in Low-Density Languages,2011,13,5,3,1,26610,vladimir eidelman,Proceedings of the Sixth Workshop on Statistical Machine Translation,0,"This paper presents the system we developed for the 2011 WMT Haitian Creole--English SMS featured translation task. Applying standard statistical machine translation methods to noisy real-world SMS data in a low-density language setting such as Haitian Creole poses a unique set of challenges, which we attempt to address in this work. Along with techniques to better exploit the limited available training data, we explore the benefits of several methods for alleviating the additional noise inherent in the SMS and transforming it to better suite the assumptions of our hierarchical phrase-based model system. We show that these methods lead to significant improvements in BLEU score over the baseline."
W11-2148,The Value of Monolingual Crowdsourcing in a Real-World Translation Scenario: Simulation using {H}aitian {C}reole Emergency {SMS} Messages,2011,11,14,2,0,44216,chang hu,Proceedings of the Sixth Workshop on Statistical Machine Translation,0,"MonoTrans2 is a translation system that combines machine translation (MT) with human computation using two crowds of monolingual source (Haitian Creole) and target (English) speakers. We report on its use in the WMT 2011 Haitian Creole to English translation task, showing that MonoTrans2 translated 38% of the sentences well compared to Google Translate's 25%."
W10-1707,The {U}niversity of {M}aryland Statistical Machine Translation System for the Fifth Workshop on Machine Translation,2010,-1,-1,3,1,26610,vladimir eidelman,Proceedings of the Joint Fifth Workshop on Statistical Machine Translation and {M}etrics{MATR},0,None
W10-0723,Shedding (a Thousand Points of) Light on Biased Language,2010,12,38,2,0,42837,tae yano,Proceedings of the {NAACL} {HLT} 2010 Workshop on Creating Speech and Language Data with {A}mazon{'}s Mechanical Turk,0,"This paper considers the linguistic indicators of bias in political text. We used Amazon Mechanical Turk judgments about sentences from American political blogs, asking annotators to indicate whether a sentence showed bias, and if so, in which political direction and through which word tokens. We also asked annotators questions about their own political views. We conducted a preliminary analysis of the data, exploring how different groups perceive bias in different blogs, and showing some lexical indicators strongly associated with perceived bias."
W10-0730,Measuring Transitivity Using Untrained Annotators,2010,7,10,3,0.757576,16057,nitin madnani,Proceedings of the {NAACL} {HLT} 2010 Workshop on Creating Speech and Language Data with {A}mazon{'}s Mechanical Turk,0,Hopper and Thompson (1980) defined a multi-axis theory of transitivity that goes beyond simple syntactic transitivity and captures how much action takes place in a sentence. Detecting these features requires a deep understanding of lexical semantics and real-world pragmatics. We propose two general approaches for creating a corpus of sentences labeled with respect to the Hopper-Thompson transitivity schema using Amazon Mechanical Turk. Both approaches assume no existing resources and incorporate all necessary annotation into a single system; this is done to allow for future generalization to other languages. The first task attempts to use language-neutral videos to elicit human-composed sentences with specified transitivity attributes. The second task uses an iterative process to first label the actors and objects in sentences and then annotate the sentences' transitivity. We examine the success of these techniques and perform a preliminary classification of the transitivity of held-out data.
W10-0735,Error Driven Paraphrase Annotation using {M}echanical {T}urk,2010,10,35,2,0,41349,olivia buzek,Proceedings of the {NAACL} {HLT} 2010 Workshop on Creating Speech and Language Data with {A}mazon{'}s Mechanical Turk,0,"The source text provided to a machine translation system is typically only one of many ways the input sentence could have been expressed, and alternative forms of expression can often produce a better translation. We introduce here error driven paraphrasing of source sentences: instead of paraphrasing a source sentence exhaustively, we obtain paraphrases for only the parts that are predicted to be problematic for the translation system. We report on an Amazon Mechanical Turk study that explores this idea, and establishes via an oracle evaluation that it holds the potential to substantially improve translation quality."
P10-4002,"cdec: A Decoder, Alignment, and Learning Framework for Finite-State and Context-Free Translation Models",2010,29,188,9,0.727273,3925,chris dyer,Proceedings of the {ACL} 2010 System Demonstrations,0,"We present cdec, an open source framework for decoding, aligning with, and training a number of statistical machine translation models, including word-based models, phrase-based models, and models based on synchronous context-free grammars. Using a single unified internal representation for translation forests, the decoder strictly separates model-specific translation logic from general rescoring, pruning, and inference algorithms. From this unified representation, the decoder can extract not only the 1- or k-best translations, but also alignments to a reference, or the quantities necessary to drive discriminative training using gradient-based or gradient-free optimization techniques. Its efficient C implementation means that memory use and runtime performance are significantly better than comparable decoders."
N10-1052,Generalizing Hierarchical Phrase-based Translation using Rules with Adjacent Nonterminals,2010,9,2,2,1,14459,hendra setiawan,Human Language Technologies: The 2010 Annual Conference of the North {A}merican Chapter of the Association for Computational Linguistics,0,"Hierarchical phrase-based translation (Hiero, (Chiang, 2005)) provides an attractive framework within which both short- and long-distance reorderings can be addressed consistently and efficiently. However, Hiero is generally implemented with a constraint preventing the creation of rules with adjacent nonterminals, because such rules introduce computational and modeling challenges. We introduce methods to address these challenges, and demonstrate that rules with adjacent nonterminals can improve Hiero's generalization power and lead to significant performance gains in Chinese-English translation."
N10-1128,"Context-free reordering, finite-state translation",2010,33,33,2,0.727273,3925,chris dyer,Human Language Technologies: The 2010 Annual Conference of the North {A}merican Chapter of the Association for Computational Linguistics,0,"We describe a class of translation model in which a set of input variants encoded as a context-free forest is translated using a finite-state translation model. The forest structure of the input is well-suited to representing word order alternatives, making it straightforward to model translation as a two step process: (1) tree-based source reordering and (2) phrase transduction. By treating the reordering process as a latent variable in a probabilistic translation model, we can learn a long-range source reordering model without example reordered sentences, which are problematic to construct. The resulting model has state-of-the-art translation performance, uses linguistically motivated features to effectively model long range reordering, and is significantly smaller than a comparable hierarchical phrase-based translation model."
D10-1005,Holistic Sentiment Analysis Across Languages: Multilingual Supervised {L}atent {D}irichlet {A}llocation,2010,46,82,2,0.952381,3312,jordan boydgraber,Proceedings of the 2010 Conference on Empirical Methods in Natural Language Processing,0,"In this paper, we develop multilingual supervised latent Dirichlet allocation (MlSLDA), a probabilistic generative model that allows insights gleaned from one language's data to inform how the model captures properties of other languages. MlSLDA accomplishes this by jointly modeling two aspects of text: how multilingual concepts are clustered into thematically coherent topics and how topics associated with text connect to an observed regression variable (such as ratings on a sentiment scale). Concepts are represented in a general hierarchical framework that is flexible enough to express semantic ontologies, dictionaries, clustering constraints, and, as a special, degenerate case, conventional topic models. Both the topics and the regression are discovered via posterior inference from corpora. We show MlSLDA can build topics that are consistent across languages, discover sensible bilingual lexical correspondences, and leverage multilingual corpora to better predict sentiment."
D10-1013,Improving Translation via Targeted Paraphrasing,2010,26,33,1,1,8279,philip resnik,Proceedings of the 2010 Conference on Empirical Methods in Natural Language Processing,0,"Targeted paraphrasing is a new approach to the problem of obtaining cost-effective, reasonable quality translation that makes use of simple and inexpensive human computations by monolingual speakers in combination with machine translation. The key insight behind the process is that it is possible to spot likely translation errors with only monolingual knowledge of the target language, and it is possible to generate alternative ways to say the same thing (i.e. paraphrases) with only monolingual knowledge of the source language. Evaluations demonstrate that this approach can yield substantial improvements in translation quality."
D10-1028,Modeling Perspective Using {A}daptor {G}rammars,2010,22,27,3,0,46393,eric hardisty,Proceedings of the 2010 Conference on Empirical Methods in Natural Language Processing,0,"Strong indications of perspective can often come from collocations of arbitrary length; for example, someone writing get the government out of my X is typically expressing a conservative rather than progressive viewpoint. However, going beyond unigram or bigram features in perspective classification gives rise to problems of data sparsity. We address this problem using nonparametric Bayesian modeling, specifically adaptor grammars (Johnson et al., 2006). We demonstrate that an adaptive naive Bayes model captures multiword lexical usages associated with perspective, and establishes a new state-of-the-art for perspective classification results using the Bitter Lemons corpus, a collection of essays about mid-east issues from Israeli and Palestinian points of view."
D10-1052,Discriminative Word Alignment with a Function Word Reordering Model,2010,26,10,3,1,14459,hendra setiawan,Proceedings of the 2010 Conference on Empirical Methods in Natural Language Processing,0,"We address the modeling, parameter estimation and search challenges that arise from the introduction of reordering models that capture non-local reordering in alignment modeling. In particular, we introduce several reordering models that utilize (pairs of) function words as contexts for alignment reordering. To address the parameter estimation challenge, we propose to estimate these reordering models from a relatively small amount of manually-aligned corpora. To address the search challenge, we devise an iterative local search algorithm that stochastically explores reordering possibilities. By capturing non-local reordering phenomena, our proposed alignment model bears a closer resemblance to state-of-the-art translation model. Empirical results show significant improvements in alignment quality as well as in translation performance over baselines in a large-scale Chinese-English translation task."
2010.amta-workshop.3,Position Paper: Improving Translation via Targeted Paraphrasing,2010,26,33,2,0,31901,yakov kronrod,"Proceedings of the Workshop on Collaborative Translation: technology, crowdsourcing, and the translator perspective",0,"Targeted paraphrasing is a new approach to the problem of obtaining cost-effective, reasonable quality translation that makes use of simple and inexpensive human computations by monolingual speakers in combination with machine translation. The key insight behind the process is that it is possible to spot likely translation errors with only monolingual knowledge of the target language, and it is possible to generate alternative ways to say the same thing (i.e. paraphrases) with only monolingual knowledge of the source language. Evaluations demonstrate that this approach can yield substantial improvements in translation quality."
W09-0426,The {U}niversity of {M}aryland Statistical Machine Translation System for the {F}ourth {W}orkshop on {M}achine {T}ranslation,2009,30,14,4,0.727273,3925,chris dyer,Proceedings of the Fourth Workshop on Statistical Machine Translation,0,"This paper describes the techniques we explored to improve the translation of news text in the German-English and Hungarian-English tracks of the WMT09 shared translation task. Beginning with a convention hierarchical phrase-based system, we found benefits for using word segmentation lattices as input, explicit generation of beginning and end of sentence markers, minimum Bayes risk decoding, and incorporation of a feature scoring the alignment of function words in the hypothesized translation. We also explored the use of monolingual paraphrases to improve coverage, as well as co-training to improve the quality of the segmentation lattices used, but these did not lead to improvements."
P09-1037,Topological Ordering of Function Words in Hierarchical Phrase-based Translation,2009,18,18,4,1,14459,hendra setiawan,Proceedings of the Joint Conference of the 47th Annual Meeting of the {ACL} and the 4th International Joint Conference on Natural Language Processing of the {AFNLP},1,"Hierarchical phrase-based models are attractive because they provide a consistent framework within which to characterize both local and long-distance reorderings, but they also make it difficult to distinguish many implausible reorderings from those that are linguistically plausible. Rather than appealing to annotation-driven syntactic modeling, we address this problem by observing the influential role of function words in determining syntactic structure, and introducing soft constraints on function word relationships as part of a standard log-linear hierarchical phrase-based model. Experimentation on Chinese-English and Arabic-English translation demonstrates that the approach yields significant gains in performance."
N09-1057,More than Words: Syntactic Packaging and Implicit Sentiment,2009,29,101,2,0,47353,stephan greene,Proceedings of Human Language Technologies: The 2009 Annual Conference of the North {A}merican Chapter of the Association for Computational Linguistics,0,"Work on sentiment analysis often focuses on the words and phrases that people use in overtly opinionated text. In this paper, we introduce a new approach to the problem that focuses not on lexical indicators, but on the syntactic packaging of ideas, which is well suited to investigating the identification of implicit sentiment, or perspective. We establish a strong predictive connection between linguistically well motivated features and implicit sentiment, and then show how computational approximations of these features can be used to improve on existing state-of-the-art sentiment classification results."
D09-1040,Improved Statistical Machine Translation Using Monolingually-Derived Paraphrases,2009,37,128,3,1,34833,yuval marton,Proceedings of the 2009 Conference on Empirical Methods in Natural Language Processing,0,"Untranslated words still constitute a major problem for Statistical Machine Translation (SMT), and current SMT systems are limited by the quantity of parallel training texts. Augmenting the training data with paraphrases generated by pivoting through other languages alleviates this problem, especially for the so-called low density languages. But pivoting requires additional parallel texts. We address this problem by deriving paraphrases monolingually, using distributional semantic similarity measures, thus providing access to larger training resources, such as comparable and unrelated monolingual corpora. We present what is to our knowledge the first successful integration of a collocational approach to untranslated words with an end-to-end, state of the art SMT system demonstrating significant translation improvements in a low-resource setting."
