2021.naacl-main.436,Pre-training with Meta Learning for {C}hinese Word Segmentation,2021,-1,-1,5,0,4529,zhen ke,Proceedings of the 2021 Conference of the North American Chapter of the Association for Computational Linguistics: Human Language Technologies,0,"Recent researches show that pre-trained models (PTMs) are beneficial to Chinese Word Segmentation (CWS). However, PTMs used in previous works usually adopt language modeling as pre-training tasks, lacking task-specific prior segmentation knowledge and ignoring the discrepancy between pre-training tasks and downstream CWS tasks. In this paper, we propose a CWS-specific pre-trained model MetaSeg, which employs a unified architecture and incorporates meta learning algorithm into a multi-criteria pre-training task. Empirical results show that MetaSeg could utilize common prior segmentation knowledge from different existing criteria and alleviate the discrepancy between pre-trained models and downstream CWS tasks. Besides, MetaSeg can achieve new state-of-the-art performance on twelve widely-used CWS datasets and significantly improve model performance in low-resource settings."
2021.findings-acl.3,{F}ew-{S}hot {E}vent {D}etection with {P}rototypical {A}mortized {C}onditional {R}andom {F}ield,2021,-1,-1,6,0,7487,xin cong,Findings of the Association for Computational Linguistics: ACL-IJCNLP 2021,0,None
2021.emnlp-main.764,Maximal Clique Based Non-Autoregressive Open Information Extraction,2021,-1,-1,6,0.680272,4834,bowen yu,Proceedings of the 2021 Conference on Empirical Methods in Natural Language Processing,0,"Open Information Extraction (OpenIE) aims to discover textual facts from a given sentence. In essence, the facts contained in plain text are unordered. However, the popular OpenIE systems usually output facts sequentially in the way of predicting the next fact conditioned on the previous decoded ones, which enforce an unnecessary order on the facts and involve the error accumulation between autoregressive steps. To break this bottleneck, we propose MacroIE, a novel non-autoregressive framework for OpenIE. MacroIE firstly constructs a fact graph based on the table filling scheme, in which each node denotes a fact element, and an edge links two nodes that belong to the same fact. Then OpenIE can be reformulated as a non-parametric process of finding maximal cliques from the graph. It directly outputs the final set of facts in one go, thus getting rid of the burden of predicting fact order, as well as the error propagation between facts. Experiments conducted on two benchmark datasets show that our proposed model significantly outperforms current state-of-the-art methods, beats the previous systems by as much as 5.7 absolute gain in F1 score."
2020.semeval-1.69,Lijunyi at {S}em{E}val-2020 Task 4: An {ALBERT} Model Based Maximum Ensemble with Different Training Sizes and Depths for Commonsense Validation and Explanation,2020,-1,-1,2,0.405415,1538,junyi li,Proceedings of the Fourteenth Workshop on Semantic Evaluation,0,"This article describes the system submitted to SemEval 2020 Task 4: Commonsense Validation and Explanation. We only participated in the subtask A, which is mainly to distinguish whether the sentence has meaning. To solve this task, we mainly used ALBERT model-based maximum ensemble with different training sizes and depths. To prove the validity of the model to the task, we also used some other neural network models for comparison. Our model achieved the accuracy score of 0.938(ranked 10/41) in subtask A."
2020.semeval-1.86,Lee at {S}em{E}val-2020 Task 5: {ALBERT} Model Based on the Maximum Ensemble Strategy and Different Data Sampling Methods for Detecting Counterfactual Statements,2020,-1,-1,3,0.405415,1538,junyi li,Proceedings of the Fourteenth Workshop on Semantic Evaluation,0,"This article describes the system submitted to SemEval 2020 Task 5: Modelling Causal Reasoning in Language: Detecting Counterfactuals. In this task, we only participate in the subtask A which is detecting counterfactual statements. In order to solve this sub-task, first of all, because of the problem of data balance, we use the undersampling and oversampling methods to process the data set. Second, we used the ALBERT model and the maximum ensemble method based on the ALBERT model. Our methods achieved a F1 score of 0.85 in subtask A."
2020.iwslt-1.18,Xiaomi{'}s Submissions for {IWSLT} 2020 Open Domain Translation Task,2020,-1,-1,5,0,18833,yuhui sun,Proceedings of the 17th International Conference on Spoken Language Translation,0,"This paper describes the Xiaomi{'}s submissions to the IWSLT20 shared open domain translation task for Chinese{\textless}-{\textgreater}Japanese language pair. We explore different model ensembling strategies based on recent Transformer variants. We also further strengthen our systems via some effective techniques, such as data filtering, data selection, tagged back translation, domain adaptation, knowledge distillation, and re-ranking. Our resulting Chinese-{\textgreater}Japanese primary system ranked second in terms of character-level BLEU score among all submissions. Our resulting Japanese-{\textgreater}Chinese primary system also achieved a competitive performance."
2020.findings-emnlp.183,Focus-Constrained Attention Mechanism for {CVAE}-based Response Generation,2020,-1,-1,6,0,19626,zhi cui,Findings of the Association for Computational Linguistics: EMNLP 2020,0,"To model diverse responses for a given post, one promising way is to introduce a latent variable into Seq2Seq models. The latent variable is supposed to capture the discourse-level information and encourage the informativeness of target responses. However, such discourse-level information is often too coarse for the decoder to be utilized. To tackle it, our idea is to transform the coarse-grained discourse-level information into fine-grained word-level information. Specifically, we firstly measure the semantic concentration of corresponding target response on the post words by introducing a fine-grained focus signal. Then, we propose a focus-constrained attention mechanism to take full advantage of focus in well aligning the input to the target response. The experimental results demonstrate that by exploiting the fine-grained signal, our model can generate more diverse and informative responses compared with several state-of-the-art models."
2020.emnlp-main.514,{C}oarse-to-{F}ine {P}re-training for {N}amed {E}ntity {R}ecognition,2020,-1,-1,6,0,6761,xue mengge,Proceedings of the 2020 Conference on Empirical Methods in Natural Language Processing (EMNLP),0,"More recently, Named Entity Recognition hasachieved great advances aided by pre-trainingapproaches such as BERT. However, currentpre-training techniques focus on building lan-guage modeling objectives to learn a gen-eral representation, ignoring the named entity-related knowledge. To this end, we proposea NER-specific pre-training framework to in-ject coarse-to-fine automatically mined entityknowledge into pre-trained models. Specifi-cally, we first warm-up the model via an en-tity span identification task by training it withWikipedia anchors, which can be deemed asgeneral-typed entities. Then we leverage thegazetteer-based distant supervision strategy totrain the model extract coarse-grained typedentities. Finally, we devise a self-supervisedauxiliary task to mine the fine-grained namedentity knowledge via clustering.Empiricalstudies on three public NER datasets demon-strate that our framework achieves significantimprovements against several pre-trained base-lines, establishing the new state-of-the-art per-formance on three benchmarks. Besides, weshow that our framework gains promising re-sults without using human-labeled trainingdata, demonstrating its effectiveness in label-few and low-resource scenarios."
2020.coling-main.2,Infusing Sequential Information into Conditional Masked Translation Model with Self-Review Mechanism,2020,-1,-1,6,0,21030,pan xie,Proceedings of the 28th International Conference on Computational Linguistics,0,"Non-autoregressive models generate target words in a parallel way, which achieve a faster decoding speed but at the sacrifice of translation accuracy. To remedy a flawed translation by non-autoregressive models, a promising approach is to train a conditional masked translation model (CMTM), and refine the generated results within several iterations. Unfortunately, such approach hardly considers the sequential dependency among target words, which inevitably results in a translation degradation. Hence, instead of solely training a Transformer-based CMTM, we propose a Self-Review Mechanism to infuse sequential information into it. Concretely, we insert a left-to-right mask to the same decoder of CMTM, and then induce it to autoregressively review whether each generated word from CMTM is supposed to be replaced or kept. The experimental results (WMT14 En ↔ De and WMT16 En ↔ Ro) demonstrate that our model uses dramatically less training computations than the typical CMTM, as well as outperforms several state-of-the-art non-autoregressive models by over 1 BLEU. Through knowledge distillation, our model even surpasses a typical left-to-right Transformer model, while significantly speeding up decoding."
2020.coling-main.340,Porous Lattice Transformer Encoder for {C}hinese {NER},2020,-1,-1,6,0,6761,xue mengge,Proceedings of the 28th International Conference on Computational Linguistics,0,"Incorporating lexicons into character-level Chinese NER by lattices is proven effective to exploitrich word boundary information. Previous work has extended RNNs to consume lattice inputsand achieved great success. However, due to the DAG structure and the inherently unidirectionalsequential nature, this method precludes batched computation and sufficient semantic interaction.In this paper, we propose PLTE, an extension of transformer encoder that is tailored for ChineseNER, which models all the characters and matched lexical words in parallel with batch process-ing. PLTE augments self-attention with positional relation representations to incorporate latticestructure. It also introduces a porous mechanism to augment localness modeling and maintainthe strength of capturing the rich long-term dependencies. Experimental results show that PLTEperforms up to 11.4 times faster than state-of-the-art methods while realizing better performance.We also demonstrate that using BERT representations further substantially boosts the performanceand brings out the best in PLTE."
2020.coling-main.341,Learning to Prune Dependency Trees with Rethinking for Neural Relation Extraction,2020,-1,-1,6,0.680272,4834,bowen yu,Proceedings of the 28th International Conference on Computational Linguistics,0,"Dependency trees have been shown to be effective in capturing long-range relations between target entities. Nevertheless, how to selectively emphasize target-relevant information and remove irrelevant content from the tree is still an open problem. Existing approaches employing pre-defined rules to eliminate noise may not always yield optimal results due to the complexity and variability of natural language. In this paper, we present a novel architecture named Dynamically Pruned Graph Convolutional Network (DP-GCN), which learns to prune the dependency tree with rethinking in an end-to-end scheme. In each layer of DP-GCN, we employ a selection module to concentrate on nodes expressing the target relation by a set of binary gates, and then augment the pruned tree with a pruned semantic graph to ensure the connectivity. After that, we introduce a rethinking mechanism to guide and refine the pruning operation by feeding back the high-level learned features repeatedly. Extensive experimental results demonstrate that our model achieves impressive results compared to strong competitors."
2020.autosimtrans-1.5,Modeling Discourse Structure for Document-level Neural Machine Translation,2020,-1,-1,6,0,22314,junxuan chen,Proceedings of the First Workshop on Automatic Simultaneous Translation,0,"Recently, document-level neural machine translation (NMT) has become a hot topic in the community of machine translation. Despite its success, most of existing studies ignored the discourse structure information of the input document to be translated, which has shown effective in other tasks. In this paper, we propose to improve document-level NMT with the aid of discourse structure information. Our encoder is based on a hierarchical attention network (HAN) (Miculicich et al., 2018). Specifically, we first parse the input document to obtain its discourse structure. Then, we introduce a Transformer-based path encoder to embed the discourse structure information of each word. Finally, we combine the discourse structure information with the word embedding before it is fed into the encoder. Experimental results on the English-to-German dataset show that our model can significantly outperform both Transformer and Transformer+HAN."
U19-1024,An Improved Coarse-to-Fine Method for Solving Generation Tasks,2019,0,0,4,0,24934,wenyv guan,Proceedings of the The 17th Annual Workshop of the Australasian Language Technology Association,0,"The coarse-to-fine (coarse2fine) methods have recently been widely used in the generation tasks. The methods first generate a rough sketch in the coarse stage and then use the sketch to get the final result in the fine stage. However, they usually lack the correction ability when getting a wrong sketch. To solve this problem, in this paper, we propose an improved coarse2fine model with a control mechanism, with which our method can control the influence of the sketch on the final results in the fine stage. Even if the sketch is wrong, our model still has the opportunity to get a correct result. We have experimented our model on the tasks of semantic parsing and math word problem solving. The results have shown the effectiveness of our proposed model."
S19-2095,{YNU} {NLP} at {S}em{E}val-2019 Task 5: Attention and Capsule Ensemble for Identifying Hate Speech,2019,0,0,1,1,4532,bin wang,Proceedings of the 13th International Workshop on Semantic Evaluation,0,"This paper describes the system submitted to SemEval 2019 Task 5: Multilingual detection of hate speech against immigrants and women in Twitter (hatEval). Its main purpose is to conduct hate speech detection on Twitter, which mainly includes two specific different targets, immigrants and women. We participate in both subtask A and subtask B for English. In order to address this task, we develope an ensemble of an attention-LSTM model based on HAN and an BiGRU-capsule model. Both models use fastText pre-trained embeddings, and we use this model in both subtasks. In comparison to other participating teams, our system is ranked 16th in the Sub-task A for English, and 12th in the Sub-task B for English."
S19-2143,{YNUWB} at {S}em{E}val-2019 Task 6: K-max pooling {CNN} with average meta-embedding for identifying offensive language,2019,0,0,1,1,4532,bin wang,Proceedings of the 13th International Workshop on Semantic Evaluation,0,"This paper describes the system submitted to SemEval 2019 Task 6: OffensEval 2019. The task aims to identify and categorize offensive language in social media, we only participate in Sub-task A, which aims to identify offensive language. In order to address this task, we propose a system based on a K-max pooling convolutional neural network model, and use an argument for averaging as a valid meta-embedding technique to get a metaembedding. Finally, we also use a cyclic learning rate policy to improve model performance. Our model achieves a Macro F1-score of 0.802 (ranked 9/103) in the Sub-task A."
N19-1103,Adaptive Convolution for Multi-Relational Learning,2019,0,5,3,0,26116,xiaotian jiang,"Proceedings of the 2019 Conference of the North {A}merican Chapter of the Association for Computational Linguistics: Human Language Technologies, Volume 1 (Long and Short Papers)",0,"We consider the problem of learning distributed representations for entities and relations of multi-relational data so as to predict missing links therein. Convolutional neural networks have recently shown their superiority for this problem, bringing increased model expressiveness while remaining parameter efficient. Despite the success, previous convolution designs fail to model full interactions between input entities and relations, which potentially limits the performance of link prediction. In this work we introduce ConvR, an adaptive convolutional network designed to maximize entity-relation interactions in a convolutional fashion. ConvR adaptively constructs convolution filters from relation representations, and applies these filters across entity representations to generate convolutional features. As such, ConvR enables rich interactions between entity and relation representations at diverse regions, and all the convolutional features generated will be able to capture such interactions. We evaluate ConvR on multiple benchmark datasets. Experimental results show that: (1) ConvR performs substantially better than competitive baselines in almost all the metrics and on all the datasets; (2) Compared with state-of-the-art convolutional models, ConvR is not only more effective but also more efficient. It offers a 7{\%} increase in MRR and a 6{\%} increase in Hits@10, while saving 12{\%} in parameter storage."
D19-5717,{YNU}-junyi in {B}io{NLP}-{OST} 2019: Using {CNN}-{LSTM} Model with Embeddings for {S}ee{D}ev Binary Event Extraction,2019,0,0,4,0.405415,1538,junyi li,Proceedings of The 5th Workshop on BioNLP Open Shared Tasks,0,"We participated in the BioNLP 2019 Open Shared Tasks: binary relation extraction of SeeDev task. The model was constructed us- ing convolutional neural networks (CNN) and long short term memory networks (LSTM). The full text information and context information were collected using the advantages of CNN and LSTM. The model consisted of two main modules: distributed semantic representation construction, such as word embedding, distance embedding and entity type embed- ding; and CNN-LSTM model. The F1 value of our participated task on the test data set of all types was 0.342. We achieved the second highest in the task. The results showed that our proposed method performed effectively in the binary relation extraction."
P18-1011,Improving Knowledge Graph Embedding Using Simple Constraints,2018,43,9,3,0,29088,boyang ding,Proceedings of the 56th Annual Meeting of the Association for Computational Linguistics (Volume 1: Long Papers),1,"Embedding knowledge graphs (KGs) into continuous vector spaces is a focus of current research. Early works performed this task via simple models developed over KG triples. Recent attempts focused on either designing more complicated triple scoring models, or incorporating extra information beyond triples. This paper, by contrast, investigates the potential of using very simple constraints to improve KG embedding. We examine non-negativity constraints on entity representations and approximate entailment constraints on relation representations. The former help to learn compact and interpretable representations for entities. The latter further encode regularities of logical entailment between relations into their distributed representations. These constraints impose prior beliefs upon the structure of the embedding space, without negative impacts on efficiency or scalability. Evaluation on WordNet, Freebase, and DBpedia shows that our approach is simple yet surprisingly effective, significantly and consistently outperforming competitive baselines. The constraints imposed indeed improve model interpretability, leading to a substantially increased structuring of the embedding space. Code and data are available at \url{https://github.com/iieir-km/ComplEx-NNE_AER}."
P16-1124,Knowledge Base Completion via Coupled Path Ranking,2016,37,33,4,1,7574,quan wang,Proceedings of the 54th Annual Meeting of the Association for Computational Linguistics (Volume 1: Long Papers),1,"Knowledge bases (KBs) are often greatly incomplete, necessitating a demand for KB completion. The path ranking algorithm (PRA) is one of the most promising approaches to this task. Previous work on PRA usually follows a single-task learning paradigm, building a prediction model for each relation independently with its own training data. It ignores meaningful associations among certain relations, and might not get enough training data for less frequent relations. This paper proposes a novel multi-task learning framework for PRA, referred to as coupled PRA (CPRA). It first devises an agglomerative clustering strategy to automatically discover relations that are highly correlated to each other, and then employs a multi-task learning strategy to effectively couple the prediction of such relations. As such, CPRA takes into account relation association and enables implicit data sharing among them. We empirically evaluate CPRA on benchmark data created from Freebase. Experimental results show that CPRA can effectively identify coherent clusters in which relations are highly correlated. By further coupling such relations, CPRA significantly outperforms PRA, in terms of both predictive accuracy and model interpretability."
D16-1019,Jointly Embedding Knowledge Graphs and Logical Rules,2016,29,61,4,1,7520,shu guo,Proceedings of the 2016 Conference on Empirical Methods in Natural Language Processing,0,None
D16-1100,Multi-Granularity {C}hinese Word Embedding,2016,12,33,5,0,35554,rongchao yin,Proceedings of the 2016 Conference on Empirical Methods in Natural Language Processing,0,None
C16-1139,Relation Extraction with Multi-instance Multi-label Convolutional Neural Networks,2016,20,34,4,0,26116,xiaotian jiang,"Proceedings of {COLING} 2016, the 26th International Conference on Computational Linguistics: Technical Papers",0,"Distant supervision is an efficient approach that automatically generates labeled data for relation extraction (RE). Traditional distantly supervised RE systems rely heavily on handcrafted features, and hence suffer from error propagation. Recently, a neural network architecture has been proposed to automatically extract features for relation classification. However, this approach follows the traditional expressed-at-least-once assumption, and fails to make full use of information across different sentences. Moreover, it ignores the fact that there can be multiple relations holding between the same entity pair. In this paper, we propose a multi-instance multi-label convolutional neural network for distantly supervised RE. It first relaxes the expressed-at-least-once assumption, and employs cross-sentence max-pooling so as to enable information sharing across different sentences. Then it handles overlapping relations by multi-label learning with a neural network classifier. Experimental results show that our approach performs significantly and consistently better than state-of-the-art methods."
P15-1009,Semantically Smooth Knowledge Graph Embedding,2015,36,68,3,1,7520,shu guo,Proceedings of the 53rd Annual Meeting of the Association for Computational Linguistics and the 7th International Joint Conference on Natural Language Processing (Volume 1: Long Papers),1,"This paper considers the problem of embedding Knowledge Graphs (KGs) consisting of entities and relations into lowdimensional vector spaces. Most of the existing methods perform this task based solely on observed facts. The only requirement is that the learned embeddings should be compatible within each individual fact. In this paper, aiming at further discovering the intrinsic geometric structure of the embedding space, we propose Semantically Smooth Embedding (SSE). The key idea of SSE is to take full advantage of additional semantic information and enforce the embedding space to be semantically smooth, i.e., entities belonging to the same semantic category will lie close to each other in the embedding space. Two manifold learning algorithms Laplacian Eigenmaps and Locally Linear Embedding are used to model the smoothness assumption. Both are formulated as geometrically based regularization terms to constrain the embedding task. We empirically evaluate SSE in two benchmark tasks of link prediction and triple classification, and achieve significant and consistent improvements over state-of-the-art methods. Furthermore, SSE is a general framework. The smoothness assumption can be imposed to a wide variety of embedding models, and it can also be constructed using other information besides entitiesxe2x80x99 semantic categories."
P15-1076,Trans-dimensional Random Fields for Language Modeling,2015,26,7,1,1,4532,bin wang,Proceedings of the 53rd Annual Meeting of the Association for Computational Linguistics and the 7th International Joint Conference on Natural Language Processing (Volume 1: Long Papers),1,"Language modeling (LM) involves determining the joint probability of words in a sentence. The conditional approach is dominant, representing the joint probability in terms of conditionals. Examples include n-gram LMs and neural network LMs. An alternative approach, called the random field (RF) approach, is used in whole-sentence maximum entropy (WSME) LMs. Although the RF approach has potential benefits, the empirical results of previous WSME models are not satisfactory. In this paper, we revisit the RF approach for language modeling, with a number of innovations. We propose a trans-dimensional RF (TDRF) model and develop a training algorithm using joint stochastic approximation and trans-dimensional mixture sampling. We perform speech recognition experiments on Wall Street Journal data, and find that our TDRF models lead to performances as good as the recurrent neural network LMs but are computationally more efficient in computing sentence probability."
