2021.privatenlp-1.4,An Investigation towards Differentially Private Sequence Tagging in a Federated Framework,2021,-1,-1,2,1,2564,abhik jana,Proceedings of the Third Workshop on Privacy in Natural Language Processing,0,"To build machine learning-based applications for sensitive domains like medical, legal, etc. where the digitized text contains private information, anonymization of text is required for preserving privacy. Sequence tagging, e.g. as done in Named Entity Recognition (NER) can help to detect private information. However, to train sequence tagging models, a sufficient amount of labeled data are required but for privacy-sensitive domains, such labeled data also can not be shared directly. In this paper, we investigate the applicability of a privacy-preserving framework for sequence tagging tasks, specifically NER. Hence, we analyze a framework for the NER task, which incorporates two levels of privacy protection. Firstly, we deploy a federated learning (FL) framework where the labeled data are not shared with the centralized server as well as the peer clients. Secondly, we apply differential privacy (DP) while the models are being trained in each client instance. While both privacy measures are suitable for privacy-aware models, their combination results in unstable models. To our knowledge, this is the first study of its kind on privacy-aware sequence tagging models."
2021.nodalida-main.43,Error Analysis of using {BART} for Multi-Document Summarization: A Study for {E}nglish and {G}erman Language,2021,-1,-1,3,0,2709,timo johner,Proceedings of the 23rd Nordic Conference on Computational Linguistics (NoDaLiDa),0,"Recent research using pre-trained language models for multi-document summarization task lacks deep investigation of potential erroneous cases and their possible application on other languages. In this work, we apply a pre-trained language model (BART) for multi-document summarization (MDS) task using both fine-tuning and without fine-tuning. We use two English datasets and one German dataset for this study. First, we reproduce the multi-document summaries for English language by following one of the recent studies. Next, we show the applicability of the model to German language by achieving state-of-the-art performance on German MDS. We perform an in-depth error analysis of the followed approach for both languages, which leads us to identifying most notable errors, from made-up facts and topic delimitation, and quantifying the amount of extractiveness."
2021.naacl-srw.5,Towards Layered Events and Schema Representations in Long Documents,2021,-1,-1,2,0,3177,hans hatzel,Proceedings of the 2021 Conference of the North American Chapter of the Association for Computational Linguistics: Student Research Workshop,0,"In this thesis proposal, we explore the application of event extraction to literary texts. Considering the lengths of literary documents modeling events in different granularities may be more adequate to extract meaningful information, as individual elements contribute little to the overall semantics. We adapt the concept of schemas as sequences of events all describing a single process, connected through shared participants extending it to for multiple schemas in a document. Segmentation of event sequences into schemas is approached by modeling event sequences, on such task as the narrative cloze task, the prediction of missing events in sequences. We propose building on sequences of event embeddings to form schema embeddings, thereby summarizing sections of documents using a single representation. This approach will allow for the comparisons of different sections of documents and entire literary works. Literature is a challenging domain based on its variety of genres, yet the representation of literary content has received relatively little attention."
2021.naacl-srw.21,Towards Multi-Modal Text-Image Retrieval to improve Human Reading,2021,-1,-1,4,0,3214,florian schneider,Proceedings of the 2021 Conference of the North American Chapter of the Association for Computational Linguistics: Student Research Workshop,0,"In primary school, children{'}s books, as well as in modern language learning apps, multi-modal learning strategies like illustrations of terms and phrases are used to support reading comprehension. Also, several studies in educational psychology suggest that integrating cross-modal information will improve reading comprehension. We claim that state-of- he-art multi-modal transformers, which could be used in a language learner context to improve human reading, will perform poorly because of the short and relatively simple textual data those models are trained with. To prove our hypotheses, we collected a new multi-modal image-retrieval dataset based on data from Wikipedia. In an in-depth data analysis, we highlight the differences between our dataset and other popular datasets. Additionally, we evaluate several state-of-the-art multi-modal transformers on text-image retrieval on our dataset and analyze their meager results, which verify our claims."
2021.naacl-main.351,Word Complexity is in the Eye of the Beholder,2021,-1,-1,4,0,4297,sian gooding,Proceedings of the 2021 Conference of the North American Chapter of the Association for Computational Linguistics: Human Language Technologies,0,"Lexical complexity is a highly subjective notion, yet this factor is often neglected in lexical simplification and readability systems which use a {''}one-size-fits-all{''} approach. In this paper, we investigate which aspects contribute to the notion of lexical complexity in various groups of readers, focusing on native and non-native speakers of English, and how the notion of complexity changes depending on the proficiency level of a non-native reader. To facilitate reproducibility of our approach and foster further research into these aspects, we release a dataset of complex words annotated by readers with different backgrounds."
2021.naacl-demos.12,{A}ctive{A}nno: General-Purpose Document-Level Annotation Tool with Active Learning Integration,2021,-1,-1,3,0,4869,max wiechmann,Proceedings of the 2021 Conference of the North American Chapter of the Association for Computational Linguistics: Human Language Technologies: Demonstrations,0,"ActiveAnno is an annotation tool focused on document-level annotation tasks developed both for industry and research settings. It is designed to be a general-purpose tool with a wide variety of use cases. It features a modern and responsive web UI for creating annotation projects, conducting annotations, adjudicating disagreements, and analyzing annotation results. ActiveAnno embeds a highly configurable and interactive user interface. The tool also integrates a RESTful API that enables integration into other software systems, including an API for machine learning integration. ActiveAnno is built with extensible design and easy deployment in mind, all to enable users to perform annotation tasks with high efficiency and high-quality annotation results."
2021.konvens-1.4,How Hateful are Movies? A Study and Prediction on Movie Subtitles,2021,-1,-1,5,0,5541,niklas boguszewski,Proceedings of the 17th Conference on Natural Language Processing (KONVENS 2021),0,None
2021.konvens-1.15,Neural End-to-end Coreference Resolution for {G}erman in Different Domains,2021,-1,-1,3,1,5567,fynn schroder,Proceedings of the 17th Conference on Natural Language Processing (KONVENS 2021),0,None
2021.findings-emnlp.218,Probing Pre-trained Language Models for Semantic Attributes and their Values,2021,-1,-1,2,0,6968,meriem beloucif,Findings of the Association for Computational Linguistics: EMNLP 2021,0,"Pretrained language models (PTLMs) yield state-of-the-art performance on many natural language processing tasks, including syntax, semantics and commonsense. In this paper, we focus on identifying to what extent do PTLMs capture semantic attributes and their values, e.g., the correlation between rich and high net worth. We use PTLMs to predict masked tokens using patterns and lists of items from Wikidata in order to verify how likely PTLMs encode semantic attributes along with their values. Such inferences based on semantics are intuitive for humans as part of our language understanding. Since PTLMs are trained on large amount of Wikipedia data we would assume that they can generate similar predictions, yet our findings reveal that PTLMs are still much worse than humans on this task. We show evidence and analysis explaining how to exploit our methodology to integrate better context and semantics into PTLMs using knowledge bases."
2021.eacl-demos.8,Forum 4.0: An Open-Source User Comment Analysis Framework,2021,-1,-1,3,0,11019,marlo haering,Proceedings of the 16th Conference of the European Chapter of the Association for Computational Linguistics: System Demonstrations,0,"With the increasing number of user comments in diverse domains, including comments on online journalism and e-commerce websites, the manual content analysis of these comments becomes time-consuming and challenging. However, research showed that user comments contain useful information for different domain experts, which is thus worth finding and utilizing. This paper introduces Forum 4.0, an open-source framework to semi-automatically analyze, aggregate, and visualize user comments based on labels defined by domain experts. We demonstrate the applicability of Forum 4.0 with comments analytics scenarios within the domains of online journalism and app stores. We outline the underlying container architecture, including the web-based user interface, the machine learning component, and the task manager for time-consuming tasks. We finally conduct machine learning experiments with simulated annotations and different sampling strategies on existing datasets from both domains to evaluate Forum 4.0{'}s performance. Forum 4.0 achieves promising classification results (ROC-AUC {\mbox{$\geq$}} 0.9 with 100 annotated samples), utilizing transformer-based embeddings with a lightweight logistic regression model. We explain how Forum 4.0{'}s architecture is applicable for millions of user comments in real-time, yet at feasible training and classification costs."
2021.eacl-demos.23,{SC}o{T}: Sense Clustering over Time: a tool for the analysis of lexical change,2021,-1,-1,5,0,11069,christian haase,Proceedings of the 16th Conference of the European Chapter of the Association for Computational Linguistics: System Demonstrations,0,"We present Sense Clustering over Time (SCoT), a novel network-based tool for analysing lexical change. SCoT represents the meanings of a word as clusters of similar words. It visualises their formation, change, and demise. There are two main approaches to the exploration of dynamic networks: the discrete one compares a series of clustered graphs from separate points in time. The continuous one analyses the changes of one dynamic network over a time-span. SCoT offers a new hybrid solution. First, it aggregates time-stamped documents into intervals and calculates one sense graph per discrete interval. Then, it merges the static graphs to a new type of dynamic semantic neighbourhood graph over time. The resulting sense clusters offer uniquely detailed insights into lexical change over continuous intervals with model transparency and provenance. SCoT has been successfully used in a European study on the changing meaning of {`}crisis{'}."
2021.eacl-demos.36,Which is Better for Deep Learning: Python or {MATLAB}? Answering Comparative Questions in Natural Language,2021,-1,-1,3,0,11131,viktoriia chekalina,Proceedings of the 16th Conference of the European Chapter of the Association for Computational Linguistics: System Demonstrations,0,"We present a system for answering comparative questions (Is X better than Y with respect to Z?) in natural language. Answering such questions is important for assisting humans in making informed decisions. The key component of our system is a natural language interface for comparative QA that can be used in personal assistants, chatbots, and similar NLP devices. Comparative QA is a challenging NLP task, since it requires collecting support evidence from many different sources, and direct comparisons of rare objects may be not available even on the entire Web. We take the first step towards a solution for such a task offering a testbed for comparative QA in natural language by probing several methods, making the three best ones available as an online demo."
2020.semeval-1.213,{UHH}-{LT} at {S}em{E}val-2020 Task 12: Fine-Tuning of Pre-Trained Transformer Networks for Offensive Language Detection,2020,16,0,3,1,10216,gregor wiedemann,Proceedings of the Fourteenth Workshop on Semantic Evaluation,0,"Fine-tuning of pre-trained transformer networks such as BERT yield state-of-the-art results for text classification tasks. Typically, fine-tuning is performed on task-specific training datasets in a supervised manner. One can also fine-tune in unsupervised manner beforehand by further pre-training the masked language modeling (MLM) task. Hereby, in-domain data for unsupervised MLM resembling the actual classification target dataset allows for domain adaptation of the model. In this paper, we compare current pre-trained transformer networks with and without MLM fine-tuning on their performance for offensive language detection. Our MLM fine-tuned RoBERTa-based classifier officially ranks 1st in the SemEval 2020 Shared Task 12 for the English language. Further experiments with the ALBERT model even surpass this result."
2020.peoples-1.8,Social Media Unrest Prediction during the {COVID}-19 Pandemic: Neural Implicit Motive Pattern Recognition as Psychometric Signs of Severe Crises,2020,-1,-1,2,0,15737,dirk johannssen,"Proceedings of the Third Workshop on Computational Modeling of People's Opinions, Personality, and Emotion's in Social Media",0,"The COVID-19 pandemic has caused international social tension and unrest. Besides the crisis itself, there are growing signs of rising conflict potential of societies around the world. Indicators of global mood changes are hard to detect and direct questionnaires suffer from social desirability biases. However, so-called implicit methods can reveal humans intrinsic desires from e.g. social media texts. We present psychologically validated social unrest predictors and replicate scalable and automated predictions, setting a new state of the art on a recent German shared task dataset. We employ this model to investigate a change of language towards social unrest during the COVID-19 pandemic by comparing established psychological predictors on samples of tweets from spring 2019 with spring 2020. The results show a significant increase of the conflict indicating psychometrics. With this work, we demonstrate the applicability of automated NLP-based approaches to quantitative psychological research."
2020.pam-1.13,Generating Lexical Representations of Frames using Lexical Substitution,2020,-1,-1,4,1,11070,saba anwar,Proceedings of the Probability and Meaning Conference (PaM 2020),0,"Semantic frames are formal linguistic structures describing situations/actions/events, e.g. Commercial transfer of goods. Each frame provides a set of roles corresponding to the situation participants, e.g. Buyer and Goods, and lexical units (LUs) {--} words and phrases that can evoke this particular frame in texts, e.g. Sell. The scarcity of annotated resources hinders wider adoption of frame semantics across languages and domains. We investigate a simple yet effective method, lexical substitution with word representation models, to automatically expand a small set of frame-annotated sentences with new words for their respective roles and LUs. We evaluate the expansion quality using FrameNet. Contextualized models demonstrate overall superior performance compared to the non-contextualized ones on roles. However, the latter show comparable performance on the task of LU expansion."
2020.lrec-1.722,Automatic Compilation of Resources for Academic Writing and Evaluating with Informal Word Identification and Paraphrasing System,2020,38,0,4,1,282,seid yimam,Proceedings of the 12th Language Resources and Evaluation Conference,0,"We present the first approach to automatically building resources for academic writing. The aim is to build a writing aid system that automatically edits a text so that it better adheres to the academic style of writing. On top of existing academic resources, such as the Corpus of Contemporary American English (COCA) academic Word List, the New Academic Word List, and the Academic Collocation List, we also explore how to dynamically build such resources that would be used to automatically identify informal or non-academic words or phrases. The resources are compiled using different generic approaches that can be extended for different domains and languages. We describe the evaluation of resources with a system implementation. The system consists of an informal word identification (IWI), academic candidate paraphrase generation, and paraphrase ranking components. To generate candidates and rank them in context, we have used the PPDB and WordNet paraphrase resources. We use the Concepts in Context (CoInCO) {``}All-Words{''} lexical substitution dataset both for the informal word identification and paraphrase generation experiments. Our informal word identification component achieves an F-1 score of 82{\%}, significantly outperforming a stratified classifier baseline. The main contribution of this work is a domain-independent methodology to build targeted resources for writing aids."
2020.lrec-1.728,Word Sense Disambiguation for 158 Languages using Word Embeddings Only,2020,37,0,8,0,1966,varvara logacheva,Proceedings of the 12th Language Resources and Evaluation Conference,0,"Disambiguation of word senses in context is easy for humans, but is a major challenge for automatic approaches. Sophisticated supervised and knowledge-based models were developed to solve this task. However, (i) the inherent Zipfian distribution of supervised training instances for a given word and/or (ii) the quality of linguistic knowledge representations motivate the development of completely unsupervised and knowledge-free approaches to word sense disambiguation (WSD). They are particularly useful for under-resourced languages which do not have any resources for building either supervised and/or knowledge-based models. In this paper, we present a method that takes as input a standard pre-trained word embedding model and induces a fully-fledged word sense inventory, which can be used for disambiguation in context. We use this method to induce a collection of sense inventories for 158 languages on the basis of the original pre-trained fastText word embeddings by Grave et al., (2018), enabling WSD in these languages. Models and system are available online."
2020.coling-main.91,Exploring {A}mharic Sentiment Analysis from Social Media Texts: Building Annotation Tools and Classification Models,2020,-1,-1,4,1,282,seid yimam,Proceedings of the 28th International Conference on Computational Linguistics,0,"This paper presents the study of sentiment analysis for Amharic social media texts. As the number of social media users is ever-increasing, social media platforms would like to understand the latent meaning and sentiments of a text to enhance decision-making procedures. However, low-resource languages such as Amharic have received less attention due to several reasons such as lack of well-annotated datasets, unavailability of computing resources, and fewer or no expert researchers in the area. This research addresses three main research questions. We first explore the suitability of existing tools for the sentiment analysis task. Annotation tools are scarce to support large-scale annotation tasks in Amharic. Also, the existing crowdsourcing platforms do not support Amharic text annotation. Hence, we build a social-network-friendly annotation tool called {`}ASAB{'} using the Telegram bot. We collect 9.4k tweets, where each tweet is annotated by three Telegram users. Moreover, we explore the suitability of machine learning approaches for Amharic sentiment analysis. The FLAIR deep learning text classifier, based on network embeddings that are computed from a distributional thesaurus, outperforms other supervised classifiers. We further investigate the challenges in building a sentiment analysis system for Amharic and we found that the widespread usage of sarcasm and figurative speech are the main issues in dealing with the problem. To advance the sentiment analysis research in Amharic and other related low-resource languages, we release the dataset, the annotation tool, source code, and models publicly under a permissive."
2020.cogalex-1.1,Individual corpora predict fast memory retrieval during reading,2020,-1,-1,5,0,21783,markus hofmann,Proceedings of the Workshop on the Cognitive Aspects of the Lexicon,0,"The corpus, from which a predictive language model is trained, can be considered the experience of a semantic system. We recorded everyday reading of two participants for two months on a tablet, generating individual corpus samples of 300/500K tokens. Then we trained word2vec models from individual corpora and a 70 million-sentence newspaper corpus to obtain individual and norm-based long-term memory structure. To test whether individual corpora can make better predictions for a cognitive task of long-term memory retrieval, we generated stimulus materials consisting of 134 sentences with uncorrelated individual and norm-based word probabilities. For the subsequent eye tracking study 1-2 months later, our regression analyses revealed that individual, but not norm-corpus-based word probabilities can account for first-fixation duration and first-pass gaze duration. Word length additionally affected gaze duration and total viewing duration. The results suggest that corpora representative for an individual{'}s long-term memory structure can better explain reading performance than a norm corpus, and that recently acquired information is lexically accessed rapidly."
2020.acl-main.268,Estimating the influence of auxiliary tasks for multi-task learning of sequence tagging tasks,2020,-1,-1,2,1,5567,fynn schroder,Proceedings of the 58th Annual Meeting of the Association for Computational Linguistics,1,"Multi-task learning (MTL) and transfer learning (TL) are techniques to overcome the issue of data scarcity when training state-of-the-art neural networks. However, finding beneficial auxiliary datasets for MTL or TL is a time- and resource-consuming trial-and-error approach. We propose new methods to automatically assess the similarity of sequence tagging datasets to identify beneficial auxiliary data for MTL or TL setups. Our methods can compute the similarity between any two sequence tagging datasets, they do not need to be annotated with the same tagset or multiple labels in parallel. Additionally, our methods take tokens and their labels into account, which is more robust than only using either of them as an information source, as conducted in prior work. We empirically show that our similarity measures correlate with the change in test score of neural networks that use the auxiliary dataset for MTL to increase the main task performance. We provide an efficient, open-source implementation."
W19-4516,Categorizing Comparative Sentences,2019,0,0,5,1,1663,alexander panchenko,Proceedings of the 6th Workshop on Argument Mining,0,"We tackle the tasks of automatically identifying comparative sentences and categorizing the intended preference (e.g., {``}Python has better NLP libraries than MATLAB{''} → Python, better, MATLAB). To this end, we manually annotate 7,199 sentences for 217 distinct target item pairs from several domains (27{\%} of the sentences contain an oriented comparison in the sense of {``}better{''} or {``}worse{''}). A gradient boosting model based on pre-trained sentence embeddings reaches an F1 score of 85{\%} in our experimental evaluation. The model can be used to extract comparative sentences for pro/con argumentation in comparative / argument search engines or debating technologies."
W19-3014,Reviving a psychometric measure: Classification and prediction of the Operant Motive Test,2019,-1,-1,2,0,15737,dirk johannssen,Proceedings of the Sixth Workshop on Computational Linguistics and Clinical Psychology,0,"Implicit motives allow for the characterization of behavior, subsequent success and long-term development. While this has been operationalized in the operant motive test, research on motives has declined mainly due to labor-intensive and costly human annotation. In this study, we analyze over 200,000 labeled data items from 40,000 participants and utilize them for engineering features for training a logistic model tree machine learning model. It captures manually assigned motives well with an F-score of 80{\%}, coming close to the pairwise annotator intraclass correlation coefficient of r = .85. In addition, we found a significant correlation of r = .2 between subsequent academic success and data automatically labeled with our model in an extrinsic evaluation."
