alonso-etal-2004-multiple,Multiple Sequence Alignment for Characterizing the Lineal Structure of Revision,2004,4,4,5,0,51732,laura alonso,Proceedings of the Fourth International Conference on Language Resources and Evaluation ({LREC}{'}04),0,"We present a first approach to the application of a data mining technique, Multiple Sequence Alignment, to the systematization of a polemic aspect of discourse, namely, the expression of contrast, concession, counterargument and semantically similar discursive relations. The representation of the phenomena under study is carried out by very simple techniques, mostly pattern-matching, but the results allow to drive insightful conclusions on the organization of this aspect of discourse: equivalence classes of discourse markers are established, and systematic patterns are discovered, which will be applied in enhancing a discursive parser."
W03-1504,Low-cost Named Entity Classification for {C}atalan: Exploiting Multilingual Resources and Unlabeled Data,2003,8,4,4,1,25372,lluis marquez,Proceedings of the {ACL} 2003 Workshop on Multilingual and Mixed-language Named Entity Recognition,0,"This work studies Named Entity Classification (NEC) for Catalan without making use of large annotated resources of this language. Two views are explored and compared, namely exploiting solely the Catalan resources, and a direct training of bilingual classification models (Spanish and Catalan), given that a large collection of annotated examples is available for Spanish. The empirical results obtained on real data point out that multilingual models clearly outperform monolingual ones, and that the resulting Catalan NEC models are easier to improve by bootstrapping on unlabelled data."
W03-0421,A Simple Named Entity Extractor using {A}da{B}oost,2003,5,63,3,1,7024,xavier carreras,Proceedings of the Seventh Conference on Natural Language Learning at {HLT}-{NAACL} 2003,0,"This paper presents a Named Entity Extraction (NEE) system for the CoNLL-2003 shared task competition. As in the past year edition (Carreras et al., 2002a), we have approached the task by treating the two main subxe2x80x93tasks of the problem, recognition (NER) and classification (NEC), sequentially and independently with separate modules. Both modules are machine learning based systems, which make use of binary and multiclass AdaBoost classifiers. Named Entity recognition is performed as a greedy sequence tagging procedure under the wellxe2x80x93known BIO labelling scheme. This tagging process makes use of three binary classifiers trained to be experts on the recognition of B, I, and O labels, respectively. Named Entity classification is viewed as a 4xe2x80x93class classification problem (with LOC, PER, ORG, and MISC class labels), which is straightforwardly addressed by the use of a multiclass learning algorithm. The system presented here consists of a replication, with some minor changes, of the system that obtained the best results in the CoNLL-2002 NEE task. Therefore, it can be considered as a benchmark of the statexe2x80x93ofxe2x80x93thexe2x80x93 art technology for the current edition, and will allow also to make comparisons about the training corpora of both editions."
W03-0422,Learning a Perceptron-Based Named Entity Chunker via Online Recognition Feedback,2003,5,21,3,1,7024,xavier carreras,Proceedings of the Seventh Conference on Natural Language Learning at {HLT}-{NAACL} 2003,0,"We present a novel approach for the problem of Named Entity Recognition and Classification (NERC), in the context of the CoNLL-2003 Shared Task."
E03-1038,Named Entity Recognition For {C}atalan Using Only {S}panish Resources and Unlabelled Data,2003,0,3,3,1,7024,xavier carreras,10th Conference of the {E}uropean Chapter of the Association for Computational Linguistics,0,None
W02-2004,Named Entity Extraction using {A}da{B}oost,2002,4,146,3,1,7024,xavier carreras,{COLING}-02: The 6th Conference on Natural Language Learning 2002 ({C}o{NLL}-2002),0,"This paper presents a Named Entity Extraction (NEE) system for the CoNLL 2002 competition. The two main sub-tasks of the problem, recognition (NER) and classification (NEC), are performed sequentially and independently with separate modules. Both modules are machine learning based systems, which make use of binary AdaBoost classifiers."
carreras-padro-2002-flexible,A Flexible Distributed Architecture for Natural Language Analyzers,2002,4,24,2,1,7024,xavier carreras,Proceedings of the Third International Conference on Language Resources and Evaluation ({LREC}{'}02),0,"Many modern NLP applications require basic language processors such as POS taggers, parsers, etc. All these tools are usually preexisting, and must be adapted to fit in the requirements of the application to be developed. This adaptation procedure is usually time consuming and increases the application development cost. Our proposal to minimize this effort is to use standard engineering solutions for software reusability. In that sense, we converted all our language processors to classes which may be instantiated and accessed from any application via a CORBA broker. Reusability is not the only advantatge, since the distributed CORBA approach also makes it possible to access the analyzers from any remote application, developed in any language, and running on any operating system."
W01-1013,Multilingual Authoring: the {NAMIC} Approach,2001,11,7,8,0,12620,roberto basili,Proceedings of the {ACL} 2001 Workshop on Human Language Technology and Knowledge Management,0,"With increasing amounts of electronic information available, and the increase in the variety of languages used to produce documents of the same type, the problem of how to manage similar documents in different languages arises. This paper proposes an approach to processing/structuring text so that Multilingual Authoring (creating hypertext links) can be effectively carried out. This work, funded by the European Union, is applied to the Multilingual Authoring of news agency text. We have applied methods from Natural Language Processing, especially Information Extraction technology, to both monolingual and Multilingual Authoring."
P98-2164,On the Evaluation and Comparison of Taggers: the Effect of Noise in Testing Corpora,1998,4,18,1,1,26974,lluis padro,"36th Annual Meeting of the Association for Computational Linguistics and 17th International Conference on Computational Linguistics, Volume 2",0,"This paper addresses the issue of POS tagger evaluation. Such evaluation is usually performed by comparing the tagger output with a reference test corpus, which is assumed to be error-free. Currently used corpora contain noise which causes the obtained performance to be a distortion of the real value. We analyze to what extent this distortion may invalidate the comparison between taggers or the measure of the improvement given by a new system. The main conclusion is that a more rigorous testing experimentation setting/designing is needed to reliably evaluate and compare tagger accuracies."
C98-2159,On the Evaluation and Comparison of Taggers: the Effect of Noise in Testing Corpora.,1998,4,18,1,1,26974,lluis padro,{COLING} 1998 Volume 2: The 17th International Conference on Computational Linguistics,0,"This paper addresses the issue of POS tagger evaluation. Such evaluation is usually performed by comparing the tagger output with a reference test corpus, which is assumed to be error-free. Currently used corpora contain noise which causes the obtained performance to be a distortion of the real value. We analyze to what extent this distortion may invalidate the comparison between taggers or the measure of the improvement given by a new system. The main conclusion is that a more rigorous testing experimentation setting/designing is needed to reliably evaluate and compare tagger accuracies."
P97-1031,A Flexible {POS} Tagger Using an Automatically Acquired Language Model,1997,25,21,2,0.670048,25372,lluis marquez,35th Annual Meeting of the Association for Computational Linguistics and 8th Conference of the {E}uropean Chapter of the Association for Computational Linguistics,1,"We present an algorithm that automatically learns context constraints using statistical decision trees. We then use the acquired constraints in a flexible POS tagger. The tagger is able to use information of any degree: n-grams, automatically learned context constraints, linguistically motivated manually written constraints, etc. The sources and kinds of constraints are unrestricted, and the language model can be easily extended, improving the results. The tagger has been tested and evaluated on the WSJ corpus."
A97-1013,Developing a hybrid {NP} parser,1997,15,13,2,0,28693,atro voutilainen,Fifth Conference on Applied Natural Language Processing,0,"We describe the use of energy function optimisation in very shallow syntactic parsing. The approach can use linguistic rules and corpus-based statistics, so the strengths of both linguistic and statistical approaches to NLP can be combined in a single framework. The rules are contextual constraints for resolving syntactic ambiguities expressed as alternative tags, and the statistical language model consists of corpus-based n-grams of syntactic tags. The success of the hybrid syntactic disambiguator is evaluated against a held-out benchmark corpus. Also the contributions of the linguistic and statistical language models to the hybrid model are estimated."
C96-2148,{POS} Tagging Using Relaxation Labelling,1996,7,18,1,1,26974,lluis padro,{COLING} 1996 Volume 2: The 16th International Conference on Computational Linguistics,0,"Relaxation labelling is an optimization technique used in many fields to solve contraint satisfcation problems. The algorithm finds a combination of values for a set of variables such that satisfies -to the maximum possible degree- a set of given constraints. This paper describes some experiments performed applying it to POS tagging, and the results obtained. It also ponders the possibility of applying it to Word Sense Disambiguation."
