P11-2100,Semi-supervised latent variable models for sentence-level sentiment analysis,2011,22,53,2,1,31725,oscar tackstrom,Proceedings of the 49th Annual Meeting of the Association for Computational Linguistics: Human Language Technologies,0,"We derive two variants of a semi-supervised model for fine-grained sentiment analysis. Both models leverage abundant natural supervision in the form of review ratings, as well as a small amount of manually crafted sentence labels, to learn sentence-level sentiment classifiers. The proposed model is a fusion of a fully supervised structured conditional model and its partially supervised counterpart. This allows for highly efficient estimation and inference algorithms with rich feature definitions. We describe the two variants as well as their component models and verify experimentally that both variants give significantly improved results for sentence-level sentiment analysis compared to all baselines."
J11-1007,Analyzing and Integrating Dependency Parsers,2011,65,71,1,1,10634,ryan mcdonald,Computational Linguistics,0,"There has been a rapid increase in the volume of research on data-driven dependency parsers in the past five years. This increase has been driven by the availability of treebanks in a wide variety of languages-due in large part to the CoNLL shared tasks-as well as the straightforward mechanisms by which dependency theories of syntax can encode complex phenomena in free word order languages. In this article, our aim is to take a step back and analyze the progress that has been made through an analysis of the two predominant paradigms for data-driven dependency parsing, which are often called graph-based and transition-based dependency parsing. Our analysis covers both theoretical and empirical aspects and sheds light on the kinds of errors each type of parser makes and how they relate to theoretical expectations. Using these observations, we present an integrated system based on a stacking learning framework and show that such a system can learn to overcome the shortcomings of each non-integrated system."
D11-1006,Multi-Source Transfer of Delexicalized Dependency Parsers,2011,77,176,1,1,10634,ryan mcdonald,Proceedings of the 2011 Conference on Empirical Methods in Natural Language Processing,0,"We present a simple method for transferring dependency parsers from source languages with labeled training data to target languages without labeled training data. We first demonstrate that delexicalized parsers can be directly transferred between languages, producing significantly higher accuracies than unsupervised parsers. We then use a constraint driven learning algorithm where constraints are drawn from parallel corpora to project the final parser. Unlike previous work on projecting syntactic resources, we show that simple methods for introducing multiple source languages can significantly improve the overall quality of the resulting parsers. The projected parsers from our system result in state-of-the-art performance when compared to previously studied unsupervised and projected parsing systems across eight different languages."
D11-1017,Training a Parser for Machine Translation Reordering,2011,40,46,3,0,44211,jason katzbrown,Proceedings of the 2011 Conference on Empirical Methods in Natural Language Processing,0,"We propose a simple training regime that can improve the extrinsic performance of a parser, given only a corpus of sentences and a way to automatically evaluate the extrinsic quality of a candidate parse. We apply our method to train parsers that excel when used as part of a reordering component in a statistical machine translation system. We use a corpus of weakly-labeled reference reorderings to guide parser training. Our best parsers contribute significant improvements in subjective translation quality while their intrinsic attachment scores typically regress."
D11-1138,Training dependency parsers by jointly optimizing multiple objectives,2011,35,29,2,0.676893,2189,keith hall,Proceedings of the 2011 Conference on Empirical Methods in Natural Language Processing,0,"We present an online learning algorithm for training parsers which allows for the inclusion of multiple objective functions. The primary example is the extension of a standard supervised parsing objective function with additional loss-functions, either based on intrinsic parsing quality or task-specific extrinsic measures of quality. Our empirical results show how this approach performs for two dependency parsing algorithms (graph-based and transition-based parsing) and how it achieves increased performance on multiple target tasks including reordering for machine translation and parser adaptation."
W10-3110,What's great and what's not: learning to classify the scope of negation for improved sentiment analysis,2010,15,117,2,0,45285,isaac councill,Proceedings of the Workshop on Negation and Speculation in Natural Language Processing,0,"Automatic detection of linguistic negation in free text is a critical need for many text processing applications, including sentiment analysis. This paper presents a negation detection system based on a conditional random field modeled using features from an English dependency parser. The scope of negation detection is limited to explicit rather than implied negations within single sentences. A new negation corpus is presented that was constructed for the domain of English product reviews obtained from the open web, and the proposed negation extraction system is evaluated against the reviews corpus as well as the standard BioScope negation corpus, achieving 80.0% and 75.5% F1 scores, respectively. The impact of accurate negation detection on a state-of-the-art sentiment analysis system is also reported."
N10-1069,Distributed Training Strategies for the Structured Perceptron,2010,27,218,1,1,10634,ryan mcdonald,Human Language Technologies: The 2010 Annual Conference of the North {A}merican Chapter of the Association for Computational Linguistics,0,"Perceptron training is widely applied in the natural language processing community for learning complex structured models. Like all structured prediction learning frameworks, the structured perceptron can be costly to train as training complexity is proportional to inference, which is frequently non-linear in example sequence length. In this paper we investigate distributed training strategies for the structured perceptron as a means to reduce training times when computing clusters are available. We look at two strategies and provide convergence bounds for a particular mode of distributed structured perceptron training based on iterative parameter mixing (or averaging). We present experiments on two structured prediction problems -- named-entity recognition and dependency parsing -- to highlight the efficiency of this method."
N10-1119,The viability of web-derived polarity lexicons,2010,25,156,4,0,45286,leonid velikovich,Human Language Technologies: The 2010 Annual Conference of the North {A}merican Chapter of the Association for Computational Linguistics,0,"We examine the viability of building large polarity lexicons semi-automatically from the web. We begin by describing a graph propagation framework inspired by previous work on constructing polarity lexicons from lexical graphs (Kim and Hovy, 2004; Hu and Liu, 2004; Esuli and Sabastiani, 2009; Blair-Goldensohn et al., 2008; Rao and Ravichandran, 2009). We then apply this technique to build an English lexicon that is significantly larger than those previously studied. Crucially, this web-derived lexicon does not require WordNet, part-of-speech taggers, or other language-dependent resources typical of sentiment analysis systems. As a result, the lexicon is not limited to specific word classes -- e.g., adjectives that occur in WordNet -- and in fact contains slang, misspellings, multiword expressions, etc. We evaluate a lexicon derived from English documents, both qualitatively and quantitatively, and show that it provides superior performance to previously studied lexicons, including one derived from WordNet."
C10-1094,Evaluation of Dependency Parsers on Unbounded Dependencies,2010,29,51,3,0,10682,joakim nivre,Proceedings of the 23rd International Conference on Computational Linguistics (Coling 2010),0,"We evaluate two dependency parsers, MSTParser and MaltParser, with respect to their capacity to recover unbounded dependencies in English, a type of evaluation that has been applied to grammar-based parsers and statistical phrase structure parsers but not to dependency parsers. The evaluation shows that when combined with simple post-processing heuristics, the parsers correctly recall unbounded dependencies roughly 50% of the time, which is only slightly worse than two grammar-based parsers specifically designed to cope with such dependencies."
N09-2029,Contrastive Summarization: An Experiment with Consumer Reviews,2009,7,49,2,0,47313,kevin lerman,"Proceedings of Human Language Technologies: The 2009 Annual Conference of the North {A}merican Chapter of the Association for Computational Linguistics, Companion Volume: Short Papers",0,Contrastive summarization is the problem of jointly generating summaries for two entities in order to highlight their differences. In this paper we present an investigation into contrastive summarization through an implementation and evaluation of a contrastive opinion summarizer in the consumer reviews domain.
E09-1059,Sentiment Summarization: Evaluating and Learning User Preferences,2009,25,95,3,0,47313,kevin lerman,Proceedings of the 12th Conference of the {E}uropean Chapter of the {ACL} ({EACL} 2009),0,"We present the results of a large-scale, end-to-end human evaluation of various sentiment summarization models. The evaluation shows that users have a strong preference for summarizers that model sentiment over non-sentiment baselines, but have no broad overall preference between any of the sentiment-based models. However, an analysis of the human judgments suggests that there are identifiable situations where one summarizer is generally preferred over the others. We exploit this fact to build a new summarizer by training a ranking SVM model over the set of human preference judgments that were collected during the evaluation, which results in a 30% relative reduction in error over the previous best summarizer."
P08-1036,A Joint Model of Text and Aspect Ratings for Sentiment Summarization,2008,22,485,2,0,3315,ivan titov,Proceedings of ACL-08: HLT,1,"Online reviews are often accompanied with numerical ratings provided by users for a set of service or product aspects. We propose a statistical model which is able to discover corresponding topics in text and extract textual evidence from reviews supporting each of these aspect ratings xe2x80x90 a fundamental problem in aspect-based sentiment summarization (Hu and Liu, 2004a). Our model achieves high accuracy, without any explicitly labeled data except the user provided opinion ratings. The proposed approach is general and can be used for segmentation in other applications where sequential data is accompanied with correlated signals."
P08-1108,Integrating Graph-Based and Transition-Based Dependency Parsers,2008,32,197,2,0.0963379,10682,joakim nivre,Proceedings of ACL-08: HLT,1,"Previous studies of data-driven dependency parsing have shown that the distribution of parsing errors are correlated with theoretical properties of the models used for learning and inference. In this paper, we show how these results can be exploited to improve parsing accuracy by integrating a graph-based and a transition-based model. By letting one model generate features for the other, we consistently improve accuracy for both models, resulting in a significant improvement of the state of the art when evaluated on data sets from the CoNLL-X shared task."
W07-2216,On the Complexity of Non-Projective Data-Driven Dependency Parsing,2007,36,83,1,1,10634,ryan mcdonald,Proceedings of the Tenth International Conference on Parsing Technologies,0,"In this paper we investigate several non-projective parsing algorithms for dependency parsing, providing novel polynomial time solutions under the assumption that each dependency decision is independent of all the others, called here the edge-factored model. We also investigate algorithms for non-projective parsing that account for nonlocal information, and present several hardness results. This suggests that it is unlikely that exact non-projective dependency parsing is tractable for any model richer than the edge-factored model."
P07-1055,Structured Models for Fine-to-Coarse Sentiment Analysis,2007,23,224,1,1,10634,ryan mcdonald,Proceedings of the 45th Annual Meeting of the Association of Computational Linguistics,1,In this paper we investigate a structured model for jointly classifying the sentiment of text at varying levels of granularity. Inference in the model is based on standard sequence classification techniques using constrained Viterbi to ensure consistent solutions. The primary advantage of such a model is that it allows classification decisions from one level in the text to influence decisions at another. Experiments show that this method can significantly reduce classification error relative to models trained in isolation.
D07-1013,Characterizing the Errors of Data-Driven Dependency Parsing Models,2007,14,232,1,1,10634,ryan mcdonald,Proceedings of the 2007 Joint Conference on Empirical Methods in Natural Language Processing and Computational Natural Language Learning ({EMNLP}-{C}o{NLL}),0,"We present a comparative error analysis of the two dominant approaches in datadriven dependency parsing: global, exhaustive, graph-based models, and local, greedy, transition-based models. We show that, in spite of similar performance overall, the two models produce different types of errors, in a way that can be explained by theoretical properties of the two models. This analysis leads to new directions for parser development."
D07-1096,The {C}o{NLL} 2007 Shared Task on Dependency Parsing,2007,51,513,4,0.0963379,10682,joakim nivre,Proceedings of the 2007 Joint Conference on Empirical Methods in Natural Language Processing and Computational Natural Language Learning ({EMNLP}-{C}o{NLL}),0,"The Conference on Computational Natural Language Learning features a shared task, in which participants train and test their learning systems on the same data sets. In 2007, as in 2006, the shared task has been devoted to dependency parsing, this year with both a multilingual track and a domain adaptation track. In thispaper, we definethe tasksof the different tracks and describe how the data sets were created from existing treebanks for ten languages. In addition, we characterize the different approaches of the participating systems, report the test results, and provide a first analysis of these results."
W06-2932,Multilingual Dependency Analysis with a Two-Stage Discriminative Parser,2006,20,202,1,1,10634,ryan mcdonald,Proceedings of the Tenth Conference on Computational Natural Language Learning ({C}o{NLL}-X),0,"We present a two-stage multilingual dependency parser and evaluate it on 13 diverse languages. The first stage is based on the unlabeled dependency parsing models described by McDonald and Pereira (2006) augmented with morphological features for a subset of the languages. The second stage takes the output from the first and labels all the edges in the dependency graph with appropriate syntactic categories using a globally trained sequence classifier over components of the graph. We report results on the CoNLL-X shared task (Buchholz et al., 2006) data sets and present an error analysis."
W06-1615,Domain Adaptation with Structural Correspondence Learning,2006,25,1026,2,0,35606,john blitzer,Proceedings of the 2006 Conference on Empirical Methods in Natural Language Processing,0,"Discriminative learning methods are widely used in natural language processing. These methods work best when their training and test data are drawn from the same distribution. For many NLP tasks, however, we are confronted with new domains in which labeled data is scarce or non-existent. In such cases, we seek to adapt existing models from a resource-rich source domain to a resource-poor target domain. We introduce structural correspondence learning to automatically induce correspondences among features from different domains. We test our technique on part of speech tagging and show performance gains for varying amounts of source and target training data, as well as improvements in target domain parsing accuracy using our improved tagger."
E06-1011,Online Learning of Approximate Dependency Parsing Algorithms,2006,19,418,1,1,10634,ryan mcdonald,11th Conference of the {E}uropean Chapter of the Association for Computational Linguistics,0,"In this paper we extend the maximum spanning tree (MST) dependency parsing framework of McDonald et al. (2005c) to incorporate higher-order feature representations and allow dependency structures with multiple parents per word. We show that those extensions can make the MST framework computationally intractable, but that the intractability can be circumvented with new approximate parsing algorithms. We conclude with experiments showing that discriminative online learning using those approximate algorithms achieves the best reported parsing accuracy for Czech and Danish."
E06-1038,Discriminative Sentence Compression with Soft Syntactic Evidence,2006,9,143,1,1,10634,ryan mcdonald,11th Conference of the {E}uropean Chapter of the Association for Computational Linguistics,0,"We present a model for sentence compression that uses a discriminative largemargin learning framework coupled with a novel feature set defined on compressed bigrams as well as deep syntactic representations provided by auxiliary dependency and phrase-structure parsers. The parsers are trained out-of-domain and contain a significant amount of noise. We argue that the discriminative nature of the learning algorithm allows the model to learn weights relative to any noise in the feature set to optimize compression accuracy directly. This differs from current state-of-the-art models (Knight and Marcu, 2000) that treat noisy parse trees, for both compressed and uncompressed sentences, as gold standard when calculating model parameters."
P05-1012,Online Large-Margin Training of Dependency Parsers,2005,29,698,1,1,10634,ryan mcdonald,Proceedings of the 43rd Annual Meeting of the Association for Computational Linguistics ({ACL}{'}05),1,"We present an effective training algorithm for linearly-scored dependency parsers that implements online large-margin multi-class training (Crammer and Singer, 2003; Crammer et al., 2003) on top of efficient parsing techniques for dependency trees (Eisner, 1996). The trained parsers achieve a competitive dependency accuracy for both English and Czech with no language specific enhancements."
P05-1061,Simple Algorithms for Complex Relation Extraction with Applications to Biomedical {IE},2005,16,78,1,1,10634,ryan mcdonald,Proceedings of the 43rd Annual Meeting of the Association for Computational Linguistics ({ACL}{'}05),1,"A complex relation is any n-ary relation in which some of the arguments may be be unspecified. We present here a simple two-stage method for extracting complex relations between named entities in text. The first stage creates a graph from pairs of entities that are likely to be related, and the second stage scores maximal cliques in that graph as potential complex relation instances. We evaluate the new method against a standard baseline for extracting genomic variation relations from biomedical text."
H05-1066,Non-Projective Dependency Parsing using Spanning Tree Algorithms,2005,21,705,1,1,10634,ryan mcdonald,Proceedings of Human Language Technology Conference and Conference on Empirical Methods in Natural Language Processing,0,"We formalize weighted dependency parsing as searching for maximum spanning trees (MSTs) in directed graphs. Using this representation, the parsing algorithm of Eisner (1996) is sufficient for searching over all projective trees in O(n3) time. More surprisingly, the representation is extended naturally to non-projective parsing using Chu-Liu-Edmonds (Chu and Liu, 1965; Edmonds, 1967) MST algorithm, yielding an O(n2) parsing algorithm. We evaluate these methods on the Prague Dependency Treebank using online large-margin learning techniques (Crammer et al., 2003; McDonald et al., 2005) and show that MST parsing increases efficiency and accuracy for languages with non-projective dependencies."
H05-1124,Flexible Text Segmentation with Structured Multilabel Classification,2005,19,75,1,1,10634,ryan mcdonald,Proceedings of Human Language Technology Conference and Conference on Empirical Methods in Natural Language Processing,0,"Many language processing tasks can be reduced to breaking the text into segments with prescribed properties. Such tasks include sentence splitting, tokenization, named-entity extraction, and chunking. We present a new model of text segmentation based on ideas from multilabel classification. Using this model, we can naturally represent segmentation problems involving overlapping and non-contiguous segments. We evaluate the model on entity extraction and noun-phrase chunking and show that it is more accurate for overlapping and non-contiguous segments, but it still performs well on simpler data sets for which sequential tagging has been the best method."
W04-3111,Integrated Annotation for Biomedical Information Extraction,2004,19,156,5,0,23568,seth kulick,"{HLT}-{NAACL} 2004 Workshop: Linking Biological Literature, Ontologies and Databases",0,"We describe an approach to two areas of biomedical information extraction, drug development and cancer genomics. We have developed a framework which includes corpus annotation integrated at multiple levels: a Treebank containing syntactic structure, a Propbank containing predicate-argument structure, and annotation of entities and relations among the entities. Crucial to this approach is the proper characterization of entities as relation components, which allows the integration of the entity annotation with the syntactic structure while retaining the capacity to annotate and extract more complex events. We are training statistical taggers using this annotation for such extraction as well as using them for improving the annotation process."
