W14-3339,Referential Translation Machines for Predicting Translation Quality,2014,35,16,2,1,13953,ergun biccici,Proceedings of the Ninth Workshop on Statistical Machine Translation,0,"We use referential translation machines (RTM) for quality estimation of translation outputs. RTMs are a computational model for identifying the translation acts between any two data sets with respect to interpretants selected in the same domain, which are effective when making monolingual and bilingual similarity judgments. RTMs achieve top performance in automatic, accurate, and language independent prediction of sentence-level and word-level statistical machine translation (SMT) quality. RTMs remove the need to access any SMT system specific information or prior knowledge of the training data or models used when generating the translations and achieve the top performance in WMT13 quality estimation task (QET13). We improve our RTM models with the Parallel FDA5 instance selection model, with additional features for predicting the translation performance, and with improved learning models. We develop RTM models for each WMT14 QET (QET14) subtask, obtain improvements over QET13 results, and rank 1st in all of the tasks and subtasks of QET14."
S14-2085,{RTM}-{DCU}: Referential Translation Machines for Semantic Similarity,2014,32,12,2,1,13953,ergun biccici,Proceedings of the 8th International Workshop on Semantic Evaluation ({S}em{E}val 2014),0,"We use referential translation machines (RTMs) for predicting the semantic similarity of text. RTMs are a computational model for identifying the translation acts between any two data sets with respect to interpretants selected in the same domain, which are effective when making monolingual and bilingual similarity judgments. RTMs judge the quality or the semantic similarity of text by using retrieved relevant training data as interpretants for reaching shared semantics. We derive features measuring the closeness of the test sentences to the training data via interpretants, the difficulty of translating them, and the presence of the acts of translation, which may ubiquitously be observed in communication. RTMs provide a language independent approach to all similarity tasks and achieve top performance when predicting monolingual cross-level semantic similarity (Task 3) and good results in semantic relatedness and entailment (Task 1) and multilingual semantic textual similarity (STS) (Task 10). RTMs remove the need to access any task or domain specific information or resource."
2014.tc-1.23,Is machine translation ready for literature,2014,-1,-1,2,0.430223,9426,antonio toral,Proceedings of Translating and the Computer 36,0,None
2014.eamt-1.34,Standard language variety conversion for content localisation via {SMT},2014,-1,-1,2,0,9655,federico fancellu,Proceedings of the 17th Annual conference of the European Association for Machine Translation,0,None
2014.eamt-1.45,Extrinsic evaluation of web-crawlers in machine translation: a study on {C}roatian-{E}nglish for the tourism domain,2014,-1,-1,5,0.430223,9426,antonio toral,Proceedings of the 17th Annual conference of the European Association for Machine Translation,0,None
2014.amta-wptp.5,Perception vs. reality: measuring machine translation post-editing productivity,2014,-1,-1,5,0.752788,4999,federico gaspari,Proceedings of the 11th Conference of the Association for Machine Translation in the Americas,0,"This paper presents a study of user-perceived vs real machine translation (MT) post-editing effort and productivity gains, focusing on two bidirectional language pairs: English{---}German and English{---}Dutch. Twenty experienced media professionals post-edited statistical MT output and also manually translated comparative texts within a production environment. The paper compares the actual post-editing time against the users{'} perception of the effort and time required to post-edit the MT output to achieve publishable quality, thus measuring real (vs perceived) productivity gains. Although for all the language pairs users perceived MT post-editing to be slower, in fact it proved to be a faster option than manual translation for two translation directions out of four, i.e. for Dutch to English, and (marginally) for English to German. For further objective scrutiny, the paper also checks the correlation of three state-of-the-art automatic MT evaluation metrics (BLEU, METEOR and TER) with the actual post-editing time."
2014.amta-researchers.8,A probabilistic feature-based fill-up for {SMT},2014,-1,-1,3,0.603689,22733,jian zhang,Proceedings of the 11th Conference of the Association for Machine Translation in the Americas: MT Researchers Track,0,"In this paper, we describe an effective translation model combination approach based on the estimation of a probabilistic Support Vector Machine (SVM). We collect domain knowledge from both in-domain and general-domain corpora inspired by a commonly used data selection algorithm, which we then use as features for the SVM training. Drawing on previous work on binary-featured phrase table fill-up (Nakov, 2008; Bisazza et al., 2011), we substitute the binary feature in the original work with our probabilistic domain-likeness feature. Later, we design two experiments to evaluate the proposed probabilistic feature-based approach on the French-to-English language pair using data provided at WMT07, WMT13 and IWLST11 translation tasks. Our experiments demonstrate that translation performance can gain significant improvements of up to +0.36 and +0.82 BLEU scores by using our probabilistic feature-based translation model fill-up approach compared with the binary featured fill-up approach in both experiments."
2014.amta-researchers.19,A discriminative framework of integrating translation memory features into {SMT},2014,-1,-1,2,1,5774,liangyou li,Proceedings of the 11th Conference of the Association for Machine Translation in the Americas: MT Researchers Track,0,"Combining Translation Memory (TM) with Statistical Machine Translation (SMT) together has been demonstrated to be beneficial. In this paper, we present a discriminative framework which can integrate TM into SMT by incorporating TM-related feature functions. Experiments on English{--}Chinese and English{--}French tasks show that our system using TM feature functions only from the best fuzzy match performs significantly better than the baseline phrase- based system on both tasks, and our discriminative model achieves comparable results to those of an effective generative model which uses similar features. Furthermore, with the capacity of handling a large amount of features in the discriminative framework, we propose a method to efficiently use multiple fuzzy matches which brings more feature functions and further significantly improves our system."
2013.tc-1.12,Emerging use-cases for machine translation,2013,-1,-1,1,1,2631,andy way,Proceedings of Translating and the Computer 35,0,None
2013.mtsummit-user.3,{COACH}: Designing a new {CAT} tool with Translator Interaction,2013,-1,-1,3,0,41881,laura bota,Proceedings of Machine Translation Summit XIV: User track,0,None
W12-0106,"Combining {EBMT}, {SMT}, {TM} and {IR} Technologies for Quality and Scale",2012,-1,-1,3,1,6023,sandipan dandapat,Proceedings of the Joint Workshop on Exploiting Synergies between Information Retrieval and Machine Translation ({ESIRMT}) and Hybrid Approaches to Machine Translation ({H}y{T}ra),0,None
petukhova-etal-2012-sumat,{SUMAT}: Data Collection and Parallel Corpus Compilation for Machine Translation of Subtitles,2012,12,6,7,0,16746,volha petukhova,Proceedings of the Eighth International Conference on Language Resources and Evaluation ({LREC}'12),0,"Subtitling and audiovisual translation have been recognized as areas that could greatly benefit from the introduction of Statistical Machine Translation (SMT) followed by post-editing, in order to increase efficiency of subtitle production process. The FP7 European project SUMAT (An Online Service for SUbtitling by MAchine Translation: http://www.sumat-project.eu) aims to develop an online subtitle translation service for nine European languages, combined into 14 different language pairs, in order to semi-automate the subtitle translation processes of both freelance translators and subtitling companies on a large scale. In this paper we discuss the data collection and parallel corpus compilation for training SMT systems, which includes several procedures such as data partition, conversion, formatting, normalization and alignment. We discuss in detail each data pre-processing step using various approaches. Apart from the quantity (around 1 million subtitles per language pair), the SUMAT corpus has a number of very important characteristics. First of all, high quality both in terms of translation and in terms of high-precision alignment of parallel documents and their contents has been achieved. Secondly, the contents are provided in one consistent format and encoding. Finally, additional information such as type of content in terms of genres and domain is available."
C12-1010,Translation Quality-Based Supplementary Data Selection by Incremental Update of Translation Models,2012,27,8,4,1,41915,pratyush banerjee,Proceedings of {COLING} 2012,0,"Supplementary data selection from out-of-domain or related-domain data is a well established technique in domain adaptation of statistical machine translation. The selection criteria for such data are mostly based on measures of similarity with available in-domain data, but not directly in terms of translation quality. In this paper, we present a technique for selecting supplementary data to improve translation performance, directly in terms of translation quality, measured by automatic evaluation metric scores. Batches of data selected from out-of-domain corpora are incrementally added to an existing baseline system and evaluated in terms of translation quality on a development set. A batch is selected only if its inclusion improves translation quality. To assist the process, we present a novel translation model merging technique that allows rapid retraining of the translation models with incremental data. When incorporated into the xe2x80x98in-domainxe2x80x99 translation models, the final cumulatively selected datasets are found to provide statistically significant improvements for a number of different supplementary datasets. Furthermore, the translation model merging technique is found to perform on a par with state-of-the-art methods of phrase-table combination."
2012.eamt-1.2,From Subtitles to Parallel Corpora,2012,5,3,7,0,13955,mark fishel,Proceedings of the 16th Annual conference of the European Association for Machine Translation,0,We describe the preparation of parallel corpora based on professional quality subtitles in seven European language pairs. The main focus is the effect of the processing steps on the size and quality of the final corpora.
2012.eamt-1.41,Domain Adaptation in {SMT} of User-Generated Forum Content Guided by {OOV} Word Reduction: Normalization and/or Supplementary Data,2012,14,19,4,1,41915,pratyush banerjee,Proceedings of the 16th Annual conference of the European Association for Machine Translation,0,"This paper reports a set of domain adaptation techniques for improving Statistical Machine Translation (SMT) for usergenerated web forum content. We investigate both normalization and supplementary training data acquisition techniques, all guided by the aim of reducing the number of Out-Of-Vocabulary (OOV) items in the target language with respect to the training data. We classify OOVs into a set of types, and address each through dedicated normalization and/or supplementary training material selection-based approaches. We investigate the effect of these methods both in an additive as well as a contrastive scenario. Our findings show that (i) normalization and supplementary training material techniques can be complementary, (ii) for general forum data, fully automatic supplementary training data acquisition can perform as well or sometimes better than semi-automatic normalization (although tackling different types of OOVs) and (iii) for very noisy data, normalization really pays off."
2012.eamt-1.44,Extending {CCG}-based Syntactic Constraints in Hierarchical Phrase-Based {SMT},2012,14,6,3,1,43864,hala almaghout,Proceedings of the 16th Annual conference of the European Association for Machine Translation,0,"In this paper, we describe two approaches to extending syntactic constraints in the Hierarchical Phrase-Based (HPB) Statistical Machine Translation (SMT) model using Combinatory Categorial Grammar (CCG). These extensions target the limitations of previous syntax-augmented HPB SMT systems which limit the coverage of the syntactic constraints applied. We present experiments on Arabicxe2x80x90English and Chinesexe2x80x90English translation. Our experiments show that using extended CCG labels helps to increase nonterminal label coverage and achieve significant improvements over the baseline for Arabicxe2x80x90 English translation. In addition, combining extended CCG labels with CCGaugmented glue grammar helps to improve the performance of the Chinesexe2x80x90English translation over the baseline systems."
2012.amta-wptp.6,{S}mart{MATE}: An Online End-To-End {MT} Post-Editing Framework,2012,-1,-1,2,1,38356,sergio penkale,Workshop on Post-Editing Technology and Practice,0,"It is a well-known fact that the amount of content which is available to be translated and localized far outnumbers the current amount of translation resources. Automation in general and Machine Translation (MT) in particular are one of the key technologies which can help improve this situation. However, a tool that integrates all of the components needed for the localization process is still missing, and MT is still out of reach for most localisation professionals. In this paper we present an online translation environment which empowers users with MT by enabling engines to be created from their data, without a need for technical knowledge or special hardware requirements and at low cost. Documents in a variety of formats can then be post-edited after being processed with their Translation Memories, MT engines and glossaries. We give an overview of the tool and present a case study of a project for a large games company, showing the applicability of our tool."
2012.amta-papers.1,Hierarchical Phrase-Based {MT} for Phonetic Representation-Based Speech Translation,2012,-1,-1,5,1,42269,zeeshan ahmed,Proceedings of the 10th Conference of the Association for Machine Translation in the Americas: Research Papers,0,"The paper presents a novel technique for speech translation using hierarchical phrased-based statistical machine translation (HPB-SMT). The system is based on translation of speech from phone sequences as opposed to conventional approach of speech translation from word sequences. The technique facilitates speech translation by allowing a machine translation (MT) system to access to phonetic information. This enables the MT system to act as both a word recognition and a translation component. This results in better performance than conventional speech translation approaches by recovering from recognition error with help of a source language model, translation model and target language model. For this purpose, the MT translation models are adopted to work on source language phones using a grapheme-to-phoneme component. The source-side phonetic confusions are handled using a confusion network. The result on IWLST'10 English- Chinese translation task shows a significant improvement in translation quality. In this paper, results for HPB-SMT are compared with previously published results of phrase-based statistical machine translation (PB-SMT) system (Baseline). The HPB-SMT system outperforms PB-SMT in this regard."
2012.amta-monomt.2,Monolingual Data Optimisation for Bootstrapping {SMT} Engines,2012,-1,-1,2,1,7874,jie jiang,Workshop on Monolingual Machine Translation,0,"Content localisation via machine translation (MT) is a sine qua non, especially for international online business. While most applications utilise rule-based solutions due to the lack of suitable in-domain parallel corpora for statistical MT (SMT) training, in this paper we investigate the possibility of applying SMT where huge amounts of monolingual content only are available. We describe a case study where an analysis of a very large amount of monolingual online trading data from eBay is conducted by ALS with a view to reducing this corpus to the most representative sample in order to ensure the widest possible coverage of the total data set. Furthermore, minimal yet optimal sets of sentences/words/terms are selected for generation of initial translation units for future SMT system-building."
2012.amta-commercial.3,Taking Statistical Machine Translation to the Student Translator,2012,30,13,3,0,40954,stephen doherty,Proceedings of the 10th Conference of the Association for Machine Translation in the Americas: Commercial MT User Program,0,"Despite the growth of statistical machine translation (SMT) research and development in recent years, it remains somewhat out of reach for the translation community where programming expertise and knowledge of statistics tend not to be commonplace. While the concept of SMT is relatively straightforward, its implementation in functioning systems remains difficult for most, regardless of expertise. More recently, however, developments such as SmartMATE have emerged which aim to assist users in creating their own customized SMT systems and thus reduce the learning curve associated with SMT. In addition to commercial uses, translator training stands to benefit from such increased levels of inclusion and access to state-of-the-art approaches to MT. In this paper we draw on experience in developing and evaluating a new syllabus in SMT for a cohort of post-graduate student translators: we identify several issues encountered in the introduction of student translators to SMT, and report on data derived from repeated measures questionnaires that aim to capture data on students{'} self-efficacy in the use of SMT. Overall, results show that participants report significant increases in their levels of confidence and knowledge of MT in general, and of SMT in particular. Additional benefits {--} such as increased technical competence and confidence {--} and future refinements are also discussed."
2012.amta-commercial.8,Translating User-Generated Content in the Social Networking Space,2012,-1,-1,2,1,7874,jie jiang,Proceedings of the 10th Conference of the Association for Machine Translation in the Americas: Commercial MT User Program,0,"This paper presents a case-study of work done by Applied Language Solutions (ALS) for a large social networking provider who claim to have built the world{'}s first multi-language social network, where Internet users from all over the world can communicate in languages that are available in the system. In an initial phase, the social networking provider contracted ALS to build Machine Translation (MT) engines for twelve language-pairs: Russian⇔English, Russian⇔Turkish, Russian⇔Arabic, Turkish⇔English, Turkish⇔Arabic and Arabic⇔English. All of the input data is user-generated content, so we faced a number of problems in building large-scale, robust, high-quality engines. Primarily, much of the source-language data is of {`}poor{'} or at least {`}non-standard{'} quality. This comes in many forms: (i) content produced by non-native speakers, (ii) content produced by native speakers containing non-deliberate typos, or (iii) content produced by native speakers which deliberately departs from spelling norms to bring about some linguistic effect. Accordingly, in addition to the {`}regular{'} pre-processing techniques used in the building of our statistical MT systems, we needed to develop routines to deal with all these scenarios. In this paper, we describe how we handle shortforms, acronyms, typos, punctuation errors, non-dictionary slang, wordplay, censor avoidance and emoticons. We demonstrate automatic evaluation scores on the social network data, together with insights from the the social networking provider regarding some of the typical errors made by the MT engines, and how we managed to correct these in the engines."
W11-1004,Incorporating Source-Language Paraphrases into Phrase-Based {SMT} with Confusion Networks,2011,24,4,3,1,7874,jie jiang,"Proceedings of Fifth Workshop on Syntax, Semantics and Structure in Statistical Translation",0,"To increase the model coverage, source-language paraphrases have been utilized to boost SMT system performance. Previous work showed that word lattices constructed from paraphrases are able to reduce out-of-vocabulary words and to express inputs in different ways for better translation quality. However, such a word-lattice-based method suffers from two problems: 1) path duplications in word lattices decrease the capacities for potential paraphrases; 2) lattice decoding in SMT dramatically increases the search space and results in poor time efficiency. Therefore, in this paper, we adopt word confusion networks as the input structure to carry source-language paraphrase information. Similar to previous work, we use word lattices to build word confusion networks for merging of duplicated paths and faster decoding. Experiments are carried out on small-, medium- and large-scale English-Chinese translation tasks, and we show that compared with the word-lattice-based method, the decoding time on three tasks is reduced significantly (up to 79%) while comparable translation quality is obtained on the large-scale task."
P11-1124,Consistent Translation using Discriminative Learning - A Translation Memory-inspired Approach,2011,23,30,3,1,11802,yanjun ma,Proceedings of the 49th Annual Meeting of the Association for Computational Linguistics: Human Language Technologies,1,"We present a discriminative learning method to improve the consistency of translations in phrase-based Statistical Machine Translation (SMT) systems. Our method is inspired by Translation Memory (TM) systems which are widely used by human translators in industrial settings. We constrain the translation of an input sentence using the most similar 'translation example' retrieved from the TM. Differently from previous research which used simple fuzzy match thresholds, these constraints are imposed using discriminative learning to optimise the translation performance. We observe that using this method can benefit the SMT system by not only producing consistent translations, but also improved translation outputs. We report a 0.9 point improvement in terms of BLEU score on English--Chinese technical documents."
2011.mtsummit-papers.7,Phonetic Representation-Based Speech Translation,2011,-1,-1,5,1,7874,jie jiang,Proceedings of Machine Translation Summit XIII: Papers,0,None
2011.mtsummit-papers.32,Domain Adaptation in Statistical Machine Translation of User-Forum Data using Component Level Mixture Modelling,2011,-1,-1,4,1,41915,pratyush banerjee,Proceedings of Machine Translation Summit XIII: Papers,0,None
2011.mtsummit-papers.52,Rich Linguistic Features for Translation Memory-Inspired Consistent Translation,2011,-1,-1,3,1,12154,yifan he,Proceedings of Machine Translation Summit XIII: Papers,0,None
2011.mtsummit-papers.60,A Framework for Diagnostic Evaluation of {MT} Based on Linguistic Checkpoints,2011,-1,-1,4,1,1243,sudip naskar,Proceedings of Machine Translation Summit XIII: Papers,0,None
2011.iwslt-evaluation.4,The {DCU} machine translation systems for {IWSLT} 2011,2011,0,3,6,1,41915,pratyush banerjee,Proceedings of the 8th International Workshop on Spoken Language Translation: Evaluation Campaign,0,"In this paper, we provide a description of the Dublin City University{'}s (DCU) submissions in the IWSLT 2011 evaluationcampaign.1 WeparticipatedintheArabic-Englishand Chinese-English Machine Translation(MT) track translation tasks. We use phrase-based statistical machine translation (PBSMT) models to create the baseline system. Due to the open-domain nature of the data to be translated, we use domain adaptation techniques to improve the quality of translation. Furthermore, we explore target-side syntactic augmentation for an Hierarchical Phrase-Based (HPB) SMT model. Combinatory Categorial Grammar (CCG) is used to extract labels for target-side phrases and non-terminals in the HPB system. Combining the domain adapted language models with the CCG-augmented HPB system gave us the best translations for both language pairs providing statistically significant improvements of 6.09 absolute BLEU points (25.94{\%} relative) and 1.69 absolute BLEU points (15.89{\%} relative) over the unadapted PBSMT baselines for the Arabic-English and Chinese-English language pairs, respectively."
2011.freeopmt-1.7,Automatic acquisition of named entities for rule-based machine translation,2011,18,4,2,0.430223,9426,antonio toral,Proceedings of the Second International Workshop on Free/Open-Source Rule-Based Machine Translation,0,"This paper proposes to enrich RBMT dictionaries with Named Entities (NEs) automatically acquired from Wikipedia. The method is applied to the Apertium English{--}Spanish system and its performance compared to that of Apertium with and without handtagged NEs. The system with automatic NEs outperforms the one without NEs, while results vary when compared to a system with handtagged NEs (results are comparable for Spanish→English but slightly worst for English→Spanish). Apart from that, adding automatic NEs contributes to decreasing the amount of unknown terms by more than 10{\%}."
