2021.naacl-tutorials.4,A Tutorial on Evaluation Metrics used in Natural Language Generation,2021,-1,-1,1,1,3162,mitesh khapra,Proceedings of the 2021 Conference of the North American Chapter of the Association for Computational Linguistics: Human Language Technologies: Tutorials,0,"The advent of Deep Learning and the availability of large scale datasets has accelerated research on Natural Language Generation with a focus on newer tasks and better models. With such rapid progress, it is vital to assess the extent of scientific progress made and identify the areas/components that need improvement. To accomplish this in an automatic and reliable manner, the NLP community has actively pursued the development of automatic evaluation metrics. Especially in the last few years, there has been an increasing focus on evaluation metrics, with several criticisms of existing metrics and proposals for several new metrics. This tutorial presents the evolution of automatic evaluation metrics to their current state along with the emerging trends in this field by specifically addressing the following questions: (i) What makes NLG evaluation challenging? (ii) Why do we need automatic evaluation metrics? (iii) What are the existing automatic evaluation metrics and how can they be organised in a coherent taxonomy? (iv) What are the criticisms and shortcomings of existing metrics? (v) What are the possible future directions of research?"
2021.emnlp-main.575,Perturbation {C}heck{L}ists for Evaluating {NLG} Evaluation Metrics,2021,-1,-1,5,1,3163,ananya sai,Proceedings of the 2021 Conference on Empirical Methods in Natural Language Processing,0,"Natural Language Generation (NLG) evaluation is a multifaceted task requiring assessment of multiple desirable criteria, e.g., fluency, coherency, coverage, relevance, adequacy, overall quality, etc. Across existing datasets for 6 NLG tasks, we observe that the human evaluation scores on these multiple criteria are often not correlated. For example, there is a very low correlation between human scores on fluency and data coverage for the task of structured data to text generation. This suggests that the current recipe of proposing new automatic evaluation metrics for NLG by showing that they correlate well with scores assigned by humans for a single criteria (overall quality) alone is inadequate. Indeed, our extensive study involving 25 automatic evaluation metrics across 6 different tasks and 18 different evaluation criteria shows that there is no single metric which correlates well with human scores on all desirable criteria, for most NLG tasks. Given this situation, we propose CheckLists for better design and evaluation of automatic metrics. We design templates which target a specific criteria (e.g., coverage) and perturb the output such that the quality gets affected only along this specific criteria (e.g., the coverage drops). We show that existing evaluation metrics are not robust against even such simple perturbations and disagree with scores assigned by humans to the perturbed output. The proposed templates thus allow for a fine-grained assessment of automatic evaluation metrics exposing their limitations and will facilitate better design, analysis and evaluation of such metrics. Our templates and code are available at https://iitmnlp.github.io/EvalEval/"
2020.tacl-1.52,Improving Dialog Evaluation with a Multi-reference Adversarial Dataset and Large Scale Pretraining,2020,-1,-1,4,1,3163,ananya sai,Transactions of the Association for Computational Linguistics,0,"There is an increasing focus on model-based dialog evaluation metrics such as ADEM, RUBER, and the more recent BERT-based metrics. These models aim to assign a high score to all relevant responses and a low score to all irrelevant responses. Ideally, such models should be trained using multiple relevant and irrelevant responses for any given context. However, no such data is publicly available, and hence existing models are usually trained using a single relevant response and multiple randomly selected responses from other contexts (random negatives). To allow for better training and robust evaluation of model-based metrics, we introduce the DailyDialog++ dataset, consisting of (i) five relevant responses for each context and (ii) five adversarially crafted irrelevant responses for each context. Using this dataset, we first show that even in the presence of multiple correct references, n-gram based metrics and embedding based metrics do not perform well at separating relevant responses from even random negatives. While model-based metrics perform better than n-gram and embedding based metrics on random negatives, their performance drops substantially when evaluated on adversarial examples. To check if large scale pretraining could help, we propose a new BERT-based evaluation metric called DEB, which is pretrained on 727M Reddit conversations and then finetuned on our dataset. DEB significantly outperforms existing models, showing better correlation with human judgments and better performance on random negatives (88.27{\%} accuracy). However, its performance again drops substantially when evaluated on adversarial responses, thereby highlighting that even large-scale pretrained evaluation models are not robust to the adversarial examples in our dataset. The dataset1 and code2 are publicly available."
2020.nlp4convai-1.2,On Incorporating Structural Information to improve Dialogue Response Generation,2020,-1,-1,4,1,8806,nikita moghe,Proceedings of the 2nd Workshop on Natural Language Processing for Conversational AI,0,"We consider the task of generating dialogue responses from background knowledge comprising of domain specific resources. Specifically, given a conversation around a movie, the task is to generate the next response based on background knowledge about the movie such as the plot, review, Reddit comments etc. This requires capturing structural, sequential and semantic information from the conversation context and the background resources. We propose a new architecture that uses the ability of BERT to capture deep contextualized representations in conjunction with explicit structure and sequence information. More specifically, we use (i) Graph Convolutional Networks (GCNs) to capture structural information, (ii) LSTMs to capture sequential information and (iii) BERT for the deep contextualized representations that capture semantic information. We analyze the proposed architecture extensively. To this end, we propose a plug-and-play Semantics-Sequences-Structures (SSS) framework which allows us to effectively combine such linguistic information. Through a series of experiments we make some interesting observations. First, we observe that the popular adaptation of the GCN model for NLP tasks where structural information (GCNs) was added on top of sequential information (LSTMs) performs poorly on our task. This leads us to explore interesting ways of combining semantic and structural information to improve the performance. Second, we observe that while BERT already outperforms other deep contextualized representations such as ELMo, it still benefits from the additional structural information explicitly added using GCNs. This is a bit surprising given the recent claims that BERT already captures structural information. Lastly, the proposed SSS framework gives an improvement of 7.95{\%} on BLUE score over the baseline."
2020.findings-emnlp.445,"{I}ndic{NLPS}uite: Monolingual Corpora, Evaluation Benchmarks and Pre-trained Multilingual Language Models for {I}ndian Languages",2020,-1,-1,6,0,19984,divyanshu kakwani,Findings of the Association for Computational Linguistics: EMNLP 2020,0,"In this paper, we introduce NLP resources for 11 major Indian languages from two major language families. These resources include: (a) large-scale sentence-level monolingual corpora, (b) pre-trained word embeddings, (c) pre-trained language models, and (d) multiple NLU evaluation datasets (\textit{IndicGLUE} benchmark). The monolingual corpora contains a total of 8.8 billion tokens across all 11 languages and Indian English, primarily sourced from news crawls. The word embeddings are based on \textit{FastText}, hence suitable for handling morphological complexity of Indian languages. The pre-trained language models are based on the compact ALBERT model. Lastly, we compile the (\textit{IndicGLUE} benchmark for Indian language NLU. To this end, we create datasets for the following tasks: Article Genre Classification, Headline Prediction, Wikipedia Section-Title Prediction, Cloze-style Multiple choice QA, Winograd NLI and COPA. We also include publicly available datasets for some Indic languages for tasks like Named Entity Recognition, Cross-lingual Sentence Retrieval, Paraphrase detection, \textit{etc.} Our embeddings are competitive or better than existing pre-trained embeddings on multiple tasks. We hope that the availability of the dataset will accelerate Indic NLP research which has the potential to impact more than a billion people. It can also help the community in evaluating advances in NLP over a more diverse pool of languages. The data and models are available at \url{https://indicnlp.ai4bharat.org}."
2020.emnlp-main.260,On the weak link between importance and prunability of attention heads,2020,-1,-1,5,0,20295,aakriti budhraja,Proceedings of the 2020 Conference on Empirical Methods in Natural Language Processing (EMNLP),0,"Given the success of Transformer-based models, two directions of study have emerged: interpreting role of individual attention heads and down-sizing the models for efficiency. Our work straddles these two streams: We analyse the importance of basing pruning strategies on the interpreted role of the attention heads. We evaluate this on Transformer and BERT models on multiple NLP tasks. Firstly, we find that a large fraction of the attention heads can be randomly pruned with limited effect on accuracy. Secondly, for Transformers, we find no advantage in pruning attention heads identified to be important based on existing studies that relate importance to the location of a head. On the BERT model too we find no preference for top or bottom layers, though the latter are reported to have higher importance. However, strategies that avoid pruning middle layers and consecutive layers perform better. Finally, during fine-tuning the compensation for pruned attention heads is roughly equally distributed across the un-pruned heads. Our results thus suggest that interpretation of attention heads does not strongly inform pruning."
2020.emnlp-main.261,Towards Interpreting {BERT} for Reading Comprehension Based {QA},2020,-1,-1,4,0,8883,sahana ramnath,Proceedings of the 2020 Conference on Empirical Methods in Natural Language Processing (EMNLP),0,"BERT and its variants have achieved state-of-the-art performance in various NLP tasks. Since then, various works have been proposed to analyze the linguistic information being captured in BERT. However, the current works do not provide an insight into how BERT is able to achieve near human-level performance on the task of Reading Comprehension based Question Answering. In this work, we attempt to interpret BERT for RCQA. Since BERT layers do not have predefined roles, we define a layer{'}s role or functionality using Integrated Gradients. Based on the defined roles, we perform a preliminary analysis across all layers. We observed that the initial layers focus on query-passage interaction, whereas later layers focus more on contextual understanding and enhancing the answer prediction. Specifically for quantifier questions (how much/how many), we notice that BERT focuses on confusing words (i.e., on other numerical quantities in the passage) in the later layers, but still manages to predict the answer correctly. The fine-tuning and analysis scripts will be publicly available at https://github.com/iitmnlp/BERT-Analysis-RCQA."
2020.coling-main.87,Joint Transformer/{RNN} Architecture for Gesture Typing in Indic Languages,2020,-1,-1,3,0,21151,emil biju,Proceedings of the 28th International Conference on Computational Linguistics,0,"Gesture typing is a method of typing words on a touch-based keyboard by creating a continuous trace passing through the relevant keys. This work is aimed at developing a keyboard that supports gesture typing in Indic languages. We begin by noting that when dealing with Indic languages, one needs to cater to two different sets of users: (i) users who prefer to type in the native Indic script (Devanagari, Bengali, etc.) and (ii) users who prefer to type in the English script but want the transliterated output in the native script. In both cases, we need a model that takes a trace as input and maps it to the intended word. To enable the development of these models, we create and release two datasets. First, we create a dataset containing keyboard traces for 193,658 words from 7 Indic languages. Second, we curate 104,412 English-Indic transliteration pairs from Wikidata across these languages. Using these datasets we build a model that performs path decoding, transliteration and transliteration correction. Unlike prior approaches, our proposed model does not make co-character independence assumptions during decoding. The overall accuracy of our model across the 7 languages varies from 70-95{\%}."
2020.acl-main.387,Towards Transparent and Explainable Attention Models,2020,37,0,4,0,14463,akash mohankumar,Proceedings of the 58th Annual Meeting of the Association for Computational Linguistics,1,"Recent studies on interpretability of attention distributions have led to notions of faithful and plausible explanations for a model{'}s predictions. Attention distributions can be considered a faithful explanation if a higher attention weight implies a greater impact on the model{'}s prediction. They can be considered a plausible explanation if they provide a human-understandable justification for the model{'}s predictions. In this work, we first explain why current attention mechanisms in LSTM based encoders can neither provide a faithful nor a plausible explanation of the model{'}s predictions. We observe that in LSTM based encoders the hidden representations at different time-steps are very similar to each other (high conicity) and attention weights in these situations do not carry much meaning because even a random permutation of the attention weights does not affect the model{'}s predictions. Based on experiments on a wide variety of tasks and datasets, we observe attention distributions often attribute the model{'}s predictions to unimportant words such as punctuation and fail to offer a plausible explanation for the predictions. To make attention mechanisms more faithful and plausible, we propose a modified LSTM cell with a diversity-driven training objective that ensures that the hidden representations learned at different time steps are diverse. We show that the resulting attention distributions offer more transparency as they (i) provide a more precise importance ranking of the hidden states (ii) are better indicative of words important for the model{'}s predictions (iii) correlate better with gradient-based attribution methods. Human evaluations indicate that the attention distributions learned by our model offer a plausible explanation of the model{'}s predictions. Our code has been made publicly available at https://github.com/akashkm99/Interpretable-Attention"
Q19-1034,Graph Convolutional Network with Sequential Attention for Goal-Oriented Dialogue Systems,2019,18,0,2,1,25420,suman banerjee,Transactions of the Association for Computational Linguistics,0,"Domain-specific goal-oriented dialogue systems typically require modeling three types of inputs, namely, (i) the knowledge-base associated with the domain, (ii) the history of the conversation, which is a sequence of utterances, and (iii) the current utterance for which the response needs to be generated. While modeling these inputs, current state-of-the-art models such as Mem2Seq typically ignore the rich structure inherent in the knowledge graph and the sentences in the conversation context. Inspired by the recent success of structure-aware Graph Convolutional Networks (GCNs) for various NLP tasks such as machine translation, semantic role labeling, and document dating, we propose a memory-augmented GCN for goal-oriented dialogues. Our model exploits (i) the entity relation graph in a knowledge-base and (ii) the dependency graph associated with an utterance to compute richer representations for words and entities. Further, we take cognizance of the fact that in certain situations, such as when the conversation is in a code-mixed language, dependency parsers may not be available. We show that in such situations we could use the global word co-occurrence graph to enrich the representations of utterances. We experiment with four datasets: (i) the modified DSTC2 dataset, (ii) recently released code-mixed versions of DSTC2 dataset in four languages, (iii) Wizard-of-Oz style CAM676 dataset, and (iv) Wizard-of-Oz style MultiWOZ dataset. On all four datasets our method outperforms existing methods, on a wide range of evaluation metrics."
N19-1382,On Knowledge distillation from complex networks for response prediction,2019,0,2,2,1,14464,siddhartha arora,"Proceedings of the 2019 Conference of the North {A}merican Chapter of the Association for Computational Linguistics: Human Language Technologies, Volume 1 (Long and Short Papers)",0,"Recent advances in Question Answering have lead to the development of very complex models which compute rich representations for query and documents by capturing all pairwise interactions between query and document words. This makes these models expensive in space and time, and in practice one has to restrict the length of the documents that can be fed to these models. Such models have also been recently employed for the task of predicting dialog responses from available background documents (e.g., Holl-E dataset). However, here the documents are longer, thereby rendering these complex models infeasible except in select restricted settings. In order to overcome this, we use standard simple models which do not capture all pairwise interactions, but learn to emulate certain characteristics of a complex teacher network. Specifically, we first investigate the conicity of representations learned by a complex model and observe that it is significantly lower than that of simpler models. Based on this insight, we modify the simple architecture to mimic this characteristic. We go further by using knowledge distillation approaches, where the simple model acts as a student and learns to match the output from the complex teacher network. We experiment with the Holl-E dialog data set and show that by mimicking characteristics and matching outputs from a teacher, even a simple network can give improved performance."
D19-1326,Let{'}s Ask Again: Refine Network for Automatic Question Generation,2019,34,2,3,1,20297,preksha nema,Proceedings of the 2019 Conference on Empirical Methods in Natural Language Processing and the 9th International Joint Conference on Natural Language Processing (EMNLP-IJCNLP),0,"In this work, we focus on the task of Automatic Question Generation (AQG) where given a passage and an answer the task is to generate the corresponding question. It is desired that the generated question should be (i) grammatically correct (ii) answerable from the passage and (iii) specific to the given answer. An analysis of existing AQG models shows that they produce questions which do not adhere to one or more of {the above-mentioned qualities}. In particular, the generated questions look like an incomplete draft of the desired question with a clear scope for refinement. {To alleviate this shortcoming}, we propose a method which tries to mimic the human process of generating questions by first creating an initial draft and then refining it. More specifically, we propose Refine Network (RefNet) which contains two decoders. The second decoder uses a dual attention network which pays attention to both (i) the original passage and (ii) the question (initial draft) generated by the first decoder. In effect, it refines the question generated by the first decoder, thereby making it more correct and complete. We evaluate RefNet on three datasets, \textit{viz.}, SQuAD, HOTPOT-QA, and DROP, and show that it outperforms existing state-of-the-art methods by 7-16{\%} on all of these datasets. Lastly, we show that we can improve the quality of the second decoder on specific metrics, such as, fluency and answerability by explicitly rewarding revisions that improve on the corresponding metric during training. The code has been made publicly available ."
Q18-1022,Leveraging Orthographic Similarity for Multilingual Neural Transliteration,2018,0,1,2,0.20697,290,anoop kunchukuttan,Transactions of the Association for Computational Linguistics,0,"We address the task of joint training of transliteration models for multiple language pairs (multilingual transliteration). This is an instance of multitask learning, where individual tasks (language pairs) benefit from sharing knowledge with related tasks. We focus on transliteration involving related tasks i.e., languages sharing writing systems and phonetic properties (orthographically similar languages). We propose a modified neural encoder-decoder model that maximizes parameter sharing across language pairs in order to effectively leverage orthographic similarity. We show that multilingual transliteration significantly outperforms bilingual transliteration in different scenarios (average increase of 58{\%} across a variety of languages we experimented with). We also show that multilingual transliteration models can generalize well to languages/language pairs not encountered during training and hence perform well on the zeroshot transliteration task. We show that further improvements can be achieved by using phonetic feature input."
P18-1156,{D}uo{RC}: Towards Complex Language Understanding with Paraphrased Reading Comprehension,2018,9,5,3,1,25404,amrita saha,Proceedings of the 56th Annual Meeting of the Association for Computational Linguistics (Volume 1: Long Papers),1,"We propose DuoRC, a novel dataset for Reading Comprehension (RC) that motivates several new challenges for neural approaches in language understanding beyond those offered by existing RC datasets. DuoRC contains 186,089 unique question-answer pairs created from a collection of 7680 pairs of movie plots where each pair in the collection reflects two versions of the same movie - one from Wikipedia and the other from IMDb - written by two different authors. We asked crowdsourced workers to create questions from one version of the plot and a different set of workers to extract or synthesize answers from the other version. This unique characteristic of DuoRC where questions and answers are created from different versions of a document narrating the same underlying story, ensures by design, that there is very little lexical overlap between the questions created from one version and the segments containing the answer in the other version. Further, since the two versions have different levels of plot detail, narration style, vocabulary, etc., answering questions from the second version requires deeper language understanding and incorporating external background knowledge. Additionally, the narrative style of passages arising from movie plots (as opposed to typical descriptive passages in existing datasets) exhibits the need to perform complex reasoning over events across multiple sentences. Indeed, we observe that state-of-the-art neural RC models which have achieved near human performance on the SQuAD dataset, even when coupled with traditional NLP techniques to address the challenges presented in DuoRC exhibit very poor performance (F1 score of 37.42{\%} on DuoRC v/s 86{\%} on SQuAD dataset). This opens up several interesting research avenues wherein DuoRC could complement other RC datasets to explore novel neural approaches for studying language understanding."
N18-2098,A Mixed Hierarchical Attention Based Encoder-Decoder Approach for Standard Table Summarization,2018,15,5,5,0,25430,parag jain,"Proceedings of the 2018 Conference of the North {A}merican Chapter of the Association for Computational Linguistics: Human Language Technologies, Volume 2 (Short Papers)",0,"Structured data summarization involves generation of natural language summaries from structured input data. In this work, we consider summarizing structured data occurring in the form of tables as they are prevalent across a wide variety of domains. We formulate the standard table summarization problem, which deals with tables conforming to a single predefined schema. To this end, we propose a mixed hierarchical attention based encoder-decoder model which is able to leverage the structure in addition to the content of the tables. Our experiments on the publicly available weathergov dataset show around 18 BLEU (around 30{\%}) improvement over the current state-of-the-art."
