D18-1211,Deep Relevance Ranking Using Enhanced Document-Query Interactions,2018,0,23,3,0,10634,ryan mcdonald,Proceedings of the 2018 Conference on Empirical Methods in Natural Language Processing,0,"We explore several new models for document relevance ranking, building upon the Deep Relevance Matching Model (DRMM) of Guo et al. (2016). Unlike DRMM, which uses context-insensitive encodings of terms and query-document term interactions, we inject rich context-sensitive encodings throughout our models, inspired by PACRR{'}s (Hui et al., 2017) convolutional n-gram matching features, but extended in several ways including multiple views of query and document inputs. We test our models on datasets from the BIOASQ question answering challenge (Tsatsaronis et al., 2015) and TREC ROBUST 2004 (Voorhees, 2005), showing they outperform BM25-based baselines, DRMM, and PACRR."
W17-4209,Improved Abusive Comment Moderation with User Embeddings,2017,0,4,4,1,65,john pavlopoulos,Proceedings of the 2017 {EMNLP} Workshop: Natural Language Processing meets Journalism,0,"Experimenting with a dataset of approximately 1.6M user comments from a Greek news sports portal, we explore how a state of the art RNN-based moderation method can be improved by adding user embeddings, user type embeddings, user biases, or user type biases. We observe improvements in all cases, with user embeddings leading to the biggest performance gains."
W17-3004,Deep Learning for User Comment Moderation,2017,44,8,3,1,65,john pavlopoulos,Proceedings of the First Workshop on Abusive Language Online,0,"Experimenting with a new dataset of 1.6M user comments from a Greek news portal and existing datasets of EnglishWikipedia comments, we show that an RNN outperforms the previous state of the art in moderation. A deep, classification-specific attention mechanism improves further the overall performance of the RNN. We also compare against a CNN and a word-list baseline, considering both fully automatic and semi-automatic moderation."
D17-1117,Deeper Attention to Abusive User Content Moderation,2017,28,24,3,1,65,john pavlopoulos,Proceedings of the 2017 Conference on Empirical Methods in Natural Language Processing,0,"Experimenting with a new dataset of 1.6M user comments from a news portal and an existing dataset of 115K Wikipedia talk page comments, we show that an RNN operating on word embeddings outpeforms the previous state of the art in moderation, which used logistic regression or an MLP classifier with character or word n-grams. We also compare against a CNN operating on word embeddings, and a word-list baseline. A novel, deep, classificationspecific attention mechanism improves the performance of the RNN further, and can also highlight suspicious words for free, without including highlighted words in the training data. We consider both fully automatic and semi-automatic moderation."
W16-2915,Using Centroids of Word Embeddings and Word Mover{'}s Distance for Biomedical Document Retrieval in Question Answering,2016,16,5,3,0,33822,georgiosioannis brokos,Proceedings of the 15th Workshop on Biomedical Natural Language Processing,0,"We propose a document retrieval method for question answering that represents documents and questions as weighted centroids of word embeddings and reranks the retrieved documents with a relaxation of Word Mover's Distance. Using biomedical questions and documents from BIOASQ, we show that our method is competitive with PUBMED. With a top-k approximation, our method is fast, and easily portable to other domains and languages."
S16-1002,{S}em{E}val-2016 Task 5: Aspect Based Sentiment Analysis,2016,13,194,4,1,18398,maria pontiki,Proceedings of the 10th International Workshop on Semantic Evaluation ({S}em{E}val-2016),0,"This paper describes the SemEval 2016 shared task on Aspect Based Sentiment Analysis (ABSA), a continuation of the respective tasks of 2014 and 2015. In its third year, the task provided 19 training and 20 testing datasets for 8 languages and 7 domains, as well as a common evaluation procedure. From these datasets, 25 were for sentence-level and 14 for text-level ABSA; the latter was introduced for the first time as a subtask in SemEval. The task attracted 245 submissions from 29 teams."
S16-1012,aueb.twitter.sentiment at {S}em{E}val-2016 Task 4: A Weighted Ensemble of {SVM}s for {T}witter Sentiment Analysis,2016,15,6,5,0,34203,stavros giorgis,Proceedings of the 10th International Workshop on Semantic Evaluation ({S}em{E}val-2016),0,This paper describes the system with which we participated in SemEval-2016 Task 4 (Sentiment Analysis in Twitter) and specifically the Message Polarity Classification subtask. Our system is a weighted ensemble of two systems. The first one is based on a previous sentiment analysis system and uses manually crafted features. The second system of our ensemble uses features based on word embeddings. Our ensemble was ranked 5th among 34 teams. The source code of our system is publicly available.
S16-1050,{AUEB}-{ABSA} at {S}em{E}val-2016 Task 5: Ensembles of Classifiers and Embeddings for Aspect Based Sentiment Analysis,2016,10,13,5,0,34240,dionysios xenos,Proceedings of the 10th International Workshop on Semantic Evaluation ({S}em{E}val-2016),0,"This paper describes our submissions to the Aspect Based Sentiment Analysis task of SemEval-2016. For Aspect Category Detection (Subtask1/Slot1), we used multiple ensembles, based on Support Vector Machine classifiers. For Opinion Target Expression extraction (Subtask1/Slot2), we used a sequence labeling approach with Conditional Random Fields. For Polarity Detection (Subtask1/Slot3), we used an ensemble of two supervised classifiers, one based on hand crafted features and one based on word embeddings. Our systems were ranked in the top 6 positions in all the tasks we participated. The source code of our systems is publicly available."
S15-2082,{S}em{E}val-2015 Task 12: Aspect Based Sentiment Analysis,2015,20,183,5,1,18398,maria pontiki,Proceedings of the 9th International Workshop on Semantic Evaluation ({S}em{E}val 2015),0,"SemEval-2015 Task 12, a continuation of SemEval-2014 Task 4, aimed to foster research beyond sentenceor text-level sentiment classification towards Aspect Based Sentiment Analysis. The goal is to identify opinions expressed about specific entities (e.g., laptops) and their aspects (e.g., price). The task provided manually annotated reviews in three domains (restaurants, laptops and hotels), and a common evaluation procedure. It attracted 93 submissions from 16 teams."
W14-1306,"Aspect Term Extraction for Sentiment Analysis: New Datasets, New Evaluation Measures and an Improved Unsupervised Method",2014,24,18,2,1,65,john pavlopoulos,Proceedings of the 5th Workshop on Language Analysis for Social Media ({LASM}),0,"Given a set of texts discussing a particular entity (e.g., customer reviews of a smartphone), aspect based sentiment analysis (ABSA) identifies prominent aspects of the entity (e.g., battery, screen) and an average sentiment score per aspect. We focus on aspect term extraction (ATE), one of the core processing stages of ABSA that extracts terms naming aspects. We make publicly available three new ATE datasets, arguing that they are better than previously available ones. We also introduce new evaluation measures for ATE, again arguing that they are better than previously used ones. Finally, we show how a popular unsupervised ATE method can be improved by using continuous space vector representations of words and phrases."
S14-2004,{S}em{E}val-2014 Task 4: Aspect Based Sentiment Analysis,2014,16,378,5,1,18398,maria pontiki,Proceedings of the 8th International Workshop on Semantic Evaluation ({S}em{E}val 2014),0,"Sentiment analysis is increasingly viewed as a vital task both from an academic and a commercial standpoint. The majority of current approaches, however, attempt to detect the overall polarity of a sentence, paragraph, or text span, irrespective of the entities mentioned (e.g., laptops) and their aspects (e.g., battery, screen). SemEval2014 Task 4 aimed to foster research in the field of aspect-based sentiment analysis, where the goal is to identify the aspects of given target entities and the sentiment expressed for each aspect. The task provided datasets containing manually annotated reviews of restaurants and laptops, as well as a common evaluation procedure. It attracted 163 submissions from 32 teams."
E14-1009,Multi-Granular Aspect Aggregation in Aspect-Based Sentiment Analysis,2014,43,7,2,1,65,john pavlopoulos,Proceedings of the 14th Conference of the {E}uropean Chapter of the Association for Computational Linguistics,0,"Aspect-based sentiment analysis estimates the sentiment expressed for each particular aspect (e.g., battery, screen) of an entity (e.g., smartphone). Different words or phrases, however, may be used to refer to the same aspect, and similar aspects may need to be aggregated at coarser or finer granularities to fit the available space or satisfy user preferences. We introduce the problem of aspect aggregation at multiple granularities. We decompose it in two processing phases, to allow previous work on term similarity and hierarchical clustering to be reused. We show that the second phase, where aspects are clustered, is almost a solved problem, whereas further research is needed in the first phase, where semantic similarity measures are employed. We also introduce a novel sense pruning mechanism for WordNet-based similarity measures, which improves their performance in the first phase. Finally, we provide publicly available benchmark datasets."
W13-2106,"Using Integer Linear Programming for Content Selection, Lexicalization, and Aggregation to Produce Compact Texts from {OWL} Ontologies",2013,32,3,2,1,839,gerasimos lampouras,Proceedings of the 14th {E}uropean Workshop on Natural Language Generation,0,"We present an Integer Linear Programming model of content selection, lexicalization, and aggregation that we developed for a system that generates texts from OWL ontologies. Unlike pipeline architectures, our model jointly considers the available choices in these three text generation stages, to avoid greedy decisions and produce more compact texts. Experiments with two ontologies confirm that it leads to more compact texts, compared to a pipeline with the same components, with no deterioration in the perceived quality of the generated texts. We also present an approximation of our model, which allows longer texts to be generated efficiently."
P13-2100,Using Integer Linear Programming in Concept-to-Text Generation to Produce More Compact Texts,2013,26,8,2,1,839,gerasimos lampouras,Proceedings of the 51st Annual Meeting of the Association for Computational Linguistics (Volume 2: Short Papers),0,"We present an ILP model of concept-totext generation. Unlike pipeline architectures, our model jointly considers the choices in content selection, lexicalization, and aggregation to avoid greedy decisions and produce more compact texts."
C12-1056,Extractive Multi-Document Summarization with Integer Linear Programming and Support Vector Regression,2012,27,40,3,1,37402,dimitrios galanis,Proceedings of {COLING} 2012,0,"We present a new method to generate extractive multi-document summaries. The method uses Integer Linear Programming to jointly maximize the importance of the sentences it includes in the summary and their diversity, without exceeding a maximum allowed summary length. To obtain an importance score for each sentence, it uses a Support Vector Regression model trained on human-authored summaries, whereas the diversity of the selected sentences is measured as the number of distinct word bigrams in the resulting summary. Experimental results on widely used benchmarks show that our method achieves state of the art results, when compared to competitive extractive summarizers, while being computationally efficient as well."
W11-2701,A New Sentence Compression Dataset and Its Use in an Abstractive Generate-and-Rank Sentence Compressor,2011,44,6,2,1,37402,dimitrios galanis,Proceedings of the {UCNLG}+{E}val: Language Generation and Evaluation Workshop,0,"Sentence compression has attracted much interest in recent years, but most sentence compressors are extractive, i.e., they only delete words. There is a lack of appropriate datasets to train and evaluate abstractive sentence compressors, i.e., methods that apart from deleting words can also rephrase expressions. We present a new dataset that contains candidate extractive and abstractive compressions of source sentences. The candidate compressions are annotated with human judgements for grammaticality and meaning preservation. We discuss how the dataset was created, and how it can be used in generate-and-rank abstractive sentence compressors. We also report experimental results with a novel abstractive sentence compressor that uses the dataset."
D11-1009,A Generate and Rank Approach to Sentence Paraphrasing,2011,37,5,2,1,3289,prodromos malakasiotis,Proceedings of the 2011 Conference on Empirical Methods in Natural Language Processing,0,"We present a method that paraphrases a given sentence by first generating candidate paraphrases and then ranking (or classifying) them. The candidates are generated by applying existing paraphrasing rules extracted from parallel corpora. The ranking component considers not only the overall quality of the rules that produced each candidate, but also the extent to which they preserve grammaticality and meaning in the particular context of the input sentence, as well as the degree to which the candidate differs from the input. We experimented with both a Maximum Entropy classifier and an SVR ranker. Experimental results show that incorporating features from an existing paraphrase recognizer in the ranking component improves performance, and that our overall method compares well against a state of the art paraphrase generator, when paraphrasing rules apply to the input sentences. We also propose a new methodology to evaluate the ranking components of generate-and-rank paraphrase generators, which evaluates them across different combinations of weights for grammaticality, meaning preservation, and diversity. The paper is accompanied by a paraphrasing dataset we constructed for evaluations of this kind."
N10-1131,An extractive supervised two-stage method for sentence compression,2010,26,37,2,1,37402,dimitrios galanis,Human Language Technologies: The 2010 Annual Conference of the North {A}merican Chapter of the Association for Computational Linguistics,0,"We present a new method that compresses sentences by removing words. In a first stage, it generates candidate compressions by removing branches from the source sentence's dependency tree using a Maximum Entropy classifier. In a second stage, it chooses the best among the candidate compressions using a Support Vector Machine Regression model. Experimental results show that our method achieves state-of-the-art performance without requiring any manually written rules."
E09-2005,An Open-Source Natural Language Generator for {OWL} Ontologies and its Use in Protege and Second Life,2009,9,31,4,1,37402,dimitrios galanis,Proceedings of the Demonstrations Session at {EACL} 2009,0,"We demonstrate an open-source natural language generation engine that produces descriptions of entities and classes in English and Greek from OWL ontologies that have been annotated with linguistic and user modeling information expressed in RDF. We also demonstrate an accompanying plug-in for the Protege ontology editor, which can be used to create the ontology's annotations and generate previews of the resulting texts by invoking the generation engine. The engine has been embedded in robots acting as museum tour guides in the physical world and in Second Life; here we demonstrate the latter application."
E09-2010,Adaptive Natural Language Interaction,2009,5,4,4,0,34540,stasinos konstantopoulos,Proceedings of the Demonstrations Session at {EACL} 2009,0,"The subject of this demonstration is natural language interaction, focusing on adaptivity and profiling of the dialogue management and the generated output (text and speech). These are demonstrated in a museum guide use-case, operating in a simulated environment. The main technical innovations presented are the profiling model, the dialogue and action management system, and the text generation and speech synthesis systems."
D09-1132,Finding Short Definitions of Terms on {W}eb Pages,2009,29,2,2,1,839,gerasimos lampouras,Proceedings of the 2009 Conference on Empirical Methods in Natural Language Processing,0,"We present a system that finds short definitions of terms on Web pages. It employs a Maximum Entropy classifier, but it is trained on automatically generated examples; hence, it is in effect unsupervised. We use rouge-w to generate training examples from encyclopedias and Web snippets, a method that outperforms an alternative centroid-based one. After training, our system can be used to find definitions of terms that are not covered by encyclopedias. The system outperforms a comparable publicly available system, as well as a previously published form of our system."
W07-2322,Generating Multilingual Descriptions from Linguistically Annotated {OWL} Ontologies: the {N}atural{OWL} System,2007,13,36,2,1,37402,dimitrios galanis,Proceedings of the Eleventh {E}uropean Workshop on Natural Language Generation ({ENLG} 07),0,"We introduce NaturalOWL, an open-source multilingual natural language generator that produces descriptions of instances and classes, starting from a linguistically annotated ontology. The generator is heavily based on ideas from ILEX and M-PIRO, but it is in many ways simpler and it provides full support for OWL DL ontologies with RDF linguistic annotations. NaturalOWL is written in Java, and it is supported by M-PIRO's authoring tool, as well as an alternative plug-in for the Protege ontology editor."
W07-1407,Learning Textual Entailment using {SVM}s and String Similarity Measures,2007,9,86,2,1,3289,prodromos malakasiotis,Proceedings of the {ACL}-{PASCAL} Workshop on Textual Entailment and Paraphrasing,0,"We present the system that we submitted to the 3rd Pascal Recognizing Textual Entailment Challenge. It uses four Support Vector Machines, one for each subtask of the challenge, with features that correspond to string similarity measures operating at the lexical and shallow syntactic level."
W05-1617,Exploiting {OWL} Ontologies in the Multilingual Generation of Object Descriptions,2005,8,16,1,1,66,ion androutsopoulos,Proceedings of the Tenth {E}uropean Workshop on Natural Language Generation ({ENLG}-05),0,None
H05-1041,A Practically Unsupervised Learning Method to Identify Single-Snippet Answers to Definition Questions on the Web,2005,14,19,1,1,66,ion androutsopoulos,Proceedings of Human Language Technology Conference and Conference on Empirical Methods in Natural Language Processing,0,"We present a practically unsupervised learning method to produce single-snippet answers to definition questions in question answering systems that supplement Web search engines. The method exploits on-line encyclopedias and dictionaries to generate automatically an arbitrarily large number of positive and negative definition examples, which are then used to train an SVM to separate the two classes. We show experimentally that the proposed method is viable, that it outperforms the alternative of training the system on questions and news articles from TREC, and that it helps the search engine handle definition questions significantly better."
C04-1199,Learning to Identify Single-Snippet Answers to Definition Questions,2004,21,31,2,0,52421,spyridoula miliaraki,{COLING} 2004: Proceedings of the 20th International Conference on Computational Linguistics,0,"We present a learning-based method to identify single-snippet answers to definition questions in question answering systems for document collections. Our method combines and extends two previous techniques that were based mostly on manually crafted lexical patterns and WordNet hypernyms. We train a Support Vector Machine (SVM) on vectors comprising the verdicts or attributes of the previous techniques, and additional phrasal attributes that we acquire automatically. The SVM is then used to identify and rank single 250-character snippets that contain answers to definition questions. Experimental results indicate that our method clearly outperforms the techniques it builds upon."
W03-2304,Learning to Order Facts for Discourse Planning in Natural Language Generation,2003,28,2,2,0,52612,aggeliki dimitromanolaki,Proceedings of the 9th {E}uropean Workshop on Natural Language Generation ({ENLG}-2003) at {EACL} 2003,0,"This paper presents a machine learning approach to discourse planning in natural language generation. More specifically, we address the problem of learning the most natural ordering of facts in discourse plans for a specific domain. We discuss our methodology and how it was instantiated using two different machine learning algorithms. A quantitative evaluation performed in the domain of museum exhibit descriptions indicates that our approach performs significantly better than manually constructed ordering rules. Being retrainable, the resulting planners can be ported easily to other similar domains, without requiring language technology expertise."
petasis-etal-2002-ellogon,{E}llogon: A New Text Engineering Platform,2002,5,49,4,0,17115,georgios petasis,Proceedings of the Third International Conference on Language Resources and Evaluation ({LREC}{'}02),0,"This paper presents Ellogon, a multi-lingual, cross-platform, general-purpose text engineering environment. Ellogon was designed in order to aid both researchers in natural language processing, as well as companies that produce language engineering systems for the end-user. Ellogon provides a powerful TIPSTER-based infrastructure for managing, storing and exchanging textual data, embedding and managing text processing components as well as visualising textual data and their associated linguistic information. Among its key features are full Unicode support, an extensive multi-lingual graphical user interface, its modular architecture and the reduced hardware requirements."
W01-0506,Stacking Classifiers for Anti-Spam Filtering of {E}-Mail,2001,15,137,2,0,53836,georgios sakkis,Proceedings of the 2001 Conference on Empirical Methods in Natural Language Processing,0,"We evaluate empirically a scheme for combining classifiers, known as stacked generalization, in the context of anti-spam filtering, a novel cost-sensitive application of text categorization. Unsolicited commercial e- mail, or spam, floods mailboxes, causing frustration, wasting bandwidth, and exposing minors to unsuitable content. Using a public corpus, we show that stacking can improve the efficiency of automatically induced anti-spam filters, and that such filters can be used in real- life applications."
C00-1003,Selectional Restrictions in {HPSG},2000,10,10,1,1,66,ion androutsopoulos,{COLING} 2000 Volume 1: The 18th International Conference on Computational Linguistics,0,"Selectional restrictions are semantic sortal constraints imposed on the participants of linguistic constructions to capture contextually-dependent constraints on interpretation. Despite their limitations, selectional restrictions have proven very useful in natural language applications, where they have been used frequently in word sense disambiguation, syntactic disambiguation, and anaphora resolution. Given their practical value, we explore two methods to incorporate selectional restrictions in the HPSG theory, assuming that the reader is familiar with HPSG. The first method employs HPSG's BACKGROUND feature and a constraint-satisfaction component pipe-lined after the parser. The second method uses subsorts of referential indices, and blocks readings that violate selectional restrictions during parsing. While theoretically less satisfactory, we have found the second method particularly useful in the development of practical systems."
