D18-1245,Multi-Level Structured Self-Attentions for Distantly Supervised Relation Extraction,2018,0,11,3,1,21659,jinhua du,Proceedings of the 2018 Conference on Empirical Methods in Natural Language Processing,0,"Attention mechanism is often used in deep neural networks for distantly supervised relation extraction (DS-RE) to distinguish valid from noisy instances. However, traditional 1-D vector attention model is insufficient for learning of different contexts in the selection of valid instances to predict the relationship for an entity pair. To alleviate this issue, we propose a novel multi-level structured (2-D matrix) self-attention mechanism for DS-RE in a multi-instance learning (MIL) framework using bidirectional recurrent neural networks (BiRNN). In the proposed method, a structured word-level self-attention learns a 2-D matrix where each row vector represents a weight distribution for different aspects of an instance regarding two entities. Targeting the MIL issue, the structured sentence-level attention learns a 2-D matrix where each row vector represents a weight distribution on selection of different valid instances. Experiments conducted on two publicly available DS-RE datasets show that the proposed framework with multi-level structured self-attention mechanism significantly outperform baselines in terms of PR curves, P@N and F1 measures."
D18-1333,Learning to Jointly Translate and Predict Dropped Pronouns with a Shared Reconstruction Mechanism,2018,12,2,3,1,7026,longyue wang,Proceedings of the 2018 Conference on Empirical Methods in Natural Language Processing,0,"Pronouns are frequently omitted in pro-drop languages, such as Chinese, generally leading to significant challenges with respect to the production of complete translations. Recently, Wang et al. (2018) proposed a novel reconstruction-based approach to alleviating dropped pronoun (DP) translation problems for neural machine translation models. In this work, we improve the original model from two perspectives. First, we employ a shared reconstructor to better exploit encoder and decoder representations. Second, we jointly learn to translate and predict DPs in an end-to-end manner, to avoid the errors propagated from an external DP prediction model. Experimental results show that our approach significantly improves both translation performance and DP prediction accuracy."
D18-1334,Getting Gender Right in Neural Machine Translation,2018,22,18,3,1,5078,eva vanmassenhove,Proceedings of the 2018 Conference on Empirical Methods in Natural Language Processing,0,"Speakers of different languages must attend to and encode strikingly different aspects of the world in order to use their language correctly (Sapir, 1921; Slobin, 1996). One such difference is related to the way gender is expressed in a language. Saying {``}I am happy{''} in English, does not encode any additional knowledge of the speaker that uttered the sentence. However, many other languages do have grammatical gender systems and so such knowledge would be encoded. In order to correctly translate such a sentence into, say, French, the inherent gender information needs to be retained/recovered. The same sentence would become either {``}Je suis heureux{''}, for a male speaker or {``}Je suis heureuse{''} for a female one. Apart from morphological agreement, demographic factors (gender, age, etc.) also influence our use of language in terms of word choices or syntactic constructions (Tannen, 1991; Pennebaker et al., 2003). We integrate gender information into NMT systems. Our contribution is two-fold: (1) the compilation of large datasets with speaker information for 20 language pairs, and (2) a simple set of experiments that incorporate gender information into NMT for multiple language pairs. Our experiments show that adding a gender feature to an NMT system significantly improves the translation quality for some language pairs."
C18-1265,Tailoring Neural Architectures for Translating from Morphologically Rich Languages,2018,0,2,2,1,7213,peyman passban,Proceedings of the 27th International Conference on Computational Linguistics,0,"A morphologically complex word (MCW) is a hierarchical constituent with meaning-preserving subunits, so word-based models which rely on surface forms might not be powerful enough to translate such structures. When translating from morphologically rich languages (MRLs), a source word could be mapped to several words or even a full sentence on the target side, which means an MCW should not be treated as an atomic unit. In order to provide better translations for MRLs, we boost the existing neural machine translation (NMT) architecture with a double- channel encoder and a double-attentive decoder. The main goal targeted in this research is to provide richer information on the encoder side and redesign the decoder accordingly to benefit from such information. Our experimental results demonstrate that we could achieve our goal as the proposed model outperforms existing subword- and character-based architectures and showed significant improvements on translating from German, Russian, and Turkish into English."
C18-1321,Incorporating Deep Visual Features into Multiobjective based Multi-view Search Results Clustering,2018,0,1,4,0,30937,sayantan mitra,Proceedings of the 27th International Conference on Computational Linguistics,0,"Current paper explores the use of multi-view learning for search result clustering. A web-snippet can be represented using multiple views. Apart from textual view cued by both the semantic and syntactic information, a complimentary view extracted from images contained in the web-snippets is also utilized in the current framework. A single consensus partitioning is finally obtained after consulting these two individual views by the deployment of a multiobjective based clustering technique. Several objective functions including the values of a cluster quality measure measuring the goodness of partitionings obtained using different views and an agreement-disagreement index, quantifying the amount of oneness among multiple views in generating partitionings are optimized simultaneously using AMOSA. In order to detect the number of clusters automatically, concepts of variable length solutions and a vast range of permutation operators are introduced in the clustering process. Finally, a set of alternative partitioning are obtained on the final Pareto front by the proposed multi-view based multiobjective technique. Experimental results by the proposed approach on several benchmark test datasets of SRC with respect to different performance metrics evidently establish the power of visual and text-based views in achieving better search result clustering."
W17-5602,{M}ulti{N}ews: A Web collection of an Aligned Multimodal and Multilingual Corpus,2017,0,1,3,1,5094,haithem afli,Proceedings of the First Workshop on Curation and Applications of Parallel and Comparable Corpora,0,"Integrating Natural Language Processing (NLP) and computer vision is a promising effort. However, the applicability of these methods directly depends on the availability of a specific multimodal data that includes images and texts. In this paper, we present a collection of a Multimodal corpus of comparable texts and their images in 9 languages from the web news articles of Euronews website. This corpus has found widespread use in the NLP community in Multilingual and multimodal tasks. Here, we focus on its acquisition of the images and text data and their multilingual alignment."
W17-2004,Human Evaluation of Multi-modal Neural Machine Translation: A Case-Study on {E}-Commerce Listing Titles,2017,25,2,5,0,4092,iacer calixto,Proceedings of the Sixth Workshop on Vision and Language,0,"In this paper, we study how humans perceive the use of images as an additional knowledge source to machine-translate user-generated product listings in an e-commerce company. We conduct a human evaluation where we assess how a multi-modal neural machine translation (NMT) model compares to two text-only approaches: a conventional state-of-the-art attention-based NMT and a phrase-based statistical machine translation (PBSMT) model. We evaluate translations obtained with different systems and also discuss the data set of user-generated product listings, which in our case comprises both product listings and associated images. We found that humans preferred translations obtained with a PBSMT system to both text-only and multi-modal NMT over 56{\%} of the time. Nonetheless, human evaluators ranked translations from a multi-modal NMT model as better than those of a text-only NMT over 88{\%} of the time, which suggests that images do help NMT in this use-case."
W17-1608,Ethical Considerations in {NLP} Shared Tasks,2017,9,5,5,0.821677,4995,carla escartin,Proceedings of the First {ACL} Workshop on Ethics in Natural Language Processing,0,"Shared tasks are increasingly common in our field, and new challenges are suggested at almost every conference and workshop. However, as this has become an established way of pushing research forward, it is important to discuss how we researchers organise and participate in shared tasks, and make that information available to the community to allow further research improvements. In this paper, we present a number of ethical issues along with other areas of concern that are related to the competitive nature of shared tasks. As such issues could potentially impact on research ethics in the Natural Language Processing community, we also propose the development of a framework for the organisation of and participation in shared tasks that can help mitigate against these issues arising."
W17-1313,Identifying Effective Translations for Cross-lingual {A}rabic-to-{E}nglish User-generated Speech Search,2017,19,1,4,0,32067,ahmad khwileh,Proceedings of the Third {A}rabic Natural Language Processing Workshop,0,"Cross Language Information Retrieval (CLIR) systems are a valuable tool to enable speakers of one language to search for content of interest expressed in a different language. A group for whom this is of particular interest is bilingual Arabic speakers who wish to search for English language content using information needs expressed in Arabic queries. A key challenge in CLIR is crossing the language barrier between the query and the documents. The most common approach to bridging this gap is automated query translation, which can be unreliable for vague or short queries. In this work, we examine the potential for improving CLIR effectiveness by predicting the translation effectiveness using Query Performance Prediction (QPP) techniques. We propose a novel QPP method to estimate the quality of translation for an Arabic-English Cross-lingual User-generated Speech Search (CLUGS) task. We present an empirical evaluation that demonstrates the quality of our method on alternative translation outputs extracted from an Arabic-to-English Machine Translation system developed for this task. Finally, we show how this framework can be integrated in CLUGS to find relevant translations for improved retrieval performance."
I17-4027,{ADAPT} at {IJCNLP}-2017 Task 4: A Multinomial Naive {B}ayes Classification Approach for Customer Feedback Analysis task,2017,0,0,5,1,22365,pintu lohar,"Proceedings of the {IJCNLP} 2017, Shared Tasks",0,"In this age of the digital economy, promoting organisations attempt their best to engage the customers in the feedback provisioning process. With the assistance of customer insights, an organisation can develop a better product and provide a better service to its customer. In this paper, we analyse the real world samples of customer feedback from Microsoft Office customers in four languages, i.e., English, French, Spanish and Japanese and conclude a five-plus-one-classes categorisation (comment, request, bug, complaint, meaningless and undetermined) for meaning classification. The task is to {\%}access multilingual corpora annotated by the proposed meaning categorization scheme and develop a system to determine what class(es) the customer feedback sentences should be annotated as in four languages. We propose following approaches to accomplish this task: (i) a multinomial naive bayes (MNB) approach for multi-label classification, (ii) MNB with one-vs-rest classifier approach, and (iii) the combination of the multilabel classification-based and the sentiment classification-based approach. Our best system produces F-scores of 0.67, 0.83, 0.72 and 0.7 for English, Spanish, French and Japanese, respectively. The results are competitive to the best ones for all languages and secure 3rd and 5th position for Japanese and French, respectively, among all submitted systems."
I17-3009,Semantics-Enhanced Task-Oriented Dialogue Translation: A Case Study on Hotel Booking,2017,0,2,5,1,7026,longyue wang,"Proceedings of the {IJCNLP} 2017, System Demonstrations",0,"We showcase TODAY, a semantics-enhanced task-oriented dialogue translation system, whose novelties are: (i) task-oriented named entity (NE) definition and a hybrid strategy for NE recognition and translation; and (ii) a novel grounded semantic method for dialogue understanding and task-order management. TODAY is a case-study demo which can efficiently and accurately assist customers and agents in different languages to reach an agreement in a dialogue for the hotel booking."
I17-1093,Demographic Word Embeddings for Racism Detection on {T}witter,2017,24,3,3,1,15356,mohammed hasanuzzaman,Proceedings of the Eighth International Joint Conference on Natural Language Processing (Volume 1: Long Papers),0,"Most social media platforms grant users freedom of speech by allowing them to freely express their thoughts, beliefs, and opinions. Although this represents incredible and unique communication opportunities, it also presents important challenges. Online racism is such an example. In this study, we present a supervised learning strategy to detect racist language on Twitter based on word embedding that incorporate demographic (Age, Gender, and Location) information. Our methodology achieves reasonable classification accuracy over a gold standard dataset (F1=76.3{\%}) and significantly improves over the classification performance of demographic-agnostic models."
E17-2095,Context-Aware Graph Segmentation for Graph-Based Translation,2017,10,0,2,1,5774,liangyou li,"Proceedings of the 15th Conference of the {E}uropean Chapter of the Association for Computational Linguistics: Volume 2, Short Papers",0,"In this paper, we present an improved graph-based translation model which segments an input graph into node-induced subgraphs by taking source context into consideration. Translations are generated by combining subgraph translations left-to-right using beam search. Experiments on Chinese{--}English and German{--}English demonstrate that the context-aware segmentation significantly improves the baseline graph-based model."
E17-2101,Using Images to Improve Machine-Translating {E}-Commerce Product Listings.,2017,25,5,6,0,4092,iacer calixto,"Proceedings of the 15th Conference of the {E}uropean Chapter of the Association for Computational Linguistics: Volume 2, Short Papers",0,"In this paper we study the impact of using images to machine-translate user-generated e-commerce product listings. We study how a multi-modal Neural Machine Translation (NMT) model compares to two text-only approaches: a conventional state-of-the-art attentional NMT and a Statistical Machine Translation (SMT) model. User-generated product listings often do not constitute grammatical or well-formed sentences. More often than not, they consist of the juxtaposition of short phrases or keywords. We train our models end-to-end as well as use text-only and multi-modal NMT models for re-ranking $n$-best lists generated by an SMT model. We qualitatively evaluate our user-generated training data also analyse how adding synthetic data impacts the results. We evaluate our models quantitatively using BLEU and TER and find that (i) additional synthetic data has a general positive impact on text-only and multi-modal NMT models, and that (ii) using a multi-modal NMT model for re-ranking n-best lists improves TER significantly across different n-best list sizes."
D17-1301,Exploiting Cross-Sentence Context for Neural Machine Translation,2017,18,24,3,1,7026,longyue wang,Proceedings of the 2017 Conference on Empirical Methods in Natural Language Processing,0,"In translation, considering the document as a whole can help to resolve ambiguities and inconsistencies. In this paper, we propose a cross-sentence context-aware approach and investigate the influence of historical contextual information on the performance of neural machine translation (NMT). First, this history is summarized in a hierarchical way. We then integrate the historical representation into NMT in two strategies: 1) a warm-start of encoder and decoder states, and 2) an auxiliary context source for updating decoder states. Experimental results on a large Chinese-English translation task show that our approach significantly improves upon a strong attention-based NMT system by up to +2.1 BLEU points."
W16-4015,Integrating Optical Character Recognition and Machine Translation of Historical Documents,2016,17,0,2,1,5094,haithem afli,Proceedings of the Workshop on Language Technology Resources and Tools for Digital Humanities ({LT}4{DH}),0,"Machine Translation (MT) plays a critical role in expanding capacity in the translation industry. However, many valuable documents, including digital documents, are encoded in non-accessible formats for machine processing (e.g., Historical or Legal documents). Such documents must be passed through a process of Optical Character Recognition (OCR) to render the text suitable for MT. No matter how good the OCR is, this process introduces recognition errors, which often renders MT ineffective. In this paper, we propose a new OCR to MT framework based on adding a new OCR error correction module to enhance the overall quality of translation. Experimentation shows that our new system correction based on the combination of Language Modeling and Translation methods outperforms the baseline system by nearly 30{\%} relative improvement."
W16-3403,Improving Phrase-Based {SMT} Using Cross-Granularity Embedding Similarity,2016,19,2,3,1,7213,peyman passban,Proceedings of the 19th Annual Conference of the {E}uropean Association for Machine Translation,0,None
W16-3404,Comparing Translator Acceptability of {TM} and {SMT} Outputs,2016,13,3,2,0.921596,20875,joss moorkens,Proceedings of the 19th Annual Conference of the {E}uropean Association for Machine Translation,0,None
W16-2372,The {ADAPT} Bilingual Document Alignment system at {WMT}16,2016,14,3,4,1,22365,pintu lohar,"Proceedings of the First Conference on Machine Translation: Volume 2, Shared Task Papers",0,"Comparable corpora have been shown ton be useful in several multilingual naturaln language processing (NLP) tasks. Manyn previous papers have focused on how ton improve the extraction of parallel datan from this kind of corpus on different levels. In this paper, we are interested in improving the quality of bilingual comparable corpora according to increased document alignment score. We describe ourn participation in the bilingual documentn alignment shared task of the First Conference on Machine Translation (WMT16).n We propose a technique based on sourceto-target sentence- and word-based scoresn and the fraction of matched source namedn entities. We performed our experiments onn English-to-French document alignmentsn for this bilingual task."
W16-0602,Extending Phrase-Based Translation with Dependencies by Using Graphs,2016,13,0,2,1,5774,liangyou li,Proceedings of the 2nd Workshop on Semantics-Driven Machine Translation ({S}ed{MT} 2016),0,"In this paper, we propose a graph-based translation model which takes advantage of discontinuous phrases. The model segments a graph which combines bigram and dependency relations into subgraphs and produces translations by combining translations of these subgraphs. Experiments on Chinesexe2x80x90English and Germanxe2x80x90English tasks show that our system is significantly better than the phrase-based model. By explicitly modeling the graph segmentation, our system gains further improvement."
P16-2045,Phrase-Level Combination of {SMT} and {TM} Using Constrained Word Lattice,2016,17,1,2,1,5774,liangyou li,Proceedings of the 54th Annual Meeting of the Association for Computational Linguistics (Volume 2: Short Papers),0,"Constrained translation has improved statistical machine translation (SMT) by combining it with translation memory (TM) at sentence-level. In this paper, we propose using a constrained word lattice, which encodes input phrases and TM constraints together, to combine SMT and TM at phrase-level. Experiments on Englishxe2x80x90 Chinese and Englishxe2x80x90French show that our approach is significantly better than previous combination methods, including sentence-level constrained translation and a recent phrase-level combination."
P16-1010,Graph-Based Translation Via Graph Segmentation,2016,27,0,2,1,5774,liangyou li,Proceedings of the 54th Annual Meeting of the Association for Computational Linguistics (Volume 1: Long Papers),1,None
N16-1113,A Novel Approach to Dropped Pronoun Translation,2016,32,6,5,1,7026,longyue wang,Proceedings of the 2016 Conference of the North {A}merican Chapter of the Association for Computational Linguistics: Human Language Technologies,0,"Dropped Pronouns (DP) in which pronounsn are frequently dropped in the source languagen but should be retained in the target languagen are challenge in machine translation. In response to this problem, we propose a semisupervised approach to recall possibly missingn pronouns in the translation. Firstly, we buildn training data for DP generation in which then DPs are automatically labelled according ton the alignment information from a parallel corpus. Secondly, we build a deep learning-basedn DP generator for input sentences in decodingn when no corresponding references exist. Moren specifically, the generation is two-phase: (1)n DP position detection, which is modeled as an sequential labelling task with recurrent neuraln networks; and (2) DP prediction, which employs a multilayer perceptron with rich features. Finally, we integrate the above outputsn into our translation system to recall missingn pronouns by both extracting rules from then DP-labelled training data and translating then DP-generated input sentences. Experimentaln results show that our approach achieves a significant improvement of 1.58 BLEU points inn translation performance with 66% F-score forn DP generation accuracy."
L16-1002,Using {B}abel{N}et to Improve {OOV} Coverage in {SMT},2016,0,8,2,1,21659,jinhua du,Proceedings of the Tenth International Conference on Language Resources and Evaluation ({LREC}'16),0,"Out-of-vocabulary words (OOVs) are a ubiquitous and difficult problem in statistical machine translation (SMT). This paper studies different strategies of using BabelNet to alleviate the negative impact brought about by OOVs. BabelNet is a multilingual encyclopedic dictionary and a semantic network, which not only includes lexicographic and encyclopedic terms, but connects concepts and named entities in a very large network of semantic relations. By taking advantage of the knowledge in BabelNet, three different methods ― using direct training data, domain-adaptation techniques and the BabelNet API ― are proposed in this paper to obtain translations for OOVs to improve system performance. Experimental results on English―Polish and English―Chinese language pairs show that domain adaptation can better utilize BabelNet knowledge and performs better than other methods. The results also demonstrate that BabelNet is a really useful tool for improving translation performance of SMT systems."
L16-1003,Enhancing Access to Online Education: Quality Machine Translation of {MOOC} Content,2016,19,1,8,0,12066,valia kordoni,Proceedings of the Tenth International Conference on Language Resources and Evaluation ({LREC}'16),0,"The present work is an overview of the TraMOOC (Translation for Massive Open Online Courses) research and innovation project, a machine translation approach for online educational content. More specifically, videolectures, assignments, and MOOC forum text is automatically translated from English into eleven European and BRIC languages. Unlike previous approaches to machine translation, the output quality in TraMOOC relies on a multimodal evaluation schema that involves crowdsourcing, error type markup, an error taxonomy for translation model comparison, and implicit evaluation via text mining, i.e. entity recognition and its performance comparison between the source and the translated text, and sentiment analysis on the students{'} forum posts. Finally, the evaluation output will result in more and better quality in-domain parallel data that will be fed back to the translation engine for higher quality output. The translation service will be incorporated into the Iversity MOOC platform and into the VideoLectures.net digital library portal."
