W14-0146,Registers in the System of Semantic Relations in pl{W}ord{N}et,2014,13,2,2,1,6131,marek maziarz,Proceedings of the Seventh Global {W}ordnet Conference,0,"Lexicalised concepts are represented in wordnets by word-sense pairs. The strength of markedness is one of the factors which influence word use. Stylistically unmarked words are largely contextneutral. Technical terms, obsolete words, xe2x80x9cofficialesexe2x80x9d, slangs, obscenities and so on are all marked, often strongly, and that limits their use considerably. We discuss the position of register and markedness in wordnets with respect to semantic relations, and we list typical values of register. We illustrate the discussion with the system of registers in plWordNet, the largest Polish wordnet. We present a decision tree for the assignment of marking labels, and examine the consistency of the editing decisions based on that tree."
kedzia-piasecki-2014-ruled,"Ruled-based, Interlingual Motivated Mapping of pl{W}ord{N}et onto {SUMO} Ontology",2014,13,2,2,1,31046,pawel kkedzia,Proceedings of the Ninth International Conference on Language Resources and Evaluation ({LREC}'14),0,"In this paper we study a rule-based approach to mapping plWordNet onto SUMO Upper Ontology on the basis of the already existing mappings: plWordNet -- the Princeton WordNet -- SUMO. Information acquired from the inter-lingual relations between plWordNet and Princeton WordNet and the relations between Princeton WordNet and SUMO ontology are used in the proposed rules. Several mapping rules together with the matching examples are presented. The automated mapping results were evaluated in two steps, (i) we automatically checked formal correctness of the mappings for the pairs of plWordNet synset and SUMO concept, (ii) a subset of 160 mapping examples was manually checked by two+one linguists. We analyzed types of the mapping errors and their causes. The proposed rules expressed very high precision, especially when the errors in the resources are taken into account. Because both wordnets were constructed independently and as a result the obtained rules are not trivial and they reveal the differences between both wordnets and both languages."
R13-1056,Evaluation of baseline information retrieval for {P}olish open-domain Question Answering system,2013,23,2,3,0.5,6176,michal marcinczuk,Proceedings of the International Conference Recent Advances in Natural Language Processing {RANLP} 2013,0,"We report on our efforts aimed at building an Open Domain Question Answering system for Polish. Our contribution is twofold: we gathered a set of questionxe2x80x90answer pairs from various Polish sources and we performed an empirical evaluation of two re-ranking methods. The gathered collection contains factoid, list, non-factoid and yes-no questions, which makes a challenging material for experiments. We show that using two re-ranking methods based on term proximity allows to obtain significant improvement on simple information retrieval baseline. The improvement is observed as finding more answer-bearing documents among the topn search results."
R13-1058,Beyond the Transfer-and-Merge {W}ordnet Construction: pl{W}ord{N}et and a Comparison with {W}ord{N}et,2013,32,8,2,1,6131,marek maziarz,Proceedings of the International Conference Recent Advances in Natural Language Processing {RANLP} 2013,0,"Wordnets are lexico-semantic resources essential in many NLP tasks. Princeton WordNet is the most widely known, and the most influential, among them. Word- nets for languages other than English tend to adopt unquestioningly WordNet's struc- ture and its net of lexicalised concepts. We discuss a large wordnet constructed inde- pendently of WordNet, upon a model with a small yet significant difference. A map- ping onto WordNet is under way; the large portions already linked open up a unique perspective on the comparison of similar but not fully compatible lexical resources. We also try to characterise numerically a wordnet's aptitude for NLP applications."
R13-1073,Information Spreading in Expanding {W}ordnet Hypernymy Structure,2013,23,1,1,1,6159,maciej piasecki,Proceedings of the International Conference Recent Advances in Natural Language Processing {RANLP} 2013,0,"The paper presents a wordnet expansion algorithm, which is based on lexicosemantic relations extracted from large text corpora. We do not assume that the extracted relation instances (i.e. word pairs) are described by probabilities. Thus, results produced by any method, including pattern-based and Distributional Semantics approaches can be used. The algorithm is based on a general spreading activation model. Support for word-to-word semantic associations is first mapped on the existing wordnet structure. Next, the support is spread over the wordnet network in order to find attachment areas for a new word. Evaluation and comparison with other approaches in experiments on Princeton WordNet 3.0 is presented."
broda-etal-2012-tools,Tools for pl{W}ord{N}et Development. Presentation and Perspectives,2012,15,5,3,0.441176,39630,bartosz broda,Proceedings of the Eighth International Conference on Language Resources and Evaluation ({LREC}'12),0,"Building a wordnet is a serious undertaking. Fortunately, Language Technology (LT) can improve the process of wordnet construction both in terms of quality and cost. In this paper we present LT tools used during the construction of plWordNet and their influence on the lexicographer's work-flow. LT is employed in plWordNet development on every possible step: from data gathering through data analysis to data presentation. Nevertheless, every decision requires input from the lexicographer, but the quality of supporting tools is an important factor. Thus a limited evaluation of usefulness of employed tools is carried out on the basis of questionnaires."
piasecki-etal-2012-recognition,Recognition of {P}olish Derivational Relations Based on Supervised Learning Scheme,2012,13,9,1,1,6159,maciej piasecki,Proceedings of the Eighth International Conference on Language Resources and Evaluation ({LREC}'12),0,"The paper presents construction of {\textbackslash}emph{Derywator} -- a language tool for the recognition of Polish derivational relations. It was built on the basis of machine learning in a way following the bootstrapping approach: a limited set of derivational pairs described manually by linguists in plWordNet is used to train {\textbackslash}emph{Derivator}. The tool is intended to be applied in semi-automated expansion of plWordNet with new instances of derivational relations. The training process is based on the construction of two transducers working in the opposite directions: one for prefixes and one for suffixes. Internal stem alternations are recognised, recorded in a form of mapping sequences and stored together with transducers. Raw results produced by {\textbackslash}emph{Derivator} undergo next corpus-based and morphological filtering. A set of derivational relations defined in plWordNet is presented. Results of tests for different derivational relations are discussed. A problem of the necessary corpus-based semantic filtering is analysed. The presented tool depends to a very little extent on the hand-crafted knowledge for a particular language, namely only a table of possible alternations and morphological filtering rules must be exchanged and it should not take longer than a couple of working days."
kurc-etal-2012-constraint,Constraint Based Description of {P}olish Multiword Expressions,2012,7,6,2,0,43337,roman kurc,Proceedings of the Eighth International Conference on Language Resources and Evaluation ({LREC}'12),0,"We present an approach to the description of Polish Multi-word Expressions (MWEs) which is based on expressions in the WCCL language of morpho-syntactic constraints instead of grammar rules or transducers. For each MWE its basic morphological form and the base forms of its constituents are specified but also each MWE is assigned to a class on the basis of its syntactic structure. For each class a WCCL constraint is defined which is parametrised by string variables referring to MWE constituent base forms or inflected forms. The constraint specifies a minimal set of conditions that must be fulfilled in order to recognise an occurrence of the given MWE in text with high accuracy. Our formalism is focused on the efficient description of large MWE lexicons for the needs of utilisation in text processing. The formalism allows for the relatively easy representation of flexible word order and discontinuous constructions. Moreover, there is no necessity for the full specification of the MWE grammatical structure. Only some aspects of the particular MWE structure can be selected in way facilitating the target accuracy of recognition. On the basis of a set of simple heuristics, WCCL-based representation of MWEs can be automatically generated from a list of MWE base forms. The proposed representation was applied on a practical scale for the description of a large set of Polish MWEs included in plWordNet."
C12-2101,A Strategy of Mapping {P}olish {W}ord{N}et onto {P}rinceton {W}ord{N}et,2012,16,20,3,0.625,6142,ewa rudnicka,Proceedings of {COLING} 2012: Posters,0,"We present a strategy and the early results of the mapping of plWordNet xe2x80x90 one of the largest such language resources in existence xe2x80x90 onto Princeton Wo rdNet. The fundamental structural premise of plWordNet differs from those of most other wordnets: lexical units rather than synsets are the basic building blocks. The addition of new material to plWordNet is consistently informed by semantic relations and by various analyses of large corpora. The mapping is difficult because of the subtly distinct structures and because of WordN etxe2x80x99s focus on synsets. We have designed a set of inter-lingual semantic relations and an effectiv e mapping procedure. In the course of mapping, we have discovered a range of systematic difference s between plWordNet and WordNet, and proposed ways of accounting for such differences."
wittenburg-etal-2010-resource,Resource and Service Centres as the Backbone for a Sustainable Service Infrastructure,2010,0,12,10,0,39140,peter wittenburg,Proceedings of the Seventh International Conference on Language Resources and Evaluation ({LREC}'10),0,"Currently, research infrastructures are being designed and established in many disciplines since they all suffer from an enormous fragmentation of their resources and tools. In the domain of language resources and tools the CLARIN initiative has been funded since 2008 to overcome many of the integration and interoperability hurdles. CLARIN can build on knowledge and work from many projects that were carried out during the last years and wants to build stable and robust services that can be used by researchers. Here service centres will play an important role that have the potential of being persistent and that adhere to criteria as they have been established by CLARIN. In the last year of the so-called preparatory phase these centres are currently developing four use cases that can demonstrate how the various pillars CLARIN has been working on can be integrated. All four use cases fulfil the criteria of being cross-national."
broda-etal-2010-building,Building a Node of the Accessible Language Technology Infrastructure,2010,15,5,3,0,39630,bartosz broda,Proceedings of the Seventh International Conference on Language Resources and Evaluation ({LREC}'10),0,"A limited prototype of the CLARIN Language Technology Infrastructure (LTI) node is presented. The node prototype provides several types of web services for Polish. The functionality encompasses morpho-syntactic processing, shallow semantic processing of corpus on the basis of the SuperMatrix system and plWordNet browsing. We take the prototype as the starting point for the discussion on requirements that must be fulfilled by the LTI. Some possible solutions are proposed for less frequently discussed problems, e.g. streaming processing of language data on the remote processing node. We experimentally investigate how to tackle with several requirements from many discussed. Such aspects as processing large volumes of data, asynchronous mode of processing and scalability of the architecture to large number of users got especial attention in the constructed prototype of the Web Service for morpho-syntactic processing of Polish called TaKIPI-WS (http://plwordnet.pwr.wroc.pl/clarin/ws/takipi/). TaKIPI-WS is a distributed system with a three-layer architecture, an asynchronous model of request handling and multi-agent-based processing. TaKIPI-WS consists of three layers: WS Interface, Database and Daemons. The role of the Database is to store and exchange data between the Interface and the Daemons. The Daemons (i.e. taggers) are responsible for executing the requests queued in the database. Results of the performance tests are presented in the paper, too."
broda-etal-2008-corpus,Corpus-based Semantic Relatedness for the Construction of {P}olish {W}ord{N}et,2008,16,14,3,0,39630,bartosz broda,Proceedings of the Sixth International Conference on Language Resources and Evaluation ({LREC}'08),0,"The construction of a wordnet, a labour-intensive enterprise, can be significantly assisted by automatic grouping of lexical material and discovery of lexical semantic relations. The objective is to ensure high quality of automatically acquired results before they are presented for lexicographers approval. We discuss a software tool that suggests synset members using a measure of semantic relatedness with a given verb or adjective; this extends previous work on nominal synsets in Polish WordNet. Syntactically-motivated constraints are deployed on a large morphologically annotated corpus of Polish. Evaluation has been performed via the WordNet-Based Similarity Test and additionally supported by human raters. A lexicographer also manually assessed a suitable sample of suggestions. The results compare favourably with other known methods of acquiring semantic relations."
