L16-1656,{S}em{R}el{D}ata ― Multilingual Contextual Annotation of Semantic Relations between Nominals: Dataset and Guidelines,2016,15,2,2,0.740741,32428,darina benikova,Proceedings of the Tenth International Conference on Language Resources and Evaluation ({LREC}'16),0,"Semantic relations play an important role in linguistic knowledge representation. Although their role is relevant in the context of written text, there is no approach or dataset that makes use of contextuality of classic semantic relations beyond the boundary of one sentence. We present the SemRelData dataset that contains annotations of semantic relations between nominals in the context of one paragraph. To be able to analyse the universality of this context notion, the annotation was performed on a multi-lingual and multi-genre corpus. To evaluate the dataset, it is compared to large, manually created knowledge resources in the respective languages. The comparison shows that knowledge bases not only have coverage gaps; they also do not account for semantic relations that are manifested in particular contexts only, yet still play an important role for text cohesion."
C16-2049,Demonstrating Ambient Search: Implicit Document Retrieval for Speech Streams,2016,13,0,5,0,5570,benjamin milde,"Proceedings of {COLING} 2016, the 26th International Conference on Computational Linguistics: System Demonstrations",0,"In this demonstration paper we describe Ambient Search, a system that displays and retrieves documents in real time based on speech input. The system operates continuously in ambient mode, i.e. it generates speech transcriptions and identifies main keywords and keyphrases, while also querying its index to display relevant documents without explicit query. Without user intervention, the results are dynamically updated; users can choose to interact with the system at any time, employing a conversation protocol that is enriched with the ambient information gathered continuously. Our evaluation shows that Ambient Search outperforms another implicit speech-based information retrieval system. Ambient search is available as open source software."
C16-1196,Ambient Search: A Document Retrieval System for Speech Streams,2016,18,2,5,0,5570,benjamin milde,"Proceedings of {COLING} 2016, the 26th International Conference on Computational Linguistics: Technical Papers",0,"We present Ambient Search, an open source system for displaying and retrieving relevant documents in real time for speech input. The system works ambiently, that is, it unobstructively listens to speech streams in the background, identifies keywords and keyphrases for query construction and continuously serves relevant documents from its index. Query terms are ranked with Word2Vec and TF-IDF and are continuously updated to allow for ongoing querying of a document collection. The retrieved documents, in our case Wikipedia articles, are visualized in real time in a browser interface. Our evaluation shows that Ambient Search compares favorably to another implicit information retrieval system on speech streams. Furthermore, we extrinsically evaluate multiword keyphrase generation, showing positive impact for manual transcriptions."
R15-1027,Distributional Semantics for Resolving Bridging Mentions,2015,32,3,3,0,37352,tim feuerbach,Proceedings of the International Conference Recent Advances in Natural Language Processing,0,"We explore the impact of adding distributional knowledge to a state-of-the-art coreference resolution system. By integrating features based on word and context expansions from a distributional thesaurus (DT), automatically mined IS-A relationships and shallow syntactical clues into the Berkeley system (Durrett and Klein, 2013), we are able to increase its F1 score on bridging mentions, i.e. coreferent mentions with non-identical heads, by 8.29 points. Our semantic features improve over the Web-based features of Bansal and Klein (2012). Since bridging mentions are a hard but infrequent class of coreference, this leads to merely small improvements in the overall system."
P15-4018,{J}o{B}im{V}iz: A Web-based Visualization for Graph-based Distributional Semantic Models,2015,22,9,4,1,17254,eugen ruppert,Proceedings of {ACL}-{IJCNLP} 2015 System Demonstrations,0,"This paper introduces a web-based visualization framework for graph-based distributional semantic models. The visualization supports a wide range of data structures, including term similarities, similarities of contexts, support of multiword expressions, sense clusters for terms and sense labels. In contrast to other browsers of semantic resources, our visualization accepts input sentences, which are subsequently processed with languageindependent or language-dependent ways to compute term-context representations. Our web demonstrator currently contains models for multiple languages, based on different preprocessing such as dependency parsing and n-gram context representations. These models can be accessed from a database, the web interface and via a RESTful API. The latter facilitates the quick integration of such models in research prototypes."
N15-1098,Do Supervised Distributional Methods Really Learn Lexical Inference Relations?,2015,27,100,3,0,3267,omer levy,Proceedings of the 2015 Conference of the North {A}merican Chapter of the Association for Computational Linguistics: Human Language Technologies,0,"Distributional representations of words have been recently used in supervised settings for recognizing lexical inference relations between word pairs, such as hypernymy and entailment. We investigate a collection of these state-of-the-art methods, and show that they do not actually learn a relation between two words. Instead, they learn an independent property of a single word in the pair: whether that word is a xe2x80x9cprototypical hypernymxe2x80x9d."
J15-2006,"Book Reviews: Ontology-Based Interpretation of Natural Language by Philipp Cimiano, Christina Unger and John {M}c{C}rae",2015,-1,-1,1,1,2565,chris biemann,Computational Linguistics,0,None
D15-1290,A Single Word is not Enough: Ranking Multiword Expressions Using Distributional Semantics,2015,25,15,2,1,24663,martin riedl,Proceedings of the 2015 Conference on Empirical Methods in Natural Language Processing,0,"We present a new unsupervised mechanism, which ranks word n-grams according to their multiwordness. It heavily relies on a new uniqueness measure that computes, based on a distributional thesaurus, how often an n-gram could be replaced in context by a single-worded term. In addition with a downweighting mechanism for incomplete terms this forms a new measure called DRUID. Results show large improvements on two small test sets over competitive baselines. We demonstrate the scalability of the method to large corpora, and the independence of the measure of shallow syntactic filtering."
W14-5117,Multiobjective Optimization and Unsupervised Lexical Acquisition for Named Entity Recognition and Classification,2014,0,2,3,0,38305,govind,Proceedings of the 11th International Conference on Natural Language Processing,0,None
P14-5016,Automatic Annotation Suggestions and Custom Annotation Layers in {W}eb{A}nno,2014,14,21,2,1,282,seid yimam,Proceedings of 52nd Annual Meeting of the Association for Computational Linguistics: System Demonstrations,0,"In this paper, we present a flexible approach to the efficient and exhaustive manual annotation of text documents. For this purpose, we extend WebAnno (Yimam et al., 2013) an open-source web-based annotation tool. 1 While it was previously limited to specific annotation layers, our extension allows adding and configuring an arbitrary number of layers through a web-based UI. These layers can be annotated separately or simultaneously, and support most types of linguistic annotations such as spans, semantic classes, dependency relations, lexical chains, and morphology. Further, we tightly integrate a generic machine learning component for automatic annotation suggestions of span annotations. In two case studies, we show that automatic annotation suggestions, combined with our split-pane UI concept, significantly reduces annotation time."
P14-1096,That{'}s sick dude!: Automatic identification of word sense change across different timescales,2014,28,36,4,0,39200,sunny mitra,Proceedings of the 52nd Annual Meeting of the Association for Computational Linguistics (Volume 1: Long Papers),1,"In this paper, we propose an unsupervised method to identify noun sense changes based on rigorous analysis of time-varying text data available in the form of millions of digitized books. We construct distributional thesauri based networks from data at different time points and cluster each of them separately to obtain word-centric sense clusters corresponding to the different time points. Subsequently, we compare these sense clusters of two different time points to find if (i) there is birth of a new sense or (ii) if an older sense has got split into more than one sense or (iii) if a newer sense has been formed from the joining of older senses or (iv) if a particular sense has died. We conduct a thorough evaluation of the proposed methodology both manually as well as through comparison with WordNet. Manual evaluation indicates that the algorithm could correctly identify 60.4% birth cases from a set of 48 randomly picked samples and 57% split/join cases from a set of 21 randomly picked samples. Remarkably, in 44% cases the birth of a novel sense is attested by WordNet, while in 46% cases and 43% cases split and join are respectively confirmed by WordNet. Our approach can be applied for lexicography, as well as for applications like word sense disambiguation or semantic search."
riedl-etal-2014-distributed,Distributed Distributional Similarities of {G}oogle {B}ooks Over the Centuries,2014,14,6,3,1,24663,martin riedl,Proceedings of the Ninth International Conference on Language Resources and Evaluation ({LREC}'14),0,"This paper introduces a distributional thesaurus and sense clusters computed on the complete Google Syntactic N-grams, which is extracted from Google Books, a very large corpus of digitized books published between 1520 and 2008. We show that a thesaurus computed on such a large text basis leads to much better results than using smaller corpora like Wikipedia. We also provide distributional thesauri for equal-sized time slices of the corpus. While distributional thesauri can be used as lexical resources in NLP tasks, comparing word similarities over time can unveil sense change of terms across different decades or centuries, and can serve as a resource for diachronic lexicography. Thesauri and clusters are available for download."
benikova-etal-2014-nosta,{N}o{S}ta-{D} Named Entity Annotation for {G}erman: Guidelines and Dataset,2014,16,26,2,0.740741,32428,darina benikova,Proceedings of the Ninth International Conference on Language Resources and Evaluation ({LREC}'14),0,"We describe the annotation of a new dataset for German Named Entity Recognition (NER). The need for this dataset is motivated by licensing issues and consistency issues of existing datasets. We describe our approach to creating annotation guidelines based on linguistic and semantic considerations, and how we iteratively refined and tested them in the early stages of annotation in order to arrive at the largest publicly available dataset for German NER, consisting of over 31,000 manually annotated sentences (over 591,000 tokens) from German Wikipedia and German online news. We provide a number of statistics on the dataset, which indicate its high quality, and discuss legal aspects of distributing the data as a compilation of citations. The data is released under the permissive CC-BY license, and will be fully available for download in September 2014 after it has been used for the GermEval 2014 shared task on NER. We further provide the full annotation guidelines and links to the annotation tool used for the creation of this resource."
cholakov-etal-2014-lexical,Lexical Substitution Dataset for {G}erman,2014,10,4,2,0,33554,kostadin cholakov,Proceedings of the Ninth International Conference on Language Resources and Evaluation ({LREC}'14),0,"This article describes a lexical substitution dataset for German. The whole dataset contains 2,040 sentences from the German Wikipedia, with one target word in each sentence. There are 51 target nouns, 51 adjectives, and 51 verbs randomly selected from 3 frequency groups based on the lemma frequency list of the German WaCKy corpus. 200 sentences have been annotated by 4 professional annotators and the remaining sentences by 1 professional annotator and 5 additional annotators who have been recruited via crowdsourcing. The resulting dataset can be used to evaluate not only lexical substitution systems, but also different sense inventories and word sense disambiguation systems."
C14-1136,Combining Supervised and Unsupervised Parsing for Distributional Similarity,2014,34,2,3,1,24663,martin riedl,"Proceedings of {COLING} 2014, the 25th International Conference on Computational Linguistics: Technical Papers",0,"In this paper, we address the role of syntactic parsing for distributional similarity. On the one hand, we are exploring distributional similarities as an extrinsic test bed for unsupervised parsers. On the other hand, we explore whether single unsupervised parsers, or their combination, can contribute to better distributional similarities, or even replace supervised parsing as a preprocessing step for word similarity. We evaluate distributional thesauri against manually created taxonomies both for English and German for five unsupervised parsers. While for English, a supervised parser is the best single parser in this evaluation, we find an unsupervised parser to work best for German. For both languages, we show significant improvements in word similarity when combining features from supervised and unsupervised parsers. To our knowledge, this is the first work where unsupervised parsers are systematically evaluated extrinsically in a semantic task, and the first work to show that unsupervised parsing can complement and even replace supervised parsing, when used as a pre-processing feature."
W13-5002,{J}o{B}im{T}ext Visualizer: A Graph-based Approach to Contextualizing Distributional Similarity,2013,27,6,1,1,2565,chris biemann,Proceedings of {T}ext{G}raphs-8 Graph-based Methods for Natural Language Processing,0,"We introduce an interactive visualization component for the JoBimText project. JoBimText is an open source platform for large-scale distributional semantics based on graph representations. First we describe the underlying technology for computing a distributional thesaurus on words using bipartite graphs of words and context features, and contextualizing the list of semantically similar words towards a given sentential context using graphbased ranking. Then we demonstrate the capabilities of this contextualized text expansion technology in an interactive visualization. The visualization can be used as a semantic parser providing contextualized expansions of words in text as well as disambiguation to word senses induced by graph clustering, and is provided as an open source tool."
W13-5006,From Global to Local Similarities: A Graph-Based Contextualization Method using Distributional Thesauri,2013,24,1,2,1,24663,martin riedl,Proceedings of {T}ext{G}raphs-8 Graph-based Methods for Natural Language Processing,0,"After recasting the computation of a distributional thesaurus in a graph-based framework for term similarity, we introduce a new contextualization method that generates, for each term occurrence in a text, a ranked list of terms that are semantically similar and compatible with the given context. The framework is instantiated by the definition of term and context, which we derive from dependency parses in this work. Evaluating our approach on a standard data set for lexical substitution, we show substantial improvements over a strong non-contextualized baseline across all parts of speech. In contrast to comparable approaches, our framework defines an unsupervised generative method for similarity in context and does not rely on the existence of lexical resources as a source for candidate expansions."
W13-1409,Exploring Cities in Crime: Significant Concordance and Co-occurrence in Quantitative Literary Analysis,2013,38,3,4,0,41087,janneke rauscher,Proceedings of the Workshop on Computational Linguistics for Literature,0,"We present CoocViewer, a graphical analysis tool for the purpose of quantitative literary analysis, and demonstrate its use on a corpus of crime novels. The tool displays words, their significant co-occurrences, and contains a new visualization for significant concordances. Contexts of words and co-occurrences can be displayed. After reviewing previous research and current challenges in the newly emerging field of quantitative literary research, we demonstrate how CoocViewer allows comparative research on literary corpora in a project-specific study, and how we can confirm or enhance our hypotheses through quantitative literary analysis."
S13-2007,{S}em{E}val-2013 Task 5: Evaluating Phrasal Semantics,2013,17,19,4,0,39671,ioannis korkontzelos,"Second Joint Conference on Lexical and Computational Semantics (*{SEM}), Volume 2: Proceedings of the Seventh International Workshop on Semantic Evaluation ({S}em{E}val 2013)",0,"This paper describes the SemEval-2013 Task 5: xe2x80x9cEvaluating Phrasal Semanticsxe2x80x9d. Its first subtask is about computing the semantic similarity of words and compositional phrases of minimal length. The second one addresses deciding the compositionality of phrases in a given context. The paper discusses the importance and background of these subtasks and their structure. In succession, it introduces the systems that participated and discusses evaluation results."
P13-4001,"{W}eb{A}nno: A Flexible, Web-based and Visually Supported System for Distributed Annotations",2013,11,61,4,1,282,seid yimam,Proceedings of the 51st Annual Meeting of the Association for Computational Linguistics: System Demonstrations,0,"We present WebAnno, a general purpose web-based annotation tool for a wide range of linguistic annotations. WebAnno offers annotation project management, freely configurable tagsets and the management of users in different roles. WebAnno uses modern web technology for visualizing and editing annotations in a web browser. It supports arbitrarily large documents, pluggable import/export filters, the curation of annotations across various users, and an interface to farming out annotations to a crowdsourcing platform. Currently WebAnno allows part-ofspeech, named entity, dependency parsing and co-reference chain annotations. The architecture design allows adding additional modes of visualization and editing, when new kinds of annotations are to be supported."
N13-1119,Three Knowledge-Free Methods for Automatic Lexical Chain Extraction,2013,37,10,2,1,18079,steffen remus,Proceedings of the 2013 Conference of the North {A}merican Chapter of the Association for Computational Linguistics: Human Language Technologies,0,"We present three approaches to lexical chaining based on the LDA topic model and evaluate them intrinsically on a manually annotated set of German documents. After motivating the choice of statistical methods for lexical chaining with their adaptability to different languages and subject domains, we describe our new two-level chain annotation scheme, which rooted in the concept of cohesive harmony. Also, we propose a new measure for direct evaluation of lexical chains. Our three LDA-based approaches outperform two knowledge-based state-of-the art methods to lexical chaining by a large margin, which can be attributed to lacking coverage of the knowledge resource. Subsequent analysis shows that the three methods yield a different chaining behavior, which could be utilized in tasks that use lexical chaining as a component within NLP applications."
N13-1133,Supervised All-Words Lexical Substitution using Delexicalized Features,2013,33,21,2,0,20401,gyorgy szarvas,Proceedings of the 2013 Conference of the North {A}merican Chapter of the Association for Computational Linguistics: Human Language Technologies,0,"We propose a supervised lexical substitution system that does not use separate classifiers per word and is therefore applicable to any word in the vocabulary. Instead of learning word-specific substitution patterns, a global model for lexical substitution is trained on delexicalized (i.e., non lexical) features, which allows to exploit the power of supervised methods while being able to generalize beyond target words in the training set. This way, our approach remains technically straightforward, provides better performance and similar coverage in comparison to unsupervised approaches. Using features from lexical resources, as well as a variety of features computed from large corpora (n-gram counts, distributional similarity) and a ranking method based on the posterior probabilities obtained from a Maximum Entropy classifier, we improve over the state of the art in the LexSub Best-Precision metric and the Generalized Average Precision measure. Robustness of our approach is demonstrated by evaluating it successfully on two different datasets."
D13-1089,Scaling to Large{\\mbox{$^3$}} Data: An Efficient and Effective Method to Compute Distributional Thesauri,2013,28,14,2,1,24663,martin riedl,Proceedings of the 2013 Conference on Empirical Methods in Natural Language Processing,0,"We introduce a new highly scalable approach for computing Distributional Thesauri (DTs). By employing pruning techniques and a distributed framework, we make the computation for very large corpora feasible on comparably small computational resources. We demonstrate this by releasing a DT for the whole vocabulary of Google Books syntactic n-grams. Evaluating against lexical resources using two measures, we show that our approach produces higher quality DTs than previous approaches, and is thus preferable in terms of speed and quality for large corpora."
W12-3307,{T}opic{T}iling: A Text Segmentation Algorithm based on {LDA},2012,18,51,2,1,24663,martin riedl,Proceedings of {ACL} 2012 Student Research Workshop,0,"This work presents a Text Segmentation algorithm called TopicTiling. This algorithm is based on the well-known TextTiling algorithm, and segments documents using the Latent Dirichlet Allocation (LDA) topic model. We show that using the mode topic ID assigned during the inference method of LDA, used to annotate unseen documents, improves performance by stabilizing the obtained topics. We show significant improvements over state of the art segmentation algorithms on two standard datasets. As an additional benefit, TopicTiling performs the segmentation in linear time and thus is computationally less expensive than other LDA-based segmentation methods."
W12-0703,Sweeping through the Topic Space: Bad luck? Roll again!,2012,18,5,2,1,24663,martin riedl,Proceedings of the Joint Workshop on Unsupervised and Semi-Supervised Learning in {NLP},0,"Topic Models (TM) such as Latent Dirichlet Allocation (LDA) are increasingly used in Natural Language Processing applications. At this, the model parameters and the influence of randomized sampling and inference are rarely examined --- usually, the recommendations from the original papers are adopted. In this paper, we examine the parameter space of LDA topic models with respect to the application of Text Segmentation (TS), specifically targeting error rates and their variance across different runs. We find that the recommended settings result in error rates far from optimal for our application. We show substantial variance in the results for different runs of model estimation and inference, and give recommendations for increasing the robustness and stability of topic models. Running the inference step several times and selecting the last topic ID assigned per token, shows considerable improvements. Similar improvements are achieved with the mode method: We store all assigned topic IDs during each inference iteration step and select the most frequent topic ID assigned to each word. These recommendations do not only apply to TS, but are generic enough to transfer to other applications."
S12-1059,{UKP}: Computing Semantic Textual Similarity by Combining Multiple Content Similarity Measures,2012,36,150,2,0,41371,daniel bar,"*{SEM} 2012: The First Joint Conference on Lexical and Computational Semantics {--} Volume 1: Proceedings of the main conference and the shared task, and Volume 2: Proceedings of the Sixth International Workshop on Semantic Evaluation ({S}em{E}val 2012)",0,"We present the UKP system which performed best in the Semantic Textual Similarity (STS) task at SemEval-2012 in two out of three metrics. It uses a simple log-linear regression model, trained on the training data, to combine multiple text similarity measures of varying complexity. These range from simple character and word n-grams and common subsequences to complex features such as Explicit Semantic Analysis vector comparisons and aggregation of word similarity based on lexical-semantic resources. Further, we employ a lexical substitution system and statistical machine translation to add additional lexemes, which alleviates lexical gaps. Our final models, one per dataset, consist of a log-linear combination of about 20 features, out of the possible 300 features implemented."
